NFKB1,,,no,ENSG00000109320,Nuclear factor NF-kappa-B p105 subunit (DNA-binding factor KBF1) (EBP-1) (Nuclear factor of kappa light polypeptide gene enhancer in B-cells 1),Nucleus,"cortical thymic epithelial cell;elicited macrophage;inflammatory macrophage;alternatively activated macrophage;mast cell;mucosal type mast cell;group 3 innate lymphoid cell;CD34-positive, CD56-positive, CD117-positive common innate lymphoid precursor, human;myeloid cell;fibroblast of connective tissue of nonglandular part of prostate",,4.059,3.775,4.059,18836,9124,-0.104,REACTOME,Immune System R-HSA-168256,False
NFKB2,,,no,ENSG00000077150,Nuclear factor NF-kappa-B p100 subunit (DNA-binding factor KBF2) (H2TF1) (Lymphocyte translocation chromosome 10 protein) (Nuclear factor of kappa light polypeptide gene enhancer in B-cells 2) (Oncogene Lyt-10) (Lyt10),Nucleus;Cytoplasm,medullary thymic epithelial cell;IgG memory B cell;group 2 innate lymphoid cell,,4.79,5.174,5.174,22228,12504,0.111,REACTOME,Immune System R-HSA-168256,False
NLRC5,,,no,ENSG00000140853,Protein NLRC5 (Caterpiller protein 16.1) (CLR16.1) (Nucleotide-binding oligomerization domain protein 27) (Nucleotide-binding oligomerization domain protein 4),Cytoplasm,,,6.075,5.398,6.075,28195,13046,-0.171,REACTOME,Immune System R-HSA-168256,True
NLRP1,,,no,ENSG00000091592,"NACHT, LRR and PYD domains-containing protein 1",Cytoplasm,pancreatic endocrine cell;type B pancreatic cell;pancreatic A cell;pancreatic D cell;enteroendocrine cell;PP cell;endocrine cell;peripheral nervous system neuron,,5.624,5.039,5.624,26102,12179,-0.159,REACTOME,Immune System R-HSA-168256,True
NLRP3,,,no,ENSG00000162711,"NACHT, LRR and PYD domains-containing protein 3",Cytoplasm,"phagocyte;elicited macrophage;alternatively activated macrophage;colon macrophage;mononuclear phagocyte;classical monocyte;CD14-positive, CD16-negative classical monocyte;hematopoietic cell;leukocyte;myeloid leukocyte;monocyte;CD14-positive monocyte;intermediate monocyte;myeloid cell",,0.328,0.386,0.386,1520,933,0.237,REACTOME,Immune System R-HSA-168256,False
NOD1,,,no,ENSG00000106100,Nucleotide-binding oligomerization domain-containing protein 1 (hNod1) (Caspase recruitment domain-containing protein 4),Cell membrane,,,1.075,1.042,1.075,4987,2519,-0.044,REACTOME,Immune System R-HSA-168256,True
NOD2,,,no,ENSG00000167207,Nucleotide-binding oligomerization domain-containing protein 2 (Caspase recruitment domain-containing protein 15) (Inflammatory bowel disease protein 1),Cell membrane,,,0.287,0.316,0.316,1334,764,0.137,REACTOME,Immune System R-HSA-168256,True
NRAS,,,no,ENSG00000213281,GTPase NRas,Cell membrane,,,1.959,2.204,2.204,9092,5326,0.17,REACTOME,Immune System R-HSA-168256,True
NUP107,,,no,ENSG00000111581,Nuclear pore complex protein Nup107 (107 kDa nucleoporin) (Nucleoporin Nup107),Nucleus membrane,,,1.538,1.412,1.538,7137,3413,-0.123,REACTOME,Immune System R-HSA-168256,True
NUP153,,,no,ENSG00000124789,Nuclear pore complex protein Nup153 (153 kDa nucleoporin) (Nucleoporin Nup153),Nucleus;Nucleus membrane;Nucleus,,,2.076,2.447,2.447,9635,5915,0.237,REACTOME,Immune System R-HSA-168256,True
NUP214,,,no,ENSG00000126883,Nuclear pore complex protein Nup214 (214 kDa nucleoporin) (Nucleoporin Nup214) (Protein CAN),Nucleus,promonocyte,,1.673,1.498,1.673,7764,3621,-0.159,REACTOME,Immune System R-HSA-168256,False
NUP62,,,no,ENSG00000213024,Nuclear pore glycoprotein p62 (62 kDa nucleoporin) (Nucleoporin Nup62),Nucleus,,,1.939,1.718,1.939,8997,4153,-0.174,REACTOME,Immune System R-HSA-168256,True
NUP93,,,no,ENSG00000102900,Nuclear pore complex protein Nup93 (93 kDa nucleoporin) (Nucleoporin Nup93),Nucleus membrane,,,2.861,2.202,2.861,13276,5322,-0.378,REACTOME,Immune System R-HSA-168256,True
NUP98,,,no,ENSG00000110713,Nuclear pore complex protein Nup98-Nup96,Nucleus membrane,,,4.959,4.232,4.959,23013,10229,-0.229,REACTOME,Immune System R-HSA-168256,True
OAS1,,,no,ENSG00000089127,2'-5'-oligoadenylate synthase 1 ((2-5')oligo(A) synthase 1) (2-5A synthase 1),Cytoplasm,goblet cell;respiratory goblet cell;tracheal goblet cell,,3.476,2.913,3.476,16131,7040,-0.255,REACTOME,Immune System R-HSA-168256,True
OAS3,,,no,ENSG00000111331,2'-5'-oligoadenylate synthase 3 ((2-5')oligo(A) synthase 3) (2-5A synthase 3),Cytoplasm;Nucleus,,,6.093,4.574,6.093,28276,11056,-0.413,REACTOME,Immune System R-HSA-168256,True
OLR1,,,no,ENSG00000173391,Oxidized low-density lipoprotein receptor 1 (Ox-LDL receptor 1) (C-type lectin domain family 8 member A) (Lectin-like oxidized LDL receptor 1) (LOX-1) (Lectin-like oxLDL receptor 1) (hLOX-1) (Lectin-type oxidized LDL receptor 1),Cell membrane,phagocyte;macrophage;elicited macrophage;inflammatory macrophage;tissue-resident macrophage;alveolar macrophage;central nervous system macrophage;microglial cell;mature microglial cell;lung macrophage;placental villous trophoblast;syncytiotrophoblast cell;hematopoietic cell;granulocyte;basophil;professional antigen presenting cell;myelocyte;granulocytopoietic cell,,0.059,0.181,0.181,275,437,1.609,REACTOME,Immune System R-HSA-168256,False
OPRD1,,,no,ENSG00000116329,Delta-type opioid receptor (D-OR-1) (DOR-1),Cell membrane,,OPIOID,0.04,0.07,0.07,185,170,0.819,REACTOME,Immune System R-HSA-168256,True
OPRM1,,,no,ENSG00000112038,Mu-type opioid receptor (M-OR-1) (MOR-1) (Mu opiate receptor) (Mu opioid receptor) (MOP) (hMOP),Cell membrane,,OPIOID,0.049,0.07,0.07,226,168,0.513,REACTOME,Immune System R-HSA-168256,True
ORAI2,,,no,ENSG00000160991,Protein orai-2 (CAP-binding protein complex-interacting protein 2) (Transmembrane protein 142B),Membrane,IgG memory B cell;IgG-negative class switched memory B cell,,2.727,2.394,2.727,12654,5787,-0.187,REACTOME,Immune System R-HSA-168256,False
P2RX1,,,no,ENSG00000108405,P2X purinoceptor 1 (P2X1) (ATP receptor) (Purinergic receptor),Membrane,"eosinophil;mast cell;megakaryocyte-erythroid progenitor cell;erythroid progenitor cell, mammalian",,0.324,0.297,0.324,1503,717,-0.127,REACTOME,Immune System R-HSA-168256,True
P2RX7,,,no,ENSG00000089041,P2X purinoceptor 7 (P2X7) (ATP receptor) (P2Z receptor) (Purinergic receptor),Cell membrane,,,1.222,1.312,1.312,5670,3171,0.103,REACTOME,Immune System R-HSA-168256,True
P4HB,,,no,ENSG00000185624,Protein disulfide-isomerase (PDI),Endoplasmic reticulum,epithelial cell of alveolus of lung;pneumocyte;type II pneumocyte;pancreatic acinar cell;acinar cell;microfold cell of epithelium of small intestine;tracheobronchial serous cell;serous cell of epithelium of bronchus;lung secretory cell,GALECTIN,18.644,12.114,18.644,86525,29279,-0.622,REACTOME,Immune System R-HSA-168256,True
PADI2,,,no,ENSG00000117115,Protein-arginine deiminase type-2,Cytoplasm,microglial cell,,1.215,1.422,1.422,5637,3437,0.227,REACTOME,Immune System R-HSA-168256,True
PANX1,,,no,ENSG00000110218,Pannexin-1,Cell membrane,stem cell of epidermis,,0.62,0.49,0.62,2879,1185,-0.339,REACTOME,Immune System R-HSA-168256,True
PDCD1,,,no,ENSG00000188389,Programmed cell death protein 1 (Protein PD-1) (hPD-1) (CD antigen CD279),Cell membrane,"CD4-positive helper T cell;T follicular helper cell;CD4-positive, CD25-positive, alpha-beta regulatory T cell;activated CD8-positive, alpha-beta T cell;CD8-alpha-alpha-positive, alpha-beta intraepithelial T cell;regulatory T cell;intraepithelial lymphocyte",PD-L1;PDL2,0.752,1.466,1.466,3492,3542,0.962,REACTOME,Immune System R-HSA-168256,False
PDCD1LG2,,,no,ENSG00000197646,Programmed cell death 1 ligand 2 (PD-1 ligand 2) (PD-L2) (PDCD1 ligand 2) (Programmed death ligand 2) (Butyrophilin B7-DC) (B7-DC) (CD antigen CD273),Cell membrane,,PDL2,0.563,0.501,0.563,2613,1211,-0.168,REACTOME,Immune System R-HSA-168256,True
PDCD4,,,no,ENSG00000150593,Programmed cell death protein 4 (Neoplastic transformation inhibitor protein) (Nuclear antigen H731-like) (Protein 197/15a),Nucleus,corneal epithelial cell;type I pneumocyte;epithelial cell of sweat gland;conjunctival epithelial cell;group 2 innate lymphoid cell;serous cell of epithelium of trachea,,15.197,10.641,15.197,70529,25718,-0.514,REACTOME,Immune System R-HSA-168256,False
PDIA3,,,no,ENSG00000167004,Protein disulfide-isomerase A3,Endoplasmic reticulum,preosteoblast;serous cell of epithelium of trachea;serous cell of epithelium of bronchus;lung secretory cell,,8.388,7.012,8.388,38929,16948,-0.258,REACTOME,Immune System R-HSA-168256,True
PDPK1,,,no,ENSG00000140992,3-phosphoinositide-dependent protein kinase 1 (hPDK1),Cytoplasm;Nucleus;Cell membrane,,,4.54,3.068,4.54,21071,7416,-0.565,REACTOME,Immune System R-HSA-168256,True
PECAM1,,,no,ENSG00000261371,Platelet endothelial cell adhesion molecule (PECAM-1) (EndoCAM) (GPIIA') (PECA1) (CD antigen CD31),Cell membrane,"epithelial cell;squamous epithelial cell;blood vessel endothelial cell;endothelial tip cell;vein endothelial cell;vasa recta ascending limb cell;vasa recta descending limb cell;retinal blood vessel endothelial cell;endothelial cell of artery;kidney capillary endothelial cell;glomerular capillary endothelial cell;capillary endothelial cell;lung microvascular endothelial cell;prostate gland microvascular endothelial cell;lung endothelial cell;fenestrated cell;glomerular endothelial cell;endothelial cell;gut endothelial cell;endothelial cell of vascular tree;endothelial cell of lymphatic vessel;endothelial cell of uterus;cardiac endothelial cell;endocardial cell;surface ectodermal cell;non-classical monocyte;CD14-low, CD16-positive monocyte",PECAM1;PECAM2,9.535,9.067,9.535,44251,21914,-0.073,REACTOME,Immune System R-HSA-168256,False
PGM1,,,no,ENSG00000079739,Phosphoglucomutase-1 (PGM 1),Cytoplasm,slow muscle cell;fast muscle cell;white fat cell,,2.336,1.391,2.336,10839,3363,-0.747,REACTOME,Immune System R-HSA-168256,True
PIAS1,,,no,,,,,,6.804,5.413,6.804,31578,13082,-0.33,REACTOME,Immune System R-HSA-168256,True
PIK3C3,,,no,ENSG00000078142,Phosphatidylinositol 3-kinase catalytic subunit type 3 (PI3-kinase type 3) (PI3K type 3) (PtdIns-3-kinase type 3),Midbody,,,4.11,3.564,4.11,19072,8614,-0.205,REACTOME,Immune System R-HSA-168256,True
PIK3CA,,,no,ENSG00000121879,"Phosphatidylinositol 4,5-bisphosphate 3-kinase catalytic subunit alpha isoform (PI3-kinase subunit alpha) (PI3K-alpha) (PI3Kalpha) (PtdIns-3-kinase subunit alpha)",,,,5.659,3.807,5.659,26265,9201,-0.572,REACTOME,Immune System R-HSA-168256,True
PIK3CB,,,no,ENSG00000051382,"Phosphatidylinositol 4,5-bisphosphate 3-kinase catalytic subunit beta isoform (PI3-kinase subunit beta) (PI3K-beta) (PI3Kbeta) (PtdIns-3-kinase subunit beta)",Cytoplasm,,,3.047,2.449,3.047,14140,5919,-0.315,REACTOME,Immune System R-HSA-168256,True
PIK3R1,,,no,ENSG00000145675,Phosphatidylinositol 3-kinase regulatory subunit alpha (PI3-kinase regulatory subunit alpha) (PI3K regulatory subunit alpha) (PtdIns-3-kinase regulatory subunit alpha) (Phosphatidylinositol 3-kinase 85 kDa regulatory subunit alpha) (PI3-kinase subunit p85-alpha) (PtdIns-3-kinase regulatory subunit p85-alpha),,epithelial cell of thymus;cortical thymic epithelial cell;alpha-beta T cell;mature alpha-beta T cell;mucosal invariant T cell;mature T cell;keratocyte,,3.459,3.316,3.459,16053,8015,-0.061,REACTOME,Immune System R-HSA-168256,False
PIK3R2,,,no,ENSG00000105647,Phosphatidylinositol 3-kinase regulatory subunit beta (PI3-kinase regulatory subunit beta) (PI3K regulatory subunit beta) (PtdIns-3-kinase regulatory subunit beta) (Phosphatidylinositol 3-kinase 85 kDa regulatory subunit beta) (PI3-kinase subunit p85-beta) (PtdIns-3-kinase regulatory subunit p85-beta),,,,3.027,2.142,3.027,14048,5178,-0.499,REACTOME,Immune System R-HSA-168256,True
PIKFYVE,,,no,ENSG00000115020,1-phosphatidylinositol 3-phosphate 5-kinase (Phosphatidylinositol 3-phosphate 5-kinase),Endosome membrane,,,4.69,4.764,4.764,21766,11515,0.023,REACTOME,Immune System R-HSA-168256,True
PILRA,,,no,ENSG00000085514,Paired immunoglobulin-like type 2 receptor alpha (Cell surface receptor FDF03) (Inhibitory receptor PILR-alpha),Secreted,"phagocyte;macrophage;alveolar macrophage;lung macrophage;classical monocyte;CD14-positive, CD16-negative classical monocyte;hematopoietic cell;leukocyte;professional antigen presenting cell;myeloid leukocyte;monocyte;non-classical monocyte;CD14-low, CD16-positive monocyte;CD14-positive monocyte;CD14-positive, CD16-positive monocyte;peripheral blood mononuclear cell;myeloid cell",CD99,0.674,0.472,0.674,3130,1140,-0.516,REACTOME,Immune System R-HSA-168256,False
PKM,,,no,ENSG00000067225,Pyruvate kinase PKM,Cytoplasm,fallopian tube secretory epithelial cell;rod bipolar cell;OFF-bipolar cell;retinal cone cell;glycinergic neuron,,15.922,10.895,15.922,73892,26331,-0.547,REACTOME,Immune System R-HSA-168256,True
PLA2G6,,,no,ENSG00000184381,85/88 kDa calcium-independent phospholipase A2 (CaI-PLA2),Cytoplasm,,,1.574,1.849,1.849,7306,4468,0.232,REACTOME,Immune System R-HSA-168256,True
PLAU,,,no,ENSG00000122861,Urokinase-type plasminogen activator (U-plasminogen activator) (uPA),Secreted,luminal epithelial cell of mammary gland;myoepithelial cell;myoepithelial cell of mammary gland;epithelial cell of prostate;basal cell of prostate epithelium;mammary gland epithelial cell;epithelial cell of urethra;conjunctival epithelial cell,PLAU,1.077,1.839,1.839,4999,4444,0.771,REACTOME,Immune System R-HSA-168256,True
PLAUR,,,no,ENSG00000011422,Urokinase plasminogen activator surface receptor (U-PAR) (uPAR) (Monocyte activation antigen Mo3) (CD antigen CD87),Cell membrane,epithelial cell of lacrimal sac;epithelial cell of uterus;epithelial cell of urethra;elicited macrophage;inflammatory macrophage;alternatively activated macrophage;hematopoietic cell;blood cell;granulocyte;leukocyte;liver dendritic cell;myeloid leukocyte;myeloid cell,VTN;PLAU,1.955,3.112,3.112,9073,7521,0.671,REACTOME,Immune System R-HSA-168256,False
PLCG1,,,no,ENSG00000124181,"1-phosphatidylinositol 4,5-bisphosphate phosphodiesterase gamma-1",Cell projection,,,15.554,13.919,15.554,72187,33640,-0.16,REACTOME,Immune System R-HSA-168256,True
PLCG2,,,no,ENSG00000197943,"1-phosphatidylinositol 4,5-bisphosphate phosphodiesterase gamma-2",Membrane raft,kidney collecting duct intercalated cell;renal intercalated cell;renal beta-intercalated cell;renal alpha-intercalated cell;pulmonary ionocyte;brush cell;intestinal tuft cell;tuft cell of colon;endothelial cell of lymphatic vessel;ionocyte;melanocyte of skin,,1.317,1.066,1.317,6110,2577,-0.304,REACTOME,Immune System R-HSA-168256,False
PLD2,,,no,ENSG00000129219,Phospholipase D2 (PLD 2) (hPLD2),Cell membrane,,,3.65,2.643,3.65,16941,6387,-0.466,REACTOME,Immune System R-HSA-168256,True
PML,,,no,ENSG00000140464,Protein PML (E3 SUMO-protein ligase PML),Nucleus;Nucleus,,,4.727,4.195,4.727,21939,10139,-0.172,REACTOME,Immune System R-HSA-168256,True
POLR2E,,,no,ENSG00000099817,"DNA-directed RNA polymerases I, II, and III subunit RPABC1 (RNA polymerases I, II, and III subunit ABC1) (DNA-directed RNA polymerase II 23 kDa polypeptide) (DNA-directed RNA polymerase II subunit E) (RPB5 homolog) (XAP4)",Nucleus,macrophage dendritic cell progenitor;pre-conventional dendritic cell,,1.758,1.605,1.758,8160,3878,-0.132,REACTOME,Immune System R-HSA-168256,False
POLR2H,,,no,ENSG00000163882,"DNA-directed RNA polymerases I, II, and III subunit RPABC3 (RNA polymerases I, II, and III subunit ABC3) (DNA-directed RNA polymerase II subunit H) (DNA-directed RNA polymerases I, II, and III 17.1 kDa polypeptide) (RPB17) (RPB8 homolog) (hRPB8)",Nucleus,fallopian tube secretory epithelial cell,,2.785,2.676,2.785,12927,6468,-0.058,REACTOME,Immune System R-HSA-168256,True
POMC,,,no,ENSG00000115138,Pro-opiomelanocortin (POMC) (Corticotropin-lipotropin),Secreted,Sertoli cell,MELANOCORTIN;OPIOID,0.555,0.327,0.555,2576,791,-0.762,REACTOME,Immune System R-HSA-168256,True
POTEF,,,no,ENSG00000196604,POTE ankyrin domain family member F (ANKRD26-like family C member 1B) (Chimeric POTE-actin protein),Cytoplasm,,,0.373,0.604,0.604,1730,1459,0.695,REACTOME,Immune System R-HSA-168256,True
POU2F1,,,no,ENSG00000143190,"POU domain, class 2, transcription factor 1 (NF-A1) (Octamer-binding protein 1) (Oct-1) (Octamer-binding transcription factor 1) (OTF-1)",Nucleus,,,2.093,1.684,2.093,9714,4071,-0.313,REACTOME,Immune System R-HSA-168256,True
PPP2CA,,,no,ENSG00000113575,Serine/threonine-protein phosphatase 2A catalytic subunit alpha isoform (PP2A-alpha),Cytoplasm,,,3.405,3.137,3.405,15803,7582,-0.118,REACTOME,Immune System R-HSA-168256,True
PPP2R1A,,,no,ENSG00000105568,Serine/threonine-protein phosphatase 2A 65 kDa regulatory subunit A alpha isoform (Medium tumor antigen-associated 61 kDa protein) (PP2A subunit A isoform PR65-alpha) (PP2A subunit A isoform R1-alpha),Cytoplasm,glioblast;Schwann cell precursor;ovarian surface epithelial cell,,9.001,6.494,9.001,41771,15695,-0.471,REACTOME,Immune System R-HSA-168256,True
PPP3CA,,,no,ENSG00000138814,Protein phosphatase 3 catalytic subunit alpha,Cytoplasm,renal beta-intercalated cell;luminal cell of prostate epithelium;stellate neuron;granule cell;cerebellar granule cell,,3.22,2.688,3.22,14943,6497,-0.26,REACTOME,Immune System R-HSA-168256,False
PRCP,,,no,ENSG00000137509,Lysosomal Pro-X carboxypeptidase,Lysosome,endothelial tip cell;retinal blood vessel endothelial cell;gut endothelial cell;endocardial cell;follicular dendritic cell,,4.942,4.236,4.942,22935,10238,-0.222,REACTOME,Immune System R-HSA-168256,False
PRICKLE1,,,no,ENSG00000139174,Prickle-like protein 1 (REST/NRSF-interacting LIM domain protein 1),Nucleus membrane,fibroblast of cardiac tissue;kidney interstitial fibroblast;mesangial cell;fibro/adipogenic progenitor cell;kidney interstitial cell,,0.524,0.772,0.772,2433,1867,0.559,REACTOME,Immune System R-HSA-168256,False
PRKACB,,,no,ENSG00000142875,cAMP-dependent protein kinase catalytic subunit beta (PKA C-beta),Cytoplasm,,,6.9,5.932,6.9,32021,14336,-0.218,REACTOME,Immune System R-HSA-168256,True
PRKCA,,,no,ENSG00000154229,Protein kinase C alpha type (PKC-A) (PKC-alpha),Cytoplasm,endothelial cell of hepatic sinusoid;endothelial cell of pericentral hepatic sinusoid;Bergmann glial cell;Schwann cell;neuron;kidney interstitial fibroblast,,0.994,0.533,0.994,4615,1288,-0.9,REACTOME,Immune System R-HSA-168256,False
PRKCB,,,no,ENSG00000166501,Protein kinase C beta type (PKC-B) (PKC-beta),Cytoplasm,IgG memory B cell;IgG-negative class switched memory B cell;amacrine cell;stellate neuron,,2.714,1.607,2.714,12596,3883,-0.756,REACTOME,Immune System R-HSA-168256,False
PRKCD,,,no,ENSG00000163932,Protein kinase C delta type,Cytoplasm,,,4.231,2.936,4.231,19638,7097,-0.527,REACTOME,Immune System R-HSA-168256,True
PRKCE,,,no,ENSG00000171132,Protein kinase C epsilon type,Cytoplasm,renal beta-intercalated cell,,0.472,0.317,0.472,2192,765,-0.577,REACTOME,Immune System R-HSA-168256,True
PRKCQ,,,no,ENSG00000065675,Protein kinase C theta type,Cytoplasm;Cell membrane,,,2.308,1.948,2.308,10713,4708,-0.245,REACTOME,Immune System R-HSA-168256,True
PRKDC,,,no,ENSG00000253729,DNA-dependent protein kinase catalytic subunit (DNA-PK catalytic subunit) (DNA-PKcs),Nucleus,fallopian tube secretory epithelial cell,,7.546,7.858,7.858,35020,18992,0.058,REACTOME,Immune System R-HSA-168256,False
PRKN,,,no,ENSG00000185345,E3 ubiquitin-protein ligase parkin (Parkin),Cytoplasm,regular atrial cardiac myocyte;regular ventricular cardiac myocyte,,0.185,0.186,0.186,860,449,0.004,REACTOME,Immune System R-HSA-168256,True
PRL,,,no,ENSG00000172179,Prolactin (PRL),Secreted,enteric smooth muscle cell,PRL,0.191,0.321,0.321,886,777,0.752,REACTOME,Immune System R-HSA-168256,False
PRLR,,,no,ENSG00000113494,Prolactin receptor (PRL-R),Membrane,choroid plexus epithelial cell;duct epithelial cell;luminal epithelial cell of mammary gland;kidney collecting duct intercalated cell;renal intercalated cell;renal alpha-intercalated cell;mammary gland epithelial cell;smooth muscle cell of sphincter of pupil;neuron;medium spiny neuron,GH;PRL,0.487,0.408,0.487,2260,987,-0.254,REACTOME,Immune System R-HSA-168256,False
PRTN3,,,no,ENSG00000196415,Myeloblastin,Cytoplasmic granule,bone marrow cell;granulocyte monocyte progenitor cell;neutrophil;immature neutrophil;promonocyte;promyelocyte;myelocyte;hematopoietic precursor cell;myeloid lineage restricted progenitor cell;granulocytopoietic cell;common myeloid progenitor,,0.423,0.824,0.824,1964,1991,0.961,REACTOME,Immune System R-HSA-168256,False
PSEN1,,,no,ENSG00000080815,Presenilin-1 (PS-1),Endoplasmic reticulum,,,0.65,0.597,0.65,3018,1442,-0.124,REACTOME,Immune System R-HSA-168256,False
PSMA6,,,no,ENSG00000100902,Proteasome subunit alpha type-6 (27 kDa prosomal protein) (PROS-27) (p27K) (Macropain iota chain) (Multicatalytic endopeptidase complex iota chain) (Proteasome iota chain),Cytoplasm,"professional antigen presenting cell;dendritic cell;T-helper 17 cell;activated CD4-positive, alpha-beta T cell;early lymphoid progenitor;common lymphoid progenitor",,5.023,3.125,5.023,23312,7552,-0.685,REACTOME,Immune System R-HSA-168256,False
PSMB10,,,no,,,,,,14.328,8.84,14.328,66497,21365,-0.697,REACTOME,Immune System R-HSA-168256,False
PSMB11,,,no,,,,,,0.17,0.109,0.17,787,264,-0.635,REACTOME,Immune System R-HSA-168256,False
PSMB5,,,no,ENSG00000100804,Proteasome subunit beta type-5,Cytoplasm,cortical thymic epithelial cell,,2.651,1.595,2.651,12301,3856,-0.732,REACTOME,Immune System R-HSA-168256,False
PSMB6,,,no,,,,,,7.317,4.869,7.317,33958,11768,-0.588,REACTOME,Immune System R-HSA-168256,True
PSMB7,,,no,,,,,,10.271,5.831,10.271,47669,14094,-0.817,REACTOME,Immune System R-HSA-168256,True
PSMB8,,,no,,,,,,8.06,5.111,8.06,37404,12352,-0.657,REACTOME,Immune System R-HSA-168256,False
PSMB9,,,no,,,,,,8.718,5.961,8.718,40459,14407,-0.548,REACTOME,Immune System R-HSA-168256,False
PSMC2,,,no,ENSG00000161057,26S proteasome regulatory subunit 7 (26S proteasome AAA-ATPase subunit RPT1) (Proteasome 26S subunit ATPase 2),Cytoplasm,,,3.374,2.053,3.374,15658,4963,-0.716,REACTOME,Immune System R-HSA-168256,True
PSMC5,,,no,ENSG00000087191,26S proteasome regulatory subunit 8 (26S proteasome AAA-ATPase subunit RPT6) (Proteasome 26S subunit ATPase 5) (Proteasome subunit p45) (Thyroid hormone receptor-interacting protein 1) (TRIP1) (p45/SUG),Cytoplasm,,,12.518,9.134,12.518,58096,22076,-0.455,REACTOME,Immune System R-HSA-168256,True
PSMD10,,,no,ENSG00000101843,26S proteasome non-ATPase regulatory subunit 10 (26S proteasome regulatory subunit p28) (Gankyrin) (p28(GANK)),Cytoplasm,,,0.903,0.888,0.903,4191,2146,-0.024,REACTOME,Immune System R-HSA-168256,True
PSMD2,,,no,ENSG00000175166,26S proteasome non-ATPase regulatory subunit 2 (26S proteasome regulatory subunit RPN1) (26S proteasome regulatory subunit S2) (26S proteasome subunit p97) (Protein 55.11) (Tumor necrosis factor type 1 receptor-associated protein 2),,fallopian tube secretory epithelial cell,,6.213,4.966,6.213,28836,12003,-0.323,REACTOME,Immune System R-HSA-168256,True
PSMD3,,,no,ENSG00000108344,26S proteasome non-ATPase regulatory subunit 3 (26S proteasome regulatory subunit RPN3) (26S proteasome regulatory subunit S3) (Proteasome subunit p58),,,,7.473,5.093,7.473,34681,12310,-0.553,REACTOME,Immune System R-HSA-168256,True
PSMD4,,,no,ENSG00000159352,26S proteasome non-ATPase regulatory subunit 4 (26S proteasome regulatory subunit RPN10) (26S proteasome regulatory subunit S5A) (Antisecretory factor 1) (AF) (ASF) (Multiubiquitin chain-binding protein),,placental villous trophoblast,,7.275,4.642,7.275,33761,11219,-0.648,REACTOME,Immune System R-HSA-168256,True
PSME3,,,no,ENSG00000131467,Proteasome activator complex subunit 3 (11S regulator complex subunit gamma) (REG-gamma) (Activator of multicatalytic protease subunit 3) (Ki nuclear autoantigen) (Proteasome activator 28 subunit gamma) (PA28g) (PA28gamma),Nucleus,,,5.832,5.017,5.832,27068,12126,-0.217,REACTOME,Immune System R-HSA-168256,True
PTAFR,,,no,ENSG00000169403,Platelet-activating factor receptor (PAF-R) (PAFr),Cell membrane,phagocyte;immature neutrophil,,1.748,1.834,1.834,8113,4433,0.069,REACTOME,Immune System R-HSA-168256,True
PTEN,,,no,ENSG00000171862,"Phosphatidylinositol 3,4,5-trisphosphate 3-phosphatase and dual-specificity protein phosphatase PTEN",Cytoplasm,melanocyte;melanocyte of skin;kidney interstitial fibroblast;subcutaneous fat cell;epicardial adipocyte,,5.614,4.698,5.614,26052,11354,-0.257,REACTOME,Immune System R-HSA-168256,False
PTGS2,,,no,ENSG00000073756,Prostaglandin G/H synthase 2,Microsome membrane,colon macrophage;blood cell;granulocyte;mast cell;myeloid cell;fibroblast of mammary gland;fibroblast of connective tissue of nonglandular part of prostate;fibroblast of connective tissue of glandular part of prostate,,0.249,0.236,0.249,1155,570,-0.078,REACTOME,Immune System R-HSA-168256,False
PTK2,,,no,ENSG00000169398,Focal adhesion kinase 1 (FADK 1),Cell junction,papillary tips cell;neural progenitor cell,,3.178,2.739,3.178,14748,6620,-0.214,REACTOME,Immune System R-HSA-168256,True
PTK2B,,,no,ENSG00000120899,Protein-tyrosine kinase 2-beta,Cytoplasm;Cytoplasm,,,19.381,15.513,19.381,89946,37493,-0.321,REACTOME,Immune System R-HSA-168256,True
PTPN1,,,no,ENSG00000196396,Tyrosine-protein phosphatase non-receptor type 1,Endoplasmic reticulum membrane,type I pneumocyte;elicited macrophage;inflammatory macrophage,,8.32,5.064,8.32,38611,12240,-0.716,REACTOME,Immune System R-HSA-168256,False
PTPN11,,,no,ENSG00000179295,Tyrosine-protein phosphatase non-receptor type 11,Cytoplasm,,,4.534,3.98,4.534,21043,9618,-0.188,REACTOME,Immune System R-HSA-168256,True
PTPN13,,,no,ENSG00000163629,Tyrosine-protein phosphatase non-receptor type 13,Cytoplasm,corneal epithelial cell;retinal pigment epithelial cell;neuronal receptor cell;photoreceptor cell;eye photoreceptor cell;retinal rod cell;papillary tips cell;lung secretory cell,,1.968,1.716,1.968,9131,4147,-0.197,REACTOME,Immune System R-HSA-168256,True
PTPN2,,,no,ENSG00000175354,Tyrosine-protein phosphatase non-receptor type 2,Nucleus;Cytoplasm;Cell membrane,"immature alpha-beta T cell;double-positive, alpha-beta thymocyte;immature T cell;thymocyte;double negative thymocyte",,5.979,5.823,5.979,27750,14073,-0.038,REACTOME,Immune System R-HSA-168256,False
