ITGB7,,,no,ENSG00000139626,Integrin beta-7 (Gut homing receptor beta subunit),Cell membrane,"plasmablast;IgA plasmablast;lymphocyte;CD8-positive, alpha-beta cytotoxic T cell;exhausted T cell;plasma cell;IgG plasma cell;IgM plasma cell;IgA plasma cell;CD16-positive, CD56-dim natural killer cell, human;group 2 innate lymphoid cell",FN1;CDH1;L1CAM;MADCAM;VCAM,1.772,1.378,1.772,8224,3330,-0.363,REACTOME,Immune System R-HSA-168256,False
ITK,,,no,ENSG00000113263,Tyrosine-protein kinase ITK/TSK,Cytoplasm,"mononuclear cell;lymphocyte;T cell;alpha-beta T cell;mature alpha-beta T cell;CD4-positive, alpha-beta T cell;CD4-positive helper T cell;T follicular helper cell;CD4-positive, CD25-positive, alpha-beta regulatory T cell;naive regulatory T cell;naive thymus-derived CD4-positive, alpha-beta T cell;activated CD4-positive, alpha-beta T cell, human;CD4-positive, alpha-beta memory T cell;CD4-positive, alpha-beta memory T cell, CD45RO-positive;central memory CD4-positive, alpha-beta T cell;effector memory CD4-positive, alpha-beta T cell;CD4-positive, alpha-beta cytotoxic T cell;effector CD4-positive, alpha-beta T cell;CD8-positive, alpha-beta T cell;naive thymus-derived CD8-positive, alpha-beta T cell;activated CD8-positive, alpha-beta T cell;effector memory CD8-positive, alpha-beta T cell, terminally differentiated;type I NK T cell;mature T cell;memory T cell;regulatory T cell;naive T cell;DN3 thymocyte;group 2 innate lymphoid cell;DN1 thymic pro-T cell",,3.247,1.75,3.247,15067,4230,-0.891,REACTOME,Immune System R-HSA-168256,False
ITPR1,,,no,ENSG00000150995,"Inositol 1,4,5-trisphosphate receptor type 1 (IP3 receptor isoform 1) (IP3R 1) (InsP3R1) (Type 1 inositol 1,4,5-trisphosphate receptor) (Type 1 InsP3 receptor)",Endoplasmic reticulum membrane,choroid plexus epithelial cell;kidney distal convoluted tubule epithelial cell;smooth muscle cell of sphincter of pupil;ciliary muscle cell;Purkinje cell,,2.385,1.138,2.385,11068,2751,-1.067,REACTOME,Immune System R-HSA-168256,False
ITPR3,,,no,ENSG00000096433,"Inositol 1,4,5-trisphosphate receptor type 3 (IP3 receptor isoform 3) (IP3R 3) (InsP3R3) (Type 3 inositol 1,4,5-trisphosphate receptor) (Type 3 InsP3 receptor)",Endoplasmic reticulum membrane,,,5.187,4.878,5.187,24072,11790,-0.089,REACTOME,Immune System R-HSA-168256,True
JAK1,,,no,ENSG00000162434,Tyrosine-protein kinase JAK1,Endomembrane system,"mature conventional dendritic cell;alpha-beta T cell;mature alpha-beta T cell;CD8-positive, alpha-beta cytokine secreting effector T cell;mucosal invariant T cell;mature T cell;CD16-negative, CD56-bright natural killer cell, human;CD16-positive, CD56-dim natural killer cell, human;ILC1, human;group 2 innate lymphoid cell, human;fibro/adipogenic progenitor cell",,8.522,4.606,8.522,39549,11131,-0.888,REACTOME,Immune System R-HSA-168256,False
JAK2,,,no,ENSG00000096968,Tyrosine-protein kinase JAK2,Endomembrane system,basal cell of epidermis;stem cell of epidermis;mesothelial fibroblast,,3.221,2.217,3.221,14948,5359,-0.539,REACTOME,Immune System R-HSA-168256,False
JAK3,,,no,ENSG00000105639,Tyrosine-protein kinase JAK3,Endomembrane system,"CD4-positive, CD25-positive, alpha-beta regulatory T cell;naive regulatory T cell;mature NK T cell",,5.762,4.755,5.762,26740,11492,-0.277,REACTOME,Immune System R-HSA-168256,False
JUP,,,no,ENSG00000173801,Junction plakoglobin (Catenin gamma) (Desmoplakin III) (Desmoplakin-3),Cell junction,epithelial cell;keratinocyte;stratified epithelial cell;paneth cell of epithelium of small intestine;urothelial cell;bladder urothelial cell;epidermal cell;conjunctival epithelial cell;bladder cell,,2.452,1.756,2.452,11379,4244,-0.482,REACTOME,Immune System R-HSA-168256,True
KEAP1,,,no,ENSG00000079999,Kelch-like ECH-associated protein 1 (Cytosolic inhibitor of Nrf2) (INrf2) (Kelch-like protein 19),Cytoplasm,,,1.359,0.725,1.359,6306,1752,-0.906,REACTOME,Immune System R-HSA-168256,True
KIF11,,,no,ENSG00000138160,Kinesin-like protein KIF11 (Kinesin-like protein 1) (Kinesin-like spindle protein HKSP) (Kinesin-related motor protein Eg5) (Thyroid receptor-interacting protein 5) (TR-interacting protein 5) (TRIP-5),Cytoplasm,DN4 thymocyte;common dendritic progenitor;lymphoid lineage restricted progenitor cell,,0.353,0.313,0.353,1636,757,-0.171,REACTOME,Immune System R-HSA-168256,False
KIF20A,,,no,ENSG00000112984,Kinesin-like protein KIF20A (GG10_2) (Mitotic kinesin-like protein 2) (MKlp2) (Rab6-interacting kinesin-like protein) (Rabkinesin-6),Golgi apparatus,,,0.264,0.21,0.264,1223,508,-0.326,REACTOME,Immune System R-HSA-168256,True
KIF2A,,,no,ENSG00000068796,Kinesin-like protein KIF2A (Kinesin-2) (hK2),Cytoplasm,platelet;megakaryocyte-erythroid progenitor cell;megakaryocyte;retinal cone cell,,4.997,3.998,4.997,23191,9663,-0.322,REACTOME,Immune System R-HSA-168256,True
KIF2C,,,no,ENSG00000142945,Kinesin-like protein KIF2C (Kinesin-like protein 6) (Mitotic centromere-associated kinesin) (MCAK),Cytoplasm,,,0.523,0.41,0.523,2428,991,-0.352,REACTOME,Immune System R-HSA-168256,True
KIF5B,,,no,ENSG00000170759,Kinesin-1 heavy chain (Conventional kinesin heavy chain) (Ubiquitous kinesin heavy chain) (UKHC),Cytoplasm,brush cell of trachea;brush cell of bronchus;salivary gland cell,,5.181,4.559,5.181,24045,11018,-0.185,REACTOME,Immune System R-HSA-168256,True
KIR2DL4,,,no,ENSG00000189013,Killer cell immunoglobulin-like receptor 2DL4 (CD158 antigen-like family member D) (G9P) (Killer cell inhibitory receptor 103AS) (KIR-103AS) (MHC class I NK cell receptor KIR103AS) (CD antigen CD158d),Cell membrane,"gamma-delta T cell;innate lymphoid cell;natural killer cell;CD16-negative, CD56-bright natural killer cell, human;decidual natural killer cell, human;ILC1, human",,0.071,0.055,0.071,328,133,-0.361,REACTOME,Immune System R-HSA-168256,False
KIR3DL1,,,no,ENSG00000167633,Killer cell immunoglobulin-like receptor 3DL1 (CD158 antigen-like family member E) (HLA-BW4-specific inhibitory NK cell receptor) (Natural killer-associated transcript 3) (NKAT-3) (p70 natural killer cell receptor clones CL-2/CL-11) (p70 NK receptor CL-2/CL-11) (CD antigen CD158e),Cell membrane,"effector memory CD8-positive, alpha-beta T cell, terminally differentiated;gamma-delta T cell;mature gamma-delta T cell;innate lymphoid cell;natural killer cell;CD16-negative, CD56-bright natural killer cell, human;CD16-positive, CD56-dim natural killer cell, human",MHC-I,0.035,0.06,0.06,164,145,0.764,REACTOME,Immune System R-HSA-168256,False
KLHL13,,,no,ENSG00000003096,Kelch-like protein 13 (BTB and kelch domain-containing protein 2),,kidney distal convoluted tubule epithelial cell;kidney loop of Henle ascending limb epithelial cell;kidney loop of Henle thick ascending limb epithelial cell;kidney cortex tubule cell;kidney loop of Henle epithelial cell;mesangial cell,,0.26,0.292,0.292,1205,705,0.168,REACTOME,Immune System R-HSA-168256,True
KLRB1,,,no,ENSG00000111796,Killer cell lectin-like receptor subfamily B member 1 (C-type lectin domain family 5 member B) (HNKR-P1a) (NKR-P1A) (Natural killer cell surface protein P1A) (CD antigen CD161),Membrane,"hematopoietic cell;leukocyte;mononuclear cell;lymphocyte;T cell;alpha-beta T cell;mature alpha-beta T cell;CD4-positive, alpha-beta T cell;CD4-positive helper T cell;T-helper 1 cell;T-helper 2 cell;T-helper 17 cell;activated CD4-positive, alpha-beta T cell, human;CD4-positive, alpha-beta memory T cell;CD4-positive, alpha-beta memory T cell, CD45RO-positive;effector memory CD4-positive, alpha-beta T cell;CD4-positive, alpha-beta cytotoxic T cell;CD8-positive, alpha-beta cytokine secreting effector T cell;mature NK T cell;type I NK T cell;mucosal invariant T cell;gamma-delta T cell;mature gamma-delta T cell;CD8-alpha alpha positive, gamma-delta intraepithelial T cell;mature T cell;intraepithelial lymphocyte;innate lymphoid cell;natural killer cell;immature natural killer cell;CD16-negative, CD56-bright natural killer cell, human;CD16-positive, CD56-dim natural killer cell, human;decidual natural killer cell, human;ILC1, human;group 2 innate lymphoid cell;group 2 innate lymphoid cell, human;group 3 innate lymphoid cell;CD34-positive, CD56-positive, CD117-positive common innate lymphoid precursor, human;DN1 thymic pro-T cell",CLEC,0.401,0.499,0.499,1862,1206,0.315,REACTOME,Immune System R-HSA-168256,False
KLRC1,,,no,ENSG00000134545,NKG2-A/NKG2-B type II integral membrane protein (CD159 antigen-like family member A) (NK cell receptor A) (NKG2-A/B-activating NK receptor) (CD antigen CD159a),Cell membrane,"lymphocyte;CD8-positive, alpha-beta T cell;activated CD8-positive, alpha-beta T cell;CD8-positive, alpha-beta cytokine secreting effector T cell;CD8-positive, alpha-beta memory T cell;effector memory CD8-positive, alpha-beta T cell, terminally differentiated;central memory CD8-positive, alpha-beta T cell;CD8-alpha-beta-positive, alpha-beta intraepithelial T cell;mature NK T cell;type I NK T cell;gamma-delta T cell;mature gamma-delta T cell;intraepithelial lymphocyte;innate lymphoid cell;natural killer cell;CD16-negative, CD56-bright natural killer cell, human;CD16-positive, CD56-dim natural killer cell, human;decidual natural killer cell, human;ILC1, human;group 3 innate lymphoid cell",MHC-I,0.32,0.367,0.367,1483,887,0.2,REACTOME,Immune System R-HSA-168256,False
KLRC2,,,no,ENSG00000205809,NKG2-C type II integral membrane protein (CD159 antigen-like family member C) (NK cell receptor C) (NKG2-C-activating NK receptor) (CD antigen CD159c),Cell membrane,"CD8-positive, alpha-beta T cell;CD8-positive, alpha-beta cytotoxic T cell;CD8-positive, alpha-beta memory T cell;effector memory CD8-positive, alpha-beta T cell, terminally differentiated;CD8-positive, alpha-beta memory T cell, CD45RO-positive;effector memory CD8-positive, alpha-beta T cell;CD8-alpha-beta-positive, alpha-beta intraepithelial T cell;mature NK T cell;gamma-delta T cell;mature gamma-delta T cell;CD8-alpha alpha positive, gamma-delta intraepithelial T cell;intraepithelial lymphocyte;innate lymphoid cell;natural killer cell;CD16-negative, CD56-bright natural killer cell, human;CD16-positive, CD56-dim natural killer cell, human;decidual natural killer cell, human;ILC1, human",MHC-I,0.078,0.215,0.215,360,520,1.472,REACTOME,Immune System R-HSA-168256,False
KLRD1,,,no,ENSG00000134539,Natural killer cells antigen CD94 (KP43) (Killer cell lectin-like receptor subfamily D member 1) (NK cell receptor) (CD antigen CD94),Cell membrane,"leukocyte;mononuclear cell;lymphocyte;T cell;alpha-beta T cell;mature alpha-beta T cell;CD8-positive, alpha-beta T cell;CD8-positive, alpha-beta cytotoxic T cell;activated CD8-positive, alpha-beta T cell, human;CD8-positive, alpha-beta cytokine secreting effector T cell;CD8-positive, alpha-beta memory T cell;effector memory CD8-positive, alpha-beta T cell, terminally differentiated;CD8-positive, alpha-beta memory T cell, CD45RO-positive;effector memory CD8-positive, alpha-beta T cell;effector CD8-positive, alpha-beta T cell;mature NK T cell;type I NK T cell;mucosal invariant T cell;gamma-delta T cell;mature gamma-delta T cell;CD8-alpha alpha positive, gamma-delta intraepithelial T cell;mature T cell;double negative T regulatory cell;innate lymphoid cell;natural killer cell;CD16-negative, CD56-bright natural killer cell, human;CD16-positive, CD56-dim natural killer cell, human;decidual natural killer cell, human;ILC1, human;group 2 innate lymphoid cell;group 2 innate lymphoid cell, human",,0.133,0.099,0.133,615,240,-0.416,REACTOME,Immune System R-HSA-168256,False
KLRF1,,,no,ENSG00000150045,Killer cell lectin-like receptor subfamily F member 1 (Lectin-like receptor F1) (Activating coreceptor NKp80) (C-type lectin domain family 5 member C),Membrane,"leukocyte;mononuclear cell;lymphocyte;CD8-positive, alpha-beta T cell;activated CD8-positive, alpha-beta T cell;activated CD8-positive, alpha-beta T cell, human;CD8-positive, alpha-beta cytokine secreting effector T cell;CD8-positive, alpha-beta memory T cell;effector memory CD8-positive, alpha-beta T cell, terminally differentiated;CD8-positive, alpha-beta memory T cell, CD45RO-positive;effector memory CD8-positive, alpha-beta T cell;mature NK T cell;type I NK T cell;gamma-delta T cell;double negative T regulatory cell;innate lymphoid cell;natural killer cell;CD16-negative, CD56-bright natural killer cell, human;CD16-positive, CD56-dim natural killer cell, human;decidual natural killer cell, human;ILC1, human",,0.28,0.372,0.372,1300,898,0.408,REACTOME,Immune System R-HSA-168256,False
KLRG1,,,no,ENSG00000139187,Killer cell lectin-like receptor subfamily G member 1 (C-type lectin domain family 15 member A) (ITIM-containing receptor MAFA-L) (MAFA-like receptor) (Mast cell function-associated antigen),Cell membrane,"lymphocyte;T cell;mature alpha-beta T cell;CD4-positive, alpha-beta cytotoxic T cell;CD8-positive, alpha-beta T cell;CD8-positive, alpha-beta cytotoxic T cell;activated CD8-positive, alpha-beta T cell;activated CD8-positive, alpha-beta T cell, human;CD8-positive, alpha-beta memory T cell;effector memory CD8-positive, alpha-beta T cell, terminally differentiated;CD8-positive, alpha-beta memory T cell, CD45RO-positive;effector memory CD8-positive, alpha-beta T cell;effector CD8-positive, alpha-beta T cell;mucosal invariant T cell;gamma-delta T cell;mature gamma-delta T cell;CD8-alpha alpha positive, gamma-delta intraepithelial T cell;mature T cell;memory T cell;double negative T regulatory cell;ILC1, human;group 2 innate lymphoid cell",CDH1,1.026,1.01,1.026,4762,2440,-0.023,REACTOME,Immune System R-HSA-168256,False
KLRK1,,,no,ENSG00000213809,NKG2-D type II integral membrane protein (Killer cell lectin-like receptor subfamily K member 1) (NK cell receptor D) (NKG2-D-activating NK receptor) (CD antigen CD314),Cell membrane,"leukocyte;mononuclear cell;lymphocyte;T cell;alpha-beta T cell;mature alpha-beta T cell;CD4-positive, alpha-beta cytotoxic T cell;CD8-positive, alpha-beta T cell;CD8-positive, alpha-beta cytotoxic T cell;naive thymus-derived CD8-positive, alpha-beta T cell;CD8-positive, alpha-beta memory T cell;effector memory CD8-positive, alpha-beta T cell, terminally differentiated;CD8-positive, alpha-beta memory T cell, CD45RO-positive;central memory CD8-positive, alpha-beta T cell;effector memory CD8-positive, alpha-beta T cell;effector CD8-positive, alpha-beta T cell;mature NK T cell;mucosal invariant T cell;gamma-delta T cell;mature T cell;memory T cell;naive T cell;cytotoxic T cell;double negative T regulatory cell;innate lymphoid cell;natural killer cell;CD16-negative, CD56-bright natural killer cell, human;CD16-positive, CD56-dim natural killer cell, human;ILC1, human",MHC-I;NKG2D,1.444,1.266,1.444,6703,3059,-0.19,REACTOME,Immune System R-HSA-168256,False
KPNA1,,,no,ENSG00000114030,Importin subunit alpha-5 (Karyopherin subunit alpha-1) (Nucleoprotein interactor 1) (NPI-1) (RAG cohort protein 2) (SRP1-beta),Cytoplasm,,,3.226,2.482,3.226,14973,5998,-0.379,REACTOME,Immune System R-HSA-168256,True
KPNA2,,,no,ENSG00000182481,Importin subunit alpha-1 (Karyopherin subunit alpha-2) (RAG cohort protein 1) (SRP1-alpha),Cytoplasm,,,2.79,2.437,2.79,12948,5891,-0.195,REACTOME,Immune System R-HSA-168256,True
KPNA3,,,no,ENSG00000102753,Importin subunit alpha-4 (Importin alpha Q2) (Qip2) (Karyopherin subunit alpha-3) (SRP1-gamma),Cytoplasm,,,1.727,1.527,1.727,8013,3690,-0.177,REACTOME,Immune System R-HSA-168256,True
KPNB1,,,no,ENSG00000108424,Importin subunit beta-1 (Importin-90) (Karyopherin subunit beta-1) (Nuclear factor p97) (Pore targeting complex 97 kDa subunit) (PTAC97),Cytoplasm,pancreatic A cell,,10.463,9.755,10.463,48556,23576,-0.101,REACTOME,Immune System R-HSA-168256,True
KRT1,,,no,,,,,,8.811,8.175,8.811,40889,19759,-0.108,REACTOME,Immune System R-HSA-168256,False
LAG3,,,no,ENSG00000089692,Lymphocyte activation gene 3 protein (LAG-3) (CD antigen CD223),Secreted,"CD8-positive, alpha-beta T cell;activated CD8-positive, alpha-beta T cell;activated CD8-positive, alpha-beta T cell, human;CD8-positive, alpha-beta memory T cell, CD45RO-positive;effector memory CD8-positive, alpha-beta T cell;effector CD8-positive, alpha-beta T cell;CD8-alpha-beta-positive, alpha-beta intraepithelial T cell;gamma-delta T cell;mature gamma-delta T cell;CD8-alpha alpha positive, gamma-delta intraepithelial T cell;regulatory T cell;exhausted T cell",,0.963,0.273,0.963,4469,661,-1.816,REACTOME,Immune System R-HSA-168256,False
LAIR1,,,no,ENSG00000167613,Leukocyte-associated immunoglobulin-like receptor 1 (LAIR-1) (hLAIR1) (CD antigen CD305),Cell membrane,early lymphoid progenitor;early T lineage precursor,LAIR1,3.477,4.339,4.339,16138,10488,0.32,REACTOME,Immune System R-HSA-168256,False
LAIR2,,,no,ENSG00000167618,Leukocyte-associated immunoglobulin-like receptor 2 (LAIR-2) (CD antigen CD306),Secreted,"CD4-positive, alpha-beta cytotoxic T cell;CD8-positive, alpha-beta T cell;CD8-positive, alpha-beta cytotoxic T cell;CD8-positive, alpha-beta memory T cell, CD45RO-positive;effector memory CD8-positive, alpha-beta T cell;effector CD8-positive, alpha-beta T cell;mature gamma-delta T cell;regulatory T cell;innate lymphoid cell;natural killer cell;CD16-positive, CD56-dim natural killer cell, human",,1.493,0.921,1.493,6928,2226,-0.697,REACTOME,Immune System R-HSA-168256,False
LAMP1,,,no,ENSG00000185896,Lysosome-associated membrane glycoprotein 1 (LAMP-1) (Lysosome-associated membrane protein 1) (CD107 antigen-like family member A) (CD antigen CD107a),Cell membrane,pancreatic PP cell;PP cell;myeloid leukocyte;myeloid cell,,13.229,8.07,13.229,61396,19504,-0.713,REACTOME,Immune System R-HSA-168256,False
LAMP2,,,no,ENSG00000005893,Lysosome-associated membrane glycoprotein 2 (LAMP-2) (Lysosome-associated membrane protein 2) (CD107 antigen-like family member B) (LGP-96) (CD antigen CD107b),Cell membrane,intrahepatic cholangiocyte;acinar cell of salivary gland;duodenum glandular cell,,4.461,2.851,4.461,20704,6890,-0.646,REACTOME,Immune System R-HSA-168256,True
LCK,,,no,ENSG00000182866,Tyrosine-protein kinase Lck,Cell membrane,"hematopoietic cell;leukocyte;mononuclear cell;lymphocyte;T cell;alpha-beta T cell;immature alpha-beta T cell;double-positive, alpha-beta thymocyte;mature alpha-beta T cell;CD4-positive, alpha-beta T cell;CD4-positive helper T cell;T-helper 2 cell;T-helper 17 cell;T-helper 22 cell;naive regulatory T cell;CD8-positive, alpha-beta T cell;CD8-positive, alpha-beta cytotoxic T cell;naive thymus-derived CD8-positive, alpha-beta T cell;activated CD8-positive, alpha-beta T cell, human;effector memory CD8-positive, alpha-beta T cell, terminally differentiated;CD8-alpha-alpha-positive, alpha-beta intraepithelial T cell;mucosal invariant T cell;gamma-delta T cell;mature T cell;regulatory T cell;exhausted T cell;intraepithelial lymphocyte;immature T cell;thymocyte;double negative thymocyte;DN4 thymocyte;double negative T regulatory cell",LCK,6.358,6.631,6.631,29506,16027,0.061,REACTOME,Immune System R-HSA-168256,False
LGALS9,,,no,ENSG00000168961,Galectin-9 (Gal-9) (Ecalectin) (Tumor antigen HOM-HD-21),Cytoplasm,"dendritic cell;CD141-positive myeloid dendritic cell;conventional dendritic cell;myeloid dendritic cell;CD1c-positive myeloid dendritic cell;CD14-low, CD16-positive monocyte;CD14-positive, CD16-positive monocyte;erythroid progenitor cell, mammalian;pre-conventional dendritic cell",GALECTIN,4.807,3.037,4.807,22307,7340,-0.662,REACTOME,Immune System R-HSA-168256,False
LGMN,,,no,ENSG00000100600,Legumain,Lysosome,pancreatic PP cell;PP cell;macrophage;elicited macrophage;alternatively activated macrophage;Kupffer cell;colon macrophage;Hofbauer cell;intermediate monocyte;immature innate lymphoid cell,,10.946,10.547,10.946,50801,25492,-0.054,REACTOME,Immune System R-HSA-168256,False
LIF,,,no,ENSG00000128342,Leukemia inhibitory factor (LIF) (Differentiation-stimulating factor) (D factor) (Melanoma-derived LPL inhibitor) (MLPLI) (Emfilermin),Secreted,smooth muscle cell of prostate;mast cell;mucosal type mast cell;group 2 innate lymphoid cell;fibroblast of mammary gland;fibroblast of connective tissue of nonglandular part of prostate;fibroblast of connective tissue of glandular part of prostate;fibroblast of breast,LIFR,0.065,0.14,0.14,301,338,1.109,REACTOME,Immune System R-HSA-168256,False
LIFR,,,no,ENSG00000113594,Leukemia inhibitory factor receptor (LIF receptor) (LIF-R) (CD antigen CD118),Secreted,retinal blood vessel endothelial cell;kidney capillary endothelial cell;lung microvascular endothelial cell;lung endothelial cell;fenestrated cell;glomerular endothelial cell;endothelial cell of sinusoid;endothelial cell of hepatic sinusoid;endothelial cell of pericentral hepatic sinusoid;endothelial cell of uterus;trophoblast giant cell;Bergmann glial cell;hepatic stellate cell,LIFR;OSM,2.913,1.509,2.913,13517,3646,-0.949,REACTOME,Immune System R-HSA-168256,False
LILRA1,,,no,ENSG00000104974,Leukocyte immunoglobulin-like receptor subfamily A member 1 (CD85 antigen-like family member I) (Leukocyte immunoglobulin-like receptor 6) (LIR-6) (CD antigen CD85i),Membrane,non-classical monocyte;mature NK T cell,,0.068,0.162,0.162,317,392,1.248,REACTOME,Immune System R-HSA-168256,False
LILRA2,,,no,ENSG00000239998,Leukocyte immunoglobulin-like receptor subfamily A member 2 (CD85 antigen-like family member H) (Immunoglobulin-like transcript 1) (ILT-1) (Leukocyte immunoglobulin-like receptor 7) (LIR-7) (CD antigen CD85h),Cell membrane,"classical monocyte;hematopoietic cell;granulocyte;leukocyte;myeloid leukocyte;monocyte;non-classical monocyte;CD14-positive monocyte;CD14-positive, CD16-positive monocyte;mature NK T cell;myeloid cell;promonocyte;myelocyte",,0.144,0.307,0.307,668,743,1.095,REACTOME,Immune System R-HSA-168256,False
LILRA4,,,no,ENSG00000239961,Leukocyte immunoglobulin-like receptor subfamily A member 4 (CD85 antigen-like family member G) (Immunoglobulin-like transcript 7) (ILT-7) (CD antigen CD85g),Cell membrane,"dendritic cell;plasmacytoid dendritic cell;plasmacytoid dendritic cell, human;dendritic cell, human;unswitched memory B cell;follicular B cell;transitional stage B cell;common dendritic progenitor",,0.317,0.44,0.44,1470,1063,0.474,REACTOME,Immune System R-HSA-168256,False
LILRA5,,,no,ENSG00000187116,Leukocyte immunoglobulin-like receptor subfamily A member 5 (CD85 antigen-like family member F) (Immunoglobulin-like transcript 11) (ILT-11) (Leukocyte immunoglobulin-like receptor 9) (LIR-9) (CD antigen CD85f),Cell membrane,"phagocyte;classical monocyte;CD14-positive, CD16-negative classical monocyte;blood cell;granulocyte;neutrophil;immature neutrophil;leukocyte;Langerhans cell;myeloid leukocyte;monocyte;non-classical monocyte;CD14-low, CD16-positive monocyte;CD14-positive monocyte;CD14-positive, CD16-positive monocyte;intermediate monocyte;mononuclear cell;mature NK T cell;myeloid cell",,0.234,0.503,0.503,1087,1216,1.103,REACTOME,Immune System R-HSA-168256,False
LILRA6,,,no,ENSG00000244482,Leukocyte immunoglobulin-like receptor subfamily A member 6 (Immunoglobulin-like transcript 8) (ILT-8) (Leukocyte Ig-like receptor),Membrane,,,0.835,0.769,0.835,3875,1858,-0.119,REACTOME,Immune System R-HSA-168256,True
LILRB1,,,no,ENSG00000104972,Leukocyte immunoglobulin-like receptor subfamily B member 1 (LIR-1) (Leukocyte immunoglobulin-like receptor 1) (CD85 antigen-like family member J) (Immunoglobulin-like transcript 2) (ILT-2) (Monocyte/macrophage immunoglobulin-like receptor 7) (MIR-7) (CD antigen CD85j),Cell membrane,"myeloid leukocyte;monocyte;non-classical monocyte;CD14-low, CD16-positive monocyte;CD14-positive monocyte;CD14-positive, CD16-positive monocyte;intermediate monocyte;mature NK T cell;myeloid cell",MHC-I,0.518,0.813,0.813,2404,1965,0.65,REACTOME,Immune System R-HSA-168256,False
LILRB2,,,no,ENSG00000131042,Leukocyte immunoglobulin-like receptor subfamily B member 2 (LIR-2) (Leukocyte immunoglobulin-like receptor 2) (CD85 antigen-like family member D) (Immunoglobulin-like transcript 4) (ILT-4) (Monocyte/macrophage immunoglobulin-like receptor 10) (MIR-10) (CD antigen CD85d),Cell membrane,"phagocyte;colon macrophage;classical monocyte;CD14-positive, CD16-negative classical monocyte;hematopoietic cell;leukocyte;dendritic cell;conventional dendritic cell;myeloid leukocyte;monocyte;non-classical monocyte;CD14-low, CD16-positive monocyte;CD14-positive monocyte;CD14-positive, CD16-positive monocyte;intermediate monocyte;mononuclear cell;mature NK T cell;peripheral blood mononuclear cell;myeloid cell",MHC-I,0.238,0.415,0.415,1104,1003,0.803,REACTOME,Immune System R-HSA-168256,False
LILRB4,,,no,ENSG00000186818,Leukocyte immunoglobulin-like receptor subfamily B member 4 (B4) (CD85 antigen-like family member K) (Immunoglobulin-like transcript 3) (ILT-3) (Leukocyte immunoglobulin-like receptor 5) (LIR-5) (Monocyte inhibitory receptor HM18) (CD antigen CD85k),Cell membrane,"alternatively activated macrophage;professional antigen presenting cell;dendritic cell;plasmacytoid dendritic cell;plasmacytoid dendritic cell, human;dendritic cell, human;plasmablast",LAIR1,0.445,0.813,0.813,2063,1964,0.87,REACTOME,Immune System R-HSA-168256,False
LILRB5,,,no,ENSG00000105609,Leukocyte immunoglobulin-like receptor subfamily B member 5 (CD85 antigen-like family member C) (Leukocyte immunoglobulin-like receptor 8) (LIR-8) (CD antigen CD85c),Membrane,alternatively activated macrophage;colon macrophage,,0.553,0.762,0.762,2567,1841,0.462,REACTOME,Immune System R-HSA-168256,False
LIMK1,,,no,ENSG00000106683,LIM domain kinase 1 (LIMK-1),Cytoplasm,,,2.024,1.643,2.024,9392,3971,-0.301,REACTOME,Immune System R-HSA-168256,True
LMNB1,,,no,ENSG00000113368,Lamin-B1,Nucleus lamina,DN4 thymocyte;precursor B cell;large pre-B-II cell;common dendritic progenitor;hematopoietic precursor cell;pro-B cell;fraction A pre-pro B cell,,3.081,3.037,3.081,14299,7340,-0.021,REACTOME,Immune System R-HSA-168256,False
LONP1,,,no,ENSG00000196365,"Lon protease homolog, mitochondrial",Mitochondrion matrix,,,4.649,3.867,4.649,21574,9345,-0.266,REACTOME,Immune System R-HSA-168256,True
