CTSL,,,no,ENSG00000135047,Procathepsin L,Lysosome,elicited macrophage;inflammatory macrophage;alternatively activated macrophage;lung macrophage;Hofbauer cell;extravillous trophoblast;placental villous trophoblast;syncytiotrophoblast cell;leukocyte;myeloid leukocyte;mast cell;mucosal type mast cell;myeloid cell;fibroblast;pancreatic stellate cell;fibroblast of mammary gland;fibroblast of breast,,7.976,6.736,7.976,37016,16281,-0.244,REACTOME,Immune System R-HSA-168256,False
CUL1,,,no,ENSG00000055130,Cullin-1 (CUL-1),,,,6.355,4.883,6.355,29495,11802,-0.38,REACTOME,Immune System R-HSA-168256,True
CUL2,,,no,ENSG00000108094,Cullin-2 (CUL-2),Nucleus,,,1.119,1.119,1.119,5194,2704,-0.0,REACTOME,Immune System R-HSA-168256,True
CUL3,,,no,ENSG00000036257,Cullin-3 (CUL-3),Nucleus,,,4.14,3.122,4.14,19214,7546,-0.407,REACTOME,Immune System R-HSA-168256,True
CUL5,,,no,ENSG00000166266,Cullin-5 (CUL-5) (Vasopressin-activated calcium-mobilizing receptor 1) (VACM-1),Nucleus,,,1.935,1.777,1.935,8981,4296,-0.123,REACTOME,Immune System R-HSA-168256,True
CXADR,,,no,ENSG00000154639,Coxsackievirus and adenovirus receptor (CAR) (hCAR) (CVB3-binding protein) (Coxsackievirus B-adenovirus receptor) (HCVADR),Secreted,type B pancreatic cell;urothelial cell;bladder urothelial cell;bladder cell,,1.149,1.243,1.243,5331,3004,0.114,REACTOME,Immune System R-HSA-168256,True
CXCL10,,,no,ENSG00000169245,C-X-C motif chemokine 10 (10 kDa interferon gamma-induced protein) (Gamma-IP10) (IP-10) (Small-inducible cytokine B10),Secreted,medullary thymic epithelial cell;early T lineage precursor,CXCL,0.492,0.691,0.691,2285,1669,0.488,REACTOME,Immune System R-HSA-168256,False
CXCL2,,,no,ENSG00000081041,C-X-C motif chemokine 2 (Growth-regulated protein beta) (Gro-beta) (Macrophage inflammatory protein 2-alpha) (MIP2-alpha),Secreted,endothelial cell of artery;prostate gland microvascular endothelial cell;duodenum glandular cell;epithelial cell of uterus;endothelial cell of lymphatic vessel;alternatively activated macrophage;reticular cell;fibroblast of mammary gland;inflammatory cell,CXCL,0.14,0.326,0.326,648,787,1.222,REACTOME,Immune System R-HSA-168256,False
CXCR1,,,no,ENSG00000163464,C-X-C chemokine receptor type 1 (CXC-R1) (CXCR-1) (CDw128a) (High affinity interleukin-8 receptor A) (IL-8R A) (IL-8 receptor type 1) (CD antigen CD181),Cell membrane,,CXCL,0.087,0.133,0.133,405,322,0.61,REACTOME,Immune System R-HSA-168256,True
CXCR2,,,no,ENSG00000180871,C-X-C chemokine receptor type 2 (CXC-R2) (CXCR-2) (CDw128b) (GRO/MGSA receptor) (High affinity interleukin-8 receptor B) (IL-8R B) (IL-8 receptor type 2) (CD antigen CD182),Cell membrane,blood cell;granulocyte;neutrophil,CXCL;MIF,0.05,0.072,0.072,231,175,0.541,REACTOME,Immune System R-HSA-168256,True
CYBA,,,no,ENSG00000051523,Cytochrome b-245 light chain (Cytochrome b(558) alpha chain) (Cytochrome b558 subunit alpha) (Neutrophil cytochrome b 22 kDa polypeptide) (Superoxide-generating NADPH oxidase light chain subunit) (p22 phagocyte B-cytochrome) (p22-phox) (p22phox),Cell membrane,"plasmacytoid dendritic cell;plasmacytoid dendritic cell, human;dendritic cell, human;activated CD8-positive, alpha-beta T cell, human;plasma cell;IgG plasma cell;IgA plasma cell",,10.279,9.046,10.279,47703,21862,-0.184,REACTOME,Immune System R-HSA-168256,False
CYBB,,,no,ENSG00000165168,Cytochrome b-245 heavy chain,Cell membrane,"phagocyte;macrophage;alveolar macrophage;lung macrophage;classical monocyte;CD14-positive, CD16-negative classical monocyte;hematopoietic cell;granulocyte;immature neutrophil;leukocyte;professional antigen presenting cell;plasmacytoid dendritic cell, human;myeloid leukocyte;monocyte;non-classical monocyte;CD14-low, CD16-positive monocyte;CD14-positive monocyte;CD14-positive, CD16-positive monocyte;intermediate monocyte;myeloid cell;promonocyte;myelocyte;granulocytopoietic cell",,3.863,4.441,4.441,17929,10733,0.201,REACTOME,Immune System R-HSA-168256,False
CYFIP2,,,no,ENSG00000055163,Cytoplasmic FMR1-interacting protein 2 (p53-inducible protein 121),Cytoplasm,kidney collecting duct principal cell;renal principal cell;epithelial cell of alveolus of lung;pneumocyte;type II pneumocyte;kidney loop of Henle ascending limb epithelial cell;kidney loop of Henle thick ascending limb epithelial cell;kidney loop of Henle epithelial cell;lung secretory cell,,6.896,7.113,7.113,32006,17191,0.045,REACTOME,Immune System R-HSA-168256,True
CYLD,,,no,ENSG00000083799,Ubiquitin carboxyl-terminal hydrolase CYLD,Cytoplasm,"mononuclear cell;lymphocyte;T cell;CD4-positive, CD25-positive, alpha-beta regulatory T cell;memory regulatory T cell;activated CD4-positive, alpha-beta T cell, human",,12.205,11.006,12.205,56642,26601,-0.149,REACTOME,Immune System R-HSA-168256,False
DCAF1,,,no,ENSG00000145041,DDB1- and CUL4-associated factor 1 (HIV-1 Vpr-binding protein) (VprBP) (Serine/threonine-protein kinase VPRBP),Cytoplasm,,,2.186,1.73,2.186,10143,4181,-0.337,REACTOME,Immune System R-HSA-168256,True
DCTN1,,,no,ENSG00000204843,Dynactin subunit 1 (150 kDa dynein-associated polypeptide) (DAP-150) (DP-150) (p135) (p150-glued),Cytoplasm,,,9.528,6.065,9.528,44219,14659,-0.652,REACTOME,Immune System R-HSA-168256,True
DDX3X,,,no,ENSG00000215301,ATP-dependent RNA helicase DDX3X,Cell membrane,immature natural killer cell,,10.204,10.005,10.204,47356,24182,-0.028,REACTOME,Immune System R-HSA-168256,False
DEFA6,,,no,ENSG00000164822,"Defensin-6 (Defensin, alpha 6)",Secreted,intestinal crypt stem cell;intestinal crypt stem cell of small intestine;small intestine goblet cell;type L enteroendocrine cell;paneth cell;double negative thymocyte,,0.036,0.061,0.061,168,148,0.758,REACTOME,Immune System R-HSA-168256,False
DEFB4A,,,no,ENSG00000171711,,,,,0.215,0.237,0.237,997,573,0.142,REACTOME,Immune System R-HSA-168256,True
DGAT1,,,no,ENSG00000185000,Diacylglycerol O-acyltransferase 1,Endoplasmic reticulum membrane,ciliated epithelial cell;enterocyte;enterocyte of epithelium of large intestine;enterocyte of colon;enterocyte of epithelium of small intestine;enterocyte of epithelium proper of ileum;columnar/cuboidal epithelial cell;M cell of gut;intestinal epithelial cell;epithelial cell of small intestine;transit amplifying cell of small intestine,,3.175,2.021,3.175,14733,4885,-0.651,REACTOME,Immune System R-HSA-168256,True
DHX9,,,no,ENSG00000135829,ATP-dependent RNA helicase A,Nucleus,pancreatic A cell,,6.308,5.925,6.308,29276,14319,-0.091,REACTOME,Immune System R-HSA-168256,True
DNM1,,,no,ENSG00000106976,Dynamin-1,Cytoplasm,retinal ganglion cell,,0.532,0.59,0.59,2469,1427,0.15,REACTOME,Immune System R-HSA-168256,True
DNM2,,,no,ENSG00000079805,Dynamin-2,Cytoplasm;Cytoplasm,corneal endothelial cell;taste receptor cell;respiratory epithelial cell;epithelial cell of lower respiratory tract;club cell;papillary tips cell,,14.019,10.728,14.019,65063,25929,-0.386,REACTOME,Immune System R-HSA-168256,False
DSG1,,,no,ENSG00000134760,Desmoglein-1 (Cadherin family member 4) (Desmosomal glycoprotein 1) (DG1) (DGI) (Pemphigus foliaceus antigen),Cell membrane,stem cell;basal cell;basal cell of epidermis;stem cell of epidermis;squamous epithelial cell;keratinocyte;corneal epithelial cell;epidermal cell;skin fibroblast,DESMOSOME,0.34,0.306,0.34,1576,740,-0.149,REACTOME,Immune System R-HSA-168256,False
DUSP6,,,no,ENSG00000139318,Dual specificity protein phosphatase 6,Cytoplasm,classical monocyte;monocyte;group 2 innate lymphoid cell,,0.721,1.708,1.708,3344,4128,1.245,REACTOME,Immune System R-HSA-168256,False
DYNC1H1,,,no,ENSG00000197102,"Cytoplasmic dynein 1 heavy chain 1 (Cytoplasmic dynein heavy chain 1) (Dynein heavy chain, cytosolic)",Cytoplasm,retinal ganglion cell;salivary gland cell,,6.154,5.529,6.154,28561,13363,-0.155,REACTOME,Immune System R-HSA-168256,True
EBI3,,,no,ENSG00000105246,Interleukin-27 subunit beta (IL-27 subunit beta) (IL-27B) (Epstein-Barr virus-induced gene 3 protein) (EBV-induced gene 3 protein),Secreted,trophoblast giant cell;extravillous trophoblast,IL12,0.609,0.275,0.609,2827,664,-1.149,REACTOME,Immune System R-HSA-168256,False
ECSIT,,,no,ENSG00000130159,"Evolutionarily conserved signaling intermediate in Toll pathway, mitochondrial (Protein SITPEC)",Cytoplasm,,,1.51,1.104,1.51,7008,2669,-0.451,REACTOME,Immune System R-HSA-168256,True
EDA,,,no,ENSG00000158813,Ectodysplasin-A (Ectodermal dysplasia protein) (EDA protein),Cell membrane,endothelial cell of sinusoid;endothelial cell of hepatic sinusoid;endothelial cell of pericentral hepatic sinusoid;regular atrial cardiac myocyte,EDA,0.241,0.273,0.273,1120,659,0.176,REACTOME,Immune System R-HSA-168256,False
EGFL7,,,no,ENSG00000172889,Epidermal growth factor-like protein 7 (EGF-like protein 7) (Multiple epidermal growth factor-like domains protein 7) (Multiple EGF-like domains protein 7) (NOTCH4-like protein) (Vascular endothelial statin) (VE-statin) (Zneu1),Secreted,"hematopoietic stem cell;CD34-positive, CD38-negative hematopoietic stem cell;epithelial cell;endothelial tip cell;endothelial cell of artery;glomerular capillary endothelial cell;capillary endothelial cell;lung microvascular endothelial cell;lung endothelial cell;pancreatic A cell;glomerular endothelial cell;endothelial cell;gut endothelial cell;endothelial cell of vascular tree;endothelial cell of sinusoid;endothelial cell of uterus;cerebral cortex endothelial cell",,2.424,2.953,2.953,11250,7136,0.285,REACTOME,Immune System R-HSA-168256,False
EIF2AK2,,,no,ENSG00000055332,"Interferon-induced, double-stranded RNA-activated protein kinase",Cytoplasm,"activated CD4-positive, alpha-beta T cell, human;activated CD8-positive, alpha-beta T cell, human",,3.569,3.153,3.569,16563,7620,-0.179,REACTOME,Immune System R-HSA-168256,False
EIF4A1,,,no,ENSG00000161960,Eukaryotic initiation factor 4A-I (eIF-4A-I) (eIF4A-I),,"CD34-positive, CD38-negative hematopoietic stem cell;myoepithelial cell;myoepithelial cell of mammary gland;prostate gland microvascular endothelial cell;basal cell of prostate epithelium;epithelial cell of urethra;myeloid dendritic cell;CD1c-positive myeloid dendritic cell;myeloid leukocyte;T-helper 17 cell;erythroid progenitor cell;erythroid progenitor cell, mammalian;proerythroblast;fibroblast of mammary gland;fibroblast of connective tissue of nonglandular part of prostate;fibroblast of connective tissue of glandular part of prostate",,20.511,17.62,20.511,95191,42585,-0.219,REACTOME,Immune System R-HSA-168256,False
EIF4A3,,,no,ENSG00000141543,Eukaryotic initiation factor 4A-III (eIF-4A-III) (eIF4A-III),Nucleus,T follicular helper cell;precursor B cell;fibroblast of connective tissue of nonglandular part of prostate,,4.602,2.624,4.602,21359,6341,-0.811,REACTOME,Immune System R-HSA-168256,False
EIF4E,,,no,ENSG00000151247,Eukaryotic translation initiation factor 4E (eIF-4E) (eIF4E) (eIF-4F 25 kDa subunit) (mRNA cap-binding protein),Cytoplasm,,,1.733,1.907,1.907,8044,4608,0.137,REACTOME,Immune System R-HSA-168256,True
EIF4G1,,,no,ENSG00000114867,Eukaryotic translation initiation factor 4 gamma 1 (eIF-4-gamma 1) (eIF-4G 1) (eIF-4G1) (p220),Cytoplasm,fallopian tube secretory epithelial cell,,9.53,6.254,9.53,44226,15116,-0.608,REACTOME,Immune System R-HSA-168256,True
ELANE,,,no,ENSG00000197561,Neutrophil elastase,Cytoplasmic vesicle,bone marrow cell;granulocyte;neutrophil;immature neutrophil;promyelocyte;hematopoietic precursor cell;granulocytopoietic cell;common myeloid progenitor;reticular cell,,0.423,1.028,1.028,1965,2484,1.279,REACTOME,Immune System R-HSA-168256,False
ELOB,,,no,ENSG00000103363,Elongin-B (EloB) (Elongin 18 kDa subunit) (RNA polymerase II transcription factor SIII subunit B) (SIII p18) (Transcription elongation factor B polypeptide 2),Nucleus,microfold cell of epithelium of small intestine;serous cell of epithelium of bronchus,,0.179,0.224,0.224,831,541,0.322,REACTOME,Immune System R-HSA-168256,True
ELOC,,,no,ENSG00000154582,Elongin-C (EloC) (Elongin 15 kDa subunit) (RNA polymerase II transcription factor SIII subunit C) (SIII p15) (Transcription elongation factor B polypeptide 1),Nucleus,prostate gland microvascular endothelial cell;mesothelial cell of pleura,,1.153,0.947,1.153,5353,2288,-0.285,REACTOME,Immune System R-HSA-168256,False
EP300,,,no,ENSG00000100393,Histone acetyltransferase p300 (p300 HAT),Cytoplasm,enucleate erythrocyte,,8.468,7.637,8.468,39300,18458,-0.149,REACTOME,Immune System R-HSA-168256,True
ERAP1,,,no,ENSG00000164307,Endoplasmic reticulum aminopeptidase 1,Endoplasmic reticulum membrane,skeletal muscle fiber;cell of skeletal muscle,,6.917,4.776,6.917,32099,11542,-0.534,REACTOME,Immune System R-HSA-168256,False
FADD,,,no,ENSG00000168040,FAS-associated death domain protein (FAS-associating death domain-containing protein) (Growth-inhibiting gene 3 protein) (Mediator of receptor induced toxicity),,,,2.684,1.754,2.684,12456,4239,-0.614,REACTOME,Immune System R-HSA-168256,True
FAF2,,,no,ENSG00000113194,FAS-associated factor 2 (Protein ETEA) (UBX domain-containing protein 3B) (UBX domain-containing protein 8),Cytoplasm,,,4.13,3.088,4.13,19169,7464,-0.419,REACTOME,Immune System R-HSA-168256,True
FASLG,,,no,ENSG00000117560,Tumor necrosis factor ligand superfamily member 6 (Apoptosis antigen ligand) (APTL) (CD95 ligand) (CD95-L) (Fas antigen ligand) (Fas ligand) (FasL) (CD antigen CD178),Cell membrane,"activated CD8-positive, alpha-beta T cell;gamma-delta T cell;intraepithelial lymphocyte;CD16-negative, CD56-bright natural killer cell, human",,0.073,0.132,0.132,340,319,0.849,REACTOME,Immune System R-HSA-168256,False
FBXO27,,,no,,,,,,0.77,0.25,0.77,3572,604,-1.623,REACTOME,Immune System R-HSA-168256,True
FBXW11,,,no,ENSG00000072803,F-box/WD repeat-containing protein 11 (F-box and WD repeats protein beta-TrCP2) (F-box/WD repeat-containing protein 1B) (Homologous to Slimb protein) (HOS),Cytoplasm,,,2.039,1.707,2.039,9461,4126,-0.256,REACTOME,Immune System R-HSA-168256,True
FBXW7,,,no,ENSG00000109670,F-box/WD repeat-containing protein 7 (Archipelago homolog) (hAgo) (F-box and WD-40 domain-containing protein 7) (F-box protein FBX30) (SEL-10) (hCdc4),Nucleus,basal cell of epidermis,,0.75,0.612,0.75,3483,1479,-0.294,REACTOME,Immune System R-HSA-168256,True
FCAR,,,no,ENSG00000186431,Immunoglobulin alpha Fc receptor (IgA Fc receptor) (CD antigen CD89),Secreted,blood cell;granulocyte;myelocyte,,0.112,0.204,0.204,518,494,0.873,REACTOME,Immune System R-HSA-168256,True
FCER1A,,,no,ENSG00000179639,High affinity immunoglobulin epsilon receptor subunit alpha (Fc-epsilon RI-alpha) (FcERI) (IgE Fc receptor subunit alpha),Cell membrane,"hematopoietic stem cell;CD34-positive, CD38-negative hematopoietic stem cell;colon macrophage;mononuclear phagocyte;basophil;professional antigen presenting cell;dendritic cell;plasmacytoid dendritic cell;plasmacytoid dendritic cell, human;conventional dendritic cell;Langerhans cell;myeloid dendritic cell;myeloid dendritic cell, human;CD1c-positive myeloid dendritic cell;dendritic cell, human;mast cell;mucosal type mast cell;megakaryocyte-erythroid progenitor cell;megakaryocyte;erythroid progenitor cell, mammalian",,0.089,0.129,0.129,413,312,0.537,REACTOME,Immune System R-HSA-168256,False
FCER2,,,no,ENSG00000104921,Low affinity immunoglobulin epsilon Fc receptor (BLAST-2) (C-type lectin domain family 4 member J) (Fc-epsilon-RII) (Immunoglobulin E-binding factor) (Lymphocyte IgE receptor) (CD antigen CD23),Cell membrane,professional antigen presenting cell;mature B cell;memory B cell;unswitched memory B cell;class switched memory B cell;IgG-negative class switched memory B cell;naive B cell;B-1a B cell;B-1b B cell;follicular B cell;mononuclear cell;lymphocyte;B cell;immature B cell;transitional stage B cell;IgM plasma cell,,1.547,1.239,1.547,7178,2995,-0.32,REACTOME,Immune System R-HSA-168256,False
FCGR1A,,,no,ENSG00000150337,High affinity immunoglobulin gamma Fc receptor I (IgG Fc receptor I) (Fc-gamma RI) (FcRI) (Fc-gamma RIA) (FcgammaRIa) (CD antigen CD64),Cell membrane,phagocyte;macrophage;microglial cell;Hofbauer cell;classical monocyte;immature neutrophil;professional antigen presenting cell;myeloid leukocyte;mast cell;mucosal type mast cell;myeloid cell,,0.1,0.142,0.142,465,344,0.506,REACTOME,Immune System R-HSA-168256,False
FCGR2A,,,no,ENSG00000143226,Low affinity immunoglobulin gamma Fc region receptor II-a (IgG Fc receptor II-a) (CDw32) (Fc-gamma RII-a) (Fc-gamma-RIIa) (FcRII-a) (CD antigen CD32),Cell membrane,"phagocyte;macrophage;elicited macrophage;inflammatory macrophage;alternatively activated macrophage;alveolar macrophage;microglial cell;colon macrophage;lung macrophage;CD14-positive, CD16-negative classical monocyte;hematopoietic cell;blood cell;granulocyte;neutrophil;leukocyte;professional antigen presenting cell;myeloid leukocyte;monocyte;CD14-positive, CD16-positive monocyte;myeloid cell",,3.617,3.735,3.735,16787,9026,0.046,REACTOME,Immune System R-HSA-168256,False
FCGR2B,,,no,ENSG00000072694,Low affinity immunoglobulin gamma Fc region receptor II-b (IgG Fc receptor II-b) (CDw32) (Fc-gamma RII-b) (Fc-gamma-RIIb) (FcRII-b) (CD antigen CD32),Cell membrane,"alternatively activated macrophage;colon macrophage;basophil;professional antigen presenting cell;dendritic cell;conventional dendritic cell;Langerhans cell;CD1c-positive myeloid dendritic cell;dendritic cell, human;unswitched memory B cell",,0.528,0.484,0.528,2452,1169,-0.127,REACTOME,Immune System R-HSA-168256,False
FCN1,,,no,ENSG00000085265,Ficolin-1 (Collagen/fibrinogen domain-containing protein 1) (Ficolin-A) (Ficolin-alpha) (M-ficolin),Secreted,"phagocyte;colon macrophage;classical monocyte;CD14-positive, CD16-negative classical monocyte;hematopoietic cell;blood cell;granulocyte;neutrophil;immature neutrophil;leukocyte;dendritic cell;conventional dendritic cell;myeloid dendritic cell;CD1c-positive myeloid dendritic cell;dendritic cell, human;myeloid leukocyte;monocyte;non-classical monocyte;CD14-low, CD16-positive monocyte;CD14-positive monocyte;CD14-positive, CD16-positive monocyte;intermediate monocyte;mononuclear cell;mature NK T cell;peripheral blood mononuclear cell;myeloid cell;promonocyte;promyelocyte;myelocyte;hematopoietic precursor cell;myeloid lineage restricted progenitor cell;granulocytopoietic cell",,0.098,0.826,0.826,454,1996,3.078,REACTOME,Immune System R-HSA-168256,False
FCN2,,,no,ENSG00000160339,Ficolin-2 (37 kDa elastin-binding protein) (Collagen/fibrinogen domain-containing protein 2) (EBP-37) (Ficolin-B) (Ficolin-beta) (Hucolin) (L-ficolin) (Serum lectin p35),Secreted,endothelial cell of sinusoid;endothelial cell of hepatic sinusoid;endothelial cell of pericentral hepatic sinusoid,,0.037,0.056,0.056,173,135,0.583,REACTOME,Immune System R-HSA-168256,False
FGF13,,,no,ENSG00000129682,Fibroblast growth factor 13 (FGF-13) (Fibroblast growth factor homologous factor 2) (FHF-2),Cytoplasm,chromaffin cell;epithelial cell of sweat gland;kidney distal convoluted tubule epithelial cell;ciliary muscle cell;neuronal brush cell;visceromotor neuron,,0.098,0.119,0.119,456,288,0.278,REACTOME,Immune System R-HSA-168256,True
FGR,,,no,ENSG00000000938,Tyrosine-protein kinase Fgr,Cell membrane,"phagocyte;classical monocyte;CD14-positive, CD16-negative classical monocyte;hematopoietic cell;granulocyte;neutrophil;leukocyte;dendritic cell;conventional dendritic cell;myeloid dendritic cell;CD1c-positive myeloid dendritic cell;myeloid leukocyte;monocyte;non-classical monocyte;CD14-low, CD16-positive monocyte;CD14-positive monocyte;CD14-positive, CD16-positive monocyte;intermediate monocyte;mononuclear cell;decidual natural killer cell, human;CD34-positive, CD56-positive, CD117-positive common innate lymphoid precursor, human;peripheral blood mononuclear cell;myeloid cell;promonocyte",,1.052,1.34,1.34,4882,3239,0.349,REACTOME,Immune System R-HSA-168256,False
FLNB,,,no,ENSG00000136068,Filamin-B (FLN-B) (ABP-278) (ABP-280 homolog) (Actin-binding-like protein) (Beta-filamin) (Filamin homolog 1) (Fh1) (Filamin-3) (Thyroid autoantigen) (Truncated actin-binding protein) (Truncated ABP),Cytoplasm,ciliary muscle cell;papillary tips cell,,9.304,6.957,9.304,43180,16814,-0.419,REACTOME,Immune System R-HSA-168256,True
FLT3,,,no,ENSG00000122025,Receptor-type tyrosine-protein kinase FLT3,Membrane,"hematopoietic stem cell;CD34-positive, CD38-negative hematopoietic stem cell;dendritic cell;plasmacytoid dendritic cell, human;CD141-positive myeloid dendritic cell;conventional dendritic cell;hematopoietic multipotent progenitor cell;subcutaneous fat cell",FLT3,0.692,0.377,0.692,3211,912,-0.875,REACTOME,Immune System R-HSA-168256,False
FLT3LG,,,no,ENSG00000090554,Fms-related tyrosine kinase 3 ligand (Flt3 ligand) (Flt3L) (SL cytokine),Secreted,"leukocyte;mononuclear cell;lymphocyte;T cell;alpha-beta T cell;mature alpha-beta T cell;CD4-positive, alpha-beta T cell;CD4-positive helper T cell;T-helper 1 cell;T-helper 22 cell;T follicular helper cell;naive thymus-derived CD4-positive, alpha-beta T cell;activated CD4-positive, alpha-beta T cell, human;CD4-positive, alpha-beta memory T cell;CD4-positive, alpha-beta memory T cell, CD45RO-positive;central memory CD4-positive, alpha-beta T cell;effector memory CD4-positive, alpha-beta T cell;CD8-positive, alpha-beta T cell;naive thymus-derived CD8-positive, alpha-beta T cell;CD8-positive, alpha-beta memory T cell;central memory CD8-positive, alpha-beta T cell;mucosal invariant T cell;mature T cell;memory T cell;regulatory T cell;naive T cell;exhausted T cell;group 2 innate lymphoid cell",,2.997,3.893,3.893,13907,9410,0.378,REACTOME,Immune System R-HSA-168256,False
FOXO1,,,no,ENSG00000150907,Forkhead box protein O1 (Forkhead box protein O1A) (Forkhead in rhabdomyosarcoma),Cytoplasm,renal beta-intercalated cell;endothelial cell of pericentral hepatic sinusoid;skeletal muscle fiber;cell of skeletal muscle;fat cell;white fat cell;brown fat cell;subcutaneous fat cell;adipocyte of breast;epicardial adipocyte;adipocyte of epicardial fat of left ventricle,,4.399,3.376,4.399,20416,8159,-0.382,REACTOME,Immune System R-HSA-168256,False
FOXO3,,,no,ENSG00000118689,Forkhead box protein O3 (AF6q21 protein) (Forkhead in rhabdomyosarcoma-like 1),Cytoplasm,tongue muscle cell;skeletal muscle fibroblast;erythroid lineage cell,,3.615,1.334,3.615,16777,3224,-1.438,REACTOME,Immune System R-HSA-168256,False
FPR1,,,no,ENSG00000171051,fMet-Leu-Phe receptor (fMLP receptor) (N-formyl peptide receptor) (FPR) (N-formylpeptide chemoattractant receptor),Cell membrane,"phagocyte;macrophage;alveolar macrophage;microglial cell;lung macrophage;classical monocyte;CD14-positive, CD16-negative classical monocyte;blood cell;granulocyte;neutrophil;immature neutrophil;leukocyte;professional antigen presenting cell;myeloid leukocyte;monocyte;CD14-positive monocyte;CD14-positive, CD16-positive monocyte;intermediate monocyte;myeloid cell",ANNEXIN;TAFA;CTSG,0.242,0.472,0.472,1125,1140,0.96,REACTOME,Immune System R-HSA-168256,False
FPR2,,,no,ENSG00000171049,N-formyl peptide receptor 2 (FMLP-related receptor I) (FMLP-R-I) (Formyl peptide receptor-like 1) (HM63) (Lipoxin A4 receptor) (LXA4 receptor) (RFP),Cell membrane,blood cell;granulocyte;neutrophil;myelocyte,ANNEXIN;SAA;LXA4,0.146,0.326,0.326,676,787,1.161,REACTOME,Immune System R-HSA-168256,True
FSCN1,,,no,ENSG00000075618,Fascin (55 kDa actin-bundling protein) (Singed-like protein) (p55),Cytoplasm,glioblast;Schwann cell precursor;neural crest cell;Sertoli cell;endothelial tip cell;mesothelial cell;lung endothelial cell;granulosa cell;gut endothelial cell;ovarian surface epithelial cell;Hofbauer cell;immature Schwann cell;enteric neuron;peripheral nervous system neuron,,3.583,2.614,3.583,16628,6318,-0.455,REACTOME,Immune System R-HSA-168256,False
FUCA1,,,no,ENSG00000179163,Tissue alpha-L-fucosidase,Lysosome,intermediate monocyte,,4.391,3.804,4.391,20376,9194,-0.207,REACTOME,Immune System R-HSA-168256,False
FYN,,,no,ENSG00000010810,Tyrosine-protein kinase Fyn,Cytoplasm,alpha-beta T cell;mature alpha-beta T cell;mucosal invariant T cell;mature T cell;immature natural killer cell;DN1 thymic pro-T cell;brown preadipocyte;fibro/adipogenic progenitor cell,,5.017,3.562,5.017,23282,8609,-0.494,REACTOME,Immune System R-HSA-168256,False
FZR1,,,no,ENSG00000105325,Fizzy-related protein homolog (Fzr) (CDC20-like protein 1) (Cdh1/Hct1 homolog) (hCDH1),Cytoplasm,,,4.495,5.923,5.923,20859,14316,0.398,REACTOME,Immune System R-HSA-168256,True
GAA,,,no,ENSG00000171298,Lysosomal alpha-glucosidase,Lysosome,epithelial cell of thymus;cortical thymic epithelial cell;alveolar macrophage;lung macrophage,,11.386,7.203,11.386,52843,17408,-0.661,REACTOME,Immune System R-HSA-168256,False
GAB2,,,no,ENSG00000033327,GRB2-associated-binding protein 2 (GRB2-associated binder 2) (Growth factor receptor bound protein 2-associated protein 2) (pp100),Cytoplasm,tissue-resident macrophage;Kupffer cell;central nervous system macrophage;immature innate lymphoid cell;brown fat cell,,0.831,0.663,0.831,3855,1603,-0.325,REACTOME,Immune System R-HSA-168256,False
GALNS,,,no,ENSG00000141012,N-acetylgalactosamine-6-sulfatase,Lysosome,,,0.846,0.746,0.846,3925,1802,-0.182,REACTOME,Immune System R-HSA-168256,True
GATA3,,,no,ENSG00000107485,Trans-acting T-cell-specific transcription factor GATA-3 (GATA-binding factor 3),Nucleus,basal cell of epidermis;kidney collecting duct epithelial cell;kidney collecting duct principal cell;renal principal cell;taste receptor cell;kidney connecting tubule epithelial cell;extravillous trophoblast;placental villous trophoblast;syncytiotrophoblast cell;T-helper 2 cell;group 2 innate lymphoid cell;group 3 innate lymphoid cell;early T lineage precursor;neuron;papillary tips cell;kidney collecting duct cell,,1.326,1.086,1.326,6156,2625,-0.288,REACTOME,Immune System R-HSA-168256,False
GBP1,,,no,ENSG00000117228,Guanylate-binding protein 1,Cytoplasmic vesicle membrane,medullary thymic epithelial cell,,2.382,2.611,2.611,11053,6311,0.133,REACTOME,Immune System R-HSA-168256,False
