gene,category,rationale,exclude_recommended,gene_id,full_name,location,cell_type,cellchat_pathway,detection_pct_0041435,detection_pct_0041534,det_max,n_cells_0041435,n_cells_0041534,log2_detection_ratio,pathway_source,pathway_term,was_uncategorized
AAMP,,,no,ENSG00000127837,Angio-associated migratory cell protein,Cell membrane;Cytoplasm,pancreatic A cell,,5.934,3.543,5.934,27538,8562,-0.744,REACTOME,Immune System R-HSA-168256,True
ABL1,,,no,ENSG00000097007,Tyrosine-protein kinase ABL1,Cytoplasm,brown preadipocyte,,4.255,3.473,4.255,19747,8394,-0.293,REACTOME,Immune System R-HSA-168256,True
ABL2,,,no,ENSG00000143322,Tyrosine-protein kinase ABL2,Cytoplasm,,,1.918,1.656,1.918,8900,4003,-0.211,REACTOME,Immune System R-HSA-168256,True
ACLY,,,no,ENSG00000131473,ATP-citrate synthase,Cytoplasm,type B pancreatic cell;pancreatic PP cell;PP cell;brown fat cell;epicardial adipocyte,,5.449,4.013,5.449,25288,9698,-0.441,REACTOME,Immune System R-HSA-168256,True
ADAM10,,,no,ENSG00000137845,Disintegrin and metalloproteinase domain-containing protein 10 (ADAM 10),Cell membrane,papillary tips cell,,6.722,5.558,6.722,31197,13433,-0.274,REACTOME,Immune System R-HSA-168256,True
ADAM17,,,no,ENSG00000151694,Disintegrin and metalloproteinase domain-containing protein 17 (ADAM 17),Membrane,alveolar macrophage;lung macrophage,,3.242,2.602,3.242,15045,6288,-0.317,REACTOME,Immune System R-HSA-168256,False
ADAM8,,,no,ENSG00000151651,Disintegrin and metalloproteinase domain-containing protein 8 (ADAM 8),Membrane,"blood cell;granulocyte;basophil;eosinophil;conventional dendritic cell;Langerhans cell;myeloid dendritic cell, human;ILC1, human",,3.762,2.957,3.762,17461,7147,-0.347,REACTOME,Immune System R-HSA-168256,False
ADAR,,,no,ENSG00000160710,Double-stranded RNA-specific adenosine deaminase (DRADA),Cytoplasm,epithelial cell;endothelial cell;endothelial cell of vascular tree;IgA plasmablast,,14.564,11.289,14.564,67589,27283,-0.368,REACTOME,Immune System R-HSA-168256,False
ADGRE5,,,no,ENSG00000123146,Adhesion G protein-coupled receptor E5 (Leukocyte antigen CD97) (CD antigen CD97),Cell membrane,"alveolar macrophage;lung macrophage;non-classical monocyte;CD14-low, CD16-positive monocyte;CD14-positive, CD16-positive monocyte;T-helper 1 cell;mature NK T cell;CD16-negative, CD56-bright natural killer cell, human;CD16-positive, CD56-dim natural killer cell, human;decidual natural killer cell, human;group 3 innate lymphoid cell;peripheral blood mononuclear cell",ADGRE,6.469,4.899,6.469,30020,11840,-0.401,REACTOME,Immune System R-HSA-168256,False
AGER,,,no,ENSG00000204305,Advanced glycosylation end product-specific receptor (Receptor for advanced glycosylation end products),Cell membrane,epithelial cell;epithelial cell of lung;epithelial cell of alveolus of lung;pneumocyte;type I pneumocyte;type II pneumocyte;lung secretory cell,,1.469,1.037,1.469,6816,2507,-0.502,REACTOME,Immune System R-HSA-168256,True
AIM2,,,no,ENSG00000163568,Interferon-inducible protein AIM2 (Absent in melanoma 2),Cytoplasm,memory B cell;class switched memory B cell;follicular B cell,,0.443,0.455,0.455,2058,1100,0.038,REACTOME,Immune System R-HSA-168256,False
AKT1,,,no,ENSG00000142208,RAC-alpha serine/threonine-protein kinase,Cytoplasm,,,4.956,3.876,4.956,23000,9367,-0.355,REACTOME,Immune System R-HSA-168256,True
AKT2,,,no,ENSG00000105221,RAC-beta serine/threonine-protein kinase,Cytoplasm;Nucleus;Cell membrane,,,11.782,8.423,11.782,54677,20357,-0.484,REACTOME,Immune System R-HSA-168256,True
AKT3,,,no,ENSG00000117020,RAC-gamma serine/threonine-protein kinase,Nucleus,,,3.288,3.692,3.692,15260,8923,0.167,REACTOME,Immune System R-HSA-168256,True
ALAD,,,no,ENSG00000148218,Delta-aminolevulinic acid dehydratase (ALADH),,erythrocyte;erythroid lineage cell;erythroblast;primitive red blood cell,,1.007,1.094,1.094,4672,2644,0.12,REACTOME,Immune System R-HSA-168256,True
ALOX15,,,no,ENSG00000161905,"Polyunsaturated fatty acid lipoxygenase ALOX15 (12/15-lipoxygenase) (Arachidonate 12-lipoxygenase, leukocyte-type) (12-LOX)",Cytoplasm,stem cell;basal cell;respiratory basal cell;basal cell of epithelium of trachea;multi-ciliated epithelial cell;lung goblet cell;glandular epithelial cell;goblet cell;respiratory goblet cell;tracheal goblet cell;respiratory epithelial cell;epithelial cell of lower respiratory tract;club cell;bronchial epithelial cell;erythroid lineage cell,,0.409,0.29,0.409,1897,700,-0.497,REACTOME,Immune System R-HSA-168256,False
ALOX5,,,no,ENSG00000012779,Polyunsaturated fatty acid 5-lipoxygenase,Cytoplasm,brush cell;intestinal tuft cell;tuft cell of colon;macrophage;tissue-resident macrophage;alveolar macrophage;lung macrophage;basophil;eosinophil;Langerhans cell;B-1b B cell;mast cell,,2.944,2.156,2.944,13665,5210,-0.45,REACTOME,Immune System R-HSA-168256,False
ALPK1,,,no,ENSG00000073331,Alpha-protein kinase 1,Cytoplasm,,,1.917,1.693,1.917,8895,4092,-0.179,REACTOME,Immune System R-HSA-168256,True
ANAPC1,,,no,ENSG00000153107,Anaphase-promoting complex subunit 1 (APC1) (Cyclosome subunit 1) (Mitotic checkpoint regulator) (Testis-specific gene 24 protein),,,,3.825,3.491,3.825,17751,8438,-0.132,REACTOME,Immune System R-HSA-168256,True
ANPEP,,,no,ENSG00000166825,Aminopeptidase N (AP-N) (hAPN),Cell membrane,intestinal crypt stem cell of small intestine;ciliated epithelial cell;enterocyte;enterocyte of epithelium of large intestine;enterocyte of colon;enterocyte of epithelium of small intestine;enterocyte of epithelium proper of ileum;intrahepatic cholangiocyte;columnar/cuboidal epithelial cell;pancreatic acinar cell;enteroendocrine cell of small intestine;M cell of gut;intestinal epithelial cell;epithelial cell of large intestine;colon epithelial cell;epithelial cell of small intestine;respiratory epithelial cell;epithelial cell of lower respiratory tract;club cell;transit amplifying cell of small intestine,,1.506,1.269,1.506,6988,3067,-0.247,REACTOME,Immune System R-HSA-168256,False
ANXA2,,,no,ENSG00000182718,Annexin A2 (Annexin II) (Annexin-2) (Calpactin I heavy chain) (Calpactin-1 heavy chain) (Chromobindin-8) (Lipocortin II) (Placental anticoagulant protein IV) (PAP-IV) (Protein I) (p36),Secreted,basal cell of epithelium of bronchus;pancreatic ductal cell;epithelial cell of alveolus of lung;pneumocyte;type I pneumocyte;bronchial epithelial cell;epithelial cell of urethra;conjunctival epithelial cell;T cell,,16.021,9.825,16.021,74352,23747,-0.705,REACTOME,Immune System R-HSA-168256,True
AP1B1,,,no,ENSG00000100280,AP-1 complex subunit beta-1 (Adaptor protein complex AP-1 subunit beta-1) (Adaptor-related protein complex 1 subunit beta-1) (Beta-1-adaptin) (Beta-adaptin 1) (Clathrin assembly protein complex 1 beta large chain) (Golgi adaptor HA1/AP1 adaptin beta subunit),Golgi apparatus;Cytoplasmic vesicle,late pro-B cell,,16.241,9.102,16.241,75373,21999,-0.835,REACTOME,Immune System R-HSA-168256,False
AP1M1,,,no,ENSG00000072958,AP-1 complex subunit mu-1 (AP-mu chain family member mu1A) (Adaptor protein complex AP-1 subunit mu-1) (Adaptor-related protein complex 1 subunit mu-1) (Clathrin assembly protein complex 1 mu-1 medium chain 1) (Clathrin coat assembly protein AP47) (Clathrin coat-associated protein AP47) (Golgi adaptor HA1/AP1 adaptin mu-1 subunit) (Mu-adaptin 1) (Mu1A-adaptin),Golgi apparatus;Cytoplasmic vesicle,,,5.618,4.537,5.618,26072,10966,-0.308,REACTOME,Immune System R-HSA-168256,True
AP1S3,,,no,ENSG00000152056,AP-1 complex subunit sigma-3 (Adaptor protein complex AP-1 subunit sigma-1C) (Adaptor-related protein complex 1 subunit sigma-1C) (Clathrin assembly protein complex 1 sigma-1C small chain) (Golgi adaptor HA1/AP1 adaptin sigma-1C subunit) (Sigma 1C subunit of AP-1 clathrin) (Sigma-adaptin 1C) (Sigma1C-adaptin),Golgi apparatus;Cytoplasmic vesicle membrane,,,0.802,0.855,0.855,3720,2066,0.093,REACTOME,Immune System R-HSA-168256,True
AP2A1,,,no,ENSG00000196961,AP-2 complex subunit alpha-1 (100 kDa coated vesicle protein A) (Adaptor protein complex AP-2 subunit alpha-1) (Adaptor-related protein complex 2 subunit alpha-1) (Alpha-adaptin A) (Alpha1-adaptin) (Clathrin assembly protein complex 2 alpha-A large chain) (Plasma membrane adaptor HA2/AP2 adaptin alpha A subunit),Cell membrane,Leydig cell;erythroid lineage cell,,5.695,4.115,5.695,26428,9945,-0.469,REACTOME,Immune System R-HSA-168256,True
AP2A2,,,no,ENSG00000183020,AP-2 complex subunit alpha-2 (100 kDa coated vesicle protein C) (Adaptor protein complex AP-2 subunit alpha-2) (Adaptor-related protein complex 2 subunit alpha-2) (Alpha-adaptin C) (Alpha2-adaptin) (Clathrin assembly protein complex 2 alpha-C large chain) (Huntingtin yeast partner J) (Huntingtin-interacting protein 9) (HIP-9) (Huntingtin-interacting protein J) (Plasma membrane adaptor HA2/AP2 adaptin alpha C subunit),Cell membrane,Kupffer cell;immature innate lymphoid cell,,9.949,5.567,9.949,46173,13455,-0.838,REACTOME,Immune System R-HSA-168256,False
AP2M1,,,no,ENSG00000161203,AP-2 complex subunit mu (AP-2 mu chain) (Adaptin-mu2) (Adaptor protein complex AP-2 subunit mu) (Adaptor-related protein complex 2 subunit mu) (Clathrin assembly protein complex 2 mu medium chain) (Clathrin coat assembly protein AP50) (Clathrin coat-associated protein AP50) (HA2 50 kDa subunit) (Plasma membrane adaptor AP-2 50 kDa protein),Cell membrane,fallopian tube secretory epithelial cell;Hofbauer cell,,16.272,9.636,16.272,75519,23288,-0.756,REACTOME,Immune System R-HSA-168256,True
APAF1,,,no,ENSG00000120868,Apoptotic protease-activating factor 1 (APAF-1),Cytoplasm,,,1.167,1.348,1.348,5418,3257,0.207,REACTOME,Immune System R-HSA-168256,True
APOB,,,no,ENSG00000084674,Apolipoprotein B-100 (Apo B-100),Cytoplasm,hepatoblast;epithelial cell;ciliated epithelial cell;enterocyte;enterocyte of epithelium of large intestine;enterocyte of colon;enterocyte of epithelium of small intestine;enterocyte of epithelium proper of ileum;cholangiocyte;intrahepatic cholangiocyte;columnar/cuboidal epithelial cell;hepatocyte;periportal region hepatocyte;midzonal region hepatocyte;centrilobular region hepatocyte;M cell of gut;intestinal epithelial cell;epithelial cell of large intestine;colon epithelial cell;epithelial cell of small intestine;endothelial cell of sinusoid;endothelial cell of hepatic sinusoid;endothelial cell of pericentral hepatic sinusoid;Kupffer cell;hepatic stellate cell,ApoB,0.034,0.062,0.062,159,151,0.867,REACTOME,Immune System R-HSA-168256,False
APP,,,no,ENSG00000142192,Amyloid-beta precursor protein (APP) (ABPP) (APPI) (Alzheimer disease amyloid A4 protein homolog) (Alzheimer disease amyloid protein) (Amyloid precursor protein) (Amyloid-beta (A4) precursor protein) (Amyloid-beta A4 protein) (Cerebral vascular amyloid peptide) (CVAP) (PreA4) (Protease nexin-II) (PN-II),Cell membrane,epithelial cell;lens epithelial cell;anterior lens cell;endothelial tip cell;kidney capillary endothelial cell;glomerular capillary endothelial cell;lung endothelial cell;type B pancreatic cell;fenestrated cell;glomerular endothelial cell;endothelial cell;endothelial cell of vascular tree;kidney loop of Henle thin ascending limb epithelial cell;surface ectodermal cell,APP,17.331,11.755,17.331,80430,28411,-0.56,REACTOME,Immune System R-HSA-168256,False
ARHGEF7,,,no,ENSG00000102606,Rho guanine nucleotide exchange factor 7 (Beta-Pix) (COOL-1) (PAK-interacting exchange factor beta) (p85),Cell junction,smooth muscle myoblast;renal interstitial pericyte,,3.783,1.921,3.783,17557,4643,-0.978,REACTOME,Immune System R-HSA-168256,False
ATG5,,,no,ENSG00000057663,Autophagy protein 5 (APG5-like) (Apoptosis-specific protein),Cytoplasm,,,1.388,1.212,1.388,6443,2930,-0.196,REACTOME,Immune System R-HSA-168256,True
ATG7,,,no,ENSG00000197548,Ubiquitin-like modifier-activating enzyme ATG7 (ATG12-activating enzyme E1 ATG7) (Autophagy-related protein 7) (APG7-like) (hAGP7) (Ubiquitin-activating enzyme E1-like protein),Cytoplasm,Kupffer cell;immature innate lymphoid cell,,1.501,1.25,1.501,6965,3021,-0.264,REACTOME,Immune System R-HSA-168256,False
ATP6V1B1,,,no,ENSG00000116039,"V-type proton ATPase subunit B, kidney isoform (V-ATPase subunit B 1) (Endomembrane proton pump 58 kDa subunit) (Vacuolar proton pump subunit B 1)",Apical cell membrane,kidney collecting duct intercalated cell;renal intercalated cell;renal beta-intercalated cell;renal alpha-intercalated cell;pulmonary ionocyte;ionocyte,,0.195,0.153,0.195,905,370,-0.349,REACTOME,Immune System R-HSA-168256,False
ATP6V1H,,,no,ENSG00000047249,V-type proton ATPase subunit H (V-ATPase subunit H) (Nef-binding protein 1) (NBP1) (Protein VMA13 homolog) (V-ATPase 50/57 kDa subunits) (Vacuolar proton pump subunit H) (Vacuolar proton pump subunit SFD),Cytoplasmic vesicle,renal beta-intercalated cell;renal alpha-intercalated cell;osteoclast,,2.787,2.265,2.787,12933,5475,-0.299,REACTOME,Immune System R-HSA-168256,True
ATP7A,,,no,ENSG00000165240,Copper-transporting ATPase 1,Golgi apparatus,pulmonary ionocyte;ionocyte,,1.149,1.123,1.149,5333,2715,-0.033,REACTOME,Immune System R-HSA-168256,False
B2M,,,no,,,,,,63.118,52.943,63.118,292926,127957,-0.254,REACTOME,Immune System R-HSA-168256,False
BAIAP2,,,no,ENSG00000175866,Brain-specific angiogenesis inhibitor 1-associated protein 2 (BAI-associated protein 2) (BAI1-associated protein 2) (Protein BAP2) (Fas ligand-associated factor 3) (FLAF3) (Insulin receptor substrate p53/p58) (IRS-58) (IRSp53/58) (Insulin receptor substrate protein of 53 kDa) (IRSp53) (Insulin receptor substrate p53),Cytoplasm;Membrane,epithelial cell of lung;epithelial cell of alveolus of lung;pneumocyte;type I pneumocyte;type II pneumocyte,,2.933,0.989,2.933,13614,2390,-1.569,REACTOME,Immune System R-HSA-168256,True
BATF,,,no,ENSG00000156127,Basic leucine zipper transcriptional factor ATF-like (B-cell-activating transcription factor) (B-ATF) (SF-HT-activated gene 2 protein) (SFA-2),Nucleus,"duct epithelial cell;luminal epithelial cell of mammary gland;mammary gland epithelial cell;mast cell;CD4-positive helper T cell;T-helper 17 cell;T follicular helper cell;CD4-positive, CD25-positive, alpha-beta regulatory T cell;naive regulatory T cell;activated CD4-positive, alpha-beta T cell;activated CD8-positive, alpha-beta T cell;type I NK T cell;regulatory T cell;exhausted T cell;group 2 innate lymphoid cell",,2.356,1.408,2.356,10935,3402,-0.743,REACTOME,Immune System R-HSA-168256,False
BCL10,,,no,ENSG00000142867,B-cell lymphoma/leukemia 10 (B-cell CLL/lymphoma 10) (Bcl-10) (CARD-containing molecule enhancing NF-kappa-B) (CARD-like apoptotic protein) (hCLAP) (CED-3/ICH-1 prodomain homologous E10-like regulator) (CIPER) (Cellular homolog of vCARMEN) (cCARMEN) (Cellular-E10) (c-E10) (Mammalian CARD-containing adapter molecule E10) (mE10),Cytoplasm,luminal epithelial cell of mammary gland;epithelial cell of uterus;mammary gland epithelial cell;epithelial cell of urethra,,1.649,1.333,1.649,7653,3222,-0.307,REACTOME,Immune System R-HSA-168256,True
BCL11B,,,no,ENSG00000127152,B-cell lymphoma/leukemia 11B (BCL-11B) (B-cell CLL/lymphoma 11B) (COUP-TF-interacting protein 2) (Radiation-induced tumor suppressor gene 1 protein) (hRit1),Nucleus,"lymphocyte;T cell;alpha-beta T cell;double-positive, alpha-beta thymocyte;mature alpha-beta T cell;CD4-positive, alpha-beta T cell;CD4-positive helper T cell;T follicular helper cell;CD4-positive, CD25-positive, alpha-beta regulatory T cell;naive regulatory T cell;memory regulatory T cell;naive thymus-derived CD4-positive, alpha-beta T cell;CD4-positive, alpha-beta memory T cell;CD4-positive, alpha-beta memory T cell, CD45RO-positive;central memory CD4-positive, alpha-beta T cell;effector memory CD4-positive, alpha-beta T cell;effector CD4-positive, alpha-beta T cell;naive thymus-derived CD8-positive, alpha-beta T cell;effector memory CD8-positive, alpha-beta T cell, terminally differentiated;central memory CD8-positive, alpha-beta T cell;type I NK T cell;mature T cell;memory T cell;regulatory T cell;naive T cell;immature T cell;thymocyte;double negative thymocyte;DN3 thymocyte;DN4 thymocyte;DN1 thymic pro-T cell;early T lineage precursor",,3.184,3.17,3.184,14778,7662,-0.006,REACTOME,Immune System R-HSA-168256,False
BCL2,,,no,ENSG00000171791,Apoptosis regulator Bcl-2,Mitochondrion outer membrane,parietal epithelial cell;kidney loop of Henle thin descending limb epithelial cell;melanocyte;Schwann cell;fat cell;subcutaneous fat cell;adipocyte of breast;epicardial adipocyte;adipocyte of epicardial fat of left ventricle,,3.767,2.743,3.767,17483,6629,-0.458,REACTOME,Immune System R-HSA-168256,False
BCL2L1,,,no,ENSG00000171552,Bcl-2-like protein 1 (Bcl2-L-1) (Apoptosis regulator Bcl-X),Mitochondrion inner membrane,erythrocyte;enucleate erythrocyte;reticulocyte;enucleated reticulocyte,,5.766,4.478,5.766,26759,10823,-0.365,REACTOME,Immune System R-HSA-168256,True
BCL2L11,,,no,ENSG00000153094,Bcl-2-like protein 11 (Bcl2-L-11) (Bcl2-interacting mediator of cell death),Endomembrane system,,,1.843,0.807,1.843,8555,1951,-1.191,REACTOME,Immune System R-HSA-168256,False
BCL6,,,no,ENSG00000113916,B-cell lymphoma 6 protein (BCL-6) (B-cell lymphoma 5 protein) (BCL-5) (Protein LAZ-3) (Zinc finger and BTB domain-containing protein 27) (Zinc finger protein 51),Nucleus,skeletal muscle fiber;fast muscle cell;cell of skeletal muscle;white fat cell;subcutaneous fat cell;sebaceous gland cell,,1.846,1.746,1.846,8568,4221,-0.08,REACTOME,Immune System R-HSA-168256,False
BECN1,,,no,ENSG00000126581,Beclin-1 (Coiled-coil myosin-like BCL2-interacting protein) (Protein GT197),Cytoplasm,,,5.496,3.778,5.496,25506,9131,-0.541,REACTOME,Immune System R-HSA-168256,True
BIRC2,,,no,ENSG00000110330,Baculoviral IAP repeat-containing protein 2,Cytoplasm;Nucleus,,,5.748,5.06,5.748,26675,12230,-0.184,REACTOME,Immune System R-HSA-168256,True
BIRC5,,,no,ENSG00000089685,Baculoviral IAP repeat-containing protein 5 (Apoptosis inhibitor 4) (Apoptosis inhibitor survivin),Cytoplasm,"double-positive, alpha-beta thymocyte;large pre-B-II cell",,0.559,0.511,0.559,2594,1234,-0.131,REACTOME,Immune System R-HSA-168256,False
BLK,,,no,ENSG00000136573,Tyrosine-protein kinase Blk,Cell membrane,professional antigen presenting cell;mature B cell;memory B cell;unswitched memory B cell;class switched memory B cell;IgG memory B cell;IgG-negative class switched memory B cell;naive B cell;B-1a B cell;B-1b B cell;follicular B cell;germinal center B cell;B cell;immature B cell;transitional stage B cell,,2.463,1.449,2.463,11430,3501,-0.766,REACTOME,Immune System R-HSA-168256,False
BLNK,,,no,ENSG00000095585,B-cell linker protein (B-cell adapter containing a SH2 domain protein) (B-cell adapter containing a Src homology 2 domain protein) (Cytoplasmic adapter protein) (Src homology 2 domain-containing leukocyte protein of 65 kDa) (SLP-65),Cytoplasm,central nervous system macrophage;B-1a B cell;late pro-B cell;early lymphoid progenitor;pro-B cell;fraction A pre-pro B cell,,1.097,0.938,1.097,5091,2267,-0.226,REACTOME,Immune System R-HSA-168256,False
BST1,,,no,ENSG00000109743,ADP-ribosyl cyclase/cyclic ADP-ribose hydrolase 2,Cell membrane,immature neutrophil;myelocyte;granulocytopoietic cell,,0.409,0.789,0.789,1897,1908,0.95,REACTOME,Immune System R-HSA-168256,True
BTK,,,no,ENSG00000010671,Tyrosine-protein kinase BTK,Cytoplasm,basophil;eosinophil;B-1a B cell;B-1b B cell;small pre-B-II cell;pre-B-I cell,,2.919,2.369,2.919,13545,5725,-0.301,REACTOME,Immune System R-HSA-168256,False
BTLA,,,no,ENSG00000186265,B- and T-lymphocyte attenuator (B- and T-lymphocyte-associated protein) (CD antigen CD272),Cell membrane,naive B cell;B cell,BTLA,3.09,1.728,3.09,14339,4176,-0.838,REACTOME,Immune System R-HSA-168256,False
BTN3A1,,,no,ENSG00000026950,Butyrophilin subfamily 3 member A1 (CD antigen CD277),Cell membrane,,,2.885,3.29,3.29,13387,7952,0.19,REACTOME,Immune System R-HSA-168256,True
BTNL2,,,no,ENSG00000204290,Butyrophilin-like protein 2 (BTL-II),Membrane,,,0.03,0.056,0.056,137,136,0.931,REACTOME,Immune System R-HSA-168256,True
BTRC,,,no,ENSG00000166167,F-box/WD repeat-containing protein 1A (E3RSIkappaB) (Epididymis tissue protein Li 2a) (F-box and WD repeats protein beta-TrCP) (pIkappaBalpha-E3 receptor subunit),Cytoplasm,,,1.88,1.689,1.88,8727,4082,-0.155,REACTOME,Immune System R-HSA-168256,True
C3AR1,,,no,ENSG00000171860,C3a anaphylatoxin chemotactic receptor (C3AR) (C3a-R),Cell membrane,phagocyte;macrophage;elicited macrophage;alternatively activated macrophage;tissue-resident macrophage;alveolar macrophage;microglial cell;colon macrophage;lung macrophage;hematopoietic cell;blood cell;granulocyte;leukocyte;professional antigen presenting cell;myeloid leukocyte;myeloid cell;myelocyte;granulocytopoietic cell,COMPLEMENT,1.053,0.919,1.053,4886,2220,-0.197,REACTOME,Immune System R-HSA-168256,False
C4A,,,no,ENSG00000244731,Complement C4-A (Acidic complement C4) (C3 and PZP-like alpha-2-macroglobulin domain-containing protein 2),Secreted;Synapse,uterine smooth muscle cell;stromal cell;stromal cell of ovary,COMPLEMENT,5.521,3.202,5.521,25624,7739,-0.786,REACTOME,Immune System R-HSA-168256,False
C4B,,,no,ENSG00000224389,Complement C4-B (Complement C4B (Chido blood group)),Secreted,uterine smooth muscle cell;stromal cell;stromal cell of ovary,,4.893,1.426,4.893,22710,3447,-1.779,REACTOME,Immune System R-HSA-168256,False
C5,,,no,ENSG00000106804,Complement C5 (C3 and PZP-like alpha-2-macroglobulin domain-containing protein 4),Secreted,hepatoblast;intrahepatic cholangiocyte;epithelial cell of alveolus of lung;pneumocyte;type II pneumocyte;hepatocyte;periportal region hepatocyte;midzonal region hepatocyte;centrilobular region hepatocyte;hepatic stellate cell;lung secretory cell,,0.19,0.373,0.373,882,902,0.974,REACTOME,Immune System R-HSA-168256,False
C5AR1,,,no,ENSG00000197405,C5a anaphylatoxin chemotactic receptor 1 (C5a anaphylatoxin chemotactic receptor) (C5a-R) (C5aR) (CD antigen CD88),Cell membrane,"phagocyte;macrophage;elicited macrophage;inflammatory macrophage;alternatively activated macrophage;alveolar macrophage;lung macrophage;classical monocyte;hematopoietic cell;granulocyte;neutrophil;leukocyte;professional antigen presenting cell;myeloid leukocyte;monocyte;non-classical monocyte;CD14-low, CD16-positive monocyte;CD14-positive monocyte;CD14-positive, CD16-positive monocyte;intermediate monocyte;myeloid cell",COMPLEMENT,0.66,1.128,1.128,3065,2727,0.773,REACTOME,Immune System R-HSA-168256,False
C8G,,,no,ENSG00000176919,Complement component C8 gamma chain,Secreted,,,0.127,0.07,0.127,591,169,-0.865,REACTOME,Immune System R-HSA-168256,True
CAMK2A,,,no,ENSG00000070808,Calcium/calmodulin-dependent protein kinase type II subunit alpha (CaM kinase II subunit alpha) (CaMK-II subunit alpha),Synapse,,,0.039,0.055,0.055,182,134,0.5,REACTOME,Immune System R-HSA-168256,True
CAMK2B,,,no,ENSG00000058404,Calcium/calmodulin-dependent protein kinase type II subunit beta (CaM kinase II subunit beta) (CaMK-II subunit beta),Cytoplasm,bipolar neuron;retinal bipolar neuron;ON-bipolar cell;rod bipolar cell;OFF-bipolar cell,,0.364,0.163,0.364,1690,393,-1.163,REACTOME,Immune System R-HSA-168256,True
CAMK2D,,,no,ENSG00000145349,Calcium/calmodulin-dependent protein kinase type II subunit delta (CaM kinase II subunit delta) (CaMK-II subunit delta),Cell membrane,cardiac muscle cell;regular ventricular cardiac myocyte;muscle precursor cell;cardiac muscle myoblast;preadipocyte;brown preadipocyte,,3.368,2.622,3.368,15631,6337,-0.361,REACTOME,Immune System R-HSA-168256,True
CAMK2G,,,no,ENSG00000148660,Calcium/calmodulin-dependent protein kinase type II subunit gamma (CaM kinase II subunit gamma) (CaMK-II subunit gamma),Sarcoplasmic reticulum membrane,astrocyte,,3.396,2.603,3.396,15759,6291,-0.384,REACTOME,Immune System R-HSA-168256,True
CAND1,,,no,ENSG00000111530,Cullin-associated NEDD8-dissociated protein 1 (Cullin-associated and neddylation-dissociated protein 1) (TBP-interacting protein of 120 kDa A) (TBP-interacting protein 120A) (p120 CAND1),Cytoplasm,,,5.562,4.044,5.562,25811,9773,-0.46,REACTOME,Immune System R-HSA-168256,True
CANX,,,no,ENSG00000127022,Calnexin (IP90) (Major histocompatibility complex class I antigen-binding protein p88) (p90),Endoplasmic reticulum membrane,fallopian tube secretory epithelial cell;IgG plasmablast;IgA plasmablast;serous cell of epithelium of bronchus,,7.354,4.775,7.354,34127,11541,-0.623,REACTOME,Immune System R-HSA-168256,True
CAPN1,,,no,ENSG00000014216,Calpain-1 catalytic subunit,Cytoplasm,club cell,,2.081,1.517,2.081,9658,3667,-0.456,REACTOME,Immune System R-HSA-168256,False
CARD11,,,no,ENSG00000198286,Caspase recruitment domain-containing protein 11 (CARD-containing MAGUK protein 1) (Carma 1),Cytoplasm,lung goblet cell;taste receptor cell,,6.991,5.459,6.991,32444,13193,-0.357,REACTOME,Immune System R-HSA-168256,True
CARD9,,,no,ENSG00000187796,Caspase recruitment domain-containing protein 9 (hCARD9),Cytoplasm,,,0.106,0.068,0.106,492,164,-0.644,REACTOME,Immune System R-HSA-168256,True
CASP1,,,no,ENSG00000137752,Caspase-1 (CASP-1),Cytoplasm,"classical monocyte;CD14-positive, CD16-negative classical monocyte;hematopoietic cell;leukocyte;professional antigen presenting cell;dendritic cell;conventional dendritic cell;myeloid dendritic cell;CD1c-positive myeloid dendritic cell;dendritic cell, human;myeloid leukocyte;monocyte;non-classical monocyte;CD14-low, CD16-positive monocyte;CD14-positive monocyte;CD14-positive, CD16-positive monocyte;peripheral blood mononuclear cell;myeloid cell;transit amplifying cell of small intestine",,2.138,2.158,2.158,9923,5215,0.013,REACTOME,Immune System R-HSA-168256,False
CASP10,,,no,ENSG00000003400,Caspase-10 (CASP-10),,,,1.731,1.67,1.731,8032,4036,-0.052,REACTOME,Immune System R-HSA-168256,True
CASP2,,,no,ENSG00000106144,Caspase-2 (CASP-2),,,,5.403,5.34,5.403,25076,12905,-0.017,REACTOME,Immune System R-HSA-168256,True
CASP3,,,no,ENSG00000164305,Caspase-3 (CASP-3),Cytoplasm,"erythroid progenitor cell;erythroid progenitor cell, mammalian",,3.016,3.198,3.198,13998,7729,0.084,REACTOME,Immune System R-HSA-168256,False
