gene,category,rationale,exclude_recommended,gene_id,full_name,location,cell_type,cellchat_pathway,detection_pct_0041435,detection_pct_0041534,det_max,n_cells_0041435,n_cells_0041534,log2_detection_ratio_0041534_over_0041435,pathway_source,pathway_term,was_uncategorized
ANAPC1,,,no,ENSG00000153107,Anaphase-promoting complex subunit 1 (APC1) (Cyclosome subunit 1) (Mitotic checkpoint regulator) (Testis-specific gene 24 protein),,,,3.825,3.491,3.825,17751,8438,-0.132,REACTOME,Class I MHC Mediated Antigen Processing And Presentation R-HSA-983169,True
ATG7,,,no,ENSG00000197548,Ubiquitin-like modifier-activating enzyme ATG7 (ATG12-activating enzyme E1 ATG7) (Autophagy-related protein 7) (APG7-like) (hAGP7) (Ubiquitin-activating enzyme E1-like protein),Cytoplasm,Kupffer cell;immature innate lymphoid cell,,1.501,1.25,1.501,6965,3021,-0.264,REACTOME,Class I MHC Mediated Antigen Processing And Presentation R-HSA-983169,False
B2M,,,no,,,,,,63.118,52.943,63.118,292926,127957,-0.254,REACTOME,Class I MHC Mediated Antigen Processing And Presentation R-HSA-983169,False
BECN1,,,no,ENSG00000126581,Beclin-1 (Coiled-coil myosin-like BCL2-interacting protein) (Protein GT197),Cytoplasm,,,5.496,3.778,5.496,25506,9131,-0.541,REACTOME,Class I MHC Mediated Antigen Processing And Presentation R-HSA-983169,True
BTK,,,no,ENSG00000010671,Tyrosine-protein kinase BTK,Cytoplasm,basophil;eosinophil;B-1a B cell;B-1b B cell;small pre-B-II cell;pre-B-I cell,,2.919,2.369,2.919,13545,5725,-0.301,REACTOME,Class I MHC Mediated Antigen Processing And Presentation R-HSA-983169,False
BTRC,,,no,ENSG00000166167,F-box/WD repeat-containing protein 1A (E3RSIkappaB) (Epididymis tissue protein Li 2a) (F-box and WD repeats protein beta-TrCP) (pIkappaBalpha-E3 receptor subunit),Cytoplasm,,,1.88,1.689,1.88,8727,4082,-0.155,REACTOME,Class I MHC Mediated Antigen Processing And Presentation R-HSA-983169,True
CANX,,,no,ENSG00000127022,Calnexin (IP90) (Major histocompatibility complex class I antigen-binding protein p88) (p90),Endoplasmic reticulum membrane,fallopian tube secretory epithelial cell;IgG plasmablast;IgA plasmablast;serous cell of epithelium of bronchus,,7.354,4.775,7.354,34127,11541,-0.623,REACTOME,Class I MHC Mediated Antigen Processing And Presentation R-HSA-983169,True
CBLB,,,no,ENSG00000114423,E3 ubiquitin-protein ligase CBL-B,Cytoplasm,pigmented epithelial cell;podocyte;muscle precursor cell;cardiac muscle myoblast;alveolar type 2 fibroblast cell;preadipocyte;brown preadipocyte;fibro/adipogenic progenitor cell,,3.958,2.343,3.958,18370,5663,-0.756,REACTOME,Class I MHC Mediated Antigen Processing And Presentation R-HSA-983169,False
CD207,,,no,ENSG00000116031,C-type lectin domain family 4 member K (Langerin) (CD antigen CD207),Membrane,mononuclear phagocyte;Langerhans cell,,0.063,0.149,0.149,292,360,1.243,REACTOME,Class I MHC Mediated Antigen Processing And Presentation R-HSA-983169,False
CD36,,,no,ENSG00000135218,Platelet glycoprotein 4 (Fatty acid translocase) (FAT) (Glycoprotein IIIb) (GPIIIB) (Leukocyte differentiation antigen CD36) (PAS IV) (PAS-4) (Platelet collagen receptor) (Platelet glycoprotein IV) (GPIV) (Thrombospondin receptor) (CD antigen CD36),Cell membrane,"vein endothelial cell;capillary endothelial cell;dermis microvascular lymphatic vessel endothelial cell;Hofbauer cell;cardiac muscle cell;regular atrial cardiac myocyte;regular ventricular cardiac myocyte;muscle precursor cell;cardiac muscle myoblast;dendritic cell, human;erythroid lineage cell;erythroblast;fat cell;white fat cell;adipocyte of breast",THBS,2.591,2.569,2.591,12024,6209,-0.012,REACTOME,Class I MHC Mediated Antigen Processing And Presentation R-HSA-983169,False
CDC20,,,no,ENSG00000117399,Cell division cycle protein 20 homolog (p55CDC),Cytoplasm,,,0.644,0.347,0.644,2990,839,-0.892,REACTOME,Class I MHC Mediated Antigen Processing And Presentation R-HSA-983169,True
CDC27,,,no,ENSG00000004897,Cell division cycle protein 27 homolog (Anaphase-promoting complex subunit 3) (APC3) (CDC27 homolog) (CDC27Hs) (H-NUC),Nucleus,enucleate erythrocyte;erythroblast,,3.214,4.181,4.181,14918,10106,0.379,REACTOME,Class I MHC Mediated Antigen Processing And Presentation R-HSA-983169,True
CDC34,,,no,ENSG00000099804,Ubiquitin-conjugating enzyme E2 R1,Cytoplasm;Nucleus,,,4.554,2.669,4.554,21136,6451,-0.771,REACTOME,Class I MHC Mediated Antigen Processing And Presentation R-HSA-983169,True
CHUK,,,no,ENSG00000213341,Inhibitor of nuclear factor kappa-B kinase subunit alpha (I-kappa-B kinase alpha) (IKK-A) (IKK-alpha) (IkBKA) (IkappaB kinase),Cytoplasm,,,1.238,1.36,1.36,5747,3288,0.136,REACTOME,Class I MHC Mediated Antigen Processing And Presentation R-HSA-983169,True
CTSL,,,no,ENSG00000135047,Procathepsin L,Lysosome,elicited macrophage;inflammatory macrophage;alternatively activated macrophage;lung macrophage;Hofbauer cell;extravillous trophoblast;placental villous trophoblast;syncytiotrophoblast cell;leukocyte;myeloid leukocyte;mast cell;mucosal type mast cell;myeloid cell;fibroblast;pancreatic stellate cell;fibroblast of mammary gland;fibroblast of breast,,7.976,6.736,7.976,37016,16281,-0.244,REACTOME,Class I MHC Mediated Antigen Processing And Presentation R-HSA-983169,False
CUL1,,,no,ENSG00000055130,Cullin-1 (CUL-1),,,,6.355,4.883,6.355,29495,11802,-0.38,REACTOME,Class I MHC Mediated Antigen Processing And Presentation R-HSA-983169,True
CUL2,,,no,ENSG00000108094,Cullin-2 (CUL-2),Nucleus,,,1.119,1.119,1.119,5194,2704,-0.0,REACTOME,Class I MHC Mediated Antigen Processing And Presentation R-HSA-983169,True
CUL3,,,no,ENSG00000036257,Cullin-3 (CUL-3),Nucleus,,,4.14,3.122,4.14,19214,7546,-0.407,REACTOME,Class I MHC Mediated Antigen Processing And Presentation R-HSA-983169,True
CUL5,,,no,ENSG00000166266,Cullin-5 (CUL-5) (Vasopressin-activated calcium-mobilizing receptor 1) (VACM-1),Nucleus,,,1.935,1.777,1.935,8981,4296,-0.123,REACTOME,Class I MHC Mediated Antigen Processing And Presentation R-HSA-983169,True
CYBA,,,no,ENSG00000051523,Cytochrome b-245 light chain (Cytochrome b(558) alpha chain) (Cytochrome b558 subunit alpha) (Neutrophil cytochrome b 22 kDa polypeptide) (Superoxide-generating NADPH oxidase light chain subunit) (p22 phagocyte B-cytochrome) (p22-phox) (p22phox),Cell membrane,"plasmacytoid dendritic cell;plasmacytoid dendritic cell, human;dendritic cell, human;activated CD8-positive, alpha-beta T cell, human;plasma cell;IgG plasma cell;IgA plasma cell",,10.279,9.046,10.279,47703,21862,-0.184,REACTOME,Class I MHC Mediated Antigen Processing And Presentation R-HSA-983169,False
CYBB,,,no,ENSG00000165168,Cytochrome b-245 heavy chain,Cell membrane,"phagocyte;macrophage;alveolar macrophage;lung macrophage;classical monocyte;CD14-positive, CD16-negative classical monocyte;hematopoietic cell;granulocyte;immature neutrophil;leukocyte;professional antigen presenting cell;plasmacytoid dendritic cell, human;myeloid leukocyte;monocyte;non-classical monocyte;CD14-low, CD16-positive monocyte;CD14-positive monocyte;CD14-positive, CD16-positive monocyte;intermediate monocyte;myeloid cell;promonocyte;myelocyte;granulocytopoietic cell",,3.863,4.441,4.441,17929,10733,0.201,REACTOME,Class I MHC Mediated Antigen Processing And Presentation R-HSA-983169,False
DCAF1,,,no,ENSG00000145041,DDB1- and CUL4-associated factor 1 (HIV-1 Vpr-binding protein) (VprBP) (Serine/threonine-protein kinase VPRBP),Cytoplasm,,,2.186,1.73,2.186,10143,4181,-0.337,REACTOME,Class I MHC Mediated Antigen Processing And Presentation R-HSA-983169,True
ELOB,,,no,ENSG00000103363,Elongin-B (EloB) (Elongin 18 kDa subunit) (RNA polymerase II transcription factor SIII subunit B) (SIII p18) (Transcription elongation factor B polypeptide 2),Nucleus,microfold cell of epithelium of small intestine;serous cell of epithelium of bronchus,,0.179,0.224,0.224,831,541,0.322,REACTOME,Class I MHC Mediated Antigen Processing And Presentation R-HSA-983169,True
ELOC,,,no,ENSG00000154582,Elongin-C (EloC) (Elongin 15 kDa subunit) (RNA polymerase II transcription factor SIII subunit C) (SIII p15) (Transcription elongation factor B polypeptide 1),Nucleus,prostate gland microvascular endothelial cell;mesothelial cell of pleura,,1.153,0.947,1.153,5353,2288,-0.285,REACTOME,Class I MHC Mediated Antigen Processing And Presentation R-HSA-983169,False
ERAP1,,,no,ENSG00000164307,Endoplasmic reticulum aminopeptidase 1,Endoplasmic reticulum membrane,skeletal muscle fiber;cell of skeletal muscle,,6.917,4.776,6.917,32099,11542,-0.534,REACTOME,Class I MHC Mediated Antigen Processing And Presentation R-HSA-983169,False
FBXO27,,,no,,,,,,0.77,0.25,0.77,3572,604,-1.623,REACTOME,Class I MHC Mediated Antigen Processing And Presentation R-HSA-983169,True
FBXW11,,,no,ENSG00000072803,F-box/WD repeat-containing protein 11 (F-box and WD repeats protein beta-TrCP2) (F-box/WD repeat-containing protein 1B) (Homologous to Slimb protein) (HOS),Cytoplasm,,,2.039,1.707,2.039,9461,4126,-0.256,REACTOME,Class I MHC Mediated Antigen Processing And Presentation R-HSA-983169,True
FBXW7,,,no,ENSG00000109670,F-box/WD repeat-containing protein 7 (Archipelago homolog) (hAgo) (F-box and WD-40 domain-containing protein 7) (F-box protein FBX30) (SEL-10) (hCdc4),Nucleus,basal cell of epidermis,,0.75,0.612,0.75,3483,1479,-0.294,REACTOME,Class I MHC Mediated Antigen Processing And Presentation R-HSA-983169,True
FCGR1A,,,no,ENSG00000150337,High affinity immunoglobulin gamma Fc receptor I (IgG Fc receptor I) (Fc-gamma RI) (FcRI) (Fc-gamma RIA) (FcgammaRIa) (CD antigen CD64),Cell membrane,phagocyte;macrophage;microglial cell;Hofbauer cell;classical monocyte;immature neutrophil;professional antigen presenting cell;myeloid leukocyte;mast cell;mucosal type mast cell;myeloid cell,,0.1,0.142,0.142,465,344,0.506,REACTOME,Class I MHC Mediated Antigen Processing And Presentation R-HSA-983169,False
FZR1,,,no,ENSG00000105325,Fizzy-related protein homolog (Fzr) (CDC20-like protein 1) (Cdh1/Hct1 homolog) (hCDH1),Cytoplasm,,,4.495,5.923,5.923,20859,14316,0.398,REACTOME,Class I MHC Mediated Antigen Processing And Presentation R-HSA-983169,True
HERC2,,,no,ENSG00000128731,E3 ubiquitin-protein ligase HERC2,Cytoplasm;Cytoplasm,,,5.42,5.615,5.615,25156,13570,0.051,REACTOME,Class I MHC Mediated Antigen Processing And Presentation R-HSA-983169,True
HERC6,,,no,ENSG00000138642,Probable E3 ubiquitin-protein ligase HERC6,Cytoplasm,"activated CD4-positive, alpha-beta T cell, human",,3.26,2.621,3.26,15131,6335,-0.315,REACTOME,Class I MHC Mediated Antigen Processing And Presentation R-HSA-983169,False
HUWE1,,,no,ENSG00000086758,E3 ubiquitin-protein ligase HUWE1,Cytoplasm,Sertoli cell,,6.666,6.033,6.666,30938,14580,-0.144,REACTOME,Class I MHC Mediated Antigen Processing And Presentation R-HSA-983169,True
IKBKB,,,no,ENSG00000104365,Inhibitor of nuclear factor kappa-B kinase subunit beta (I-kappa-B-kinase beta) (IKK-B) (IKK-beta) (IkBKB),Cytoplasm,,,6.533,5.319,6.533,30318,12855,-0.297,REACTOME,Class I MHC Mediated Antigen Processing And Presentation R-HSA-983169,True
IKBKG,,,no,ENSG00000269335,NF-kappa-B essential modulator (NEMO) (FIP-3) (IkB kinase-associated protein 1) (IKKAP1) (Inhibitor of nuclear factor kappa-B kinase subunit gamma) (I-kappa-B kinase subunit gamma) (IKK-gamma) (IKKG) (IkB kinase subunit gamma) (NF-kappa-B essential modifier),Cytoplasm,,,5.586,2.413,5.586,25926,5831,-1.211,REACTOME,Class I MHC Mediated Antigen Processing And Presentation R-HSA-983169,True
ITCH,,,no,ENSG00000078747,E3 ubiquitin-protein ligase Itchy homolog (Itch),Cell membrane,preadipocyte,,5.147,4.62,5.147,23887,11167,-0.156,REACTOME,Class I MHC Mediated Antigen Processing And Presentation R-HSA-983169,True
ITGAV,,,no,ENSG00000138448,Integrin alpha-V (Vitronectin receptor) (Vitronectin receptor subunit alpha) (CD antigen CD51),Cell membrane,pigmented ciliary epithelial cell;type B pancreatic cell;kidney glomerular epithelial cell;podocyte;retinal pigment epithelial cell,NRG;IGF;SPP1;ANGPTL;PTN;PERIOSTIN;COLLAGEN;FN1;LAMININ;THBS;VTN;TENASCIN;DSPP;VWF;BSP;DMP1;CD23;JAM;L1CAM;THY1;ADGRA;ADGRB;ADGRE;MMP,1.289,1.144,1.289,5982,2765,-0.172,REACTOME,Class I MHC Mediated Antigen Processing And Presentation R-HSA-983169,True
ITGB5,,,no,ENSG00000082781,Integrin beta-5,Cell membrane,,SPP1;PERIOSTIN;VTN;BSP;ADGRB,4.185,2.55,4.185,19424,6162,-0.715,REACTOME,Class I MHC Mediated Antigen Processing And Presentation R-HSA-983169,True
KEAP1,,,no,ENSG00000079999,Kelch-like ECH-associated protein 1 (Cytosolic inhibitor of Nrf2) (INrf2) (Kelch-like protein 19),Cytoplasm,,,1.359,0.725,1.359,6306,1752,-0.906,REACTOME,Class I MHC Mediated Antigen Processing And Presentation R-HSA-983169,True
KLHL13,,,no,ENSG00000003096,Kelch-like protein 13 (BTB and kelch domain-containing protein 2),,kidney distal convoluted tubule epithelial cell;kidney loop of Henle ascending limb epithelial cell;kidney loop of Henle thick ascending limb epithelial cell;kidney cortex tubule cell;kidney loop of Henle epithelial cell;mesangial cell,,0.26,0.292,0.292,1205,705,0.168,REACTOME,Class I MHC Mediated Antigen Processing And Presentation R-HSA-983169,True
LY96,,,no,ENSG00000154589,Lymphocyte antigen 96 (Ly-96) (ESOP-1) (Protein MD-2),Secreted,macrophage;alveolar macrophage;colon macrophage;lung macrophage;Hofbauer cell;IgA plasma cell,,1.93,1.815,1.93,8956,4387,-0.088,REACTOME,Class I MHC Mediated Antigen Processing And Presentation R-HSA-983169,False
MRC1,,,no,ENSG00000260314,Macrophage mannose receptor 1 (MMR) (C-type lectin domain family 13 member D) (C-type lectin domain family 13 member D-like) (Human mannose receptor) (hMR) (Macrophage mannose receptor 1-like protein 1) (CD antigen CD206),Endosome membrane,endothelial cell of lymphatic vessel;endothelial cell of sinusoid;endothelial cell of hepatic sinusoid;endothelial cell of pericentral hepatic sinusoid;phagocyte;macrophage;elicited macrophage;alternatively activated macrophage;tissue-resident macrophage;Kupffer cell;alveolar macrophage;microglial cell;colon macrophage;lung macrophage;Hofbauer cell;mononuclear phagocyte;surface ectodermal cell;professional antigen presenting cell;immature innate lymphoid cell,CD45,3.535,2.99,3.535,16406,7226,-0.242,REACTOME,Class I MHC Mediated Antigen Processing And Presentation R-HSA-983169,False
MRC2,,,no,ENSG00000011028,C-type mannose receptor 2 (C-type lectin domain family 13 member E) (Endocytic receptor 180) (Macrophage mannose receptor 2) (Urokinase-type plasminogen activator receptor-associated protein) (UPAR-associated protein) (Urokinase receptor-associated protein) (CD antigen CD280),Membrane,endosteal cell;preosteoblast;connective tissue cell;fibroblast;keratocyte;pancreatic stellate cell;fibroblast of cardiac tissue;fibroblast of lung;osteoblast;tendon cell,,2.601,2.598,2.601,12069,6278,-0.002,REACTOME,Class I MHC Mediated Antigen Processing And Presentation R-HSA-983169,False
MYD88,,,no,ENSG00000172936,Myeloid differentiation primary response protein MyD88,Cytoplasm,dendritic cell;CD141-positive myeloid dendritic cell;conventional dendritic cell;Langerhans cell;non-classical monocyte,,3.966,3.207,3.966,18406,7750,-0.307,REACTOME,Class I MHC Mediated Antigen Processing And Presentation R-HSA-983169,False
MYLIP,,,no,ENSG00000007944,E3 ubiquitin-protein ligase MYLIP,Cytoplasm,T-helper 1 cell,,1.076,1.054,1.076,4994,2548,-0.03,REACTOME,Class I MHC Mediated Antigen Processing And Presentation R-HSA-983169,True
NCF1,,,no,ENSG00000158517,Neutrophil cytosol factor 1 (NCF-1) (47 kDa autosomal chronic granulomatous disease protein) (47 kDa neutrophil oxidase factor) (NCF-47K) (Neutrophil NADPH oxidase factor 1) (Nox organizer 2) (Nox-organizing protein 2) (SH3 and PX domain-containing protein 1A) (p47-phox),Cytoplasm,"phagocyte;classical monocyte;CD14-positive, CD16-negative classical monocyte;hematopoietic cell;blood cell;granulocyte;immature neutrophil;leukocyte;plasmacytoid dendritic cell;plasmacytoid dendritic cell, human;mature B cell;naive B cell;B-1a B cell;B-1b B cell;germinal center B cell;plasmablast;myeloid leukocyte;monocyte;CD14-positive monocyte;B cell;immature B cell;small pre-B-II cell;pre-B-I cell;myelocyte",,7.028,5.147,7.028,32617,12440,-0.449,REACTOME,Class I MHC Mediated Antigen Processing And Presentation R-HSA-983169,False
NCF2,,,no,ENSG00000116701,Neutrophil cytosol factor 2 (NCF-2) (67 kDa neutrophil oxidase factor) (NADPH oxidase activator 2) (Neutrophil NADPH oxidase factor 2) (p67-phox),Cytoplasm,"phagocyte;macrophage;alveolar macrophage;lung macrophage;classical monocyte;CD14-positive, CD16-negative classical monocyte;hematopoietic cell;blood cell;granulocyte;neutrophil;leukocyte;dendritic cell;conventional dendritic cell;myeloid dendritic cell;CD1c-positive myeloid dendritic cell;myeloid leukocyte;monocyte;non-classical monocyte;CD14-low, CD16-positive monocyte;CD14-positive monocyte;CD14-positive, CD16-positive monocyte;intermediate monocyte;peripheral blood mononuclear cell;myeloid cell",,1.758,1.886,1.886,8158,4559,0.102,REACTOME,Class I MHC Mediated Antigen Processing And Presentation R-HSA-983169,False
NCF4,,,no,ENSG00000100365,Neutrophil cytosol factor 4 (NCF-4) (Neutrophil NADPH oxidase factor 4) (SH3 and PX domain-containing protein 4) (p40-phox) (p40phox),Cytoplasm,colon macrophage;Hofbauer cell;hematopoietic cell;granulocyte;eosinophil;neutrophil;leukocyte;intermediate monocyte;basophil mast progenitor cell;myelocyte;myeloid lineage restricted progenitor cell;granulocytopoietic cell,,2.183,1.483,2.183,10132,3585,-0.558,REACTOME,Class I MHC Mediated Antigen Processing And Presentation R-HSA-983169,False
NEDD4,,,no,ENSG00000069869,E3 ubiquitin-protein ligase NEDD4,Cytoplasm,skeletal muscle fiber;slow muscle cell;fast muscle cell;cell of skeletal muscle,,1.495,1.057,1.495,6936,2554,-0.5,REACTOME,Class I MHC Mediated Antigen Processing And Presentation R-HSA-983169,True
NEDD4L,,,no,ENSG00000049759,E3 ubiquitin-protein ligase NEDD4-like,Cytoplasm,kidney collecting duct intercalated cell;renal intercalated cell;renal beta-intercalated cell;renal alpha-intercalated cell;epithelial cell of lung;epithelial cell of alveolus of lung;pneumocyte;type I pneumocyte;type II pneumocyte;luminal cell of prostate epithelium;retinal pigment epithelial cell;papillary tips cell;lung secretory cell,,0.577,0.422,0.577,2679,1020,-0.452,REACTOME,Class I MHC Mediated Antigen Processing And Presentation R-HSA-983169,True
PDIA3,,,no,ENSG00000167004,Protein disulfide-isomerase A3,Endoplasmic reticulum,preosteoblast;serous cell of epithelium of trachea;serous cell of epithelium of bronchus;lung secretory cell,,8.388,7.012,8.388,38929,16948,-0.258,REACTOME,Class I MHC Mediated Antigen Processing And Presentation R-HSA-983169,True
PIK3C3,,,no,ENSG00000078142,Phosphatidylinositol 3-kinase catalytic subunit type 3 (PI3-kinase type 3) (PI3K type 3) (PtdIns-3-kinase type 3),Midbody,,,4.11,3.564,4.11,19072,8614,-0.205,REACTOME,Class I MHC Mediated Antigen Processing And Presentation R-HSA-983169,True
PRKN,,,no,ENSG00000185345,E3 ubiquitin-protein ligase parkin (Parkin),Cytoplasm,regular atrial cardiac myocyte;regular ventricular cardiac myocyte,,0.185,0.186,0.186,860,449,0.004,REACTOME,Class I MHC Mediated Antigen Processing And Presentation R-HSA-983169,True
PSMA6,,,no,ENSG00000100902,Proteasome subunit alpha type-6 (27 kDa prosomal protein) (PROS-27) (p27K) (Macropain iota chain) (Multicatalytic endopeptidase complex iota chain) (Proteasome iota chain),Cytoplasm,"professional antigen presenting cell;dendritic cell;T-helper 17 cell;activated CD4-positive, alpha-beta T cell;early lymphoid progenitor;common lymphoid progenitor",,5.023,3.125,5.023,23312,7552,-0.685,REACTOME,Class I MHC Mediated Antigen Processing And Presentation R-HSA-983169,False
PSMB10,,,no,,,,,,14.328,8.84,14.328,66497,21365,-0.697,REACTOME,Class I MHC Mediated Antigen Processing And Presentation R-HSA-983169,False
PSMB11,,,no,,,,,,0.17,0.109,0.17,787,264,-0.635,REACTOME,Class I MHC Mediated Antigen Processing And Presentation R-HSA-983169,False
PSMB5,,,no,ENSG00000100804,Proteasome subunit beta type-5,Cytoplasm,cortical thymic epithelial cell,,2.651,1.595,2.651,12301,3856,-0.732,REACTOME,Class I MHC Mediated Antigen Processing And Presentation R-HSA-983169,False
PSMB6,,,no,,,,,,7.317,4.869,7.317,33958,11768,-0.588,REACTOME,Class I MHC Mediated Antigen Processing And Presentation R-HSA-983169,True
PSMB7,,,no,,,,,,10.271,5.831,10.271,47669,14094,-0.817,REACTOME,Class I MHC Mediated Antigen Processing And Presentation R-HSA-983169,True
PSMB8,,,no,,,,,,8.06,5.111,8.06,37404,12352,-0.657,REACTOME,Class I MHC Mediated Antigen Processing And Presentation R-HSA-983169,False
PSMB9,,,no,,,,,,8.718,5.961,8.718,40459,14407,-0.548,REACTOME,Class I MHC Mediated Antigen Processing And Presentation R-HSA-983169,False
PSMC2,,,no,ENSG00000161057,26S proteasome regulatory subunit 7 (26S proteasome AAA-ATPase subunit RPT1) (Proteasome 26S subunit ATPase 2),Cytoplasm,,,3.374,2.053,3.374,15658,4963,-0.716,REACTOME,Class I MHC Mediated Antigen Processing And Presentation R-HSA-983169,True
PSMC5,,,no,ENSG00000087191,26S proteasome regulatory subunit 8 (26S proteasome AAA-ATPase subunit RPT6) (Proteasome 26S subunit ATPase 5) (Proteasome subunit p45) (Thyroid hormone receptor-interacting protein 1) (TRIP1) (p45/SUG),Cytoplasm,,,12.518,9.134,12.518,58096,22076,-0.455,REACTOME,Class I MHC Mediated Antigen Processing And Presentation R-HSA-983169,True
PSMD10,,,no,ENSG00000101843,26S proteasome non-ATPase regulatory subunit 10 (26S proteasome regulatory subunit p28) (Gankyrin) (p28(GANK)),Cytoplasm,,,0.903,0.888,0.903,4191,2146,-0.024,REACTOME,Class I MHC Mediated Antigen Processing And Presentation R-HSA-983169,True
PSMD2,,,no,ENSG00000175166,26S proteasome non-ATPase regulatory subunit 2 (26S proteasome regulatory subunit RPN1) (26S proteasome regulatory subunit S2) (26S proteasome subunit p97) (Protein 55.11) (Tumor necrosis factor type 1 receptor-associated protein 2),,fallopian tube secretory epithelial cell,,6.213,4.966,6.213,28836,12003,-0.323,REACTOME,Class I MHC Mediated Antigen Processing And Presentation R-HSA-983169,True
PSMD3,,,no,ENSG00000108344,26S proteasome non-ATPase regulatory subunit 3 (26S proteasome regulatory subunit RPN3) (26S proteasome regulatory subunit S3) (Proteasome subunit p58),,,,7.473,5.093,7.473,34681,12310,-0.553,REACTOME,Class I MHC Mediated Antigen Processing And Presentation R-HSA-983169,True
PSMD4,,,no,ENSG00000159352,26S proteasome non-ATPase regulatory subunit 4 (26S proteasome regulatory subunit RPN10) (26S proteasome regulatory subunit S5A) (Antisecretory factor 1) (AF) (ASF) (Multiubiquitin chain-binding protein),,placental villous trophoblast,,7.275,4.642,7.275,33761,11219,-0.648,REACTOME,Class I MHC Mediated Antigen Processing And Presentation R-HSA-983169,True
PSME3,,,no,ENSG00000131467,Proteasome activator complex subunit 3 (11S regulator complex subunit gamma) (REG-gamma) (Activator of multicatalytic protease subunit 3) (Ki nuclear autoantigen) (Proteasome activator 28 subunit gamma) (PA28g) (PA28gamma),Nucleus,,,5.832,5.017,5.832,27068,12126,-0.217,REACTOME,Class I MHC Mediated Antigen Processing And Presentation R-HSA-983169,True
RBCK1,,,no,ENSG00000125826,RanBP-type and C3HC4-type zinc finger-containing protein 1,,,,4.27,2.934,4.27,19815,7091,-0.541,REACTOME,Class I MHC Mediated Antigen Processing And Presentation R-HSA-983169,True
RBX1,,,no,ENSG00000100387,E3 ubiquitin-protein ligase RBX1,Cytoplasm,erythroid lineage cell,,1.086,0.684,1.086,5040,1653,-0.667,REACTOME,Class I MHC Mediated Antigen Processing And Presentation R-HSA-983169,True
S100A1,,,no,ENSG00000160678,Protein S100-A1 (S-100 protein alpha chain) (S-100 protein subunit alpha) (S100 calcium-binding protein A1),Cytoplasm,glandular epithelial cell;acinar cell;acinar cell of salivary gland;fallopian tube secretory epithelial cell;slow muscle cell;chondrocyte;tracheobronchial serous cell;serous cell of epithelium of bronchus,,0.42,0.331,0.42,1951,801,-0.343,REACTOME,Class I MHC Mediated Antigen Processing And Presentation R-HSA-983169,True
SEC13,,,no,ENSG00000157020,Protein SEC13 homolog (GATOR complex protein SEC13) (SEC13-like protein 1) (SEC13-related protein),Cytoplasmic vesicle,plasmablast;macrophage dendritic cell progenitor;osteoblast,,4.054,2.508,4.054,18816,6062,-0.693,REACTOME,Class I MHC Mediated Antigen Processing And Presentation R-HSA-983169,False
SEC14L3,,,no,ENSG00000100012,SEC14-like protein 3 (Tocopherol-associated protein 2),,,,0.073,0.151,0.151,341,366,1.043,REACTOME,Class I MHC Mediated Antigen Processing And Presentation R-HSA-983169,True
SIAH1,,,no,ENSG00000196470,E3 ubiquitin-protein ligase SIAH1,Cytoplasm;Nucleus,syncytiotrophoblast cell,,2.241,1.824,2.241,10399,4409,-0.297,REACTOME,Class I MHC Mediated Antigen Processing And Presentation R-HSA-983169,True
SKP1,,,no,ENSG00000113558,S-phase kinase-associated protein 1 (Cyclin-A/CDK2-associated protein p19) (p19A) (Organ of Corti protein 2) (OCP-2) (Organ of Corti protein II) (OCP-II) (RNA polymerase II elongation factor-like protein) (SIII) (Transcription elongation factor B polypeptide 1-like) (p19skp1),,sperm,,3.057,3.406,3.406,14187,8232,0.156,REACTOME,Class I MHC Mediated Antigen Processing And Presentation R-HSA-983169,True
SKP2,,,no,ENSG00000145604,S-phase kinase-associated protein 2 (Cyclin-A/CDK2-associated protein p45) (F-box protein Skp2) (F-box/LRR-repeat protein 1) (p45skp2),Cytoplasm,,,1.436,1.32,1.436,6664,3191,-0.121,REACTOME,Class I MHC Mediated Antigen Processing And Presentation R-HSA-983169,True
SMURF1,,,no,ENSG00000198742,E3 ubiquitin-protein ligase SMURF1 (hSMURF1),Cytoplasm,,,4.224,3.159,4.224,19604,7636,-0.419,REACTOME,Class I MHC Mediated Antigen Processing And Presentation R-HSA-983169,True
SMURF2,,,no,ENSG00000108854,E3 ubiquitin-protein ligase SMURF2 (hSMURF2),Nucleus,,,2.986,3.82,3.82,13856,9232,0.355,REACTOME,Class I MHC Mediated Antigen Processing And Presentation R-HSA-983169,True
