gene,category,rationale,single_gene_panel_note,exclude_recommended,detection_pct_0041323,detection_pct_0041326,n_cells_0041323,n_cells_0041326,log2_detection_ratio_326_over_323,gene_id,full_name,location,cell_type,cellchat_pathway
GZMB,,,,no,0.058,0.217,663,2533,1.905,ENSG00000100453,Granzyme B,Secreted,"hematopoietic cell;leukocyte;dendritic cell;plasmacytoid dendritic cell;plasmacytoid dendritic cell, human;dendritic cell, human;mononuclear cell;lymphocyte;T cell;alpha-beta T cell;CD8-positive, alpha-beta thymocyte;mature alpha-beta T cell;activated CD4-positive, alpha-beta T cell;CD4-positive, alpha-beta cytotoxic T cell;CD8-positive, alpha-beta T cell;CD8-positive, alpha-beta cytotoxic T cell;activated CD8-positive, alpha-beta T cell;activated CD8-positive, alpha-beta T cell, human;CD8-positive, alpha-beta cytokine secreting effector T cell;CD8-positive, alpha-beta memory T cell;effector memory CD8-positive, alpha-beta T cell, terminally differentiated;CD8-positive, alpha-beta memory T cell, CD45RO-positive;effector memory CD8-positive, alpha-beta T cell;effector CD8-positive, alpha-beta T cell;CD8-alpha-beta-positive, alpha-beta intraepithelial T cell;mature NK T cell;type I NK T cell;mucosal invariant T cell;gamma-delta T cell;mature gamma-delta T cell;mature T cell;cytotoxic T cell;exhausted T cell;innate lymphoid cell;natural killer cell;CD16-negative, CD56-bright natural killer cell, human;CD16-positive, CD56-dim natural killer cell, human;decidual natural killer cell, human;ILC1, human",
HES1,,,,no,9.237,7.275,105790,85001,-0.345,ENSG00000114315,Transcription factor HES-1 (Class B basic helix-loop-helix protein 39) (bHLHb39) (Hairy and enhancer of split 1) (Hairy homolog) (Hairy-like protein) (hHL),Nucleus,intestinal crypt stem cell of large intestine;basal cell of epithelium of bronchus;enterocyte;vasa recta ascending limb cell;glomerular capillary endothelial cell;fenestrated cell;glomerular endothelial cell;gut endothelial cell;endothelial cell of uterus;radial glial cell;Mueller cell;forebrain radial glial cell,
HHEX,,,,no,5.171,4.815,59224,56258,-0.103,ENSG00000152804,Hematopoietically-expressed homeobox protein HHEX (Homeobox protein HEX) (Homeobox protein PRH),Nucleus,pancreatic endocrine cell;pancreatic D cell;hematopoietic multipotent progenitor cell;early T lineage precursor,
HK1,,,,no,5.106,6.115,58477,71456,0.26,ENSG00000156515,Hexokinase-1,Mitochondrion outer membrane,erythroid lineage cell;enucleated reticulocyte;retina horizontal cell,
HK2,,,,no,0.796,1.377,9112,16091,0.792,ENSG00000159399,Hexokinase-2,Mitochondrion outer membrane,white fat cell,
HNF1A,,,,no,1.966,2.325,22514,27165,0.242,ENSG00000135100,Hepatocyte nuclear factor 1-alpha (HNF-1-alpha) (HNF-1A) (Liver-specific transcription factor LF-B1) (LFB1) (Transcription factor 1) (TCF-1),Nucleus,,
HNF1B,,,,no,11.215,17.919,128449,209380,0.676,ENSG00000275410,Hepatocyte nuclear factor 1-beta (HNF-1-beta) (HNF-1B) (Homeoprotein LFB3) (Transcription factor 2) (TCF-2) (Variant hepatic nuclear factor 1) (vHNF1),Nucleus,kidney collecting duct epithelial cell;kidney collecting duct principal cell;kidney loop of Henle ascending limb epithelial cell;kidney loop of Henle thick ascending limb epithelial cell;kidney loop of Henle thin ascending limb epithelial cell;kidney epithelial cell;parietal epithelial cell;kidney cortex tubule cell;kidney connecting tubule epithelial cell;epithelial cell of nephron;kidney loop of Henle epithelial cell;kidney loop of Henle thin descending limb epithelial cell;kidney cell,
HNF4A,,,,no,4.8,5.17,54972,60407,0.107,ENSG00000101076,Hepatocyte nuclear factor 4-alpha (HNF-4-alpha) (Nuclear receptor subfamily 2 group A member 1) (Transcription factor 14) (TCF-14) (Transcription factor HNF-4),Nucleus,intestinal crypt stem cell;intestinal crypt stem cell of small intestine;transit amplifying cell of small intestine,
HRAS,,,,no,3.894,4.039,44603,47189,0.052,ENSG00000174775,GTPase HRas,Cell membrane,,
HSPD1,,,,no,36.856,35.731,422107,417503,-0.045,ENSG00000144381,"60 kDa heat shock protein, mitochondrial",Mitochondrion matrix,professional antigen presenting cell;dendritic cell;mast cell;mucosal type mast cell;proerythroblast;fibroblast of connective tissue of nonglandular part of prostate;fibroblast of connective tissue of glandular part of prostate,
ICA1,,,,no,10.933,10.403,125214,121553,-0.072,ENSG00000003147,Islet cell autoantigen 1 (69 kDa islet cell autoantigen) (ICA69) (Islet cell autoantigen p69) (ICAp69) (p69),Cytoplasm,lung neuroendocrine cell,
ICAM1,,,,no,3.492,3.187,39994,37245,-0.132,ENSG00000090339,Intercellular adhesion molecule 1 (ICAM-1) (Major group rhinovirus receptor) (CD antigen CD54),Membrane,squamous epithelial cell;blood vessel endothelial cell;vein endothelial cell;endothelial cell of umbilical vein;vasa recta ascending limb cell;prostate gland microvascular endothelial cell;type I pneumocyte;medullary thymic epithelial cell;endothelial cell;gut endothelial cell;endothelial cell of vascular tree,ICAM
IFNG,,,,no,0.062,0.022,705,255,-1.496,ENSG00000111537,Interferon gamma (IFN-gamma) (Immune interferon),Secreted,"lymphocyte;T cell;alpha-beta T cell;mature alpha-beta T cell;T-helper 1 cell;activated CD4-positive, alpha-beta T cell;CD4-positive, alpha-beta cytotoxic T cell;CD8-positive, alpha-beta T cell;CD8-positive, alpha-beta cytotoxic T cell;activated CD8-positive, alpha-beta T cell;CD8-positive, alpha-beta memory T cell;effector memory CD8-positive, alpha-beta T cell, terminally differentiated;CD8-positive, alpha-beta memory T cell, CD45RO-positive;effector memory CD8-positive, alpha-beta T cell;effector CD8-positive, alpha-beta T cell;mature NK T cell;type I NK T cell;gamma-delta T cell;CD8-alpha alpha positive, gamma-delta intraepithelial T cell;mature T cell;regulatory T cell;exhausted T cell;innate lymphoid cell;natural killer cell;CD16-negative, CD56-bright natural killer cell, human;CD16-positive, CD56-dim natural killer cell, human;ILC1, human;DN1 thymic pro-T cell",IFN-II
IKBKB,,,,no,7.38,9.27,84528,108313,0.329,ENSG00000104365,Inhibitor of nuclear factor kappa-B kinase subunit beta (I-kappa-B-kinase beta) (IKK-B) (IKK-beta) (IkBKB),Cytoplasm,,
IL12A,,,,no,0.361,0.231,4133,2694,-0.646,ENSG00000168811,Interleukin-12 subunit alpha (IL-12A) (Cytotoxic lymphocyte maturation factor 35 kDa subunit) (CLMF p35) (IL-12 subunit p35) (NK cell stimulatory factor chain 1) (NKSF1),Secreted,,
IL12B,,,,no,0.05,,571,0,,ENSG00000113302,Interleukin-12 subunit beta (IL-12B) (Cytotoxic lymphocyte maturation factor 40 kDa subunit) (CLMF p40) (IL-12 subunit p40) (NK cell stimulatory factor chain 2) (NKSF2),Secreted,,IL12
IL1A,,,,no,0.063,0.024,726,276,-1.424,ENSG00000115008,Interleukin-1 alpha (IL-1 alpha) (Hematopoietin-1),Nucleus,,IL1
IL1B,,,,no,0.2,0.231,2296,2697,0.203,ENSG00000125538,Interleukin-1 beta (IL-1 beta) (Catabolin),Cytoplasm,"brush cell of bronchus;elicited macrophage;inflammatory macrophage;alternatively activated macrophage;colon macrophage;mononuclear phagocyte;CD14-positive, CD16-negative classical monocyte;dendritic cell;conventional dendritic cell;myeloid dendritic cell;CD1c-positive myeloid dendritic cell;myeloid leukocyte;monocyte;CD14-positive monocyte;intermediate monocyte;myeloid cell;hematopoietic multipotent progenitor cell",IL1
IL2,,,,no,0.039,,442,0,,ENSG00000109471,Interleukin-2 (IL-2) (T-cell growth factor) (TCGF) (Aldesleukin),Secreted,"T cell;CD4-positive helper T cell;T-helper 1 cell;activated CD4-positive, alpha-beta T cell;activated CD8-positive, alpha-beta T cell;type I NK T cell",IL2
IL6,,,,no,0.419,0.217,4797,2534,-0.95,ENSG00000136244,Interleukin-6 (IL-6) (B-cell stimulatory factor 2) (BSF-2) (CTL differentiation factor) (CDF) (Hybridoma growth factor) (Interferon beta-2) (IFN-beta-2),Secreted,squamous epithelial cell;blood vessel endothelial cell;vein endothelial cell;prostate gland microvascular endothelial cell;endothelial cell;endothelial cell of vascular tree;vascular associated smooth muscle cell;smooth muscle cell of prostate;myeloid cell;fibroblast of mammary gland;fibroblast of connective tissue of nonglandular part of prostate;fibroblast of connective tissue of glandular part of prostate;fibroblast of breast;mural cell,IL6
INPPL1,,,,no,14.524,18.626,166343,217635,0.359,ENSG00000165458,"Phosphatidylinositol 3,4,5-trisphosphate 5-phosphatase 2",Cytoplasm,pulmonary ionocyte;ionocyte,
INSM1,,,,no,0.389,0.235,4454,2744,-0.728,ENSG00000173404,Insulinoma-associated protein 1 (Zinc finger protein IA-1),Nucleus,neuroendocrine cell;type EC enteroendocrine cell;lung neuroendocrine cell;pancreatic PP cell;PP cell;type L enteroendocrine cell;intestinal enteroendocrine cell;enteroendocrine cell of small intestine;enteroendocrine cell of colon,
INSR,,,,no,27.543,34.363,315452,401520,0.319,ENSG00000171105,Insulin receptor (IR),Cell membrane,secondary lens fiber,
IRS1,,,,no,5.307,6.072,60779,70949,0.194,ENSG00000169047,Insulin receptor substrate 1 (IRS-1),,tracheobronchial smooth muscle cell,
IRS2,,,,no,3.409,5.046,39043,58963,0.566,ENSG00000185950,Insulin receptor substrate 2 (IRS-2),Cytoplasm,salivary gland cell,
IRS4,,,,no,0.035,0.032,400,378,-0.111,ENSG00000133124,Insulin receptor substrate 4 (IRS-4) (160 kDa phosphotyrosine protein) (py160) (Phosphoprotein of 160 kDa) (pp160),Cell membrane,,
ISL1,,,,no,0.659,0.604,7546,7062,-0.125,ENSG00000016082,Insulin gene enhancer protein ISL-1 (Islet-1),Nucleus,pancreatic endocrine cell;pancreatic A cell;pancreatic D cell;pancreatic PP cell;enteroendocrine cell;PP cell;type L enteroendocrine cell;intestinal enteroendocrine cell;enteroendocrine cell of small intestine;enteroendocrine cell of colon;endocrine cell;neuron;ON-bipolar cell;rod bipolar cell;medium spiny neuron,
ITPR3,,,,no,7.175,11.43,82178,133554,0.672,ENSG00000096433,"Inositol 1,4,5-trisphosphate receptor type 3 (IP3 receptor isoform 3) (IP3R 3) (InsP3R3) (Type 3 inositol 1,4,5-trisphosphate receptor) (Type 3 InsP3 receptor)",Endoplasmic reticulum membrane,,
JAK2,,,,no,2.05,2.653,23475,30998,0.372,ENSG00000096968,Tyrosine-protein kinase JAK2,Endomembrane system,basal cell of epidermis;stem cell of epidermis;mesothelial fibroblast,
KCNJ11,,,,no,1.585,0.987,18151,11533,-0.683,ENSG00000187486,"ATP-sensitive inward rectifier potassium channel 11 (IKATP) (Inward rectifier K(+) channel Kir6.2) (Potassium channel, inwardly rectifying subfamily J member 11)",Membrane,,
KCNMA1,,,,no,2.849,3.362,32628,39284,0.239,ENSG00000156113,"Calcium-activated potassium channel subunit alpha-1 (BK channel) (BKCA alpha) (Calcium-activated potassium channel, subfamily M subunit alpha-1) (K(VCA)alpha) (KCa1.1) (Maxi K channel) (MaxiK) (Slo-alpha) (Slo1) (Slowpoke homolog) (Slo homolog) (hSlo)",Cell membrane,type B pancreatic cell;Kupffer cell;bipolar neuron;retinal bipolar neuron,
KCNMB1,,,,no,0.241,0.498,2765,5817,1.044,ENSG00000145936,"Calcium-activated potassium channel subunit beta-1 (BK channel subunit beta-1) (BKbeta) (BKbeta1) (Hbeta1) (Calcium-activated potassium channel, subfamily M subunit beta-1) (Calcium-activated potassium channel subunit beta) (Charybdotoxin receptor subunit beta-1) (K(VCA)beta-1) (Maxi K channel subunit beta-1) (Slo-beta-1) (Slo-beta)",Membrane,microglial cell;mature microglial cell;smooth muscle cell;enteric smooth muscle cell;uterine smooth muscle cell;tracheobronchial smooth muscle cell;bronchial smooth muscle cell;Langerhans cell,
KCNN3,,,,no,0.134,0.203,1532,2367,0.599,ENSG00000143603,Small conductance calcium-activated potassium channel protein 3 (SK3) (SKCa 3) (SKCa3) (KCa2.3),Membrane,interstitial cell of Cajal;vasa recta descending limb cell;astrocyte,
KCNN4,,,,no,0.204,0.517,2341,6042,1.339,ENSG00000104783,Intermediate conductance calcium-activated potassium channel protein 4 (SK4) (SKCa 4) (SKCa4) (IKCa1) (IK1) (KCa3.1) (KCa4) (Putative Gardos channel),Cell membrane,placental villous trophoblast;syncytiotrophoblast cell,
KCNU1,,,,no,0.025,,285,0,,ENSG00000215262,"Potassium channel subfamily U member 1 (Calcium-activated potassium channel subunit alpha-3) (Calcium-activated potassium channel, subfamily M subunit alpha-3) (KCa5) (Slowpoke homolog 3)",Cell membrane,,
KRAS,,,,no,7.627,4.406,87350,51484,-0.792,ENSG00000133703,GTPase KRas,Cell membrane,,
LIPE,,,,no,0.129,0.106,1477,1238,-0.284,ENSG00000079435,Hormone-sensitive lipase (HSL),Cell membrane,fat cell;white fat cell;brown fat cell;subcutaneous fat cell;adipocyte of breast;epicardial adipocyte;adipocyte of epicardial fat of left ventricle,
LMO2,,,,no,1.106,1.337,12663,15621,0.274,ENSG00000135363,Rhombotin-2 (Cysteine-rich protein TTG-2) (LIM domain only protein 2) (LMO-2) (T-cell translocation protein 2),Nucleus,retinal blood vessel endothelial cell;glomerular capillary endothelial cell;lung microvascular endothelial cell;lung endothelial cell;gut endothelial cell;endothelial cell of lymphatic vessel;cerebral cortex endothelial cell;surface ectodermal cell;megakaryocyte-erythroid progenitor cell;erythroid lineage cell;erythroid progenitor cell;proerythroblast;erythroblast;hematopoietic multipotent progenitor cell;myeloid lineage restricted progenitor cell,
LTA,,,,no,0.05,0.028,572,331,-0.818,ENSG00000226979,Lymphotoxin-alpha (LT-alpha) (TNF-beta) (Tumor necrosis factor ligand superfamily member 1),Secreted;Membrane,"CD4-positive, alpha-beta T cell;CD4-positive helper T cell;activated CD4-positive, alpha-beta T cell;activated CD8-positive, alpha-beta T cell;mature NK T cell;type I NK T cell;regulatory T cell;group 3 innate lymphoid cell;CD34-positive, CD56-positive, CD117-positive common innate lymphoid precursor, human",LT
MAFB,,,,no,6.639,4.685,76036,54738,-0.503,ENSG00000204103,Transcription factor MafB (Maf-B) (V-maf musculoaponeurotic fibrosarcoma oncogene homolog B),Nucleus,"intestinal crypt stem cell of large intestine;elicited macrophage;alternatively activated macrophage;colon macrophage;CD14-low, CD16-positive monocyte",
MAP2K1,,,,no,4.591,3.625,52585,42362,-0.341,ENSG00000169032,Dual specificity mitogen-activated protein kinase kinase 1 (MAP kinase kinase 1) (MAPKK 1) (MKK1),Cytoplasm,,
MAP4K2,,,,no,2.971,3.693,34030,43146,0.314,ENSG00000168067,Mitogen-activated protein kinase kinase kinase kinase 2,Cytoplasm,,
MAPK1,,,,no,12.287,10.624,140728,124144,-0.21,ENSG00000100030,Mitogen-activated protein kinase 1 (MAP kinase 1) (MAPK 1),Cytoplasm,"CD8-positive, alpha-beta cytokine secreting effector T cell",
MAPK10,,,,no,1.99,1.682,22794,19649,-0.243,ENSG00000109339,Mitogen-activated protein kinase 10 (MAP kinase 10) (MAPK 10),Cytoplasm,ependymal cell;choroid plexus epithelial cell;astrocyte;papillary tips cell,
MAPK11,,,,no,0.727,0.909,8330,10624,0.322,ENSG00000185386,Mitogen-activated protein kinase 11 (MAP kinase 11) (MAPK 11),Cytoplasm,,
MAPK12,,,,no,0.309,0.469,3538,5484,0.603,ENSG00000188130,Mitogen-activated protein kinase 12 (MAP kinase 12) (MAPK 12),Cytoplasm;Nucleus;Mitochondrion,,
MAPK14,,,,no,5.16,6.672,59092,77955,0.371,ENSG00000112062,Mitogen-activated protein kinase 14 (MAP kinase 14) (MAPK 14),Cytoplasm,,
MAPK3,,,,no,8.17,12.041,93574,140692,0.559,ENSG00000102882,Mitogen-activated protein kinase 3 (MAP kinase 3) (MAPK 3),Cytoplasm,,
MAPK8,,,,no,4.446,4.116,50917,48090,-0.111,ENSG00000107643,Mitogen-activated protein kinase 8 (MAP kinase 8) (MAPK 8),Cytoplasm,,
MAPK9,,,,no,9.884,7.415,113205,86638,-0.415,ENSG00000050748,Mitogen-activated protein kinase 9 (MAP kinase 9) (MAPK 9),Cytoplasm,,
MKNK1,,,,no,9.465,11.669,108400,136350,0.302,ENSG00000079277,MAP kinase-interacting serine/threonine-protein kinase 1,Cytoplasm;Nucleus,,
MLXIP,,,,no,12.175,13.295,139438,155352,0.127,ENSG00000175727,MLX-interacting protein (Class E basic helix-loop-helix protein 36) (bHLHe36) (Transcriptional activator MondoA),Cytoplasm,intestinal crypt stem cell;intestinal crypt stem cell of small intestine;intestinal crypt stem cell of colon;intestinal enteroendocrine cell;enteroendocrine cell of colon;late pro-B cell,
MLXIPL,,,,no,2.319,2.819,26556,32935,0.282,ENSG00000009950,Carbohydrate-responsive element-binding protein (ChREBP) (Class D basic helix-loop-helix protein 14) (bHLHd14) (MLX interactor) (MLX-interacting protein-like) (WS basic-helix-loop-helix leucine zipper protein) (WS-bHLH) (Williams-Beuren syndrome chromosomal region 14 protein),Nucleus,cholangiocyte;hepatocyte;periportal region hepatocyte;midzonal region hepatocyte;centrilobular region hepatocyte;hepatic stellate cell;fat cell;white fat cell;brown fat cell;subcutaneous fat cell;epicardial adipocyte;adipocyte of epicardial fat of left ventricle,
MNX1,,,,no,3.387,5.034,38794,58817,0.571,ENSG00000130675,Motor neuron and pancreas homeobox protein 1 (Homeobox protein HB9),Nucleus,type EC enteroendocrine cell,
MTOR,,,,no,5.627,5.542,64450,64752,-0.022,ENSG00000198793,Serine/threonine-protein kinase mTOR,Endoplasmic reticulum membrane,,
NEUROD1,,,,no,1.227,0.951,14050,11111,-0.367,ENSG00000162992,Neurogenic differentiation factor 1 (NeuroD) (NeuroD1) (Class A basic helix-loop-helix protein 3) (bHLHa3),Cytoplasm,type EC enteroendocrine cell;lung neuroendocrine cell;pancreatic endocrine cell;type B pancreatic cell;pancreatic A cell;pancreatic D cell;pancreatic PP cell;pancreatic epsilon cell;enteroendocrine cell;PP cell;type L enteroendocrine cell;intestinal enteroendocrine cell;enteroendocrine cell of small intestine;enteroendocrine cell of colon;endocrine cell,
NFATC1,,,,no,1.318,1.555,15093,18175,0.239,ENSG00000131196,"Nuclear factor of activated T-cells, cytoplasmic 1 (NF-ATc1) (NFATc1) (NFAT transcription complex cytosolic component) (NF-ATc) (NFATc)",Cytoplasm,epithelial cell of thymus;endothelial cell of lymphatic vessel;osteoclast;neuron,
NFKB1,,,,no,4.659,4.48,53358,52342,-0.057,ENSG00000109320,Nuclear factor NF-kappa-B p105 subunit (DNA-binding factor KBF1) (EBP-1) (Nuclear factor of kappa light polypeptide gene enhancer in B-cells 1),Nucleus,"cortical thymic epithelial cell;elicited macrophage;inflammatory macrophage;alternatively activated macrophage;mast cell;mucosal type mast cell;group 3 innate lymphoid cell;CD34-positive, CD56-positive, CD117-positive common innate lymphoid precursor, human;myeloid cell;fibroblast of connective tissue of nonglandular part of prostate",
NOS3,,,,no,1.286,1.835,14734,21444,0.513,ENSG00000164867,Nitric oxide synthase 3,Cell membrane;Membrane,,
NOX1,,,,no,0.019,,223,0,,ENSG00000007952,NADPH oxidase 1 (NOX-1),Cell projection,intestinal crypt stem cell of colon,
NOX4,,,,no,0.301,0.189,3447,2206,-0.673,ENSG00000086991,NADPH oxidase 4,Endoplasmic reticulum membrane,epithelial cell of proximal tubule;kidney epithelial cell;parietal epithelial cell;kidney cortex tubule cell;epithelial cell of nephron;fibroblast of cardiac tissue;fibro/adipogenic progenitor cell;kidney cell,
NR1H2,,,,no,13.08,13.019,149801,152120,-0.007,ENSG00000131408,Oxysterols receptor LXR-beta (Liver X receptor beta) (Nuclear receptor NER) (Nuclear receptor subfamily 1 group H member 2) (Ubiquitously-expressed nuclear receptor),Nucleus,epithelial cell of lung,Desmosterol
NR1H3,,,,no,4.006,4.722,45876,55170,0.237,ENSG00000025434,Oxysterols receptor LXR-alpha (Liver X receptor alpha) (Nuclear receptor subfamily 1 group H member 3),Nucleus,,Desmosterol
NR5A2,,,,no,37.066,34.501,424518,403138,-0.103,ENSG00000116833,Nuclear receptor subfamily 5 group A member 2 (Alpha-1-fetoprotein transcription factor) (B1-binding factor) (hB1F) (CYP7A promoter-binding factor) (Hepatocytic transcription factor) (Liver receptor homolog 1) (LRH-1),Nucleus,hepatoblast;cholangiocyte;hepatocyte;endothelial cell of sinusoid;endothelial cell of hepatic sinusoid;endothelial cell of pericentral hepatic sinusoid;endothelial cell of uterus,
NRAS,,,,no,7.324,4.932,83886,57624,-0.571,ENSG00000213281,GTPase NRas,Cell membrane,,
OGT,,,,no,18.638,25.623,213457,299397,0.459,ENSG00000147162,UDP-N-acetylglucosamine--peptide N-acetylglucosaminyltransferase 110 kDa subunit,Nucleus,,
PAX6,,,,no,1.529,1.186,17512,13860,-0.366,ENSG00000007372,Paired box protein Pax-6 (Aniridia type II protein) (Oculorhombin),Nucleus,pigmented epithelial cell;pigmented ciliary epithelial cell;corneal epithelial cell;pancreatic endocrine cell;type B pancreatic cell;pancreatic A cell;pancreatic PP cell;enteroendocrine cell;PP cell;conjunctival epithelial cell;endocrine cell;smooth muscle cell of sphincter of pupil;radial glial cell;Mueller cell;forebrain radial glial cell;retinal ganglion cell;medium spiny neuron;glycinergic neuron,
PCSK1,,,,no,2.232,0.776,25559,9072,-1.523,ENSG00000175426,Neuroendocrine convertase 1 (NEC 1),Cytoplasmic vesicle,neuroendocrine cell;chromaffin cell;type EC enteroendocrine cell;pancreatic endocrine cell;type B pancreatic cell;pancreatic D cell;pancreatic PP cell;pancreatic epsilon cell;enteroendocrine cell;PP cell;type L enteroendocrine cell;intestinal enteroendocrine cell;enteroendocrine cell of small intestine;enteroendocrine cell of colon;paneth cell;endocrine cell,
PDPK1,,,,no,6.841,7.32,78351,85530,0.098,ENSG00000140992,3-phosphoinositide-dependent protein kinase 1 (hPDK1),Cytoplasm;Nucleus;Cell membrane,,
PDX1,,,,no,1.183,0.885,13551,10342,-0.419,ENSG00000139515,Pancreas/duodenum homeobox protein 1 (PDX-1) (Glucose-sensitive factor) (GSF) (Insulin promoter factor 1) (IPF-1) (Insulin upstream factor 1) (IUF-1) (Islet/duodenum homeobox-1) (IDX-1) (Somatostatin-transactivating factor 1) (STF-1),Nucleus;Cytoplasm,pancreatic ductal cell;pancreatic endocrine cell;type B pancreatic cell,
PIK3CA,,,,no,6.97,6.121,79827,71518,-0.187,ENSG00000121879,"Phosphatidylinositol 4,5-bisphosphate 3-kinase catalytic subunit alpha isoform (PI3-kinase subunit alpha) (PI3K-alpha) (PI3Kalpha) (PtdIns-3-kinase subunit alpha)",,,
PIK3CB,,,,no,10.714,9.571,122705,111829,-0.163,ENSG00000051382,"Phosphatidylinositol 4,5-bisphosphate 3-kinase catalytic subunit beta isoform (PI3-kinase subunit beta) (PI3K-beta) (PI3Kbeta) (PtdIns-3-kinase subunit beta)",Cytoplasm,,
PIK3CD,,,,no,1.39,2.73,15919,31898,0.974,ENSG00000171608,"Phosphatidylinositol 4,5-bisphosphate 3-kinase catalytic subunit delta isoform (PI3-kinase subunit delta) (PI3K-delta) (PI3Kdelta) (PtdIns-3-kinase subunit delta)",Cytoplasm,,
PIK3R1,,,,no,4.493,4.853,51457,56704,0.111,ENSG00000145675,Phosphatidylinositol 3-kinase regulatory subunit alpha (PI3-kinase regulatory subunit alpha) (PI3K regulatory subunit alpha) (PtdIns-3-kinase regulatory subunit alpha) (Phosphatidylinositol 3-kinase 85 kDa regulatory subunit alpha) (PI3-kinase subunit p85-alpha) (PtdIns-3-kinase regulatory subunit p85-alpha),,epithelial cell of thymus;cortical thymic epithelial cell;alpha-beta T cell;mature alpha-beta T cell;mucosal invariant T cell;mature T cell;keratocyte,
PIK3R2,,,,no,8.295,7.973,94998,93166,-0.057,ENSG00000105647,Phosphatidylinositol 3-kinase regulatory subunit beta (PI3-kinase regulatory subunit beta) (PI3K regulatory subunit beta) (PtdIns-3-kinase regulatory subunit beta) (Phosphatidylinositol 3-kinase 85 kDa regulatory subunit beta) (PI3-kinase subunit p85-beta) (PtdIns-3-kinase regulatory subunit p85-beta),,,
PIM1,,,,no,5.599,5.118,64122,59799,-0.13,ENSG00000137193,Serine/threonine-protein kinase pim-1,Cell membrane,"mesothelial cell of pleura;erythrocyte;enucleate erythrocyte;T-helper 17 cell;exhausted T cell;group 2 innate lymphoid cell;CD34-positive, CD56-positive, CD117-positive common innate lymphoid precursor, human;erythroid lineage cell;reticulocyte;enucleated reticulocyte",
PKM,,,,no,31.956,30.91,365988,361178,-0.048,ENSG00000067225,Pyruvate kinase PKM,Cytoplasm,fallopian tube secretory epithelial cell;rod bipolar cell;OFF-bipolar cell;retinal cone cell;glycinergic neuron,
PLCB1,,,,no,4.51,3.9,51649,45569,-0.21,ENSG00000182621,"1-phosphatidylinositol 4,5-bisphosphate phosphodiesterase beta-1",Nucleus membrane,endothelial cell of sinusoid;endothelial cell of hepatic sinusoid;endothelial cell of pericentral hepatic sinusoid;cardiac endothelial cell;kidney loop of Henle ascending limb epithelial cell;kidney loop of Henle thick ascending limb epithelial cell;kidney loop of Henle epithelial cell;Schwann cell;mesangial cell,
PLCE1,,,,no,0.657,0.643,7519,7517,-0.029,ENSG00000138193,"1-phosphatidylinositol 4,5-bisphosphate phosphodiesterase epsilon-1",Cytoplasm,corneal endothelial cell;pigmented ciliary epithelial cell;kidney glomerular epithelial cell;podocyte;parietal epithelial cell;retinal pigment epithelial cell;smooth muscle myoblast;Schwann cell,
PLCG1,,,,no,5.209,7.695,59656,89916,0.563,ENSG00000124181,"1-phosphatidylinositol 4,5-bisphosphate phosphodiesterase gamma-1",Cell projection,,
PLCG2,,,,no,1.576,2.24,18051,26172,0.507,ENSG00000197943,"1-phosphatidylinositol 4,5-bisphosphate phosphodiesterase gamma-2",Membrane raft,kidney collecting duct intercalated cell;renal intercalated cell;renal beta-intercalated cell;renal alpha-intercalated cell;pulmonary ionocyte;brush cell;intestinal tuft cell;tuft cell of colon;endothelial cell of lymphatic vessel;ionocyte;melanocyte of skin,
PPARA,,,,no,4.03,4.47,46150,52227,0.15,ENSG00000186951,Peroxisome proliferator-activated receptor alpha (PPAR-alpha) (Nuclear receptor subfamily 1 group C member 1),Nucleus,centrilobular region hepatocyte;sebaceous gland cell,DHEA;DHEAS
PPARGC1A,,,,no,2.556,2.147,29270,25092,-0.251,ENSG00000109819,Peroxisome proliferator-activated receptor gamma coactivator 1-alpha (PGC-1-alpha) (PPAR-gamma coactivator 1-alpha) (PPARGC-1-alpha) (Ligand effect modulator 6),Nucleus,pigmented epithelial cell;pigmented ciliary epithelial cell;epithelial cell of sweat gland;white fat cell,
PPP1CA,,,,no,16.15,16.684,184968,194948,0.047,ENSG00000172531,Serine/threonine-protein phosphatase PP1-alpha catalytic subunit (PP-1A),Cytoplasm,large pre-B-II cell;pre-conventional dendritic cell,
