gene,category,rationale,single_gene_panel_note,exclude_recommended,detection_pct_0041323,detection_pct_0041326,n_cells_0041323,n_cells_0041326,log2_detection_ratio_326_over_323,gene_id,full_name,location,cell_type,cellchat_pathway
TKT,,,,no,44.914,42.653,514403,498383,-0.075,ENSG00000163931,Transketolase (TK),,late pro-B cell;promonocyte;promyelocyte;myelocyte;hematopoietic precursor cell;hematopoietic multipotent progenitor cell;early lymphoid progenitor;pro-B cell;fraction A pre-pro B cell;myeloid lineage restricted progenitor cell;granulocytopoietic cell,
TLR10,,,,no,0.094,0.088,1071,1031,-0.084,ENSG00000174123,Toll-like receptor 10 (CD antigen CD290),Membrane,memory B cell;follicular B cell,
TMPO,,,,no,8.587,8.686,98350,101497,0.017,ENSG00000120802,"Lamina-associated polypeptide 2, isoform alpha (Thymopoietin isoform alpha) (TP alpha) (Thymopoietin-related peptide isoform alpha) (TPRP isoform alpha)",Nucleus;Chromosome,"double-positive, alpha-beta thymocyte;DN4 thymocyte;precursor B cell;large pre-B-II cell;common dendritic progenitor;fraction A pre-pro B cell;myeloid lineage restricted progenitor cell",
TNFRSF13B,,,,no,0.015,0.03,177,350,0.955,ENSG00000240505,Tumor necrosis factor receptor superfamily member 13B (Transmembrane activator and CAML interactor) (CD antigen CD267),Membrane,professional antigen presenting cell;mature B cell;memory B cell;unswitched memory B cell;class switched memory B cell;IgG memory B cell;follicular B cell;plasmablast;B cell;transitional stage B cell;plasma cell;IgG plasma cell;IgM plasma cell;IgA plasma cell,APRIL;BAFF
TNFRSF13C,,,,no,0.051,0.068,580,791,0.419,ENSG00000159958,Tumor necrosis factor receptor superfamily member 13C (B-cell-activating factor receptor) (BAFF receptor) (BAFF-R) (BLyS receptor 3) (CD antigen CD268),Membrane,professional antigen presenting cell;mature B cell;memory B cell;unswitched memory B cell;class switched memory B cell;IgG memory B cell;IgG-negative class switched memory B cell;naive B cell;B-1b B cell;follicular B cell;B cell;immature B cell;transitional stage B cell,BAFF
TNFRSF17,,,,no,0.035,0.067,402,785,0.937,ENSG00000048462,Tumor necrosis factor receptor superfamily member 17 (B-cell maturation protein) (CD antigen CD269),Cell membrane,mature B cell;plasmablast;B cell;small pre-B-II cell;plasma cell;IgG plasma cell;IgM plasma cell;IgA plasma cell,APRIL;BAFF
TNFRSF18,,,,no,0.075,0.043,856,504,-0.793,ENSG00000186891,Tumor necrosis factor receptor superfamily member 18 (Activation-inducible TNFR family receptor) (Glucocorticoid-induced TNFR-related protein) (CD antigen CD357),Secreted,"stem cell of epidermis;Langerhans cell;alpha-beta T cell;mature alpha-beta T cell;activated CD4-positive, alpha-beta T cell;CD8-alpha-beta-positive, alpha-beta intraepithelial T cell;mucosal invariant T cell;mature T cell;regulatory T cell;intraepithelial lymphocyte;IgA plasma cell;CD16-negative, CD56-bright natural killer cell, human;decidual natural killer cell, human;ILC1, human;group 2 innate lymphoid cell;group 2 innate lymphoid cell, human;group 3 innate lymphoid cell;CD34-positive, CD56-positive, CD117-positive common innate lymphoid precursor, human;lymphoid lineage restricted progenitor cell;pro-T cell;early T lineage precursor",GITRL
TOP2A,,,,no,0.538,0.346,6160,4040,-0.637,ENSG00000131747,DNA topoisomerase 2-alpha,Cytoplasm,"immature alpha-beta T cell;double-positive, alpha-beta thymocyte;DN4 thymocyte;precursor B cell;large pre-B-II cell;promonocyte;erythroid lineage cell;pro-B cell;fraction A pre-pro B cell;salivary gland cell",
TOP2B,,,,no,13.445,13.264,153981,154988,-0.02,ENSG00000077097,DNA topoisomerase 2-beta,Nucleus,late pro-B cell;early lymphoid progenitor;lymphoid lineage restricted progenitor cell;pro-B cell;fraction A pre-pro B cell;common lymphoid progenitor,
TOR3A,,,,no,2.247,1.514,25740,17686,-0.57,ENSG00000186283,Torsin-3A (ATP-dependent interferon-responsive protein) (Torsin family 3 member A),Cytoplasm;Endoplasmic reticulum lumen,plasmablast;plasma cell;IgG plasma cell;IgM plasma cell;IgA plasma cell,
TPX2,,,,no,0.412,0.244,4715,2852,-0.754,ENSG00000088325,Targeting protein for Xklp2 (Differentially expressed in cancerous and non-cancerous lung cells 2) (DIL-2) (Hepatocellular carcinoma-associated antigen 519) (Hepatocellular carcinoma-associated antigen 90) (Protein fls353) (Restricted expression proliferation-associated protein 100) (p100),Nucleus,"double-positive, alpha-beta thymocyte;DN4 thymocyte;fraction A pre-pro B cell",
TRAF3IP3,,,,no,0.25,0.531,2867,6209,1.086,ENSG00000009790,TRAF3-interacting JNK-activating modulator (TRAF3-interacting protein 3),Cell membrane,"hematopoietic cell;leukocyte;B-1a B cell;mononuclear cell;lymphocyte;T cell;alpha-beta T cell;mature alpha-beta T cell;CD4-positive, alpha-beta T cell;CD4-positive, CD25-positive, alpha-beta regulatory T cell;naive regulatory T cell;memory regulatory T cell;naive thymus-derived CD4-positive, alpha-beta T cell;activated CD4-positive, alpha-beta T cell, human;CD4-positive, alpha-beta memory T cell;CD4-positive, alpha-beta memory T cell, CD45RO-positive;central memory CD4-positive, alpha-beta T cell;naive thymus-derived CD8-positive, alpha-beta T cell;CD8-positive, alpha-beta cytokine secreting effector T cell;central memory CD8-positive, alpha-beta T cell;mature T cell;regulatory T cell;naive T cell;exhausted T cell;double negative T regulatory cell;group 2 innate lymphoid cell;CD34-positive, CD56-positive, CD117-positive common innate lymphoid precursor, human",
TRAF4,,,,no,6.23,4.589,71352,53625,-0.441,ENSG00000076604,TNF receptor-associated factor 4,Cytoplasm,"urothelial cell;bladder urothelial cell;plasmacytoid dendritic cell;plasmacytoid dendritic cell, human;B-1a B cell;bladder cell",
TRIB1,,,,no,1.729,0.733,19802,8561,-1.239,ENSG00000173334,Tribbles homolog 1 (TRB-1) (G-protein-coupled receptor-induced gene 2 protein) (GIG-2) (SKIP1),,skeletal muscle satellite stem cell;ileal goblet cell;medullary thymic epithelial cell;skeletal muscle satellite cell;IgA plasma cell,
TUBB,,,,no,44.86,44.064,513780,514881,-0.026,ENSG00000196230,Tubulin beta chain (Tubulin beta-5 chain),Cytoplasm,"glioblast;Schwann cell precursor;neural crest cell;ovarian surface epithelial cell;mesodermal cell;mast cell;mucosal type mast cell;double-positive, alpha-beta thymocyte;large pre-B-II cell;primitive red blood cell;fraction A pre-pro B cell;immature Schwann cell;enteric neuron;peripheral nervous system neuron",
TUBB3,,,,no,0.225,0.265,2580,3099,0.236,ENSG00000258947,Tubulin beta-3 chain (Tubulin beta-4 chain) (Tubulin beta-III),Cytoplasm,lung neuroendocrine cell;small pre-B-II cell;sympathetic neuron,
TYMS,,,,no,1.741,0.895,19943,10463,-0.959,ENSG00000176890,Thymidylate synthase (TS) (TSase),Nucleus,"double-positive, alpha-beta thymocyte;T-helper 17 cell;large pre-B-II cell;primitive red blood cell;macrophage dendritic cell progenitor;hematopoietic precursor cell;lymphoid lineage restricted progenitor cell;pro-B cell;fraction A pre-pro B cell",
U2AF1,,,,no,1.515,1.015,17352,11857,-0.578,ENSG00000160201,Splicing factor U2AF 35 kDa subunit (U2 auxiliary factor 35 kDa subunit) (U2 small nuclear RNA auxiliary factor 1) (U2 snRNP auxiliary factor small subunit),Nucleus,stem cell of epidermis;pancreatic D cell;endocrine cell;T-helper 17 cell;exhausted T cell;large pre-B-II cell;transit amplifying cell of colon,
UBE2C,,,,no,0.192,0.104,2196,1215,-0.883,ENSG00000175063,Ubiquitin-conjugating enzyme E2 C,,"double-positive, alpha-beta thymocyte;DN4 thymocyte;large pre-B-II cell;promonocyte;fraction A pre-pro B cell",
UBE2I,,,,no,10.059,10.856,115206,126849,0.11,ENSG00000103275,SUMO-conjugating enzyme UBC9,Nucleus,large pre-B-II cell,
UBE2T,,,,no,0.495,0.292,5668,3416,-0.759,ENSG00000077152,Ubiquitin-conjugating enzyme E2 T,Nucleus,large pre-B-II cell,
UCP2,,,,no,1.737,1.662,19895,19420,-0.064,ENSG00000175567,Dicarboxylate carrier SLC25A8 (Mitochondrial uncoupling protein 2) (UCP 2) (Solute carrier family 25 member 8) (UCPH),Mitochondrion inner membrane,"erythrocyte;professional antigen presenting cell;dendritic cell;plasmacytoid dendritic cell;plasmacytoid dendritic cell, human;CD141-positive myeloid dendritic cell;dendritic cell, human;B-1a B cell;B-1b B cell;germinal center B cell;small pre-B-II cell;large pre-B-II cell;pre-B-I cell;erythroid lineage cell;reticulocyte;enucleated reticulocyte",
UHRF1,,,,no,1.003,0.908,11493,10610,-0.144,ENSG00000276043,E3 ubiquitin-protein ligase UHRF1,Nucleus,"immature alpha-beta T cell;double-positive, alpha-beta thymocyte;immature T cell;thymocyte;double negative thymocyte;precursor B cell;large pre-B-II cell;common dendritic progenitor;macrophage dendritic cell progenitor;hematopoietic precursor cell;early lymphoid progenitor;lymphoid lineage restricted progenitor cell;pro-B cell;fraction A pre-pro B cell;early T lineage precursor;common lymphoid progenitor",
WASHC4,,,,no,9.39,9.697,107540,113302,0.046,ENSG00000136051,WASH complex subunit 4 (Strumpellin and WASH-interacting protein) (SWIP) (WASH complex subunit SWIP),Early endosome,B cell,
WDFY4,,,,no,0.225,0.431,2577,5032,0.937,ENSG00000128815,WD repeat- and FYVE domain-containing protein 4,Early endosome,"central nervous system macrophage;microglial cell;professional antigen presenting cell;plasmacytoid dendritic cell;CD141-positive myeloid dendritic cell;Langerhans cell;myeloid dendritic cell, human;B cell",
XBP1,,,,no,72.745,63.583,833141,742953,-0.194,ENSG00000100219,X-box-binding protein 1 (XBP-1) (Tax-responsive element-binding protein 5) (TREB-5),Endoplasmic reticulum,luminal epithelial cell of mammary gland;ileal goblet cell;IgG plasmablast;IgA plasmablast;plasma cell;IgG plasma cell;IgM plasma cell;IgA plasma cell;tracheobronchial serous cell;serous cell of epithelium of trachea;serous cell of epithelium of bronchus,
ZBP1,,,,no,0.042,0.144,477,1685,1.792,ENSG00000124256,Z-DNA-binding protein 1 (DNA-dependent activator of IFN-regulatory factors) (DAI) (Tumor stroma and activated macrophage protein DLM-1),Cytoplasm,"mature B cell;plasmablast;activated CD4-positive, alpha-beta T cell, human;activated CD8-positive, alpha-beta T cell, human;plasma cell;IgG plasma cell;IgM plasma cell;IgA plasma cell;CD16-negative, CD56-bright natural killer cell, human",
ZNF296,,,,no,0.132,0.126,1508,1467,-0.069,ENSG00000170684,Zinc finger protein 296 (ZFP296) (Zinc finger protein 342),Nucleus,immature B cell;small pre-B-II cell;pre-B-I cell,
