gene,category,rationale,single_gene_panel_note,exclude_recommended,detection_pct_0041323,detection_pct_0041326,n_cells_0041323,n_cells_0041326,log2_detection_ratio_326_over_323,gene_id,full_name,location,cell_type,cellchat_pathway
ACSL4,,,,no,6.804,6.355,77926,74262,-0.098,ENSG00000068366,Long-chain-fatty-acid--CoA ligase 4,Mitochondrion outer membrane,hepatoblast;epithelial cell of lung;epithelial cell of alveolus of lung;pneumocyte;type II pneumocyte;intestinal tuft cell;tuft cell of colon;kidney distal convoluted tubule epithelial cell;mast cell;lung secretory cell,
ADD1,,,,no,18.293,20.894,209506,244146,0.192,ENSG00000087274,Alpha-adducin (Erythrocyte adducin subunit alpha),Cytoplasm,neuronal receptor cell;photoreceptor cell;eye photoreceptor cell;retinal rod cell,
AIFM1,,,,no,6.156,5.964,70509,69692,-0.046,ENSG00000156709,"Apoptosis-inducing factor 1, mitochondrial",Mitochondrion intermembrane space,,
AKT1,,,,no,21.471,16.765,245908,195890,-0.357,ENSG00000142208,RAC-alpha serine/threonine-protein kinase,Cytoplasm,,
AKT2,,,,no,14.34,16.101,164236,188133,0.167,ENSG00000105221,RAC-beta serine/threonine-protein kinase,Cytoplasm;Nucleus;Cell membrane,,
AKT3,,,,no,6.099,7.575,69847,88506,0.313,ENSG00000117020,RAC-gamma serine/threonine-protein kinase,Nucleus,,
ALOX15,,,,no,0.052,0.163,598,1909,1.646,ENSG00000161905,"Polyunsaturated fatty acid lipoxygenase ALOX15 (12/15-lipoxygenase) (Arachidonate 12-lipoxygenase, leukocyte-type) (12-LOX)",Cytoplasm,stem cell;basal cell;respiratory basal cell;basal cell of epithelium of trachea;multi-ciliated epithelial cell;lung goblet cell;glandular epithelial cell;goblet cell;respiratory goblet cell;tracheal goblet cell;respiratory epithelial cell;epithelial cell of lower respiratory tract;club cell;bronchial epithelial cell;erythroid lineage cell,
APAF1,,,,no,2.69,3.132,30809,36599,0.22,ENSG00000120868,Apoptotic protease-activating factor 1 (APAF-1),Cytoplasm,,
APP,,,,no,50.114,50.835,573949,593997,0.021,ENSG00000142192,Amyloid-beta precursor protein (APP) (ABPP) (APPI) (Alzheimer disease amyloid A4 protein homolog) (Alzheimer disease amyloid protein) (Amyloid precursor protein) (Amyloid-beta (A4) precursor protein) (Amyloid-beta A4 protein) (Cerebral vascular amyloid peptide) (CVAP) (PreA4) (Protease nexin-II) (PN-II),Cell membrane,epithelial cell;lens epithelial cell;anterior lens cell;endothelial tip cell;kidney capillary endothelial cell;glomerular capillary endothelial cell;lung endothelial cell;type B pancreatic cell;fenestrated cell;glomerular endothelial cell;endothelial cell;endothelial cell of vascular tree;kidney loop of Henle thin ascending limb epithelial cell;surface ectodermal cell,APP
ATF3,,,,no,5.902,2.359,67595,27560,-1.323,ENSG00000162772,Cyclic AMP-dependent transcription factor ATF-3 (cAMP-dependent transcription factor ATF-3) (Activating transcription factor 3),Nucleus,ileal goblet cell;paneth cell of epithelium of small intestine;duodenum glandular cell;epithelial cell of uterus;vascular associated smooth muscle cell,
ATF4,,,,no,51.875,47.634,594118,556593,-0.123,ENSG00000128272,Cyclic AMP-dependent transcription factor ATF-4 (cAMP-dependent transcription factor ATF-4) (Activating transcription factor 4) (Cyclic AMP-responsive element-binding protein 2) (CREB-2) (cAMP-responsive element-binding protein 2) (Tax-responsive enhancer element-binding protein 67) (TaxREB67),Nucleus,pancreatic PP cell;pancreatic acinar cell;PP cell,
ATG5,,,,no,4.701,4.044,53843,47254,-0.217,ENSG00000057663,Autophagy protein 5 (APG5-like) (Apoptosis-specific protein),Cytoplasm,,
ATG7,,,,no,1.781,2.171,20399,25366,0.285,ENSG00000197548,Ubiquitin-like modifier-activating enzyme ATG7 (ATG12-activating enzyme E1 ATG7) (Autophagy-related protein 7) (APG7-like) (hAGP7) (Ubiquitin-activating enzyme E1-like protein),Cytoplasm,Kupffer cell;immature innate lymphoid cell,
ATM,,,,no,9.108,10.276,104310,120077,0.174,ENSG00000149311,Serine-protein kinase ATM,Nucleus,"central nervous system macrophage;mononuclear cell;lymphocyte;T cell;alpha-beta T cell;mature alpha-beta T cell;CD8-positive, alpha-beta cytokine secreting effector T cell;mucosal invariant T cell;mature T cell",
AVPR1A,,,,no,0.435,0.432,4979,5048,-0.009,ENSG00000166148,Vasopressin V1a receptor (V1aR) (AVPR V1a) (Antidiuretic hormone receptor 1a) (Vascular/hepatic-type arginine vasopressin receptor),Cell membrane,smooth muscle cell;vascular associated smooth muscle cell;uterine smooth muscle cell;smooth muscle cell of prostate;pericyte;mural cell,AVP
BAD,,,,no,0.348,0.301,3987,3518,-0.209,ENSG00000002330,Bcl2-associated agonist of cell death (BAD) (Bcl-2-binding component 6) (Bcl-2-like protein 8) (Bcl2-L-8) (Bcl-xL/Bcl-2-associated death promoter) (Bcl2 antagonist of cell death),Mitochondrion outer membrane;Cytoplasm,,
BAK1,,,,no,3.058,2.46,35028,28744,-0.314,ENSG00000030110,Bcl-2 homologous antagonist/killer (Apoptosis regulator BAK) (Bcl-2-like protein 7) (Bcl2-L-7),Mitochondrion outer membrane,,
BAX,,,,no,1.317,1.334,15080,15593,0.019,ENSG00000087088,Apoptosis regulator BAX (Bcl-2-like protein 4) (Bcl2-L-4),Cytoplasm,,
BBC3,,,,no,1.991,2.122,22808,24790,0.091,ENSG00000105327,"Bcl-2-binding component 3, isoforms 3/4 (JFY-1) (p53 up-regulated modulator of apoptosis)",,duct epithelial cell;luminal epithelial cell of mammary gland;epithelial cell of uterus;mammary gland epithelial cell,
BCL10,,,,no,4.167,3.776,47720,44124,-0.142,ENSG00000142867,B-cell lymphoma/leukemia 10 (B-cell CLL/lymphoma 10) (Bcl-10) (CARD-containing molecule enhancing NF-kappa-B) (CARD-like apoptotic protein) (hCLAP) (CED-3/ICH-1 prodomain homologous E10-like regulator) (CIPER) (Cellular homolog of vCARMEN) (cCARMEN) (Cellular-E10) (c-E10) (Mammalian CARD-containing adapter molecule E10) (mE10),Cytoplasm,luminal epithelial cell of mammary gland;epithelial cell of uterus;mammary gland epithelial cell;epithelial cell of urethra,
BCL2,,,,no,1.295,1.556,14831,18181,0.265,ENSG00000171791,Apoptosis regulator Bcl-2,Mitochondrion outer membrane,parietal epithelial cell;kidney loop of Henle thin descending limb epithelial cell;melanocyte;Schwann cell;fat cell;subcutaneous fat cell;adipocyte of breast;epicardial adipocyte;adipocyte of epicardial fat of left ventricle,
BCL2A1,,,,no,0.333,0.358,3817,4187,0.105,ENSG00000140379,Bcl-2-related protein A1 (Bcl-2-like protein 5) (Bcl2-L-5) (Hemopoietic-specific early response protein) (Protein BFL-1) (Protein GRS),Cytoplasm,"phagocyte;macrophage;elicited macrophage;inflammatory macrophage;alternatively activated macrophage;colon macrophage;lung macrophage;classical monocyte;CD14-positive, CD16-negative classical monocyte;follicular dendritic cell;hematopoietic cell;blood cell;granulocyte;neutrophil;leukocyte;professional antigen presenting cell;myeloid dendritic cell, human;myeloid leukocyte;monocyte;non-classical monocyte;CD14-low, CD16-positive monocyte;CD14-positive monocyte;CD14-positive, CD16-positive monocyte;myeloid cell;myelocyte",
BCL2L1,,,,no,18.876,18.984,216190,221821,0.008,ENSG00000171552,Bcl-2-like protein 1 (Bcl2-L-1) (Apoptosis regulator Bcl-X),Mitochondrion inner membrane,erythrocyte;enucleate erythrocyte;reticulocyte;enucleated reticulocyte,
BCL2L11,,,,no,1.776,1.509,20337,17629,-0.235,ENSG00000153094,Bcl-2-like protein 11 (Bcl2-L-11) (Bcl2-interacting mediator of cell death),Endomembrane system,,
BCL2L2,,,,no,23.813,21.413,272733,250209,-0.153,ENSG00000129473,Bcl-2-like protein 2 (Bcl2-L-2) (Apoptosis regulator Bcl-W),Mitochondrion membrane,,
BECN1,,,,no,14.026,13.156,160640,153721,-0.092,ENSG00000126581,Beclin-1 (Coiled-coil myosin-like BCL2-interacting protein) (Protein GT197),Cytoplasm,,
BID,,,,no,1.289,0.952,14758,11120,-0.437,ENSG00000015475,BH3-interacting domain death agonist (p22 BID) (BID),Cytoplasm,"CD141-positive myeloid dendritic cell;myeloid dendritic cell, human;non-classical monocyte;pre-conventional dendritic cell",
BIK,,,,no,1.012,0.954,11590,11151,-0.085,ENSG00000100290,Bcl-2-interacting killer (Apoptosis inducer NBK) (BIP1) (BP4),Endomembrane system,pulmonary ionocyte;brush cell;brush cell of trachebronchial tree;brush cell of bronchus;intestinal tuft cell;tuft cell of colon;ionocyte,
BIRC2,,,,no,15.907,16.978,182178,198387,0.094,ENSG00000110330,Baculoviral IAP repeat-containing protein 2,Cytoplasm;Nucleus,,
BIRC5,,,,no,0.708,0.358,8109,4186,-0.983,ENSG00000089685,Baculoviral IAP repeat-containing protein 5 (Apoptosis inhibitor 4) (Apoptosis inhibitor survivin),Cytoplasm,"double-positive, alpha-beta thymocyte;large pre-B-II cell",
BIRC7,,,,no,0.043,0.048,491,560,0.161,ENSG00000101197,Baculoviral IAP repeat-containing protein 7,Nucleus,,
BMP2,,,,no,6.312,3.984,72291,46556,-0.664,ENSG00000125845,Bone morphogenetic protein 2 (BMP-2) (Bone morphogenetic protein 2A) (BMP-2A),Secreted,endothelial cell of lymphatic vessel,BMP
BRCA1,,,,no,0.771,0.492,8835,5745,-0.65,ENSG00000012048,Breast cancer type 1 susceptibility protein,Nucleus,,
C1QBP,,,,no,21.567,16.001,247001,186964,-0.431,ENSG00000108561,"Complement component 1 Q subcomponent-binding protein, mitochondrial (ASF/SF2-associated protein p32) (Glycoprotein gC1qBP) (C1qBP) (Hyaluronan-binding protein 1) (Mitochondrial matrix protein p32) (gC1q-R protein) (p33) (SF2AP32)",Mitochondrion matrix,erythroid progenitor cell;proerythroblast;macrophage dendritic cell progenitor;pre-conventional dendritic cell,
CAMK2A,,,,no,0.038,0.012,431,141,-1.641,ENSG00000070808,Calcium/calmodulin-dependent protein kinase type II subunit alpha (CaM kinase II subunit alpha) (CaMK-II subunit alpha),Synapse,,
CAMK2B,,,,no,0.397,0.229,4543,2680,-0.79,ENSG00000058404,Calcium/calmodulin-dependent protein kinase type II subunit beta (CaM kinase II subunit beta) (CaMK-II subunit beta),Cytoplasm,bipolar neuron;retinal bipolar neuron;ON-bipolar cell;rod bipolar cell;OFF-bipolar cell,
CAMK2D,,,,no,3.496,4.151,40034,48503,0.248,ENSG00000145349,Calcium/calmodulin-dependent protein kinase type II subunit delta (CaM kinase II subunit delta) (CaMK-II subunit delta),Cell membrane,cardiac muscle cell;regular ventricular cardiac myocyte;muscle precursor cell;cardiac muscle myoblast;preadipocyte;brown preadipocyte,
CAMK2G,,,,no,2.392,3.066,27398,35823,0.358,ENSG00000148660,Calcium/calmodulin-dependent protein kinase type II subunit gamma (CaM kinase II subunit gamma) (CaMK-II subunit gamma),Sarcoplasmic reticulum membrane,astrocyte,
CAPN1,,,,no,5.531,5.052,63351,59034,-0.131,ENSG00000014216,Calpain-1 catalytic subunit,Cytoplasm,club cell,
CARD8,,,,no,3.012,3.645,34500,42586,0.275,ENSG00000105483,Caspase recruitment domain-containing protein 8,Cytoplasm,,
CASP1,,,,no,1.174,2.209,13447,25806,0.912,ENSG00000137752,Caspase-1 (CASP-1),Cytoplasm,"classical monocyte;CD14-positive, CD16-negative classical monocyte;hematopoietic cell;leukocyte;professional antigen presenting cell;dendritic cell;conventional dendritic cell;myeloid dendritic cell;CD1c-positive myeloid dendritic cell;dendritic cell, human;myeloid leukocyte;monocyte;non-classical monocyte;CD14-low, CD16-positive monocyte;CD14-positive monocyte;CD14-positive, CD16-positive monocyte;peripheral blood mononuclear cell;myeloid cell;transit amplifying cell of small intestine",
CASP10,,,,no,1.886,2.387,21601,27893,0.34,ENSG00000003400,Caspase-10 (CASP-10),,,
CASP2,,,,no,3.772,3.93,43205,45924,0.059,ENSG00000106144,Caspase-2 (CASP-2),,,
CASP3,,,,no,4.989,4.109,57135,48018,-0.28,ENSG00000164305,Caspase-3 (CASP-3),Cytoplasm,"erythroid progenitor cell;erythroid progenitor cell, mammalian",
CASP6,,,,no,4.177,3.646,47838,42604,-0.196,ENSG00000138794,Caspase-6 (CASP-6) (CSP-6),Cytoplasm,intestinal tuft cell;tuft cell of colon,
CASP7,,,,no,7.156,4.502,81962,52600,-0.669,ENSG00000165806,Caspase-7 (CASP-7),Cytoplasm,respiratory epithelial cell;epithelial cell of lower respiratory tract;club cell,
CASP8,,,,no,2.154,2.786,24664,32555,0.372,ENSG00000064012,Caspase-8 (CASP-8),Cytoplasm,"memory regulatory T cell;CD8-positive, alpha-beta cytokine secreting effector T cell",
CASP9,,,,no,1.897,2.254,21722,26333,0.249,ENSG00000132906,Caspase-9 (CASP-9),,,
CCNA1,,,,no,0.031,0.009,357,109,-1.741,ENSG00000133101,Cyclin-A1,Nucleus,,
CCND1,,,,no,9.831,5.998,112592,70080,-0.713,ENSG00000110092,G1/S-specific cyclin-D1 (B-cell lymphoma 1 protein) (BCL-1) (BCL-1 oncogene) (PRAD1 oncogene),Nucleus,glioblast;Schwann cell precursor;epithelial cell;type I pneumocyte;epithelial cell of uterus;epithelial cell of thymus;cortical thymic epithelial cell,
CCND2,,,,no,17.11,16.337,195956,190890,-0.067,ENSG00000118971,G1/S-specific cyclin-D2,Nucleus,"intestinal crypt stem cell of small intestine;IgG plasmablast;IgA plasmablast;activated CD4-positive, alpha-beta T cell;CD34-positive, CD56-positive, CD117-positive common innate lymphoid precursor, human;neural progenitor cell",
CD14,,,,no,6.434,7.258,73687,84803,0.174,ENSG00000170458,Monocyte differentiation antigen CD14 (Myeloid cell-specific leucine-rich glycoprotein) (CD antigen CD14),Cell membrane,"acinar cell of salivary gland;phagocyte;macrophage;elicited macrophage;inflammatory macrophage;alternatively activated macrophage;microglial cell;kidney resident macrophage;colon macrophage;Hofbauer cell;classical monocyte;CD14-positive, CD16-negative classical monocyte;blood cell;granulocyte;dendritic cell, human;myeloid leukocyte;monocyte;CD14-positive monocyte;CD14-positive, CD16-positive monocyte;intermediate monocyte;myeloid cell;salivary gland cell",
CD2,,,,no,0.235,0.318,2697,3711,0.432,ENSG00000116824,T-cell surface antigen CD2 (Erythrocyte receptor) (LFA-2) (LFA-3 receptor) (Rosette receptor) (T-cell surface antigen T11/Leu-5) (CD antigen CD2),Cell membrane,"hematopoietic cell;leukocyte;mononuclear cell;lymphocyte;T cell;alpha-beta T cell;mature alpha-beta T cell;CD4-positive helper T cell;T-helper 1 cell;T-helper 17 cell;T follicular helper cell;CD4-positive, CD25-positive, alpha-beta regulatory T cell;memory regulatory T cell;activated CD4-positive, alpha-beta T cell;activated CD4-positive, alpha-beta T cell, human;effector memory CD4-positive, alpha-beta T cell;CD4-positive, alpha-beta cytotoxic T cell;effector CD4-positive, alpha-beta T cell;activated CD8-positive, alpha-beta T cell;activated CD8-positive, alpha-beta T cell, human;CD8-positive, alpha-beta memory T cell;effector memory CD8-positive, alpha-beta T cell, terminally differentiated;CD8-alpha-beta-positive, alpha-beta intraepithelial T cell;CD8-alpha-alpha-positive, alpha-beta intraepithelial T cell;mature NK T cell;type I NK T cell;CD8-alpha alpha positive, gamma-delta intraepithelial T cell;mature T cell;regulatory T cell;cytotoxic T cell;exhausted T cell;intraepithelial lymphocyte;DN3 thymocyte;DN1 thymic pro-T cell",
CD38,,,,no,0.382,0.421,4378,4921,0.14,ENSG00000004468,ADP-ribosyl cyclase/cyclic ADP-ribose hydrolase 1,Cell surface,"plasmablast;IgG plasmablast;IgA plasmablast;alpha-beta T cell;immature alpha-beta T cell;double-positive, alpha-beta thymocyte;mature alpha-beta T cell;CD8-alpha-alpha-positive, alpha-beta intraepithelial T cell;mucosal invariant T cell;mature T cell;immature T cell;thymocyte;precursor B cell;small pre-B-II cell;large pre-B-II cell;pre-B-I cell;late pro-B cell;plasma cell;IgG plasma cell;IgM plasma cell;IgA plasma cell;erythroid progenitor cell, mammalian;lymphoid lineage restricted progenitor cell;pro-B cell;fraction A pre-pro B cell",PECAM2
CD44,,,,no,47.499,46.665,544000,545266,-0.026,ENSG00000026508,CD44 antigen (CDw44) (Epican) (Extracellular matrix receptor III) (ECMR-III) (GP90 lymphocyte homing/adhesion receptor) (HUTCH-I) (Heparan sulfate proteoglycan) (Hermes antigen) (Hyaluronate receptor) (Phagocytic glycoprotein 1) (PGP-1) (Phagocytic glycoprotein I) (PGP-I) (CD antigen CD44),Cell membrane,intestinal crypt stem cell of large intestine;pancreatic ductal cell;pancreatic acinar cell;elicited macrophage;alternatively activated macrophage;hematopoietic cell;granulocyte;leukocyte;myeloid leukocyte;mast cell;B cell;myeloid cell;early T lineage precursor;fibroblast of breast,MIF;SPP1;GALECTIN;COLLAGEN;FN1;LAMININ;SELE
CDC25A,,,,no,0.369,0.252,4223,2946,-0.548,ENSG00000164045,M-phase inducer phosphatase 1,,,
CDC25C,,,,no,0.089,0.046,1021,538,-0.953,ENSG00000158402,M-phase inducer phosphatase 3,Nucleus,,
CDK2,,,,no,2.645,2.406,30290,28108,-0.137,ENSG00000123374,Cyclin-dependent kinase 2,Cytoplasm,,
CDK5,,,,no,1.22,1.269,13967,14830,0.058,ENSG00000164885,Cyclin-dependent kinase 5,Nucleus,,
CDKN1A,,,,no,15.485,12.015,177354,140389,-0.366,ENSG00000124762,Cyclin-dependent kinase inhibitor 1 (CDK-interacting protein 1) (Melanoma differentiation-associated protein 6) (MDA-6) (p21),Cytoplasm,skeletal muscle satellite stem cell;epithelial cell of lacrimal sac;prostate gland microvascular endothelial cell;medullary thymic epithelial cell;vascular associated smooth muscle cell;myometrial cell;skeletal muscle satellite cell;mature conventional dendritic cell;tendon cell,
CDKN1B,,,,no,8.969,11.332,102727,132413,0.337,ENSG00000111276,Cyclin-dependent kinase inhibitor 1B (Cyclin-dependent kinase inhibitor p27) (p27Kip1),Nucleus;Cytoplasm;Endosome,"CD4-positive, CD25-positive, alpha-beta regulatory T cell;naive regulatory T cell;memory regulatory T cell;effector CD4-positive, alpha-beta T cell;DN3 thymocyte",
CDKN2A,,,,no,0.184,0.103,2112,1198,-0.847,ENSG00000147889,Cyclin-dependent kinase inhibitor 2A (Cyclin-dependent kinase 4 inhibitor A) (CDK4I) (Multiple tumor suppressor 1) (MTS-1) (p16-INK4a) (p16-INK4) (p16INK4A),Cytoplasm,glandular epithelial cell;fallopian tube secretory epithelial cell,
CFLAR,,,,no,10.617,14.308,121592,167180,0.43,ENSG00000003402,CASP8 and FADD-like apoptosis regulator (Caspase homolog) (CASH) (Caspase-eight-related protein) (Casper) (Caspase-like apoptosis regulatory protein) (CLARP) (Cellular FLICE-like inhibitory protein) (c-FLIP) (FADD-like antiapoptotic molecule 1) (FLAME-1) (Inhibitor of FLICE) (I-FLICE) (MACH-related inducer of toxicity) (MRIT) (Usurpin),,epithelial cell of lacrimal sac;inflammatory macrophage,
CHUK,,,,no,5.004,3.988,57308,46599,-0.327,ENSG00000213341,Inhibitor of nuclear factor kappa-B kinase subunit alpha (I-kappa-B kinase alpha) (IKK-A) (IKK-alpha) (IkBKA) (IkappaB kinase),Cytoplasm,,
CP,,,,no,0.383,0.955,4381,11164,1.321,ENSG00000047457,Ceruloplasmin,Secreted,non-pigmented ciliary epithelial cell;respiratory goblet cell;tracheal goblet cell;hepatocyte;periportal region hepatocyte;midzonal region hepatocyte;centrilobular region hepatocyte;respiratory epithelial cell;epithelial cell of lower respiratory tract;club cell;chorionic trophoblast cell;serous cell of epithelium of trachea,
CREBBP,,,,no,14.832,17.279,169874,201905,0.22,ENSG00000005339,CREB-binding protein (Histone lysine acetyltransferase CREBBP),Cytoplasm,,
CSF2RB,,,,no,0.365,0.478,4176,5586,0.391,ENSG00000100368,Cytokine receptor common subunit beta (CDw131) (GM-CSF/IL-3/IL-5 receptor common beta subunit) (CD antigen CD131),Membrane,follicular dendritic cell;granulocyte;basophil;eosinophil;plasmacytoid dendritic cell;basophil mast progenitor cell,IL4
CTH,,,,no,2.489,2.26,28501,26407,-0.139,ENSG00000116761,Cystathionine gamma-lyase (CGL) (CSE),Cytoplasm,,
CTNNB1,,,,no,25.402,27.226,290932,318130,0.1,ENSG00000168036,Catenin beta-1 (Beta-catenin),Cytoplasm,melanocyte;serous cell of epithelium of trachea,
CTSC,,,,no,6.391,6.951,73200,81219,0.121,ENSG00000109861,Dipeptidyl peptidase 1,Lysosome,"type II pneumocyte;club cell;alveolar macrophage;lung macrophage;Hofbauer cell;plasmacytoid dendritic cell, human;lung secretory cell",
CTSH,,,,no,5.948,6.342,68120,74106,0.093,ENSG00000103811,Pro-cathepsin H,Lysosome,"intrahepatic cholangiocyte;epithelial cell of lung;epithelial cell of alveolus of lung;pneumocyte;type II pneumocyte;urothelial cell;bladder urothelial cell;follicular dendritic cell;conventional dendritic cell;myeloid dendritic cell, human;mature conventional dendritic cell;lung secretory cell;bladder cell",
CTSK,,,,no,1.741,2.075,19938,24250,0.254,ENSG00000143387,Cathepsin K,Lysosome,endosteal cell;osteoclast;preosteoblast;decidual cell;connective tissue cell;fibroblast;keratocyte;reticular cell;fibroblast of mammary gland;skin fibroblast;fibroblast of breast;myofibroblast cell;stromal cell;tendon cell;adventitial cell;inflammatory cell,
CTSL,,,,no,14.526,15.423,166367,180209,0.086,ENSG00000135047,Procathepsin L,Lysosome,elicited macrophage;inflammatory macrophage;alternatively activated macrophage;lung macrophage;Hofbauer cell;extravillous trophoblast;placental villous trophoblast;syncytiotrophoblast cell;leukocyte;myeloid leukocyte;mast cell;mucosal type mast cell;myeloid cell;fibroblast;pancreatic stellate cell;fibroblast of mammary gland;fibroblast of breast,
CYBB,,,,no,3.063,4.606,35082,53819,0.588,ENSG00000165168,Cytochrome b-245 heavy chain,Cell membrane,"phagocyte;macrophage;alveolar macrophage;lung macrophage;classical monocyte;CD14-positive, CD16-negative classical monocyte;hematopoietic cell;granulocyte;immature neutrophil;leukocyte;professional antigen presenting cell;plasmacytoid dendritic cell, human;myeloid leukocyte;monocyte;non-classical monocyte;CD14-low, CD16-positive monocyte;CD14-positive monocyte;CD14-positive, CD16-positive monocyte;intermediate monocyte;myeloid cell;promonocyte;myelocyte;granulocytopoietic cell",
CYCS,,,,no,10.654,5.669,122015,66245,-0.91,ENSG00000172115,Cytochrome c,Mitochondrion intermembrane space,epithelial cell of urethra;osteoclast;fibroblast of connective tissue of nonglandular part of prostate,
CYLD,,,,no,9.366,8.867,107267,103612,-0.079,ENSG00000083799,Ubiquitin carboxyl-terminal hydrolase CYLD,Cytoplasm,"mononuclear cell;lymphocyte;T cell;CD4-positive, CD25-positive, alpha-beta regulatory T cell;memory regulatory T cell;activated CD4-positive, alpha-beta T cell, human",
DAP,,,,no,52.982,43.684,606804,510433,-0.278,ENSG00000112977,Death-associated protein 1 (DAP-1),,,
DAP3,,,,no,20.578,20.658,235678,241384,0.006,ENSG00000132676,"Small ribosomal subunit protein mS29 (28S ribosomal protein S29, mitochondrial) (MRP-S29) (S29mt) (Death-associated protein 3) (DAP-3) (Ionizing radiation resistance conferring protein)",Mitochondrion,,
DAPK1,,,,no,6.566,8.963,75205,104727,0.449,ENSG00000196730,Death-associated protein kinase 1 (DAP kinase 1),Cytoplasm;Cytoplasm,corneal endothelial cell;type I pneumocyte;kidney loop of Henle thin descending limb epithelial cell;Kupffer cell;mesothelial fibroblast,
DAXX,,,,no,4.933,4.124,56500,48183,-0.259,ENSG00000204209,Death domain-associated protein 6 (Daxx) (hDaxx) (ETS1-associated protein 1) (EAP1) (Fas death domain-associated protein),Cytoplasm,,
DDIT3,,,,no,0.975,1.594,11171,18628,0.709,ENSG00000175197,DNA damage-inducible transcript 3 protein (DDIT-3) (C/EBP zeta) (C/EBP-homologous protein) (CHOP) (C/EBP-homologous protein 10) (CHOP-10) (CCAAT/enhancer-binding protein homologous protein) (Growth arrest and DNA damage-inducible protein GADD153),Cytoplasm,epithelial cell of uterus;B cell;Mueller cell,
DIABLO,,,,no,0.593,0.418,6796,4888,-0.504,ENSG00000184047,"Diablo IAP-binding mitochondrial protein (Diablo homolog, mitochondrial) (Direct IAP-binding protein with low pI) (Second mitochondria-derived activator of caspase) (Smac)",Mitochondrion,,
DNAJA1,,,,no,18.575,14.741,212739,172245,-0.334,ENSG00000086061,DnaJ homolog subfamily A member 1 (DnaJ protein homolog 2) (HSDJ) (Heat shock 40 kDa protein 4) (Heat shock protein J2) (HSJ-2) (Human DnaJ protein 2) (hDj-2),Membrane,skeletal muscle satellite stem cell;epithelial cell of lacrimal sac;vasa recta ascending limb cell;prostate gland microvascular endothelial cell;cortical thymic epithelial cell;gut endothelial cell;skeletal muscle satellite cell;fibroblast of connective tissue of nonglandular part of prostate;tendon cell,
DPYD,,,,no,4.382,5.826,50186,68071,0.411,ENSG00000188641,Dihydropyrimidine dehydrogenase [NADP(+)] (DHPDHase) (DPD),Cytoplasm,hepatoblast;cholangiocyte;hepatocyte;periportal region hepatocyte;centrilobular region hepatocyte;Kupffer cell;immature innate lymphoid cell;oligodendrocyte;preadipocyte;brown preadipocyte;mesothelial fibroblast,
DSG2,,,,no,13.092,10.438,149943,121965,-0.327,ENSG00000046604,Desmoglein-2 (Cadherin family member 5) (HDGC),Cell membrane,intestinal crypt stem cell of small intestine;intestinal crypt stem cell of colon;intestinal tuft cell;tuft cell of colon,DESMOSOME
E2F1,,,,no,0.466,0.294,5341,3440,-0.664,ENSG00000101412,Transcription factor E2F1 (E2F-1) (PBR3) (Retinoblastoma-associated protein 1) (RBAP-1) (Retinoblastoma-binding protein 3) (RBBP-3) (pRB-binding protein E2F-1),Nucleus,,
EBP,,,,no,8.98,6.693,102849,78202,-0.424,ENSG00000147155,"3-beta-hydroxysteroid-Delta(8),Delta(7)-isomerase",Endoplasmic reticulum membrane,T-helper 17 cell;exhausted T cell;transit amplifying cell of small intestine,
EGR3,,,,no,2.771,1.199,31736,14011,-1.208,ENSG00000179388,Early growth response protein 3 (EGR-3) (Zinc finger protein pilot),Nucleus,brush cell of bronchus,
EIF2AK2,,,,no,5.806,5.972,66501,69784,0.041,ENSG00000055332,"Interferon-induced, double-stranded RNA-activated protein kinase",Cytoplasm,"activated CD4-positive, alpha-beta T cell, human;activated CD8-positive, alpha-beta T cell, human",
EIF2AK3,,,,no,19.462,14.016,222899,163771,-0.474,ENSG00000172071,Eukaryotic translation initiation factor 2-alpha kinase 3,Endoplasmic reticulum membrane,,
EIF2S1,,,,no,10.471,7.707,119922,90053,-0.442,ENSG00000134001,Eukaryotic translation initiation factor 2 subunit 1 (Eukaryotic translation initiation factor 2 subunit alpha) (eIF-2-alpha) (eIF-2A) (eIF-2alpha) (eIF2-alpha),Cytoplasm,,
EMP1,,,,no,3.046,3.081,34891,35997,0.016,ENSG00000134531,Epithelial membrane protein 1 (EMP-1) (CL-20) (Protein B4B) (Tumor-associated membrane protein),Membrane,epithelial cell of lacrimal sac;prostate gland microvascular endothelial cell;corneal epithelial cell;conjunctival epithelial cell;tendon cell,
