gene,category,rationale,single_gene_panel_note,exclude_recommended,detection_pct_0041323,detection_pct_0041326,n_cells_0041323,n_cells_0041326,log2_detection_ratio_326_over_323,gene_id,full_name,location,cell_type,cellchat_pathway
TYK2,,,,no,6.969,8.633,79812,100880,0.309,ENSG00000105397,Non-receptor tyrosine-protein kinase TYK2,,,
UNC5A,,,,no,0.135,0.042,1545,495,-1.671,ENSG00000113763,Netrin receptor UNC5A (Protein unc-5 homolog 1) (Protein unc-5 homolog A),Cell membrane,,ADGRL;UNC5;Netrin
VDAC1,,,,no,16.544,19.468,189477,227475,0.235,ENSG00000213585,Voltage-dependent anion-selective channel protein 1 (VDAC-1) (hVDAC1) (Outer mitochondrial membrane protein porin 1) (Plasmalemmal porin) (Porin 31HL) (Porin 31HM),Mitochondrion outer membrane,microfold cell of epithelium of small intestine;osteoclast;ON-bipolar cell;rod bipolar cell;OFF-bipolar cell,
VDAC2,,,,no,17.796,18.516,203812,216360,0.057,ENSG00000165637,Voltage-dependent anion-selective channel protein 2 (VDAC-2) (hVDAC2) (Outer mitochondrial membrane protein porin 2),Mitochondrion outer membrane,mast cell;mucosal type mast cell,
VPS4A,,,,no,13.959,14.121,159870,165002,0.017,ENSG00000132612,Vacuolar protein sorting-associated protein 4A,Late endosome membrane,,
WEE1,,,,no,2.58,2.299,29544,26858,-0.166,ENSG00000166483,Wee1-like protein kinase (WEE1hu),Nucleus,skeletal muscle satellite stem cell;duct epithelial cell;luminal epithelial cell of mammary gland;urothelial cell;bladder urothelial cell;epithelial cell of uterus;mammary gland epithelial cell;tongue muscle cell;skeletal muscle satellite cell;salivary gland cell;bladder cell,
XIAP,,,,no,6.598,6.754,75572,78916,0.034,ENSG00000101966,E3 ubiquitin-protein ligase XIAP,Cytoplasm,,
YWHAQ,,,,no,46.074,42.169,527680,492733,-0.128,ENSG00000134308,14-3-3 protein theta (14-3-3 protein T-cell) (14-3-3 protein tau) (Protein HS1),Cytoplasm,peripheral nervous system neuron,
YWHAZ,,,,no,38.124,34.43,436630,402308,-0.147,ENSG00000164924,14-3-3 protein zeta/delta (Protein kinase C inhibitor protein 1) (KCIP-1),Cytoplasm,,
ZBP1,,,,no,0.042,0.144,477,1685,1.792,ENSG00000124256,Z-DNA-binding protein 1 (DNA-dependent activator of IFN-regulatory factors) (DAI) (Tumor stroma and activated macrophage protein DLM-1),Cytoplasm,"mature B cell;plasmablast;activated CD4-positive, alpha-beta T cell, human;activated CD8-positive, alpha-beta T cell, human;plasma cell;IgG plasma cell;IgM plasma cell;IgA plasma cell;CD16-negative, CD56-bright natural killer cell, human",
