gene,category,rationale,single_gene_panel_note,exclude_recommended,detection_pct_0041323,detection_pct_0041326,n_cells_0041323,n_cells_0041326,log2_detection_ratio_326_over_323,gene_id,full_name,location,cell_type,cellchat_pathway
PDCD4,,,,no,67.301,62.279,770791,727708,-0.112,ENSG00000150593,Programmed cell death protein 4 (Neoplastic transformation inhibitor protein) (Nuclear antigen H731-like) (Protein 197/15a),Nucleus,corneal epithelial cell;type I pneumocyte;epithelial cell of sweat gland;conjunctival epithelial cell;group 2 innate lymphoid cell;serous cell of epithelium of trachea,
PDGFRB,,,,no,6.511,5.072,74566,59261,-0.36,ENSG00000113721,Platelet-derived growth factor receptor beta (PDGF-R-beta) (PDGFR-beta),Cell membrane,cerebral cortex endothelial cell;muscle cell;smooth muscle cell;vascular associated smooth muscle cell;bronchial smooth muscle cell;smooth muscle myoblast;connective tissue cell;fibroblast;keratocyte;hepatic stellate cell;preadipocyte;brown preadipocyte;pancreatic stellate cell;pericyte;renal interstitial pericyte;mural cell,PDGF
PDPK1,,,,no,6.841,7.32,78351,85530,0.098,ENSG00000140992,3-phosphoinositide-dependent protein kinase 1 (hPDK1),Cytoplasm;Nucleus;Cell membrane,,
PEA15,,,,no,14.08,10.672,161258,124701,-0.4,ENSG00000162734,Astrocytic phosphoprotein PEA-15 (15 kDa phosphoprotein enriched in astrocytes) (Phosphoprotein enriched in diabetes) (PED),Cytoplasm,radial glial cell;forebrain radial glial cell;OFF-bipolar cell;glycinergic neuron,
PGAM5,,,,no,5.844,4.709,66931,55023,-0.312,ENSG00000247077,"Serine/threonine-protein phosphatase PGAM5, mitochondrial",Mitochondrion outer membrane,,
PIK3CA,,,,no,6.97,6.121,79827,71518,-0.187,ENSG00000121879,"Phosphatidylinositol 4,5-bisphosphate 3-kinase catalytic subunit alpha isoform (PI3-kinase subunit alpha) (PI3K-alpha) (PI3Kalpha) (PtdIns-3-kinase subunit alpha)",,,
PIK3CB,,,,no,10.714,9.571,122705,111829,-0.163,ENSG00000051382,"Phosphatidylinositol 4,5-bisphosphate 3-kinase catalytic subunit beta isoform (PI3-kinase subunit beta) (PI3K-beta) (PI3Kbeta) (PtdIns-3-kinase subunit beta)",Cytoplasm,,
PIK3CD,,,,no,1.39,2.73,15919,31898,0.974,ENSG00000171608,"Phosphatidylinositol 4,5-bisphosphate 3-kinase catalytic subunit delta isoform (PI3-kinase subunit delta) (PI3K-delta) (PI3Kdelta) (PtdIns-3-kinase subunit delta)",Cytoplasm,,
PIK3R1,,,,no,4.493,4.853,51457,56704,0.111,ENSG00000145675,Phosphatidylinositol 3-kinase regulatory subunit alpha (PI3-kinase regulatory subunit alpha) (PI3K regulatory subunit alpha) (PtdIns-3-kinase regulatory subunit alpha) (Phosphatidylinositol 3-kinase 85 kDa regulatory subunit alpha) (PI3-kinase subunit p85-alpha) (PtdIns-3-kinase regulatory subunit p85-alpha),,epithelial cell of thymus;cortical thymic epithelial cell;alpha-beta T cell;mature alpha-beta T cell;mucosal invariant T cell;mature T cell;keratocyte,
PIK3R2,,,,no,8.295,7.973,94998,93166,-0.057,ENSG00000105647,Phosphatidylinositol 3-kinase regulatory subunit beta (PI3-kinase regulatory subunit beta) (PI3K regulatory subunit beta) (PtdIns-3-kinase regulatory subunit beta) (Phosphatidylinositol 3-kinase 85 kDa regulatory subunit beta) (PI3-kinase subunit p85-beta) (PtdIns-3-kinase regulatory subunit p85-beta),,,
PLA2G4A,,,,no,0.574,0.664,6575,7759,0.21,ENSG00000116711,Cytosolic phospholipase A2 (cPLA2) (Phospholipase A2 group IVA),Cytoplasm,glutamatergic neuron;kidney interstitial fibroblast;kidney interstitial cell,
PLAT,,,,no,1.625,1.605,18607,18753,-0.018,ENSG00000104368,Tissue-type plasminogen activator (t-PA) (t-plasminogen activator) (tPA),Secreted,interstitial cell of Cajal;vasa recta ascending limb cell;kidney capillary endothelial cell;glomerular capillary endothelial cell;lung microvascular endothelial cell;lung endothelial cell;fenestrated cell;glomerular endothelial cell;epithelial cell of urethra;fibroblast of connective tissue of glandular part of prostate,
PLEC,,,,no,25.446,30.531,291429,356744,0.263,ENSG00000178209,Plectin (PCN) (PLTN) (Hemidesmosomal protein 1) (HD1) (Plectin-1),Cytoplasm,,
PMAIP1,,,,no,1.459,0.36,16710,4201,-2.021,ENSG00000141682,Phorbol-12-myristate-13-acetate-induced protein 1 (PMA-induced protein 1) (Immediate-early-response protein APR) (Protein Noxa),Mitochondrion,stem cell of epidermis;epithelial cell of lacrimal sac;keratinocyte;urothelial cell;bladder urothelial cell;epithelial cell of uterus;cortical thymic epithelial cell;epidermal cell;conjunctival epithelial cell;naive regulatory T cell;bladder cell,
PPID,,,,no,5.254,4.894,60174,57187,-0.102,ENSG00000171497,Peptidyl-prolyl cis-trans isomerase D (PPIase D),Cytoplasm,,
PRF1,,,,no,0.049,0.12,560,1405,1.298,ENSG00000180644,Perforin-1 (P1) (Cytolysin) (Lymphocyte pore-forming protein) (PFP),Cytolytic granule,"hematopoietic cell;leukocyte;mononuclear cell;lymphocyte;T cell;alpha-beta T cell;mature alpha-beta T cell;CD4-positive, alpha-beta cytotoxic T cell;CD8-positive, alpha-beta T cell;CD8-positive, alpha-beta cytotoxic T cell;activated CD8-positive, alpha-beta T cell;activated CD8-positive, alpha-beta T cell, human;CD8-positive, alpha-beta cytokine secreting effector T cell;CD8-positive, alpha-beta memory T cell;effector memory CD8-positive, alpha-beta T cell, terminally differentiated;CD8-positive, alpha-beta memory T cell, CD45RO-positive;effector memory CD8-positive, alpha-beta T cell;effector CD8-positive, alpha-beta T cell;CD8-alpha-beta-positive, alpha-beta intraepithelial T cell;mature NK T cell;type I NK T cell;mucosal invariant T cell;gamma-delta T cell;mature gamma-delta T cell;CD8-alpha alpha positive, gamma-delta intraepithelial T cell;mature T cell;exhausted T cell;double negative T regulatory cell;innate lymphoid cell;natural killer cell;CD16-negative, CD56-bright natural killer cell, human;CD16-positive, CD56-dim natural killer cell, human;decidual natural killer cell, human;ILC1, human",
PRKCD,,,,no,5.091,6.43,58306,75129,0.337,ENSG00000163932,Protein kinase C delta type,Cytoplasm,,
PRKCQ,,,,no,1.611,1.576,18445,18410,-0.032,ENSG00000065675,Protein kinase C theta type,Cytoplasm;Cell membrane,,
PRNP,,,,no,10.654,8.002,122021,93501,-0.413,ENSG00000171867,Major prion protein (PrP) (ASCR) (PrP27-30) (PrP33-35C) (CD antigen CD230),Cell membrane,pancreatic D cell,ADGRG
PSEN1,,,,no,2.373,2.46,27176,28745,0.052,ENSG00000080815,Presenilin-1 (PS-1),Endoplasmic reticulum,,
PSEN2,,,,no,3.14,2.887,35966,33730,-0.122,ENSG00000143801,Presenilin-2 (PS-2),Endoplasmic reticulum membrane,,
PSMA6,,,,no,13.452,13.306,154070,155481,-0.016,ENSG00000100902,Proteasome subunit alpha type-6 (27 kDa prosomal protein) (PROS-27) (p27K) (Macropain iota chain) (Multicatalytic endopeptidase complex iota chain) (Proteasome iota chain),Cytoplasm,"professional antigen presenting cell;dendritic cell;T-helper 17 cell;activated CD4-positive, alpha-beta T cell;early lymphoid progenitor;common lymphoid progenitor",
PSMB5,,,,no,9.185,8.727,105190,101968,-0.074,ENSG00000100804,Proteasome subunit beta type-5,Cytoplasm,cortical thymic epithelial cell,
PSMC2,,,,no,6.495,6.37,74392,74434,-0.028,ENSG00000161057,26S proteasome regulatory subunit 7 (26S proteasome AAA-ATPase subunit RPT1) (Proteasome 26S subunit ATPase 2),Cytoplasm,,
PSMC5,,,,no,30.406,29.321,348236,342609,-0.052,ENSG00000087191,26S proteasome regulatory subunit 8 (26S proteasome AAA-ATPase subunit RPT6) (Proteasome 26S subunit ATPase 5) (Proteasome subunit p45) (Thyroid hormone receptor-interacting protein 1) (TRIP1) (p45/SUG),Cytoplasm,,
PSMD10,,,,no,4.371,3.157,50060,36892,-0.469,ENSG00000101843,26S proteasome non-ATPase regulatory subunit 10 (26S proteasome regulatory subunit p28) (Gankyrin) (p28(GANK)),Cytoplasm,,
PSMD2,,,,no,9.373,9.291,107351,108568,-0.013,ENSG00000175166,26S proteasome non-ATPase regulatory subunit 2 (26S proteasome regulatory subunit RPN1) (26S proteasome regulatory subunit S2) (26S proteasome subunit p97) (Protein 55.11) (Tumor necrosis factor type 1 receptor-associated protein 2),,fallopian tube secretory epithelial cell,
PSMD3,,,,no,16.487,16.171,188821,188957,-0.028,ENSG00000108344,26S proteasome non-ATPase regulatory subunit 3 (26S proteasome regulatory subunit RPN3) (26S proteasome regulatory subunit S3) (Proteasome subunit p58),,,
PSMD4,,,,no,9.985,10.427,114361,121840,0.062,ENSG00000159352,26S proteasome non-ATPase regulatory subunit 4 (26S proteasome regulatory subunit RPN10) (26S proteasome regulatory subunit S5A) (Antisecretory factor 1) (AF) (ASF) (Multiubiquitin chain-binding protein),,placental villous trophoblast,
PSME3,,,,no,14.974,12.598,171497,147200,-0.249,ENSG00000131467,Proteasome activator complex subunit 3 (11S regulator complex subunit gamma) (REG-gamma) (Activator of multicatalytic protease subunit 3) (Ki nuclear autoantigen) (Proteasome activator 28 subunit gamma) (PA28g) (PA28gamma),Nucleus,,
PTK2,,,,no,10.001,10.179,114546,118942,0.025,ENSG00000169398,Focal adhesion kinase 1 (FADK 1),Cell junction,papillary tips cell;neural progenitor cell,
PTPN13,,,,no,2.649,3.331,30334,38922,0.331,ENSG00000163629,Tyrosine-protein phosphatase non-receptor type 13,Cytoplasm,corneal epithelial cell;retinal pigment epithelial cell;neuronal receptor cell;photoreceptor cell;eye photoreceptor cell;retinal rod cell;papillary tips cell;lung secretory cell,
PYCARD,,,,no,1.739,1.942,19918,22691,0.159,ENSG00000103490,Apoptosis-associated speck-like protein containing a CARD (hASC) (Caspase recruitment domain-containing protein 5) (PYD and CARD domain-containing protein) (Target of methylation-induced silencing 1),Cytoplasm,"microfold cell of epithelium of small intestine;classical monocyte;monocyte;non-classical monocyte;CD14-low, CD16-positive monocyte;myeloid cell;promonocyte;pre-conventional dendritic cell",
PYGB,,,,no,8.83,11.012,101128,128678,0.319,ENSG00000100994,"Glycogen phosphorylase, brain form",,pulmonary ionocyte;epithelial cell of sweat gland;ionocyte,
PYGL,,,,no,2.178,2.499,24942,29197,0.198,ENSG00000100504,"Glycogen phosphorylase, liver form",Cytoplasm,Hofbauer cell;blood cell;granulocyte;neutrophil;immature neutrophil;myelocyte;granulocytopoietic cell;Mueller cell,
PYGM,,,,no,0.096,0.102,1100,1192,0.087,ENSG00000068976,"Glycogen phosphorylase, muscle form",,slow muscle cell;fast muscle cell,
RAF1,,,,no,15.389,15.043,176249,175777,-0.033,ENSG00000132155,RAF proto-oncogene serine/threonine-protein kinase,Cytoplasm;Cell membrane;Mitochondrion;Nucleus,,
RARA,,,,no,5.861,6.088,67123,71138,0.055,ENSG00000131759,Retinoic acid receptor alpha (RAR-alpha) (Nuclear receptor subfamily 1 group B member 1),Nucleus,,RA
RBCK1,,,,no,6.5,7.581,74446,88578,0.222,ENSG00000125826,RanBP-type and C3HC4-type zinc finger-containing protein 1,,,
RELA,,,,no,10.299,10.655,117951,124503,0.049,ENSG00000173039,Transcription factor p65 (Nuclear factor NF-kappa-B p65 subunit) (Nuclear factor of kappa light polypeptide gene enhancer in B-cells 3),Nucleus,,
REXO2,,,,no,4.903,4.871,56149,56915,-0.009,ENSG00000076043,"Oligoribonuclease, mitochondrial",Mitochondrion intermembrane space,pancreatic D cell;pre-B-I cell;proerythroblast,
RIPK1,,,,no,5.558,5.625,63661,65728,0.017,ENSG00000137275,Receptor-interacting serine/threonine-protein kinase 1,Cytoplasm,,
RIPK3,,,,no,0.709,1.079,8116,12611,0.607,ENSG00000129465,Receptor-interacting serine/threonine-protein kinase 3,Cytoplasm,,
RNASEL,,,,no,0.637,1.073,7295,12533,0.752,ENSG00000135828,2-5A-dependent ribonuclease (2-5A-dependent RNase),Cytoplasm,,
RNF31,,,,no,3.067,4.003,35128,46779,0.384,ENSG00000092098,E3 ubiquitin-protein ligase RNF31,Cytoplasm,,
ROCK1,,,,no,8.709,8.698,99743,101636,-0.002,ENSG00000067900,Rho-associated protein kinase 1,Cytoplasm,,
SAT2,,,,no,16.266,20.15,186294,235451,0.309,ENSG00000141504,Thialysine N-epsilon-acetyltransferase,Cytoplasm,granulosa cell,
SATB1,,,,no,8.1,7.843,92770,91644,-0.047,ENSG00000182568,DNA-binding protein SATB1 (Special AT-rich sequence-binding protein 1),Nucleus matrix,"liver dendritic cell;T cell;immature alpha-beta T cell;double-positive, alpha-beta thymocyte;CD8-alpha-alpha-positive, alpha-beta intraepithelial T cell;intraepithelial lymphocyte;immature T cell;thymocyte;early T lineage precursor;common lymphoid progenitor",
SHARPIN,,,,no,2.163,2.572,24778,30049,0.249,ENSG00000179526,Sharpin (Shank-associated RH domain-interacting protein) (Shank-interacting protein-like 1) (hSIPL1),Cytoplasm,,
SLC11A2,,,,no,11.118,12.882,127330,150525,0.213,ENSG00000110911,Natural resistance-associated macrophage protein 2 (NRAMP 2) (Divalent cation transporter 1) (Divalent metal transporter 1) (DMT-1) (Solute carrier family 11 member 2),Cell membrane,,
SLC25A31,,,,no,0.112,0.019,1286,222,-2.563,ENSG00000151475,"ADP/ATP translocase 4 (ADP,ATP carrier protein 4) (Adenine nucleotide translocator 4) (ANT 4) (Solute carrier family 25 member 31) (Sperm flagellar energy carrier protein)",Mitochondrion inner membrane,,
SLC25A4,,,,no,7.178,4.688,82209,54781,-0.615,ENSG00000151729,"ADP/ATP translocase 1 (ADP,ATP carrier protein 1) (ADP,ATP carrier protein, heart/skeletal muscle isoform T1) (Adenine nucleotide translocator 1) (ANT 1) (Solute carrier family 25 member 4)",Mitochondrion inner membrane,cardiac muscle cell;slow muscle cell;fast muscle cell,
SLC39A8,,,,no,17.459,13.836,199955,161667,-0.336,ENSG00000138821,Metal cation symporter ZIP8 (BCG-induced integral membrane protein in monocyte clone 103 protein) (LIV-1 subfamily of ZIP zinc transporter 6) (LZT-Hs6) (Solute carrier family 39 member 8) (Zrt- and Irt-like protein 8) (ZIP-8),Cell membrane,epithelial cell of lung;epithelial cell of alveolus of lung;pneumocyte;type I pneumocyte;type II pneumocyte;acinar cell of salivary gland;mesothelial fibroblast;lung secretory cell,
SLC3A2,,,,no,7.377,10.392,84484,121429,0.494,ENSG00000168003,Amino acid transporter heavy chain SLC3A2 (4F2 cell-surface antigen heavy chain) (4F2hc) (4F2 heavy chain antigen) (Lymphocyte activation antigen 4F2 large subunit) (Solute carrier family 3 member 2) (CD antigen CD98),Apical cell membrane,myoepithelial cell;myoepithelial cell of mammary gland;pancreatic A cell;cerebral cortex endothelial cell;mammary gland epithelial cell;fibroblast of mammary gland,
SLC40A1,,,,no,21.916,21.592,251007,252292,-0.022,ENSG00000138449,Solute carrier family 40 member 1 (Ferroportin-1) (Iron-regulated transporter 1),Cell membrane,"placental villous trophoblast;syncytiotrophoblast cell;erythroid progenitor cell, mammalian;connective tissue cell;fibroblast;pulmonary interstitial fibroblast;fibroblast of lung;bronchus fibroblast of lung",
SLC7A11,,,,no,0.304,0.323,3477,3775,0.09,ENSG00000151012,Cystine/glutamate transporter (Amino acid transport system xc-) (Calcium channel blocker resistance protein CCBR1) (Solute carrier family 7 member 11) (xCT),Cell membrane,myoepithelial cell;myoepithelial cell of mammary gland,
SMAD7,,,,no,3.089,3.936,35374,45995,0.35,ENSG00000101665,Mothers against decapentaplegic homolog 7 (MAD homolog 7) (Mothers against DPP homolog 7) (Mothers against decapentaplegic homolog 8) (MAD homolog 8) (Mothers against DPP homolog 8) (SMAD family member 7) (SMAD 7) (Smad7) (hSMAD7),Nucleus,,
SMPD1,,,,no,4.273,5.158,48939,60273,0.272,ENSG00000166311,Sphingomyelin phosphodiesterase,Lysosome,PP cell;endocrine cell,
SOD1,,,,no,19.873,17.571,227600,205312,-0.178,ENSG00000142168,Superoxide dismutase [Cu-Zn],Cytoplasm,,
SPTA1,,,,no,0.036,0.013,416,152,-1.481,ENSG00000163554,"Spectrin alpha chain, erythrocytic 1 (Erythroid alpha-spectrin)",Cytoplasm,blood cell;erythrocyte;enucleate erythrocyte;erythroid lineage cell;reticulocyte;enucleated reticulocyte;erythroblast;primitive red blood cell,
SQSTM1,,,,no,15.086,15.277,172778,178511,0.018,ENSG00000161011,Sequestosome-1 (EBI3-associated protein of 60 kDa) (EBIAP) (p60) (Phosphotyrosine-independent ligand for the Lck SH2 domain of 62 kDa) (Ubiquitin-binding protein p62),Cytoplasm,intestinal crypt stem cell of large intestine;pancreatic PP cell;PP cell;epithelial cell of urethra;mature conventional dendritic cell,
STAT1,,,,no,11.297,15.53,129387,181465,0.459,ENSG00000115415,Signal transducer and activator of transcription 1-alpha/beta (Transcription factor ISGF-3 components p91/p84),Cytoplasm,"pancreatic A cell;lens fiber cell;secondary lens fiber;intermediate monocyte;T cell;activated CD4-positive, alpha-beta T cell;activated CD4-positive, alpha-beta T cell, human",
STAT2,,,,no,4.249,6.034,48659,70510,0.506,ENSG00000170581,Signal transducer and activator of transcription 2 (p113),Cytoplasm,,
STAT3,,,,no,24.177,23.625,276903,276050,-0.033,ENSG00000168610,Signal transducer and activator of transcription 3 (Acute-phase response factor),Cytoplasm,,
STAT4,,,,no,0.588,0.813,6739,9502,0.467,ENSG00000138378,Signal transducer and activator of transcription 4,Cytoplasm;Nucleus,"T-helper 1 cell;activated CD8-positive, alpha-beta T cell",
STAT5A,,,,no,3.094,4.484,35439,52395,0.535,ENSG00000126561,Signal transducer and activator of transcription 5A,Cytoplasm,"megakaryocyte-erythroid progenitor cell;erythroid progenitor cell, mammalian;myeloid lineage restricted progenitor cell;common myeloid progenitor;subcutaneous fat cell",
STAT5B,,,,no,3.789,3.777,43391,44139,-0.004,ENSG00000173757,Signal transducer and activator of transcription 5B,Cytoplasm,,
STAT6,,,,no,14.104,17.573,161529,205341,0.317,ENSG00000166888,Signal transducer and activator of transcription 6 (IL-4 Stat),Cytoplasm;Nucleus,,
TAP1,,,,no,4.706,5.339,53892,62390,0.182,ENSG00000168394,Antigen peptide transporter 1 (APT1),Endoplasmic reticulum membrane,"leukocyte;CD141-positive myeloid dendritic cell;myeloid dendritic cell, human;plasmablast;mononuclear cell;alpha-beta T cell;mature alpha-beta T cell;T-helper 17 cell;activated CD4-positive, alpha-beta T cell;activated CD8-positive, alpha-beta T cell;mucosal invariant T cell;mature T cell;exhausted T cell;pre-conventional dendritic cell",
TFRC,,,,no,6.869,4.179,78671,48832,-0.717,ENSG00000072274,Transferrin receptor protein 1 (TR) (TfR) (TfR1) (Trfr) (T9) (p90) (CD antigen CD71),Cell membrane,inflammatory macrophage;alveolar macrophage;lung macrophage;erythrocyte;enucleate erythrocyte;immature innate lymphoid cell;myeloid cell;erythroid lineage cell;proerythroblast;erythroblast;primitive red blood cell;transit amplifying cell of small intestine,
TGFB2,,,,no,2.892,3.27,33127,38214,0.177,ENSG00000092969,Transforming growth factor beta-2 proprotein (Cetermin) (Glioblastoma-derived T-cell suppressor factor) (G-TSF),Secreted,type I pneumocyte,TGFb
TGFBR3,,,,no,9.845,11.175,112756,130572,0.183,ENSG00000069702,Transforming growth factor beta receptor type 3 (TGF-beta receptor type 3) (TGFR-3) (Betaglycan) (Transforming growth factor beta receptor III) (TGF-beta receptor type III),Cell membrane,corneal endothelial cell;podocyte;muscle cell;smooth muscle cell;skeletal muscle fibroblast;preadipocyte;brown preadipocyte;fat cell;white fat cell;brown fat cell;adipocyte of breast,
TICAM1,,,,no,2.159,2.533,24723,29600,0.231,ENSG00000127666,"TIR domain-containing adapter molecule 1 (TICAM-1) (Proline-rich, vinculin and TIR domain-containing protein B) (Putative NF-kappa-B-activating protein 502H) (Toll-interleukin-1 receptor domain-containing adapter protein inducing interferon beta) (MyD88-3) (TIR domain-containing adapter protein inducing IFN-beta)",Cytoplasmic vesicle,,
TICAM2,,,,no,1.386,1.558,15869,18209,0.17,ENSG00000243414,TIR domain-containing adapter molecule 2 (TICAM-2) (Putative NF-kappa-B-activating protein 502) (TRIF-related adapter molecule) (Toll-like receptor adaptor protein 3) (Toll/interleukin-1 receptor domain-containing protein) (MyD88-4),Endoplasmic reticulum;Early endosome membrane;Late endosome membrane,,
TIMP2,,,,no,16.32,11.934,186913,139447,-0.452,ENSG00000035862,Metalloproteinase inhibitor 2 (CSC-21K) (Tissue inhibitor of metalloproteinases 2) (TIMP-2),Secreted,mesenchymal stem cell;endosteal cell;surface ectodermal cell;trophoblast giant cell;connective tissue cell;fibroblast;keratocyte;reticular cell;skin fibroblast;tendon cell;adventitial cell,
TJP1,,,,no,17.674,17.38,202414,203083,-0.024,ENSG00000104067,Tight junction protein ZO-1 (Tight junction protein 1) (Zona occludens protein 1) (Zonula occludens protein 1),Cell membrane,epithelial cell;corneal endothelial cell;lung endothelial cell;endothelial cell;endothelial cell of vascular tree;podocyte,
TJP2,,,,no,14.437,15.018,165345,175479,0.057,ENSG00000119139,Tight junction protein ZO-2 (Tight junction protein 2) (Zona occludens protein 2) (Zonula occludens protein 2),Cell junction,taste receptor cell;bipolar neuron;retinal bipolar neuron;neuronal receptor cell;photoreceptor cell;eye photoreceptor cell;retinal rod cell;mesothelial fibroblast,
TLR3,,,,no,2.802,2.782,32086,32510,-0.01,ENSG00000164342,Toll-like receptor 3 (CD antigen CD283),Endoplasmic reticulum membrane,,
TLR4,,,,no,1.988,1.885,22772,22030,-0.077,ENSG00000136869,Toll-like receptor 4 (hToll) (CD antigen CD284),Cell membrane,,RESISTIN;ANGPTL
TNF,,,,no,0.21,0.071,2409,827,-1.571,ENSG00000232810,Tumor necrosis factor (Cachectin) (TNF-alpha) (Tumor necrosis factor ligand superfamily member 2) (TNF-a),Cell membrane,"T cell;CD4-positive helper T cell;T-helper 1 cell;T-helper 17 cell;activated CD4-positive, alpha-beta T cell;activated CD8-positive, alpha-beta T cell;mucosal invariant T cell;group 3 innate lymphoid cell;CD34-positive, CD56-positive, CD117-positive common innate lymphoid precursor, human",TNF
TNFRSF10A,,,,no,1.418,1.189,16245,13898,-0.254,ENSG00000104689,Tumor necrosis factor receptor superfamily member 10A (Death receptor 4) (TNF-related apoptosis-inducing ligand receptor 1) (TRAIL receptor 1) (TRAIL-R1) (CD antigen CD261),Cell membrane,,
TNFRSF10B,,,,no,8.196,8.887,93867,103842,0.117,ENSG00000120889,Tumor necrosis factor receptor superfamily member 10B (Death receptor 5) (TNF-related apoptosis-inducing ligand receptor 2) (TRAIL receptor 2) (TRAIL-R2) (CD antigen CD262),Membrane,,TRAIL
TNFRSF12A,,,,no,10.928,7.394,125158,86399,-0.564,ENSG00000006327,Tumor necrosis factor receptor superfamily member 12A (Fibroblast growth factor-inducible immediate-early response protein 14) (FGF-inducible 14) (Tweak-receptor) (TweakR) (CD antigen CD266),Membrane,duct epithelial cell;pancreatic ductal cell;luminal epithelial cell of mammary gland;mesothelial cell of pleura;pancreatic D cell;epithelial cell of prostate;basal cell of prostate epithelium;mammary gland epithelial cell;epithelial cell of urethra;fibroblast of connective tissue of glandular part of prostate,TWEAK
TNFRSF1A,,,,no,6.2,5.286,71006,61761,-0.23,ENSG00000067182,Tumor necrosis factor receptor superfamily member 1A (Tumor necrosis factor receptor 1) (TNF-R1) (Tumor necrosis factor receptor type I) (TNF-RI) (TNFR-I) (p55) (p60) (CD antigen CD120a),Cell membrane,mesothelial cell of pleura;follicular dendritic cell,TNF;LT
TNFSF10,,,,no,3.339,5.115,38244,59772,0.615,ENSG00000121858,Tumor necrosis factor ligand superfamily member 10 (Apo-2 ligand) (Apo-2L) (TNF-related apoptosis-inducing ligand) (Protein TRAIL) (CD antigen CD253),Cell membrane,epithelial cell;glomerular capillary endothelial cell;lung endothelial cell;goblet cell;respiratory goblet cell;bronchial goblet cell;tracheal goblet cell;club cell;endothelial cell;endothelial cell of vascular tree;mast cell,TRAIL
TOP2A,,,,no,0.538,0.346,6160,4040,-0.637,ENSG00000131747,DNA topoisomerase 2-alpha,Cytoplasm,"immature alpha-beta T cell;double-positive, alpha-beta thymocyte;DN4 thymocyte;precursor B cell;large pre-B-II cell;promonocyte;erythroid lineage cell;pro-B cell;fraction A pre-pro B cell;salivary gland cell",
TP53,,,,no,9.256,9.212,106013,107635,-0.007,ENSG00000141510,Cellular tumor antigen p53 (Antigen NY-CO-13) (Phosphoprotein p53) (Tumor suppressor p53),Cytoplasm,,
TP53BP2,,,,no,10.406,9.408,119185,109926,-0.146,ENSG00000143514,Apoptosis-stimulating of p53 protein 2 (Bcl2-binding protein) (Bbp) (Renal carcinoma antigen NY-REN-51) (Tumor suppressor p53-binding protein 2) (53BP2) (p53-binding protein 2) (p53BP2),Cytoplasm,type II pneumocyte,
TP63,,,,no,0.041,0.021,465,248,-0.936,ENSG00000073282,Tumor protein 63 (p63) (Chronic ulcerative stomatitis protein) (CUSP) (Keratinocyte transcription factor KET) (Transformation-related protein 63) (TP63) (Tumor protein p73-like) (p73L) (p40) (p51),Nucleus,stem cell;basal cell;basal cell of epidermis;respiratory basal cell;stem cell of epidermis;basal epithelial cell of prostatic duct;bladder urothelial cell;basal epithelial cell of tracheobronchial tree;skeletal muscle fiber;fast muscle cell;cell of skeletal muscle;papillary tips cell,
TP73,,,,no,0.036,0.038,414,440,0.059,ENSG00000078900,Tumor protein p73 (p53-like transcription factor) (p53-related protein),Nucleus,,
TRAF1,,,,no,0.511,0.642,5854,7502,0.329,ENSG00000056558,TNF receptor-associated factor 1 (Epstein-Barr virus-induced protein 6),,"Langerhans cell;activated CD4-positive, alpha-beta T cell;activated CD8-positive, alpha-beta T cell",
TRAF2,,,,no,2.616,3.665,29966,42824,0.486,ENSG00000127191,TNF receptor-associated factor 2,Cytoplasm,,
TRAF5,,,,no,9.93,10.29,113726,120236,0.051,ENSG00000082512,TNF receptor-associated factor 5 (RING finger protein 84),Cytoplasm,,
TRPM7,,,,no,9.065,8.254,103826,96445,-0.135,ENSG00000092439,Transient receptor potential cation channel subfamily M member 7,Membrane,kidney distal convoluted tubule epithelial cell;retinal pigment epithelial cell;ciliary muscle cell,
TSPO,,,,no,0.322,0.195,3687,2277,-0.724,ENSG00000100300,Translocator protein (Mitochondrial benzodiazepine receptor) (PKBS) (Peripheral-type benzodiazepine receptor) (PBR),Mitochondrion membrane,"stratified epithelial cell;classical monocyte;CD14-positive, CD16-negative classical monocyte;hematopoietic cell;blood cell;granulocyte;immature neutrophil;leukocyte;myeloid leukocyte;monocyte;CD14-positive monocyte;myeloid cell;promonocyte;myelocyte;granulocytopoietic cell",
TUBA4A,,,,no,1.86,2.028,21302,23695,0.125,ENSG00000127824,Tubulin alpha-4A chain,Cytoplasm,pancreatic D cell;platelet;T-helper 17 cell;megakaryocyte;erythroid lineage cell,
