gene,category,rationale,single_gene_panel_note,exclude_recommended,detection_pct_0041323,detection_pct_0041326,n_cells_0041323,n_cells_0041326,log2_detection_ratio_326_over_323,gene_id,full_name,location,cell_type,cellchat_pathway
PRF1,,,,no,0.049,0.12,560,1405,1.298,ENSG00000180644,Perforin-1 (P1) (Cytolysin) (Lymphocyte pore-forming protein) (PFP),Cytolytic granule,"hematopoietic cell;leukocyte;mononuclear cell;lymphocyte;T cell;alpha-beta T cell;mature alpha-beta T cell;CD4-positive, alpha-beta cytotoxic T cell;CD8-positive, alpha-beta T cell;CD8-positive, alpha-beta cytotoxic T cell;activated CD8-positive, alpha-beta T cell;activated CD8-positive, alpha-beta T cell, human;CD8-positive, alpha-beta cytokine secreting effector T cell;CD8-positive, alpha-beta memory T cell;effector memory CD8-positive, alpha-beta T cell, terminally differentiated;CD8-positive, alpha-beta memory T cell, CD45RO-positive;effector memory CD8-positive, alpha-beta T cell;effector CD8-positive, alpha-beta T cell;CD8-alpha-beta-positive, alpha-beta intraepithelial T cell;mature NK T cell;type I NK T cell;mucosal invariant T cell;gamma-delta T cell;mature gamma-delta T cell;CD8-alpha alpha positive, gamma-delta intraepithelial T cell;mature T cell;exhausted T cell;double negative T regulatory cell;innate lymphoid cell;natural killer cell;CD16-negative, CD56-bright natural killer cell, human;CD16-positive, CD56-dim natural killer cell, human;decidual natural killer cell, human;ILC1, human",
PRKAA1,,,,no,8.061,7.554,92325,88264,-0.094,ENSG00000132356,5'-AMP-activated protein kinase catalytic subunit alpha-1 (AMPK subunit alpha-1),Cytoplasm,,
PRKAA2,,,,no,2.068,1.699,23685,19858,-0.283,ENSG00000162409,5'-AMP-activated protein kinase catalytic subunit alpha-2 (AMPK subunit alpha-2),Cytoplasm,renal beta-intercalated cell,
PRKAB1,,,,no,3.934,4.127,45057,48224,0.069,ENSG00000111725,5'-AMP-activated protein kinase subunit beta-1 (AMPK subunit beta-1) (AMPKb),,enteroendocrine cell of colon;lung secretory cell,
PRKACA,,,,no,13.316,14.222,152507,166178,0.095,ENSG00000072062,cAMP-dependent protein kinase catalytic subunit alpha (PKA C-alpha),Cytoplasm,,
PRKACB,,,,no,5.254,5.917,60170,69137,0.172,ENSG00000142875,cAMP-dependent protein kinase catalytic subunit beta (PKA C-beta),Cytoplasm,,
PRKAG1,,,,no,7.179,6.306,82220,73684,-0.187,ENSG00000181929,5'-AMP-activated protein kinase subunit gamma-1 (AMPK gamma1) (AMPK subunit gamma-1) (AMPKg),,,
PRKAG2,,,,no,2.524,2.493,28910,29126,-0.018,ENSG00000106617,5'-AMP-activated protein kinase subunit gamma-2 (AMPK gamma2) (AMPK subunit gamma-2) (H91620p),,regular atrial cardiac myocyte,
PRKAR1A,,,,no,21.727,20.477,248837,239269,-0.085,ENSG00000108946,cAMP-dependent protein kinase type I-alpha regulatory subunit (Tissue-specific extinguisher 1) (TSE1),Cell membrane,ciliated columnar cell of tracheobronchial tree;ciliated cell of the bronchus;endothelial tip cell;granulosa cell;ovarian surface epithelial cell;Leydig cell,
PRKCA,,,,no,2.789,3.645,31945,42590,0.386,ENSG00000154229,Protein kinase C alpha type (PKC-A) (PKC-alpha),Cytoplasm,endothelial cell of hepatic sinusoid;endothelial cell of pericentral hepatic sinusoid;Bergmann glial cell;Schwann cell;neuron;kidney interstitial fibroblast,
PRKCB,,,,no,0.4,0.534,4584,6243,0.417,ENSG00000166501,Protein kinase C beta type (PKC-B) (PKC-beta),Cytoplasm,IgG memory B cell;IgG-negative class switched memory B cell;amacrine cell;stellate neuron,
PRKCD,,,,no,5.091,6.43,58306,75129,0.337,ENSG00000163932,Protein kinase C delta type,Cytoplasm,,
PRKCE,,,,no,1.225,1.263,14032,14757,0.044,ENSG00000171132,Protein kinase C epsilon type,Cytoplasm,renal beta-intercalated cell,
PRKCG,,,,no,0.083,0.065,952,759,-0.356,ENSG00000126583,Protein kinase C gamma type (PKC-gamma),Cytoplasm,,
PRKCI,,,,no,5.332,5.185,61066,60585,-0.04,ENSG00000163558,Protein kinase C iota type,Cytoplasm,fallopian tube secretory epithelial cell,
PRKCQ,,,,no,1.611,1.576,18445,18410,-0.032,ENSG00000065675,Protein kinase C theta type,Cytoplasm;Cell membrane,,
PRKCZ,,,,no,3.072,4.046,35180,47272,0.397,ENSG00000067606,Protein kinase C zeta type,Cytoplasm,type I pneumocyte;syncytiotrophoblast cell,
PTEN,,,,no,21.121,18.505,241901,216228,-0.191,ENSG00000171862,"Phosphatidylinositol 3,4,5-trisphosphate 3-phosphatase and dual-specificity protein phosphatase PTEN",Cytoplasm,melanocyte;melanocyte of skin;kidney interstitial fibroblast;subcutaneous fat cell;epicardial adipocyte,
PTPA,,,,no,7.595,8.41,86984,98271,0.147,ENSG00000119383,Serine/threonine-protein phosphatase 2A activator,Cytoplasm,,
PTPN1,,,,no,6.782,6.906,77670,80696,0.026,ENSG00000196396,Tyrosine-protein phosphatase non-receptor type 1,Endoplasmic reticulum membrane,type I pneumocyte;elicited macrophage;inflammatory macrophage,
PTPN11,,,,no,21.057,16.009,241160,187059,-0.395,ENSG00000179295,Tyrosine-protein phosphatase non-receptor type 11,Cytoplasm,,
PTPRF,,,,no,15.905,17.873,182158,208836,0.168,ENSG00000142949,Receptor-type tyrosine-protein phosphatase F,Membrane,epithelial cell of alveolus of lung;pneumocyte;type I pneumocyte;fallopian tube secretory epithelial cell,NGL;PTPR
PYGB,,,,no,8.83,11.012,101128,128678,0.319,ENSG00000100994,"Glycogen phosphorylase, brain form",,pulmonary ionocyte;epithelial cell of sweat gland;ionocyte,
PYGL,,,,no,2.178,2.499,24942,29197,0.198,ENSG00000100504,"Glycogen phosphorylase, liver form",Cytoplasm,Hofbauer cell;blood cell;granulocyte;neutrophil;immature neutrophil;myelocyte;granulocytopoietic cell;Mueller cell,
PYGM,,,,no,0.096,0.102,1100,1192,0.087,ENSG00000068976,"Glycogen phosphorylase, muscle form",,slow muscle cell;fast muscle cell,
RAC1,,,,no,48.985,45.143,561018,527479,-0.118,ENSG00000136238,Ras-related C3 botulinum toxin substrate 1,Cell membrane,endothelial cell of umbilical vein;epithelial cell of urethra,
RAF1,,,,no,15.389,15.043,176249,175777,-0.033,ENSG00000132155,RAF proto-oncogene serine/threonine-protein kinase,Cytoplasm;Cell membrane;Mitochondrion;Nucleus,,
RELA,,,,no,10.299,10.655,117951,124503,0.049,ENSG00000173039,Transcription factor p65 (Nuclear factor NF-kappa-B p65 subunit) (Nuclear factor of kappa light polypeptide gene enhancer in B-cells 3),Nucleus,,
RHEB,,,,no,1.068,0.646,12232,7544,-0.726,ENSG00000106615,GTP-binding protein Rheb (Ras homolog enriched in brain),Endomembrane system,,
RPTOR,,,,no,2.551,3.812,29214,44542,0.58,ENSG00000141564,Regulatory-associated protein of mTOR (Raptor) (p150 target of rapamycin (TOR)-scaffold protein),Lysosome membrane,,
SCGN,,,,no,3.116,3.419,35692,39952,0.134,ENSG00000079689,Secretagogin,Cytoplasm;Secreted,neuroendocrine cell;type EC enteroendocrine cell;lung neuroendocrine cell;pancreatic endocrine cell;type B pancreatic cell;pancreatic A cell;pancreatic D cell;pancreatic PP cell;pancreatic epsilon cell;glandular epithelial cell;enteroendocrine cell;PP cell;type L enteroendocrine cell;intestinal enteroendocrine cell;enteroendocrine cell of small intestine;enteroendocrine cell of colon;endocrine cell;cortical interneuron;cerebral cortex GABAergic interneuron,
SELE,,,,no,0.198,0.046,2268,535,-2.113,ENSG00000007908,E-selectin (CD62 antigen-like family member E) (Endothelial leukocyte adhesion molecule 1) (ELAM-1) (Leukocyte-endothelial cell adhesion molecule 2) (LECAM2) (CD antigen CD62E),Cell membrane,epithelial cell;squamous epithelial cell;blood vessel endothelial cell;vein endothelial cell;vasa recta ascending limb cell;retinal blood vessel endothelial cell;kidney capillary endothelial cell;prostate gland microvascular endothelial cell;endothelial cell;gut endothelial cell;endothelial cell of vascular tree;endothelial cell of uterus,CEACAM;SELE;SELPLG
SERPINE1,,,,no,3.762,1.954,43082,22829,-0.945,ENSG00000106366,Plasminogen activator inhibitor 1 (PAI) (PAI-1) (Endothelial plasminogen activator inhibitor) (Serpin E1),Secreted,squamous epithelial cell;blood vessel endothelial cell;vein endothelial cell;endothelial cell of umbilical vein;prostate gland microvascular endothelial cell;endothelial cell;endothelial cell of vascular tree;myometrial cell;connective tissue cell;fibroblast;fibroblast of lung;fibroblast of mammary gland;fibroblast of connective tissue of nonglandular part of prostate;fibroblast of connective tissue of glandular part of prostate;fibroblast of breast;mesothelial fibroblast,
SH2B2,,,,no,0.488,0.693,5586,8093,0.506,ENSG00000160999,SH2B adapter protein 2 (Adapter protein with pleckstrin homology and Src homology 2 domains) (SH2 and PH domain-containing adapter protein APS),Cytoplasm,germinal center B cell,
SHC1,,,,no,13.155,12.942,150659,151223,-0.024,ENSG00000160691,SHC-transforming protein 1 (SHC-transforming protein 3) (SHC-transforming protein A) (Src homology 2 domain-containing-transforming protein C1) (SH2 domain protein C1),Cytoplasm;Cell junction,endothelial tip cell;endothelial cell of lymphatic vessel;surface ectodermal cell,
SHC4,,,,no,0.065,0.018,739,208,-1.858,ENSG00000185634,SHC-transforming protein 4 (Rai-like protein) (RaLP) (SHC-transforming protein D) (hShcD) (Src homology 2 domain-containing-transforming protein C4) (SH2 domain protein C4),Postsynaptic cell membrane,Schwann cell,
SLC2A1,,,,no,1.168,1.595,13374,18635,0.45,ENSG00000117394,"Solute carrier family 2, facilitated glucose transporter member 1 (Glucose transporter type 1, erythrocyte/brain) (GLUT-1) (HepG2 glucose transporter)",Cell membrane,cerebral cortex endothelial cell;trophoblast giant cell;extravillous trophoblast;placental villous trophoblast;syncytiotrophoblast cell;erythrocyte;enucleate erythrocyte;erythroid lineage cell;reticulocyte;Mueller cell;fibroblast,
SLC2A2,,,,no,0.395,0.746,4529,8716,0.916,ENSG00000163581,"Solute carrier family 2, facilitated glucose transporter member 2 (Glucose transporter type 2, liver) (GLUT-2)",Cell membrane,hepatoblast;cholangiocyte,
SLC2A4,,,,no,0.103,0.065,1174,760,-0.656,ENSG00000181856,"Solute carrier family 2, facilitated glucose transporter member 4 (Glucose transporter type 4, insulin-responsive) (GLUT-4)",Cell membrane,,
SMAD2,,,,no,13.153,12.16,150638,142090,-0.113,ENSG00000175387,Mothers against decapentaplegic homolog 2 (MAD homolog 2) (Mothers against DPP homolog 2) (JV18-1) (Mad-related protein 2) (hMAD-2) (SMAD family member 2) (SMAD 2) (Smad2) (hSMAD2),Cytoplasm,non-pigmented ciliary epithelial cell,
SMAD3,,,,no,8.116,8.999,92953,105149,0.149,ENSG00000166949,Mothers against decapentaplegic homolog 3 (MAD homolog 3) (Mad3) (Mothers against DPP homolog 3) (hMAD-3) (JV15-2) (SMAD family member 3) (SMAD 3) (Smad3) (hSMAD3),Cytoplasm,corneal epithelial cell;papillary tips cell,
SMAD4,,,,no,15.054,15.207,172407,177694,0.015,ENSG00000141646,Mothers against decapentaplegic homolog 4 (MAD homolog 4) (Mothers against DPP homolog 4) (Deletion target in pancreatic carcinoma 4) (SMAD family member 4) (SMAD 4) (Smad4) (hSMAD4),Cytoplasm,,
SNAP25,,,,no,1.262,0.642,14451,7503,-0.975,ENSG00000132639,Synaptosomal-associated protein 25 (SNAP-25) (Super protein) (SUP) (Synaptosomal-associated 25 kDa protein),Cytoplasm,neural cell;neuron;interneuron;bipolar neuron;retinal bipolar neuron;ON-bipolar cell;rod bipolar cell;OFF-bipolar cell;amacrine cell;cerebellar granule cell;Cajal-Retzius cell;retinal ganglion cell;retinal cone cell;glycinergic neuron,
SOCS1,,,,no,0.963,0.642,11029,7496,-0.586,ENSG00000185338,Suppressor of cytokine signaling 1 (SOCS-1) (JAK-binding protein) (JAB) (STAT-induced STAT inhibitor 1) (SSI-1) (Tec-interacting protein 3) (TIP-3),Nucleus,"intestinal crypt stem cell of large intestine;epithelial cell of thymus;basophil;mast cell;mucosal type mast cell;T cell;effector CD4-positive, alpha-beta T cell;DN3 thymocyte;decidual natural killer cell, human;group 2 innate lymphoid cell;DN1 thymic pro-T cell",
SOCS2,,,,no,3.725,2.563,42661,29950,-0.539,ENSG00000120833,Suppressor of cytokine signaling 2 (SOCS-2) (Cytokine-inducible SH2 protein 2) (CIS-2) (STAT-induced STAT inhibitor 2) (SSI-2),,"hematopoietic stem cell;CD34-positive, CD38-negative hematopoietic stem cell;late pro-B cell;hematopoietic multipotent progenitor cell;early lymphoid progenitor;lymphoid lineage restricted progenitor cell;pro-B cell;fraction A pre-pro B cell",
SOCS3,,,,no,18.79,7.464,215199,87219,-1.332,ENSG00000184557,Suppressor of cytokine signaling 3 (SOCS-3) (Cytokine-inducible SH2 protein 3) (CIS-3) (STAT-induced STAT inhibitor 3) (SSI-3),,mesenchymal stem cell;vasa recta ascending limb cell;vasa recta descending limb cell;retinal blood vessel endothelial cell;lung microvascular endothelial cell;prostate gland microvascular endothelial cell;lung endothelial cell;gut endothelial cell;endothelial cell of uterus;tongue muscle cell;decidual cell;myofibroblast cell;tendon cell,
SOS1,,,,no,4.977,5.046,56997,58960,0.02,ENSG00000115904,Son of sevenless homolog 1 (SOS-1),,mesothelial fibroblast;fat cell;white fat cell;brown fat cell;adipocyte of epicardial fat of left ventricle,
SREBF1,,,,no,4.25,6.194,48677,72372,0.543,ENSG00000072310,Sterol regulatory element-binding protein 1 (SREBP-1) (Class D basic helix-loop-helix protein 1) (bHLHd1) (Sterol regulatory element-binding transcription factor 1),Nucleus,white fat cell;brown fat cell,
STAT1,,,,no,11.297,15.53,129387,181465,0.459,ENSG00000115415,Signal transducer and activator of transcription 1-alpha/beta (Transcription factor ISGF-3 components p91/p84),Cytoplasm,"pancreatic A cell;lens fiber cell;secondary lens fiber;intermediate monocyte;T cell;activated CD4-positive, alpha-beta T cell;activated CD4-positive, alpha-beta T cell, human",
STAT3,,,,no,24.177,23.625,276903,276050,-0.033,ENSG00000168610,Signal transducer and activator of transcription 3 (Acute-phase response factor),Cytoplasm,,
STAT5A,,,,no,3.094,4.484,35439,52395,0.535,ENSG00000126561,Signal transducer and activator of transcription 5A,Cytoplasm,"megakaryocyte-erythroid progenitor cell;erythroid progenitor cell, mammalian;myeloid lineage restricted progenitor cell;common myeloid progenitor;subcutaneous fat cell",
STAT5B,,,,no,3.789,3.777,43391,44139,-0.004,ENSG00000173757,Signal transducer and activator of transcription 5B,Cytoplasm,,
STX1A,,,,no,1.592,0.999,18236,11674,-0.672,ENSG00000106089,Syntaxin-1A (Neuron-specific antigen HPC-1),Cytoplasmic vesicle,pancreatic endocrine cell;type B pancreatic cell;pancreatic D cell;glandular epithelial cell;enteroendocrine cell;PP cell;endocrine cell,
TGFB1,,,,no,0.496,0.604,5679,7058,0.285,ENSG00000105329,Transforming growth factor beta-1 proprotein,Secreted,"extravillous trophoblast;platelet;myeloid dendritic cell;CD1c-positive myeloid dendritic cell;CD4-positive, alpha-beta cytotoxic T cell;CD8-positive, alpha-beta cytotoxic T cell;mucosal invariant T cell;CD16-positive, CD56-dim natural killer cell, human;megakaryocyte;osteoblast",TGFb
TGFB2,,,,no,2.892,3.27,33127,38214,0.177,ENSG00000092969,Transforming growth factor beta-2 proprotein (Cetermin) (Glioblastoma-derived T-cell suppressor factor) (G-TSF),Secreted,type I pneumocyte,TGFb
TGFB3,,,,no,9.565,4.734,109550,55314,-1.015,ENSG00000119699,Transforming growth factor beta-3 proprotein,Secreted,,TGFb
TGFBR1,,,,no,7.479,7.001,85658,81804,-0.095,ENSG00000106799,TGF-beta receptor type-1 (TGFR-1),Cell membrane,kidney collecting duct principal cell;renal principal cell;microglial cell;mature microglial cell,TGFb;GDF;MSTN
TGFBR2,,,,no,19.206,21.814,219971,254896,0.184,ENSG00000163513,TGF-beta receptor type-2 (TGFR-2),Cell membrane,retinal blood vessel endothelial cell;kidney capillary endothelial cell;glomerular capillary endothelial cell;lung microvascular endothelial cell;lung endothelial cell;fenestrated cell;glomerular endothelial cell;surface ectodermal cell,TGFb;GDF
THBD,,,,no,2.133,0.719,24429,8400,-1.569,ENSG00000178726,Thrombomodulin (TM) (Fetomodulin) (CD antigen CD141),Membrane,squamous epithelial cell;blood vessel endothelial cell;vein endothelial cell;vasa recta ascending limb cell;vasa recta descending limb cell;retinal blood vessel endothelial cell;endothelial cell of artery;kidney capillary endothelial cell;capillary endothelial cell;lung microvascular endothelial cell;prostate gland microvascular endothelial cell;lung endothelial cell;endothelial cell;gut endothelial cell;endothelial cell of vascular tree;endothelial cell of lymphatic vessel;alternatively activated macrophage;surface ectodermal cell,
TNF,,,,no,0.21,0.071,2409,827,-1.571,ENSG00000232810,Tumor necrosis factor (Cachectin) (TNF-alpha) (Tumor necrosis factor ligand superfamily member 2) (TNF-a),Cell membrane,"T cell;CD4-positive helper T cell;T-helper 1 cell;T-helper 17 cell;activated CD4-positive, alpha-beta T cell;activated CD8-positive, alpha-beta T cell;mucosal invariant T cell;group 3 innate lymphoid cell;CD34-positive, CD56-positive, CD117-positive common innate lymphoid precursor, human",TNF
TNFRSF1A,,,,no,6.2,5.286,71006,61761,-0.23,ENSG00000067182,Tumor necrosis factor receptor superfamily member 1A (Tumor necrosis factor receptor 1) (TNF-R1) (Tumor necrosis factor receptor type I) (TNF-RI) (TNFR-I) (p55) (p60) (CD antigen CD120a),Cell membrane,mesothelial cell of pleura;follicular dendritic cell,TNF;LT
TRIB3,,,,no,2.332,1.542,26712,18017,-0.597,ENSG00000101255,Tribbles homolog 3 (TRB-3) (Neuronal cell death-inducible putative kinase) (SINK) (p65-interacting inhibitor of NF-kappa-B),Nucleus,myoepithelial cell;myoepithelial cell of mammary gland,
TRPM4,,,,no,4.431,5.79,50751,67658,0.386,ENSG00000130529,Transient receptor potential cation channel subfamily M member 4 (hTRPM4) (Calcium-activated non-selective cation channel 1) (Long transient receptor potential channel 4) (LTrpC-4) (LTrpC4) (Melastatin-4),Cell membrane,,
TSC1,,,,no,2.57,3.604,29433,42117,0.488,ENSG00000165699,Hamartin (Tuberous sclerosis 1 protein),Cytoplasm,,
TSC2,,,,no,8.886,11.983,101769,140022,0.431,ENSG00000103197,Tuberin (Tuberous sclerosis 2 protein),Cytoplasm;Membrane,,
VCAM1,,,,no,8.121,2.933,93007,34270,-1.469,ENSG00000162692,Vascular cell adhesion protein 1 (V-CAM 1) (VCAM-1) (INCAM-100) (CD antigen CD106),Secreted,vasa recta ascending limb cell;prostate gland microvascular endothelial cell;medullary thymic epithelial cell;parietal epithelial cell;kidney loop of Henle thin descending limb epithelial cell;follicular dendritic cell;connective tissue cell;fibroblast;fibroblast of lung;mesothelial fibroblast,VCAM
VDR,,,,no,1.282,1.502,14678,17556,0.229,ENSG00000111424,"Vitamin D3 receptor (VDR) (1,25-dihydroxyvitamin D3 receptor) (Nuclear receptor subfamily 1 group I member 1)",Nucleus,intestinal crypt stem cell;intestinal crypt stem cell of small intestine;transit amplifying cell of small intestine,Calcitriol
VEGFA,,,,no,9.162,8.643,104935,100994,-0.084,ENSG00000112715,"Vascular endothelial growth factor A, long form (L-VEGF) (Vascular permeability factor) (VPF)",Secreted,intestinal crypt stem cell of large intestine;type I pneumocyte;type B pancreatic cell;club cell;kidney glomerular epithelial cell;podocyte;elicited macrophage;inflammatory macrophage;liver dendritic cell;subcutaneous fat cell,VEGF
VEGFB,,,,no,17.446,23.079,199805,269673,0.404,ENSG00000173511,Vascular endothelial growth factor B (VEGF-B) (VEGF-related factor) (VRF),Secreted,,VEGF
VEGFC,,,,no,0.562,0.883,6438,10317,0.651,ENSG00000150630,Vascular endothelial growth factor C (VEGF-C) (Flt4 ligand) (Flt4-L) (Vascular endothelial growth factor-related protein) (VRP),Secreted,endothelial cell of artery;cardiac endothelial cell,VEGF
VEGFD,,,,no,0.231,0.159,2651,1859,-0.541,ENSG00000165197,Vascular endothelial growth factor D (VEGF-D) (c-Fos-induced growth factor) (FIGF),Secreted,connective tissue cell;fibroblast;pulmonary interstitial fibroblast;fibroblast of lung,VEGF
