gene,category,rationale,single_gene_panel_note,exclude_recommended,detection_pct_0041323,detection_pct_0041326,n_cells_0041323,n_cells_0041326,log2_detection_ratio_326_over_323,gene_id,full_name,location,cell_type,cellchat_pathway
ENO2,,,,no,0.501,0.665,5740,7770,0.408,ENSG00000111674,Gamma-enolase,Cytoplasm,ON-bipolar cell;rod bipolar cell;OFF-bipolar cell;Cajal-Retzius cell;retinal ganglion cell;neuronal receptor cell;photoreceptor cell;eye photoreceptor cell;retinal cone cell;glycinergic neuron,
ERBB2,,,,no,5.451,6.4,62435,74778,0.231,ENSG00000141736,Receptor tyrosine-protein kinase erbB-2,Cell membrane,,EGF;NRG
ERBB3,,,,no,11.452,14.628,131158,170929,0.353,ENSG00000065361,Receptor tyrosine-protein kinase erbB-3,Secreted,intestinal crypt stem cell of small intestine,NRG
EREG,,,,no,0.045,0.128,515,1491,1.505,ENSG00000124882,Proepiregulin,Cell membrane,hematopoietic stem cell;colon macrophage;mononuclear phagocyte;common myeloid progenitor,EGF
ERN1,,,,no,11.908,8.604,136379,100541,-0.469,ENSG00000178607,Serine/threonine-protein kinase/endoribonuclease IRE1 (Endoplasmic reticulum-to-nucleus signaling 1) (Inositol-requiring protein 1) (hIRE1p) (Ire1-alpha) (IRE1a),Endoplasmic reticulum membrane,mucosal invariant T cell;plasma cell;IgG plasma cell;IgA plasma cell,
F2R,,,,no,1.599,1.326,18309,15489,-0.27,ENSG00000181104,Proteinase-activated receptor 1 (PAR-1) (Coagulation factor II receptor) (Thrombin receptor),Cell membrane,endothelial tip cell;endothelial cell of umbilical vein;endocardial cell;pancreatic stellate cell,PARs;KLK;PROCR
FADD,,,,no,3.145,3.373,36022,39418,0.101,ENSG00000168040,FAS-associated death domain protein (FAS-associating death domain-containing protein) (Growth-inhibiting gene 3 protein) (Mediator of receptor induced toxicity),,,
FAF1,,,,no,9.923,10.341,113646,120829,0.06,ENSG00000185104,FAS-associated factor 1 (hFAF1) (UBX domain-containing protein 12) (UBX domain-containing protein 3A),Nucleus,,
FAS,,,,no,1.751,1.442,20051,16855,-0.279,ENSG00000026103,Tumor necrosis factor receptor superfamily member 6 (Apo-1 antigen) (Apoptosis-mediating surface antigen FAS) (FASLG receptor) (CD antigen CD95),Secreted,basal cell of prostate epithelium;medullary thymic epithelial cell,FASLG
FASLG,,,,no,0.121,0.134,1381,1565,0.152,ENSG00000117560,Tumor necrosis factor ligand superfamily member 6 (Apoptosis antigen ligand) (APTL) (CD95 ligand) (CD95-L) (Fas antigen ligand) (Fas ligand) (FasL) (CD antigen CD178),Cell membrane,"activated CD8-positive, alpha-beta T cell;gamma-delta T cell;intraepithelial lymphocyte;CD16-negative, CD56-bright natural killer cell, human",
FASN,,,,no,3.095,2.902,35452,33908,-0.093,ENSG00000169710,Fatty acid synthase,Cytoplasm,luminal epithelial cell of mammary gland;epithelial cell of lung;pneumocyte;type II pneumocyte;mammary gland epithelial cell;fat cell;white fat cell;brown fat cell;subcutaneous fat cell;epicardial adipocyte;lung secretory cell;sebaceous gland cell,
FEZ1,,,,no,0.26,0.235,2979,2750,-0.144,ENSG00000149557,Fasciculation and elongation protein zeta-1 (Zygin I) (Zygin-1),Cytoplasm,radial glial cell;forebrain radial glial cell;cortical interneuron;cerebral cortex GABAergic interneuron;Cajal-Retzius cell;connective tissue cell;fibroblast;fibroblast of lung,
FNTA,,,,no,9.635,10.382,110346,121314,0.108,ENSG00000168522,Protein farnesyltransferase/geranylgeranyltransferase type-1 subunit alpha,,,
FOXO3,,,,no,14.004,9.691,160388,113235,-0.531,ENSG00000118689,Forkhead box protein O3 (AF6q21 protein) (Forkhead in rhabdomyosarcoma-like 1),Cytoplasm,tongue muscle cell;skeletal muscle fibroblast;erythroid lineage cell,
FZR1,,,,no,2.81,3.256,32178,38047,0.213,ENSG00000105325,Fizzy-related protein homolog (Fzr) (CDC20-like protein 1) (Cdh1/Hct1 homolog) (hCDH1),Cytoplasm,,
GADD45A,,,,no,5.886,3.406,67415,39799,-0.789,ENSG00000116717,Growth arrest and DNA damage-inducible protein GADD45 alpha (DNA damage-inducible transcript 1 protein) (DDIT-1),Nucleus,myoepithelial cell of mammary gland;urothelial cell;bladder urothelial cell;epithelial cell of uterus;epithelial cell of prostate;basal cell of prostate epithelium;epithelial cell of urethra;myometrial cell;bladder cell,
GADD45G,,,,no,3.816,3.375,43710,39432,-0.178,ENSG00000130222,Growth arrest and DNA damage-inducible protein GADD45 gamma (Cytokine-responsive protein CR6) (DNA damage-inducible transcript 2 protein) (DDIT-2),,intestinal crypt stem cell of large intestine;Sertoli cell;mesothelial cell;Leydig cell;lung secretory cell,
GCH1,,,,no,3.808,2.234,43608,26101,-0.769,ENSG00000131979,GTP cyclohydrolase 1,Cytoplasm,type EC enteroendocrine cell;pancreatic D cell;pancreatic PP cell;type L enteroendocrine cell;intestinal enteroendocrine cell;enteroendocrine cell of small intestine;enteroendocrine cell of colon;sympathetic neuron,
GCLM,,,,no,5.397,4.686,61812,54757,-0.204,ENSG00000023909,Glutamate--cysteine ligase regulatory subunit (GCS light chain) (Gamma-ECS regulatory subunit) (Gamma-glutamylcysteine synthetase regulatory subunit) (Glutamate--cysteine ligase modifier subunit),,myoepithelial cell;myoepithelial cell of mammary gland;type EC enteroendocrine cell;intestinal enteroendocrine cell;enteroendocrine cell of small intestine;alternatively activated macrophage;erythroid lineage cell,
GLUD1,,,,no,9.876,6.878,113110,80362,-0.522,ENSG00000148672,"Glutamate dehydrogenase 1, mitochondrial (GDH 1)",Mitochondrion,pancreatic A cell,
GOLGA2,,,,no,12.373,12.141,141707,141863,-0.027,ENSG00000167110,Golgin subfamily A member 2 (130 kDa cis-Golgi matrix protein) (GM130) (GM130 autoantigen) (Golgin-95),Golgi apparatus,pancreatic PP cell,
GSR,,,,no,19.509,19.18,223437,224109,-0.025,ENSG00000104687,"Glutathione reductase, mitochondrial (GR) (GRase)",Cytoplasm,,
GSS,,,,no,3.757,3.087,43025,36069,-0.283,ENSG00000100983,Glutathione synthetase (GSH synthetase) (GSH-S),,,
GSTM1,,,,no,0.943,4.705,10802,54980,2.319,ENSG00000134184,Glutathione S-transferase Mu 1,Cytoplasm,,
GZMB,,,,no,0.058,0.217,663,2533,1.905,ENSG00000100453,Granzyme B,Secreted,"hematopoietic cell;leukocyte;dendritic cell;plasmacytoid dendritic cell;plasmacytoid dendritic cell, human;dendritic cell, human;mononuclear cell;lymphocyte;T cell;alpha-beta T cell;CD8-positive, alpha-beta thymocyte;mature alpha-beta T cell;activated CD4-positive, alpha-beta T cell;CD4-positive, alpha-beta cytotoxic T cell;CD8-positive, alpha-beta T cell;CD8-positive, alpha-beta cytotoxic T cell;activated CD8-positive, alpha-beta T cell;activated CD8-positive, alpha-beta T cell, human;CD8-positive, alpha-beta cytokine secreting effector T cell;CD8-positive, alpha-beta memory T cell;effector memory CD8-positive, alpha-beta T cell, terminally differentiated;CD8-positive, alpha-beta memory T cell, CD45RO-positive;effector memory CD8-positive, alpha-beta T cell;effector CD8-positive, alpha-beta T cell;CD8-alpha-beta-positive, alpha-beta intraepithelial T cell;mature NK T cell;type I NK T cell;mucosal invariant T cell;gamma-delta T cell;mature gamma-delta T cell;mature T cell;cytotoxic T cell;exhausted T cell;innate lymphoid cell;natural killer cell;CD16-negative, CD56-bright natural killer cell, human;CD16-positive, CD56-dim natural killer cell, human;decidual natural killer cell, human;ILC1, human",
HGF,,,,no,1.036,1.258,11870,14699,0.279,ENSG00000019991,Hepatocyte growth factor (Hepatopoietin-A) (Scatter factor) (SF),,promyelocyte;connective tissue cell;fibroblast;hepatic stellate cell;fibroblast of mammary gland;fibroblast of breast;mural cell,HGF
HMGB2,,,,no,0.558,0.318,6396,3717,-0.812,ENSG00000164104,High mobility group protein B2 (High mobility group protein 2) (HMG-2),Nucleus,"bone marrow cell;granulocyte monocyte progenitor cell;immature alpha-beta T cell;double-positive, alpha-beta thymocyte;large pre-B-II cell;promonocyte;erythroid lineage cell;primitive red blood cell;myelocyte;hematopoietic precursor cell;pro-B cell;fraction A pre-pro B cell;myeloid lineage restricted progenitor cell",
HMOX1,,,,no,1.145,1.238,13114,14463,0.112,ENSG00000100292,Heme oxygenase 1 (HO-1),Endoplasmic reticulum membrane,"epithelial cell of lacrimal sac;squamous epithelial cell;blood vessel endothelial cell;vein endothelial cell;prostate gland microvascular endothelial cell;type II pneumocyte;endothelial cell of vascular tree;elicited macrophage;alternatively activated macrophage;Hofbauer cell;non-classical monocyte;CD14-low, CD16-positive monocyte;CD14-positive, CD16-positive monocyte;intermediate monocyte;lung secretory cell",
HRAS,,,,no,3.894,4.039,44603,47189,0.052,ENSG00000174775,GTPase HRas,Cell membrane,,
HTRA2,,,,no,0.918,1.071,10518,12515,0.222,ENSG00000115317,"Serine protease HTRA2, mitochondrial",Mitochondrion intermembrane space;Mitochondrion membrane,erythrocyte;erythroid lineage cell;erythroblast,
IFNA1,,,,no,0.061,0.01,699,118,-2.595,ENSG00000197919,Interferon-alpha1,,,IFN-I
IFNA17,,,,no,0.076,0.012,876,146,-2.614,ENSG00000234829,Interferon alpha-17 (IFN-alpha-17) (Interferon alpha-88) (Interferon alpha-I') (LeIF I) (Interferon alpha-T),Secreted,,IFN-I
IFNA2,,,,no,0.09,0.018,1030,216,-2.282,ENSG00000188379,Interferon alpha-2 (IFN-alpha-2) (Interferon alpha-A) (LeIF A),Secreted,,IFN-I
IFNA7,,,,no,0.063,0.012,725,146,-2.341,ENSG00000214042,Interferon alpha-7 (IFN-alpha-7) (Interferon alpha-J) (LeIF J) (Interferon alpha-J1) (IFN-alpha-J1),Secreted,,IFN-I
IFNA8,,,,no,0.087,0.013,992,149,-2.764,ENSG00000120242,Interferon alpha-8 (IFN-alpha-8) (Interferon alpha-B) (LeIF B) (Interferon alpha-B2),Secreted,,IFN-I
IFNAR1,,,,no,24.095,20.931,275955,244572,-0.203,ENSG00000142166,Interferon alpha/beta receptor 1 (IFN-R-1) (IFN-alpha/beta receptor 1) (Cytokine receptor class-II member 1) (Cytokine receptor family 2 member 1) (CRF2-1) (Type I interferon receptor 1),Cell membrane,,IFN-I
IFNAR2,,,,no,4.256,4.007,48740,46824,-0.087,ENSG00000159110,Interferon alpha/beta receptor 2 (IFN-R-2) (IFN-alpha binding protein) (IFN-alpha/beta receptor 2) (Interferon alpha binding protein) (Type I interferon receptor 2),Secreted,plasma cell;IgG plasma cell;IgM plasma cell,IFN-I
IFNB1,,,,no,0.037,,429,0,,ENSG00000171855,Interferon beta (IFN-beta) (Fibroblast interferon),Secreted,,IFN-I
IFNG,,,,no,0.062,0.022,705,255,-1.496,ENSG00000111537,Interferon gamma (IFN-gamma) (Immune interferon),Secreted,"lymphocyte;T cell;alpha-beta T cell;mature alpha-beta T cell;T-helper 1 cell;activated CD4-positive, alpha-beta T cell;CD4-positive, alpha-beta cytotoxic T cell;CD8-positive, alpha-beta T cell;CD8-positive, alpha-beta cytotoxic T cell;activated CD8-positive, alpha-beta T cell;CD8-positive, alpha-beta memory T cell;effector memory CD8-positive, alpha-beta T cell, terminally differentiated;CD8-positive, alpha-beta memory T cell, CD45RO-positive;effector memory CD8-positive, alpha-beta T cell;effector CD8-positive, alpha-beta T cell;mature NK T cell;type I NK T cell;gamma-delta T cell;CD8-alpha alpha positive, gamma-delta intraepithelial T cell;mature T cell;regulatory T cell;exhausted T cell;innate lymphoid cell;natural killer cell;CD16-negative, CD56-bright natural killer cell, human;CD16-positive, CD56-dim natural killer cell, human;ILC1, human;DN1 thymic pro-T cell",IFN-II
IFNGR1,,,,no,10.424,12.924,119388,151017,0.31,ENSG00000027697,Interferon gamma receptor 1 (IFN-gamma receptor 1) (IFN-gamma-R1) (CDw119) (Interferon gamma receptor alpha-chain) (IFN-gamma-R-alpha) (CD antigen CD119),Cell membrane,myoepithelial cell;myoepithelial cell of mammary gland;microglial cell,IFN-II
IFNGR2,,,,no,7.387,6.266,84604,73213,-0.238,ENSG00000159128,Interferon gamma receptor 2 (IFN-gamma receptor 2) (IFN-gamma-R2) (Interferon gamma receptor accessory factor 1) (AF-1) (Interferon gamma receptor beta-chain) (IFN-gamma-R-beta) (Interferon gamma transducer 1),Cell membrane,epithelial cell of urethra,IFN-II
IGF2R,,,,no,18.039,19.057,206599,222671,0.079,ENSG00000197081,Cation-independent mannose-6-phosphate receptor (CI Man-6-P receptor) (CI-MPR) (M6PR) (300 kDa mannose 6-phosphate receptor) (MPR 300) (Insulin-like growth factor 2 receptor) (Insulin-like growth factor II receptor) (IGF-II receptor) (M6P/IGF2 receptor) (M6P/IGF2R) (CD antigen CD222),Golgi apparatus membrane,endocardial cell,IGF
IKBKB,,,,no,7.38,9.27,84528,108313,0.329,ENSG00000104365,Inhibitor of nuclear factor kappa-B kinase subunit beta (I-kappa-B-kinase beta) (IKK-B) (IKK-beta) (IkBKB),Cytoplasm,,
IKBKG,,,,no,3.475,3.987,39802,46583,0.198,ENSG00000269335,NF-kappa-B essential modulator (NEMO) (FIP-3) (IkB kinase-associated protein 1) (IKKAP1) (Inhibitor of nuclear factor kappa-B kinase subunit gamma) (I-kappa-B kinase subunit gamma) (IKK-gamma) (IKKG) (IkB kinase subunit gamma) (NF-kappa-B essential modifier),Cytoplasm,,
IL18,,,,no,1.034,1.329,11844,15524,0.361,ENSG00000150782,Interleukin-18 (IL-18) (Iboctadekin) (Interferon gamma-inducing factor) (IFN-gamma-inducing factor) (Interleukin-1 gamma) (IL-1 gamma),Cytoplasm,kidney collecting duct intercalated cell;renal intercalated cell;renal beta-intercalated cell;renal alpha-intercalated cell;corneal epithelial cell;conjunctival epithelial cell,IL1
IL1A,,,,no,0.063,0.024,726,276,-1.424,ENSG00000115008,Interleukin-1 alpha (IL-1 alpha) (Hematopoietin-1),Nucleus,,IL1
IL1B,,,,no,0.2,0.231,2296,2697,0.203,ENSG00000125538,Interleukin-1 beta (IL-1 beta) (Catabolin),Cytoplasm,"brush cell of bronchus;elicited macrophage;inflammatory macrophage;alternatively activated macrophage;colon macrophage;mononuclear phagocyte;CD14-positive, CD16-negative classical monocyte;dendritic cell;conventional dendritic cell;myeloid dendritic cell;CD1c-positive myeloid dendritic cell;myeloid leukocyte;monocyte;CD14-positive monocyte;intermediate monocyte;myeloid cell;hematopoietic multipotent progenitor cell",IL1
IL3,,,,no,0.025,,281,0,,ENSG00000164399,Interleukin-3 (IL-3) (Hematopoietic growth factor) (Mast cell growth factor) (MCGF) (Multipotential colony-stimulating factor) (P-cell-stimulating factor),Secreted,,IL4
IL33,,,,no,0.752,0.681,8609,7961,-0.142,ENSG00000137033,Interleukin-33 (IL-33) (Interleukin-1 family member 11) (IL-1F11) (Nuclear factor from high endothelial venules) (NF-HEV),Nucleus,respiratory basal cell;basal cell of epithelium of trachea;retinal blood vessel endothelial cell;lung microvascular endothelial cell;lung endothelial cell;club cell;endothelial cell of sinusoid;endothelial cell of hepatic sinusoid;endothelial cell of uterus;endocardial cell;follicular dendritic cell,IL1
IL3RA,,,,no,0.876,1.149,10030,13420,0.391,ENSG00000185291,Interleukin-3 receptor subunit alpha (IL-3 receptor subunit alpha) (IL-3R subunit alpha) (IL-3R-alpha) (IL-3RA) (CD antigen CD123),Membrane,"prostate gland microvascular endothelial cell;gut endothelial cell;granulocyte;dendritic cell;plasmacytoid dendritic cell;plasmacytoid dendritic cell, human;dendritic cell, human;common dendritic progenitor",IL4
IL6,,,,no,0.419,0.217,4797,2534,-0.95,ENSG00000136244,Interleukin-6 (IL-6) (B-cell stimulatory factor 2) (BSF-2) (CTL differentiation factor) (CDF) (Hybridoma growth factor) (Interferon beta-2) (IFN-beta-2),Secreted,squamous epithelial cell;blood vessel endothelial cell;vein endothelial cell;prostate gland microvascular endothelial cell;endothelial cell;endothelial cell of vascular tree;vascular associated smooth muscle cell;smooth muscle cell of prostate;myeloid cell;fibroblast of mammary gland;fibroblast of connective tissue of nonglandular part of prostate;fibroblast of connective tissue of glandular part of prostate;fibroblast of breast;mural cell,IL6
IRF1,,,,no,8.716,6.71,99826,78402,-0.377,ENSG00000125347,Interferon regulatory factor 1 (IRF-1),Nucleus,"vasa recta ascending limb cell;epithelial cell of thymus;cortical thymic epithelial cell;medullary thymic epithelial cell;gut endothelial cell;surface ectodermal cell;IgG-negative class switched memory B cell;mature alpha-beta T cell;mucosal invariant T cell;CD16-negative, CD56-bright natural killer cell, human;group 2 innate lymphoid cell, human",
ITPR1,,,,no,1.418,1.182,16241,13811,-0.263,ENSG00000150995,"Inositol 1,4,5-trisphosphate receptor type 1 (IP3 receptor isoform 1) (IP3R 1) (InsP3R1) (Type 1 inositol 1,4,5-trisphosphate receptor) (Type 1 InsP3 receptor)",Endoplasmic reticulum membrane,choroid plexus epithelial cell;kidney distal convoluted tubule epithelial cell;smooth muscle cell of sphincter of pupil;ciliary muscle cell;Purkinje cell,
ITPR3,,,,no,7.175,11.43,82178,133554,0.672,ENSG00000096433,"Inositol 1,4,5-trisphosphate receptor type 3 (IP3 receptor isoform 3) (IP3R 3) (InsP3R3) (Type 3 inositol 1,4,5-trisphosphate receptor) (Type 3 InsP3 receptor)",Endoplasmic reticulum membrane,,
JAK1,,,,no,10.6,11.872,121398,138716,0.163,ENSG00000162434,Tyrosine-protein kinase JAK1,Endomembrane system,"mature conventional dendritic cell;alpha-beta T cell;mature alpha-beta T cell;CD8-positive, alpha-beta cytokine secreting effector T cell;mucosal invariant T cell;mature T cell;CD16-negative, CD56-bright natural killer cell, human;CD16-positive, CD56-dim natural killer cell, human;ILC1, human;group 2 innate lymphoid cell, human;fibro/adipogenic progenitor cell",
JAK2,,,,no,2.05,2.653,23475,30998,0.372,ENSG00000096968,Tyrosine-protein kinase JAK2,Endomembrane system,basal cell of epidermis;stem cell of epidermis;mesothelial fibroblast,
JAK3,,,,no,0.946,1.802,10834,21059,0.93,ENSG00000105639,Tyrosine-protein kinase JAK3,Endomembrane system,"CD4-positive, CD25-positive, alpha-beta regulatory T cell;naive regulatory T cell;mature NK T cell",
KPNA1,,,,no,5.048,5.114,57820,59750,0.018,ENSG00000114030,Importin subunit alpha-5 (Karyopherin subunit alpha-1) (Nucleoprotein interactor 1) (NPI-1) (RAG cohort protein 2) (SRP1-beta),Cytoplasm,,
KPNB1,,,,no,16.842,17.68,192889,206587,0.07,ENSG00000108424,Importin subunit beta-1 (Importin-90) (Karyopherin subunit beta-1) (Nuclear factor p97) (Pore targeting complex 97 kDa subunit) (PTAC97),Cytoplasm,pancreatic A cell,
KRAS,,,,no,7.627,4.406,87350,51484,-0.792,ENSG00000133703,GTPase KRas,Cell membrane,,
LEF1,,,,no,0.195,0.161,2233,1887,-0.272,ENSG00000138795,Lymphoid enhancer-binding factor 1 (LEF-1) (T cell-specific transcription factor 1-alpha) (TCF1-alpha),Nucleus,"T cell;immature alpha-beta T cell;double-positive, alpha-beta thymocyte;CD4-positive, CD25-positive, alpha-beta regulatory T cell;naive regulatory T cell;memory regulatory T cell;naive thymus-derived CD4-positive, alpha-beta T cell;naive thymus-derived CD8-positive, alpha-beta T cell;CD8-alpha-alpha-positive, alpha-beta intraepithelial T cell;naive T cell;intraepithelial lymphocyte;immature T cell;thymocyte;double negative thymocyte;late pro-B cell;neuron",
LMNB1,,,,no,1.766,1.734,20225,20258,-0.027,ENSG00000113368,Lamin-B1,Nucleus lamina,DN4 thymocyte;precursor B cell;large pre-B-II cell;common dendritic progenitor;hematopoietic precursor cell;pro-B cell;fraction A pre-pro B cell,
LY96,,,,no,0.936,1.043,10715,12189,0.157,ENSG00000154589,Lymphocyte antigen 96 (Ly-96) (ESOP-1) (Protein MD-2),Secreted,macrophage;alveolar macrophage;colon macrophage;lung macrophage;Hofbauer cell;IgA plasma cell,
MAP1LC3A,,,,no,3.321,3.131,38033,36580,-0.085,ENSG00000101460,Microtubule-associated proteins 1A/1B light chain 3A (Autophagy-related protein LC3 A) (Autophagy-related ubiquitin-like modifier LC3 A) (MAP1 light chain 3-like protein 1) (MAP1A/MAP1B light chain 3 A) (MAP1A/MAP1B LC3 A) (Microtubule-associated protein 1 light chain 3 alpha),Cytoplasmic vesicle,type B pancreatic cell;follicular dendritic cell;peripheral nervous system neuron,
MAP1LC3B,,,,no,9.934,6.005,113776,70169,-0.726,ENSG00000140941,Microtubule-associated proteins 1A/1B light chain 3B (Autophagy-related protein LC3 B) (Autophagy-related ubiquitin-like modifier LC3 B) (MAP1 light chain 3-like protein 2) (MAP1A/MAP1B light chain 3 B) (MAP1A/MAP1B LC3 B) (Microtubule-associated protein 1 light chain 3 beta),Cytoplasmic vesicle,epithelial cell of uterus;pro-B cell,
MAP2K1,,,,no,4.591,3.625,52585,42362,-0.341,ENSG00000169032,Dual specificity mitogen-activated protein kinase kinase 1 (MAP kinase kinase 1) (MAPKK 1) (MKK1),Cytoplasm,,
MAP3K14,,,,no,1.64,1.905,18784,22264,0.216,ENSG00000006062,Mitogen-activated protein kinase kinase kinase 14,Cytoplasm,,
MAP3K5,,,,no,5.551,4.769,63570,55719,-0.219,ENSG00000197442,Mitogen-activated protein kinase kinase kinase 5,Cytoplasm,basal epithelial cell of prostatic duct;cortical cell of adrenal gland;chorionic trophoblast cell;kidney interstitial fibroblast;papillary tips cell,
MAPK1,,,,no,12.287,10.624,140728,124144,-0.21,ENSG00000100030,Mitogen-activated protein kinase 1 (MAP kinase 1) (MAPK 1),Cytoplasm,"CD8-positive, alpha-beta cytokine secreting effector T cell",
MAPK10,,,,no,1.99,1.682,22794,19649,-0.243,ENSG00000109339,Mitogen-activated protein kinase 10 (MAP kinase 10) (MAPK 10),Cytoplasm,ependymal cell;choroid plexus epithelial cell;astrocyte;papillary tips cell,
MAPK3,,,,no,8.17,12.041,93574,140692,0.559,ENSG00000102882,Mitogen-activated protein kinase 3 (MAP kinase 3) (MAPK 3),Cytoplasm,,
MAPK8,,,,no,4.446,4.116,50917,48090,-0.111,ENSG00000107643,Mitogen-activated protein kinase 8 (MAP kinase 8) (MAPK 8),Cytoplasm,,
MAPK9,,,,no,9.884,7.415,113205,86638,-0.415,ENSG00000050748,Mitogen-activated protein kinase 9 (MAP kinase 9) (MAPK 9),Cytoplasm,,
MAPT,,,,no,0.655,0.64,7501,7478,-0.033,ENSG00000186868,Microtubule-associated protein tau (Neurofibrillary tangle protein) (Paired helical filament-tau) (PHF-tau),Cytoplasm,interneuron;bipolar neuron;retinal bipolar neuron;cerebral cortex GABAergic interneuron;retina horizontal cell;Cajal-Retzius cell;retinal ganglion cell;visceromotor neuron,
MED12,,,,no,4.099,5.8,46943,67767,0.501,ENSG00000184634,Mediator of RNA polymerase II transcription subunit 12 (Activator-recruited cofactor 240 kDa component) (ARC240) (CAG repeat protein 45) (Mediator complex subunit 12) (OPA-containing protein) (Thyroid hormone receptor-associated protein complex 230 kDa component) (Trap230) (Trinucleotide repeat-containing gene 11 protein),Nucleus,,
MGMT,,,,no,5.66,9.184,64822,107318,0.698,ENSG00000170430,Methylated-DNA--protein-cysteine methyltransferase,Nucleus,epithelial cell of thymus;cortical thymic epithelial cell,
NCOA4,,,,no,18.143,16.985,207791,198469,-0.095,ENSG00000266412,Nuclear receptor coactivator 4 (NCoA-4) (Androgen receptor coactivator 70 kDa protein) (70 kDa AR-activator) (70 kDa androgen receptor coactivator) (Androgen receptor-associated protein of 70 kDa) (Ret-activating protein ELE1),,eosinophil;erythrocyte;enucleate erythrocyte;platelet;peripheral blood mononuclear cell;megakaryocyte-erythroid progenitor cell;megakaryocyte;erythroid lineage cell;reticulocyte;enucleated reticulocyte;basophil mast progenitor cell,
NEDD9,,,,no,3.241,2.583,37117,30183,-0.327,ENSG00000111859,Enhancer of filamentation 1 (hEF1) (CRK-associated substrate-related protein) (CAS-L) (CasL) (Cas scaffolding protein family member 2) (CASS2) (Neural precursor cell expressed developmentally down-regulated protein 9) (NEDD-9) (Renal carcinoma antigen NY-REN-12) (p105),Cytoplasm,epithelial cell of lung;type I pneumocyte;epithelial cell of uterus;parietal epithelial cell,
NEFH,,,,no,0.25,0.133,2860,1554,-0.909,ENSG00000100285,Neurofilament heavy polypeptide (NF-H) (200 kDa neurofilament protein) (Neurofilament triplet H protein),Cytoplasm,granulosa cell;epithelial cell of prostate;luminal cell of prostate epithelium,
NFKB1,,,,no,4.659,4.48,53358,52342,-0.057,ENSG00000109320,Nuclear factor NF-kappa-B p105 subunit (DNA-binding factor KBF1) (EBP-1) (Nuclear factor of kappa light polypeptide gene enhancer in B-cells 1),Nucleus,"cortical thymic epithelial cell;elicited macrophage;inflammatory macrophage;alternatively activated macrophage;mast cell;mucosal type mast cell;group 3 innate lymphoid cell;CD34-positive, CD56-positive, CD117-positive common innate lymphoid precursor, human;myeloid cell;fibroblast of connective tissue of nonglandular part of prostate",
NGF,,,,no,0.049,0.036,565,424,-0.443,ENSG00000134259,Beta-nerve growth factor (Beta-NGF),Secreted,smooth muscle myoblast;pericyte;renal interstitial pericyte;mural cell,NGF;NT
NGFR,,,,no,2.743,1.52,31415,17760,-0.852,ENSG00000064300,Tumor necrosis factor receptor superfamily member 16 (Gp80-LNGFR) (Low affinity neurotrophin receptor p75NTR) (Low-affinity nerve growth factor receptor) (NGF receptor) (p75 ICD) (CD antigen CD271),Cell membrane,basal epithelial cell of tracheobronchial tree;radial glial cell;Mueller cell;visceromotor neuron,NGF;NT
NLRP3,,,,no,0.247,0.519,2828,6060,1.071,ENSG00000162711,"NACHT, LRR and PYD domains-containing protein 3",Cytoplasm,"phagocyte;elicited macrophage;alternatively activated macrophage;colon macrophage;mononuclear phagocyte;classical monocyte;CD14-positive, CD16-negative classical monocyte;hematopoietic cell;leukocyte;myeloid leukocyte;monocyte;CD14-positive monocyte;intermediate monocyte;myeloid cell",
NRAS,,,,no,7.324,4.932,83886,57624,-0.571,ENSG00000213281,GTPase NRas,Cell membrane,,
NTRK1,,,,no,0.39,0.071,4465,832,-2.453,ENSG00000198400,High affinity nerve growth factor receptor,Cell membrane,renal beta-intercalated cell,NT
OCLN,,,,no,18.515,14.318,212049,167305,-0.371,ENSG00000197822,Occludin,Cell membrane,respiratory epithelial cell;epithelial cell of lower respiratory tract;club cell,OCLN
PAK1,,,,no,7.519,7.94,86117,92771,0.078,ENSG00000149269,Serine/threonine-protein kinase PAK 1,Cytoplasm,Langerhans cell;promonocyte,
PARP1,,,,no,17.235,18.289,197395,213698,0.086,ENSG00000143799,Poly [ADP-ribose] polymerase 1 (PARP-1),Chromosome,germinal center B cell;B cell;large pre-B-II cell;fraction A pre-pro B cell,
PARP3,,,,no,1.206,1.303,13809,15231,0.112,ENSG00000041880,Protein mono-ADP-ribosyltransferase PARP3,Nucleus,,
