gene,category,rationale,single_gene_panel_note,exclude_recommended,detection_pct_0041323,detection_pct_0041326,n_cells_0041323,n_cells_0041326,log2_detection_ratio_326_over_323,gene_id,full_name,location,cell_type,cellchat_pathway
CD4,,,,no,2.249,3.322,25757,38821,0.563,ENSG00000010610,T-cell surface glycoprotein CD4 (T-cell surface antigen T4/Leu-3) (CD antigen CD4),Cell membrane,"macrophage;colon macrophage;dendritic cell;plasmacytoid dendritic cell;plasmacytoid dendritic cell, human;dendritic cell, human;lymphocyte;T cell;T-helper 1 cell;T follicular helper cell;effector memory CD4-positive, alpha-beta T cell;regulatory T cell;cytotoxic T cell",IL16;MHC-II
CD8A,,,,no,0.553,0.847,6338,9902,0.615,ENSG00000153563,T-cell surface glycoprotein CD8 alpha chain (T-lymphocyte differentiation antigen T8/Leu-2) (CD antigen CD8a),Secreted,"hematopoietic cell;leukocyte;mononuclear cell;lymphocyte;T cell;alpha-beta T cell;immature alpha-beta T cell;double-positive, alpha-beta thymocyte;CD8-positive, alpha-beta thymocyte;immature NK T cell;mature alpha-beta T cell;CD8-positive, alpha-beta T cell;CD8-positive, alpha-beta cytotoxic T cell;naive thymus-derived CD8-positive, alpha-beta T cell;activated CD8-positive, alpha-beta T cell;activated CD8-positive, alpha-beta T cell, human;CD8-positive, alpha-beta memory T cell;effector memory CD8-positive, alpha-beta T cell, terminally differentiated;CD8-positive, alpha-beta memory T cell, CD45RO-positive;central memory CD8-positive, alpha-beta T cell;effector memory CD8-positive, alpha-beta T cell;effector CD8-positive, alpha-beta T cell;CD8-alpha-beta-positive, alpha-beta intraepithelial T cell;CD8-alpha-alpha-positive, alpha-beta intraepithelial T cell;mature NK T cell;mucosal invariant T cell;CD8-alpha alpha positive, gamma-delta intraepithelial T cell;mature T cell;memory T cell;naive T cell;cytotoxic T cell;exhausted T cell;intraepithelial lymphocyte;immature T cell;thymocyte;DN1 thymic pro-T cell",CEACAM;LCK;MHC-I
CD8B,,,,no,0.164,0.14,1879,1641,-0.224,ENSG00000172116,T-cell surface glycoprotein CD8 beta chain (CD antigen CD8b),Secreted,"hematopoietic cell;leukocyte;mononuclear cell;lymphocyte;T cell;alpha-beta T cell;immature alpha-beta T cell;double-positive, alpha-beta thymocyte;CD8-positive, alpha-beta thymocyte;mature alpha-beta T cell;activated CD4-positive, alpha-beta T cell, human;CD8-positive, alpha-beta T cell;CD8-positive, alpha-beta cytotoxic T cell;naive thymus-derived CD8-positive, alpha-beta T cell;activated CD8-positive, alpha-beta T cell;activated CD8-positive, alpha-beta T cell, human;CD8-positive, alpha-beta memory T cell;effector memory CD8-positive, alpha-beta T cell, terminally differentiated;CD8-positive, alpha-beta memory T cell, CD45RO-positive;central memory CD8-positive, alpha-beta T cell;effector memory CD8-positive, alpha-beta T cell;effector CD8-positive, alpha-beta T cell;CD8-alpha-beta-positive, alpha-beta intraepithelial T cell;CD8-alpha-alpha-positive, alpha-beta intraepithelial T cell;mature NK T cell;mucosal invariant T cell;CD8-alpha alpha positive, gamma-delta intraepithelial T cell;mature T cell;memory T cell;naive T cell;cytotoxic T cell;exhausted T cell;intraepithelial lymphocyte;immature T cell;thymocyte;double negative thymocyte;double negative T regulatory cell",MHC-I
CIITA,,,,no,1.157,3.553,13249,41519,1.619,ENSG00000179583,MHC class II transactivator (CIITA),Nucleus,professional antigen presenting cell;dendritic cell;CD141-positive myeloid dendritic cell;conventional dendritic cell;Langerhans cell;myeloid dendritic cell;CD1c-positive myeloid dendritic cell,
KIR2DL1,,,,no,0.027,0.014,307,158,-0.987,ENSG00000125498,Killer cell immunoglobulin-like receptor 2DL1 (CD158 antigen-like family member A) (Natural killer-associated transcript 1) (NKAT-1) (p58 natural killer cell receptor clones CL-42/47.11) (p58 NK receptor CL-42/47.11) (p58.1 MHC class-I-specific NK receptor) (CD antigen CD158a),Cell membrane,"gamma-delta T cell;innate lymphoid cell;natural killer cell;CD16-negative, CD56-bright natural killer cell, human;CD16-positive, CD56-dim natural killer cell, human;decidual natural killer cell, human",MHC-I
KIR3DL1,,,,no,0.019,0.009,217,100,-1.147,ENSG00000167633,Killer cell immunoglobulin-like receptor 3DL1 (CD158 antigen-like family member E) (HLA-BW4-specific inhibitory NK cell receptor) (Natural killer-associated transcript 3) (NKAT-3) (p70 natural killer cell receptor clones CL-2/CL-11) (p70 NK receptor CL-2/CL-11) (CD antigen CD158e),Cell membrane,"effector memory CD8-positive, alpha-beta T cell, terminally differentiated;gamma-delta T cell;mature gamma-delta T cell;innate lymphoid cell;natural killer cell;CD16-negative, CD56-bright natural killer cell, human;CD16-positive, CD56-dim natural killer cell, human",MHC-I
KLRC1,,,,no,0.134,0.177,1530,2072,0.409,ENSG00000134545,NKG2-A/NKG2-B type II integral membrane protein (CD159 antigen-like family member A) (NK cell receptor A) (NKG2-A/B-activating NK receptor) (CD antigen CD159a),Cell membrane,"lymphocyte;CD8-positive, alpha-beta T cell;activated CD8-positive, alpha-beta T cell;CD8-positive, alpha-beta cytokine secreting effector T cell;CD8-positive, alpha-beta memory T cell;effector memory CD8-positive, alpha-beta T cell, terminally differentiated;central memory CD8-positive, alpha-beta T cell;CD8-alpha-beta-positive, alpha-beta intraepithelial T cell;mature NK T cell;type I NK T cell;gamma-delta T cell;mature gamma-delta T cell;intraepithelial lymphocyte;innate lymphoid cell;natural killer cell;CD16-negative, CD56-bright natural killer cell, human;CD16-positive, CD56-dim natural killer cell, human;decidual natural killer cell, human;ILC1, human;group 3 innate lymphoid cell",MHC-I
KLRC2,,,,no,0.021,,235,0,,ENSG00000205809,NKG2-C type II integral membrane protein (CD159 antigen-like family member C) (NK cell receptor C) (NKG2-C-activating NK receptor) (CD antigen CD159c),Cell membrane,"CD8-positive, alpha-beta T cell;CD8-positive, alpha-beta cytotoxic T cell;CD8-positive, alpha-beta memory T cell;effector memory CD8-positive, alpha-beta T cell, terminally differentiated;CD8-positive, alpha-beta memory T cell, CD45RO-positive;effector memory CD8-positive, alpha-beta T cell;CD8-alpha-beta-positive, alpha-beta intraepithelial T cell;mature NK T cell;gamma-delta T cell;mature gamma-delta T cell;CD8-alpha alpha positive, gamma-delta intraepithelial T cell;intraepithelial lymphocyte;innate lymphoid cell;natural killer cell;CD16-negative, CD56-bright natural killer cell, human;CD16-positive, CD56-dim natural killer cell, human;decidual natural killer cell, human;ILC1, human",MHC-I
KLRK1,,,,no,0.252,0.379,2884,4433,0.591,ENSG00000213809,NKG2-D type II integral membrane protein (Killer cell lectin-like receptor subfamily K member 1) (NK cell receptor D) (NKG2-D-activating NK receptor) (CD antigen CD314),Cell membrane,"leukocyte;mononuclear cell;lymphocyte;T cell;alpha-beta T cell;mature alpha-beta T cell;CD4-positive, alpha-beta cytotoxic T cell;CD8-positive, alpha-beta T cell;CD8-positive, alpha-beta cytotoxic T cell;naive thymus-derived CD8-positive, alpha-beta T cell;CD8-positive, alpha-beta memory T cell;effector memory CD8-positive, alpha-beta T cell, terminally differentiated;CD8-positive, alpha-beta memory T cell, CD45RO-positive;central memory CD8-positive, alpha-beta T cell;effector memory CD8-positive, alpha-beta T cell;effector CD8-positive, alpha-beta T cell;mature NK T cell;mucosal invariant T cell;gamma-delta T cell;mature T cell;memory T cell;naive T cell;cytotoxic T cell;double negative T regulatory cell;innate lymphoid cell;natural killer cell;CD16-negative, CD56-bright natural killer cell, human;CD16-positive, CD56-dim natural killer cell, human;ILC1, human",MHC-I;NKG2D
LILRB1,,,,no,0.775,1.517,8874,17721,0.969,ENSG00000104972,Leukocyte immunoglobulin-like receptor subfamily B member 1 (LIR-1) (Leukocyte immunoglobulin-like receptor 1) (CD85 antigen-like family member J) (Immunoglobulin-like transcript 2) (ILT-2) (Monocyte/macrophage immunoglobulin-like receptor 7) (MIR-7) (CD antigen CD85j),Cell membrane,"myeloid leukocyte;monocyte;non-classical monocyte;CD14-low, CD16-positive monocyte;CD14-positive monocyte;CD14-positive, CD16-positive monocyte;intermediate monocyte;mature NK T cell;myeloid cell",MHC-I
LILRB2,,,,no,0.349,0.519,3995,6059,0.572,ENSG00000131042,Leukocyte immunoglobulin-like receptor subfamily B member 2 (LIR-2) (Leukocyte immunoglobulin-like receptor 2) (CD85 antigen-like family member D) (Immunoglobulin-like transcript 4) (ILT-4) (Monocyte/macrophage immunoglobulin-like receptor 10) (MIR-10) (CD antigen CD85d),Cell membrane,"phagocyte;colon macrophage;classical monocyte;CD14-positive, CD16-negative classical monocyte;hematopoietic cell;leukocyte;dendritic cell;conventional dendritic cell;myeloid leukocyte;monocyte;non-classical monocyte;CD14-low, CD16-positive monocyte;CD14-positive monocyte;CD14-positive, CD16-positive monocyte;intermediate monocyte;mononuclear cell;mature NK T cell;peripheral blood mononuclear cell;myeloid cell",MHC-I
MICA,,,,no,1.492,1.625,17090,18982,0.123,ENSG00000204520,MHC class I polypeptide-related sequence A (MIC-A),Cell membrane,,MHC-I
MICB,,,,no,0.433,0.421,4956,4921,-0.039,ENSG00000204516,MHC class I polypeptide-related sequence B (MIC-B),Cell membrane,,MHC-I
NLRC5,,,,no,1.404,2.182,16081,25498,0.636,ENSG00000140853,Protein NLRC5 (Caterpiller protein 16.1) (CLR16.1) (Nucleotide-binding oligomerization domain protein 27) (Nucleotide-binding oligomerization domain protein 4),Cytoplasm,,
TAP1,,,,no,4.706,5.339,53892,62390,0.182,ENSG00000168394,Antigen peptide transporter 1 (APT1),Endoplasmic reticulum membrane,"leukocyte;CD141-positive myeloid dendritic cell;myeloid dendritic cell, human;plasmablast;mononuclear cell;alpha-beta T cell;mature alpha-beta T cell;T-helper 17 cell;activated CD4-positive, alpha-beta T cell;activated CD8-positive, alpha-beta T cell;mucosal invariant T cell;mature T cell;exhausted T cell;pre-conventional dendritic cell",
TAP2,,,,no,3.737,4.715,42805,55098,0.335,ENSG00000204267,Antigen peptide transporter 2 (APT2),Endoplasmic reticulum membrane,CD141-positive myeloid dendritic cell,
ULBP2,,,,no,0.144,0.074,1645,865,-0.956,ENSG00000131015,UL16-binding protein 2 (ALCAN-alpha) (NKG2D ligand 2) (N2DL-2) (NKG2DL2) (Retinoic acid early transcript 1H),Cell membrane,,MHC-I
