gene,category,rationale,exclude_recommended,in_5K_reference,gene_id,full_name,location,cell_type,cellchat_pathway,detection_pct_0041323,detection_pct_0041326,det_max,n_cells_0041323,n_cells_0041326,log2_detection_ratio
ANPEP,,,no,True,ENSG00000166825,Aminopeptidase N (AP-N) (hAPN),Cell membrane,intestinal crypt stem cell of small intestine;ciliated epithelial cell;enterocyte;enterocyte of epithelium of large intestine;enterocyte of colon;enterocyte of epithelium of small intestine;enterocyte of epithelium proper of ileum;intrahepatic cholangiocyte;columnar/cuboidal epithelial cell;pancreatic acinar cell;enteroendocrine cell of small intestine;M cell of gut;intestinal epithelial cell;epithelial cell of large intestine;colon epithelial cell;epithelial cell of small intestine;respiratory epithelial cell;epithelial cell of lower respiratory tract;club cell;transit amplifying cell of small intestine,,59.817,58.898,59.817,685081,688203,-0.022
ANXA2,,,no,True,ENSG00000182718,Annexin A2 (Annexin II) (Annexin-2) (Calpactin I heavy chain) (Calpactin-1 heavy chain) (Chromobindin-8) (Lipocortin II) (Placental anticoagulant protein IV) (PAP-IV) (Protein I) (p36),Secreted,basal cell of epithelium of bronchus;pancreatic ductal cell;epithelial cell of alveolus of lung;pneumocyte;type I pneumocyte;bronchial epithelial cell;epithelial cell of urethra;conjunctival epithelial cell;T cell,,39.275,44.388,44.388,449817,518659,0.177
ANXA3,,,no,True,ENSG00000138772,"Annexin A3 (35-alpha calcimedin) (Annexin III) (Annexin-3) (Inositol 1,2-cyclic phosphate 2-phosphohydrolase) (Lipocortin III) (Placental anticoagulant protein III) (PAP-III)",,pancreatic ductal cell;epithelial cell of lung;epithelial cell of alveolus of lung;pneumocyte;type I pneumocyte;epithelial cell of uterus;immature neutrophil;myelocyte;tracheobronchial serous cell,,11.643,10.303,11.643,133343,120384,-0.176
AQP5,,,no,True,ENSG00000161798,Aquaporin-5 (AQP-5),Apical cell membrane,respiratory basal cell;basal cell of epithelium of trachea;epithelial cell;epithelial cell of lacrimal sac;glandular epithelial cell;goblet cell;respiratory goblet cell;tracheal goblet cell;acinar cell of salivary gland;duodenum glandular cell;respiratory epithelial cell;epithelial cell of lower respiratory tract;club cell;epithelial cell of sweat gland;conjunctival epithelial cell;tracheobronchial serous cell;serous cell of epithelium of trachea;serous cell of epithelium of bronchus,,0.12,0.059,0.12,1377,688,-1.03
AQP8,,,no,True,ENSG00000103375,Aquaporin-8 (AQP-8),Cell membrane,pancreatic acinar cell;acinar cell,,23.06,30.156,30.156,264108,352363,0.387
ATF4,,,no,True,ENSG00000128272,Cyclic AMP-dependent transcription factor ATF-4 (cAMP-dependent transcription factor ATF-4) (Activating transcription factor 4) (Cyclic AMP-responsive element-binding protein 2) (CREB-2) (cAMP-responsive element-binding protein 2) (Tax-responsive enhancer element-binding protein 67) (TaxREB67),Nucleus,pancreatic PP cell;pancreatic acinar cell;PP cell,,51.875,47.634,51.875,594118,556593,-0.123
ATP1A1,,,no,True,ENSG00000163399,Sodium/potassium-transporting ATPase subunit alpha-1 (Na(+)/K(+) ATPase alpha-1 subunit),Basolateral cell membrane,intestinal crypt stem cell of small intestine;enterocyte of epithelium of small intestine;pancreatic ductal cell;intrahepatic cholangiocyte;epithelial cell of alveolus of lung;pneumocyte;type II pneumocyte;pulmonary ionocyte;microfold cell of epithelium of small intestine;epithelial cell of small intestine;kidney distal convoluted tubule epithelial cell;macula densa epithelial cell;kidney loop of Henle ascending limb epithelial cell;kidney loop of Henle thick ascending limb epithelial cell;kidney loop of Henle medullary thick ascending limb epithelial cell;kidney loop of Henle cortical thick ascending limb epithelial cell;kidney loop of Henle thin ascending limb epithelial cell;kidney loop of Henle epithelial cell;ionocyte;transit amplifying cell of small intestine;serous cell of epithelium of trachea;lung secretory cell,,56.009,55.094,56.009,641463,643760,-0.024
BACE1,,,no,True,ENSG00000186318,Beta-secretase 1,Cell membrane,pancreatic acinar cell;acinar cell,,21.772,20.142,21.772,249355,235357,-0.112
BNIP3,,,no,True,ENSG00000176171,BCL2/adenovirus E1B 19 kDa protein-interacting protein 3,Mitochondrion;Mitochondrion outer membrane,pancreatic acinar cell;cortical thymic epithelial cell;ovarian surface epithelial cell;glycinergic neuron,,27.04,17.418,27.04,309692,203522,-0.635
CAV2,,,no,True,ENSG00000105971,Caveolin-2,Nucleus;Cytoplasm;Golgi apparatus membrane,pancreatic ductal cell;myoepithelial cell;myoepithelial cell of mammary gland;endothelial cell of artery;capillary endothelial cell;mesothelial cell of pleura;type I pneumocyte;bronchial smooth muscle cell;brown fat cell;adipocyte of breast,,5.932,5.385,5.932,67943,62928,-0.14
CD151,,,no,True,ENSG00000177697,CD151 antigen (GP27) (Membrane glycoprotein SFA-1) (Platelet-endothelial tetraspan antigen 3) (PETA-3) (Tetraspanin-24) (Tspan-24) (CD antigen CD151),Membrane,pancreatic ductal cell;myometrial cell;bronchial smooth muscle cell,,17.06,15.549,17.06,195386,181686,-0.134
CD44,,,no,True,ENSG00000026508,CD44 antigen (CDw44) (Epican) (Extracellular matrix receptor III) (ECMR-III) (GP90 lymphocyte homing/adhesion receptor) (HUTCH-I) (Heparan sulfate proteoglycan) (Hermes antigen) (Hyaluronate receptor) (Phagocytic glycoprotein 1) (PGP-1) (Phagocytic glycoprotein I) (PGP-I) (CD antigen CD44),Cell membrane,intestinal crypt stem cell of large intestine;pancreatic ductal cell;pancreatic acinar cell;elicited macrophage;alternatively activated macrophage;hematopoietic cell;granulocyte;leukocyte;myeloid leukocyte;mast cell;B cell;myeloid cell;early T lineage precursor;fibroblast of breast,MIF;SPP1;GALECTIN;COLLAGEN;FN1;LAMININ;SELE,47.499,46.665,47.499,544000,545266,-0.026
CD59,,,no,True,ENSG00000085063,CD59 glycoprotein (1F5 antigen) (20 kDa homologous restriction factor) (HRF-20) (HRF20) (MAC-inhibitory protein) (MAC-IP) (MEM43 antigen) (Membrane attack complex inhibition factor) (MACIF) (Membrane inhibitor of reactive lysis) (MIRL) (Protectin) (CD antigen CD59),Cell membrane,pancreatic ductal cell;blood vessel endothelial cell;vein endothelial cell;capillary endothelial cell;lung microvascular endothelial cell;prostate gland microvascular endothelial cell;lung endothelial cell;endothelial cell of vascular tree;epithelial cell of urethra;fibroblast of breast;serous cell of epithelium of trachea,,16.947,12.598,16.947,194095,147205,-0.428
CFTR,,,no,True,ENSG00000001626,Cystic fibrosis transmembrane conductance regulator (CFTR) (ATP-binding cassette sub-family C member 7) (Channel conductance-controlling ATPase),Apical cell membrane,intestinal crypt stem cell of colon;pancreatic ductal cell;cholangiocyte;columnar/cuboidal epithelial cell;pulmonary ionocyte;lung goblet cell;bronchial goblet cell;paneth cell of epithelium of small intestine;duodenum glandular cell;periportal region hepatocyte;M cell of gut;ionocyte,,29.856,32.182,32.182,341934,376037,0.108
CLDN1,,,no,True,ENSG00000163347,Claudin-1 (Senescence-associated epithelial membrane protein),Cell junction,basal cell of epidermis;stem cell of epidermis;pancreatic ductal cell;intrahepatic cholangiocyte;epithelial cell of lacrimal sac;mesothelial cell of pleura;corneal epithelial cell;epithelial cell of urethra;conjunctival epithelial cell,CLDN,21.44,14.895,21.44,245550,174040,-0.526
COL18A1,,,no,True,ENSG00000182871,Collagen alpha-1(XVIII) chain,Secreted,pancreatic ductal cell;kidney loop of Henle thin ascending limb epithelial cell,,13.111,15.849,15.849,150159,185186,0.274
CTRL,,,no,True,ENSG00000141086,Chymotrypsin-like protease CTRL-1,,pancreatic acinar cell;glandular epithelial cell;acinar cell,,28.326,31.947,31.947,324416,373291,0.174
CUZD1,,,no,True,ENSG00000138161,CUB and zona pellucida-like domain-containing protein 1 (CUB and ZP domain-containing protein 1) (Transmembrane protein UO-44),Zymogen granule membrane,pancreatic acinar cell;glandular epithelial cell;acinar cell,,79.374,68.247,79.374,909062,797443,-0.218
CXCL6,,,no,True,ENSG00000124875,C-X-C motif chemokine 6 (Chemokine alpha 3) (CKA-3) (Granulocyte chemotactic protein 2) (GCP-2) (Small-inducible cytokine B6),Secreted,pancreatic ductal cell;intrahepatic cholangiocyte;epithelial cell of prostate;basal cell of prostate epithelium;club cell,CXCL,3.505,1.098,3.505,40148,12824,-1.675
DUSP23,,,no,True,ENSG00000158716,Dual specificity protein phosphatase 23,Cytoplasm,retinal blood vessel endothelial cell;lung microvascular endothelial cell;lung endothelial cell;pancreatic acinar cell;acinar cell of salivary gland;endothelial cell of uterus;Cajal-Retzius cell;salivary gland cell;tracheobronchial serous cell;serous cell of epithelium of trachea,,8.709,10.035,10.035,99744,117252,0.204
EPHB6,,,no,True,ENSG00000106123,Ephrin type-B receptor 6 (HEP) (Tyrosine-protein kinase-defective receptor EPH-6),Membrane,pancreatic ductal cell,EPHB,4.772,4.568,4.772,54653,53378,-0.063
ERP27,,,no,True,ENSG00000139055,Endoplasmic reticulum resident protein 27 (ER protein 27) (ERp27) (Inactive protein disulfide-isomerase 27),Endoplasmic reticulum lumen,kidney collecting duct intercalated cell;type B pancreatic cell;pancreatic acinar cell;acinar cell;parietal epithelial cell,,52.01,45.698,52.01,595668,533963,-0.187
FKBP11,,,no,True,ENSG00000134285,Peptidyl-prolyl cis-trans isomerase FKBP11 (PPIase FKBP11),Membrane,pancreatic acinar cell;acinar cell;plasmablast;plasma cell;IgG plasma cell;IgM plasma cell;IgA plasma cell;osteoblast;tracheobronchial serous cell,,15.625,14.172,15.625,178955,165594,-0.141
HES4,,,no,True,ENSG00000188290,Transcription factor HES-4 (hHES4) (Class B basic helix-loop-helix protein 42) (bHLHb42) (Hairy and enhancer of split 4) (bHLH factor Hes4),Nucleus,duct epithelial cell;pancreatic ductal cell;luminal epithelial cell of mammary gland;paneth cell of colon;urothelial cell;bladder urothelial cell;respiratory epithelial cell;epithelial cell of lower respiratory tract;club cell;cerebral cortex endothelial cell;mammary gland epithelial cell;vascular associated smooth muscle cell;bronchial smooth muscle cell;monocyte;pro-T cell;fibroblast of connective tissue of nonglandular part of prostate;mural cell;bladder cell,,0.953,1.054,1.054,10918,12315,0.145
HEXB,,,no,True,ENSG00000049860,Beta-hexosaminidase subunit beta,Lysosome,pancreatic ductal cell;alveolar macrophage;lung macrophage;placental villous trophoblast;syncytiotrophoblast cell,,19.526,16.191,19.526,223634,189184,-0.27
HNF1B,,,no,True,ENSG00000275410,Hepatocyte nuclear factor 1-beta (HNF-1-beta) (HNF-1B) (Homeoprotein LFB3) (Transcription factor 2) (TCF-2) (Variant hepatic nuclear factor 1) (vHNF1),Nucleus,kidney collecting duct epithelial cell;kidney collecting duct principal cell;kidney loop of Henle ascending limb epithelial cell;kidney loop of Henle thick ascending limb epithelial cell;kidney loop of Henle thin ascending limb epithelial cell;kidney epithelial cell;parietal epithelial cell;kidney cortex tubule cell;kidney connecting tubule epithelial cell;epithelial cell of nephron;kidney loop of Henle epithelial cell;kidney loop of Henle thin descending limb epithelial cell;kidney cell,,11.215,17.919,17.919,128449,209380,0.676
HPGDS,,,no,True,ENSG00000163106,Hematopoietic prostaglandin D synthase (H-PGDS),Cytoplasm,"pancreatic ductal cell;brush cell;intestinal tuft cell;tuft cell of colon;Hofbauer cell;granulocyte;basophil;eosinophil;mast cell;group 2 innate lymphoid cell;megakaryocyte-erythroid progenitor cell;erythroid progenitor cell, mammalian;basophil mast progenitor cell;hematopoietic multipotent progenitor cell",,0.362,0.298,0.362,4150,3479,-0.283
LAD1,,,no,True,ENSG00000159166,Ladinin-1 (Lad-1) (Linear IgA disease antigen) (LADA),Secreted,pancreatic ductal cell;keratinocyte;stratified epithelial cell;epidermal cell,,14.243,16.255,16.255,163123,189940,0.191
MUC1,,,no,True,ENSG00000185499,Mucin-1 (MUC-1) (Breast carcinoma-associated antigen DF3) (Cancer antigen 15-3) (CA 15-3) (Carcinoma-associated mucin) (Episialin) (H23AG) (Krebs von den Lungen-6) (KL-6) (PEMT) (Peanut-reactive urinary mucin) (PUM) (Polymorphic epithelial mucin) (PEM) (Tumor-associated epithelial membrane antigen) (EMA) (Tumor-associated mucin) (CD antigen CD227),Apical cell membrane,goblet cell;respiratory goblet cell;tracheal goblet cell;fallopian tube secretory epithelial cell;duodenum glandular cell;respiratory epithelial cell;epithelial cell of lower respiratory tract;club cell;kidney loop of Henle thin ascending limb epithelial cell;serous cell of epithelium of trachea,,7.475,10.505,10.505,85610,122752,0.491
MUC5B,,,no,True,ENSG00000117983,"Mucin-5B (MUC-5B) (Cervical mucin) (High molecular weight salivary mucin MG1) (Mucin-5 subtype B, tracheobronchial) (Sublingual gland mucin)",Secreted,intestinal crypt stem cell of colon;lung goblet cell;intestine goblet cell;large intestine goblet cell;colon goblet cell;brush cell of trachebronchial tree;epithelial cell of large intestine;club cell;tracheobronchial serous cell;serous cell of epithelium of trachea,,0.182,0.262,0.262,2079,3064,0.531
P4HB,,,no,True,ENSG00000185624,Protein disulfide-isomerase (PDI),Endoplasmic reticulum,epithelial cell of alveolus of lung;pneumocyte;type II pneumocyte;pancreatic acinar cell;acinar cell;microfold cell of epithelium of small intestine;tracheobronchial serous cell;serous cell of epithelium of bronchus;lung secretory cell,GALECTIN,79.5,71.201,79.5,910512,831959,-0.159
PABPC4,,,no,True,ENSG00000090621,Polyadenylate-binding protein 4 (PABP-4) (Poly(A)-binding protein 4) (Activated-platelet protein 1) (APP-1) (Inducible poly(A)-binding protein) (iPABP),Cytoplasm,intestinal crypt stem cell of large intestine;pancreatic acinar cell;acinar cell;IgA plasma cell,,37.964,42.059,42.059,434796,491449,0.148
PDIA2,,,no,True,ENSG00000185615,Protein disulfide-isomerase A2,Endoplasmic reticulum lumen,pancreatic acinar cell;glandular epithelial cell;paneth cell;acinar cell;duodenum glandular cell,,38.416,31.583,38.416,439979,369042,-0.283
PDX1,,,no,True,ENSG00000139515,Pancreas/duodenum homeobox protein 1 (PDX-1) (Glucose-sensitive factor) (GSF) (Insulin promoter factor 1) (IPF-1) (Insulin upstream factor 1) (IUF-1) (Islet/duodenum homeobox-1) (IDX-1) (Somatostatin-transactivating factor 1) (STF-1),Nucleus;Cytoplasm,pancreatic ductal cell;pancreatic endocrine cell;type B pancreatic cell,,1.183,0.885,1.183,13551,10342,-0.419
RAB9A,,,no,True,ENSG00000123595,Ras-related protein Rab-9A,Cell membrane,pancreatic ductal cell,,8.145,5.234,8.145,93288,61156,-0.638
SDC4,,,no,True,ENSG00000124145,Syndecan-4 (SYND4) (Amphiglycan) (Ryudocan core protein),Secreted,duct epithelial cell;pancreatic ductal cell;luminal epithelial cell of mammary gland;myoepithelial cell;myoepithelial cell of mammary gland;mammary gland epithelial cell;serous cell of epithelium of trachea,ANGPTL;MK;PTN;COLLAGEN;FN1;THBS;TENASCIN,16.859,13.533,16.859,193090,158133,-0.317
SEL1L,,,no,True,ENSG00000071537,Protein sel-1 homolog 1 (Suppressor of lin-12-like protein 1) (Sel-1L),Endoplasmic reticulum membrane,pancreatic acinar cell;acinar cell;IgG plasmablast;IgA plasmablast;plasma cell;IgA plasma cell,,51.009,45.792,51.009,584204,535067,-0.156
SERPINA5,,,no,True,ENSG00000188488,Plasma serine protease inhibitor (Acrosomal serine protease inhibitor) (Plasminogen activator inhibitor 3) (PAI-3) (PAI3) (Protein C inhibitor) (PCI) (Serpin A5),Secreted,duct epithelial cell;pancreatic ductal cell;intrahepatic cholangiocyte;Sertoli cell;mesothelial cell;kidney distal convoluted tubule epithelial cell;Leydig cell,,22.016,19.428,22.016,252150,227015,-0.18
SERPINI2,,,no,True,ENSG00000114204,Serpin I2 (Myoepithelium-derived serine protease inhibitor) (Pancpin) (Pancreas-specific protein TSA2004) (Peptidase inhibitor 14) (PI-14),Secreted,pancreatic acinar cell;glandular epithelial cell;acinar cell,,27.597,26.728,27.597,316063,312313,-0.046
SFRP5,,,no,True,ENSG00000120057,Secreted frizzled-related protein 5 (sFRP-5) (Frizzled-related protein 1b) (FRP-1b) (Secreted apoptosis-related protein 3) (SARP-3),Secreted,pancreatic ductal cell;double negative thymocyte,,12.137,14.818,14.818,139005,173150,0.288
SLC3A1,,,no,True,ENSG00000138079,"Amino acid transporter heavy chain SLC3A1 (D2h) (Neutral and basic amino acid transport protein) (NBAT) (Solute carrier family 3 member 1) (b(0,+)-type amino acid transporter-related heavy chain) (rBAT)",Cell membrane,ciliated epithelial cell;epithelial cell of proximal tubule;pancreatic ductal cell;columnar/cuboidal epithelial cell;kidney loop of Henle ascending limb epithelial cell;kidney loop of Henle thick ascending limb epithelial cell;kidney loop of Henle thin ascending limb epithelial cell;kidney epithelial cell;kidney cortex tubule cell;epithelial cell of nephron;kidney loop of Henle epithelial cell;kidney cell,,7.891,2.336,7.891,90376,27295,-1.756
SNHG8,,,no,True,ENSG00000269893,,,hematopoietic stem cell;pancreatic acinar cell;basophil mast progenitor cell,,1.544,0.378,1.544,17684,4413,-2.032
SOD3,,,no,True,ENSG00000109610,Extracellular superoxide dismutase [Cu-Zn] (EC-SOD),Secreted,pancreatic ductal cell;duodenum glandular cell;kidney loop of Henle thin ascending limb epithelial cell;smooth muscle cell;vascular associated smooth muscle cell;myometrial cell;tracheobronchial smooth muscle cell;bronchial smooth muscle cell;decidual cell;keratocyte;reticular cell;pulmonary interstitial fibroblast;skin fibroblast;fibroblast of connective tissue of glandular part of prostate;chondrocyte;inflammatory cell,,3.889,2.758,3.889,44537,32231,-0.495
SOX9,,,no,True,ENSG00000125398,Transcription factor SOX-9,Nucleus,intestinal crypt stem cell of large intestine;intrahepatic cholangiocyte;Sertoli cell;duodenum glandular cell;brush cell;intestinal tuft cell;tuft cell of colon;forebrain radial glial cell;chondrocyte;serous cell of epithelium of trachea,,15.268,17.427,17.427,174867,203625,0.191
SPATS2L,,,no,True,ENSG00000196141,SPATS2-like protein (DNA polymerase-transactivated protein 6) (Stress granule and nucleolar protein) (SGNP),Cytoplasm,pancreatic ductal cell;cholangiocyte;intrahepatic cholangiocyte,,20.301,16.493,20.301,232505,192718,-0.3
SPHK1,,,no,True,ENSG00000176170,Sphingosine kinase 1 (SK 1) (SPK 1),Cytoplasm,pancreatic ductal cell;vein endothelial cell;endothelial cell of umbilical vein;endothelial cell of lymphatic vessel;pancreatic stellate cell;fibroblast of mammary gland;fibroblast of breast,,4.308,5.795,5.795,49341,67714,0.428
TEX11,,,no,True,ENSG00000120498,Testis-expressed protein 11 (Protein ZIP4 homolog) (ZIP4H),Chromosome,pancreatic acinar cell;acinar cell,,0.092,0.018,0.092,1055,205,-2.392
TFPI2,,,no,True,ENSG00000105825,Tissue factor pathway inhibitor 2 (TFPI-2) (Placental protein 5) (PP5),Secreted,pancreatic ductal cell;squamous epithelial cell;blood vessel endothelial cell;vein endothelial cell;endothelial cell of umbilical vein;glomerular capillary endothelial cell;mesothelial cell of pleura;epithelial cell of uterus;basal cell of prostate epithelium;trophoblast giant cell;fibroblast of connective tissue of glandular part of prostate,,10.26,8.219,10.26,117505,96041,-0.32
TMEM97,,,no,True,ENSG00000109084,Sigma intracellular receptor 2 (Sigma-2 receptor) (Sigma2 receptor) (Meningioma-associated protein 30) (Transmembrane protein 97),Nucleus membrane,Sertoli cell;mesothelial cell;pancreatic acinar cell;Leydig cell,,26.078,25.324,26.078,298668,295899,-0.042
TNFRSF12A,,,no,True,ENSG00000006327,Tumor necrosis factor receptor superfamily member 12A (Fibroblast growth factor-inducible immediate-early response protein 14) (FGF-inducible 14) (Tweak-receptor) (TweakR) (CD antigen CD266),Membrane,duct epithelial cell;pancreatic ductal cell;luminal epithelial cell of mammary gland;mesothelial cell of pleura;pancreatic D cell;epithelial cell of prostate;basal cell of prostate epithelium;mammary gland epithelial cell;epithelial cell of urethra;fibroblast of connective tissue of glandular part of prostate,TWEAK,10.928,7.394,10.928,125158,86399,-0.564
TRPV6,,,no,True,ENSG00000165125,Transient receptor potential cation channel subfamily V member 6 (TrpV6) (CaT-like) (CaT-L) (Calcium transport protein 1) (CaT1) (Epithelial calcium channel 2) (ECaC2),Cell membrane,pancreatic ductal cell,,10.835,9.779,10.835,124087,114264,-0.148
VTCN1,,,no,True,ENSG00000134258,V-set domain-containing T-cell activation inhibitor 1 (B7 homolog 4) (B7-H4) (B7h.5) (Immune costimulatory protein B7-H4) (Protein B7S1) (T-cell costimulatory molecule B7x),Cell membrane,duct epithelial cell;pancreatic ductal cell;luminal epithelial cell of mammary gland,,5.141,5.264,5.264,58881,61508,0.034
