gene,category,rationale,exclude_recommended,in_5K_reference,gene_id,full_name,location,cell_type,cellchat_pathway,detection_pct_0041323,detection_pct_0041326,det_max,n_cells_0041323,n_cells_0041326,log2_detection_ratio
ABCA1,,,no,True,ENSG00000165029,Phospholipid-transporting ATPase ABCA1,Cell membrane,hepatocyte;periportal region hepatocyte;midzonal region hepatocyte;centrilobular region hepatocyte;alternatively activated macrophage;Kupffer cell;immature innate lymphoid cell;medium spiny neuron;connective tissue cell;fibroblast;hepatic stellate cell;fibroblast of lung;mesothelial fibroblast;fat cell;white fat cell;brown fat cell;epicardial adipocyte,ApoA,4.024,9.526,9.526,46086,111313,1.243
ABCC4,,,no,True,ENSG00000125257,ATP-binding cassette sub-family C member 4,Basolateral cell membrane,kidney collecting duct intercalated cell;renal intercalated cell;renal alpha-intercalated cell;luminal cell of prostate epithelium;tissue-resident macrophage;central nervous system macrophage;enucleate erythrocyte;epidermal Langerhans cell,,1.253,1.428,1.428,14351,16690,0.189
ABCG1,,,no,True,ENSG00000160179,ATP-binding cassette sub-family G member 1,Endoplasmic reticulum membrane,alveolar macrophage;lung macrophage,,1.01,1.901,1.901,11562,22217,0.913
ABI3,,,no,True,ENSG00000108798,ABI gene family member 3 (New molecule including SH3) (Nesh),Cytoplasm,"colon macrophage;Langerhans cell;non-classical monocyte;CD14-low, CD16-positive monocyte;CD14-positive, CD16-positive monocyte;CD8-alpha-beta-positive, alpha-beta intraepithelial T cell;peripheral blood mononuclear cell;pre-conventional dendritic cell",,2.192,3.035,3.035,25102,35467,0.47
ACHE,,,no,True,ENSG00000087085,Acetylcholinesterase (AChE),Synapse,medullary thymic epithelial cell;follicular dendritic cell,,0.76,0.781,0.781,8703,9128,0.04
ACP5,,,no,True,ENSG00000102575,Tartrate-resistant acid phosphatase type 5 (TR-AP),Lysosome,macrophage;tissue-resident macrophage;alveolar macrophage;colon macrophage;lung macrophage;mononuclear phagocyte;osteoclast;basophil;professional antigen presenting cell;Langerhans cell;intermediate monocyte;mononuclear cell;lymphocyte;B cell,,0.357,0.405,0.405,4090,4731,0.181
ADA,,,no,True,ENSG00000196839,Adenosine deaminase,Cell membrane,"bone marrow cell;granulocyte monocyte progenitor cell;immature alpha-beta T cell;double-positive, alpha-beta thymocyte;immature T cell;thymocyte;double negative thymocyte;late pro-B cell;common dendritic progenitor;macrophage dendritic cell progenitor;hematopoietic precursor cell;hematopoietic multipotent progenitor cell;early lymphoid progenitor;lymphoid lineage restricted progenitor cell;pro-B cell;fraction A pre-pro B cell;pro-T cell;early T lineage precursor;common lymphoid progenitor",,1.192,1.529,1.529,13652,17862,0.359
ADAM17,,,no,True,ENSG00000151694,Disintegrin and metalloproteinase domain-containing protein 17 (ADAM 17),Membrane,alveolar macrophage;lung macrophage,,4.807,4.935,4.935,55055,57662,0.038
ADAM28,,,no,True,ENSG00000042980,Disintegrin and metalloproteinase domain-containing protein 28 (ADAM 28),Secreted,basal cell of epithelium of trachea;lung goblet cell;macrophage;tissue-resident macrophage;central nervous system macrophage;microglial cell;mature microglial cell;professional antigen presenting cell;memory B cell;unswitched memory B cell;class switched memory B cell,,0.421,0.986,0.986,4827,11525,1.227
ADAM8,,,no,True,ENSG00000151651,Disintegrin and metalloproteinase domain-containing protein 8 (ADAM 8),Membrane,"blood cell;granulocyte;basophil;eosinophil;conventional dendritic cell;Langerhans cell;myeloid dendritic cell, human;ILC1, human",,1.243,2.199,2.199,14233,25691,0.823
ADAMDEC1,,,no,True,ENSG00000134028,ADAM DEC1,Secreted,mononuclear phagocyte;smooth muscle fiber of ileum;myofibroblast cell;mesenchymal cell,,0.138,0.105,0.138,1586,1226,-0.4
ADGRE2,,,no,True,ENSG00000127507,Adhesion G protein-coupled receptor E2 (EGF-like module receptor 2) (EGF-like module-containing mucin-like hormone receptor-like 2) (CD antigen CD312),Cell membrane,granulocyte;Langerhans cell,ADGRE,0.872,1.211,1.211,9984,14149,0.474
ADGRE5,,,no,True,ENSG00000123146,Adhesion G protein-coupled receptor E5 (Leukocyte antigen CD97) (CD antigen CD97),Cell membrane,"alveolar macrophage;lung macrophage;non-classical monocyte;CD14-low, CD16-positive monocyte;CD14-positive, CD16-positive monocyte;T-helper 1 cell;mature NK T cell;CD16-negative, CD56-bright natural killer cell, human;CD16-positive, CD56-dim natural killer cell, human;decidual natural killer cell, human;group 3 innate lymphoid cell;peripheral blood mononuclear cell",ADGRE,12.141,11.433,12.141,139049,133592,-0.087
ADM,,,no,True,ENSG00000148926,Pro-adrenomedullin,Secreted,glomerular capillary endothelial cell;trophoblast giant cell;extravillous trophoblast;myeloid cell;fibroblast of breast;white fat cell,CALCR;ADM,2.236,1.678,2.236,25611,19603,-0.415
AHCY,,,no,True,ENSG00000101444,Adenosylhomocysteinase (AdoHcyase),Cytoplasm,macrophage dendritic cell progenitor,,27.863,22.805,27.863,319108,266476,-0.289
ALDH2,,,no,True,ENSG00000111275,"Aldehyde dehydrogenase, mitochondrial",Mitochondrion matrix,"microfold cell of epithelium of small intestine;alveolar macrophage;lung macrophage;myeloid dendritic cell, human",,14.451,12.373,14.451,165503,144576,-0.224
ALDOA,,,no,True,ENSG00000149925,Fructose-bisphosphate aldolase A,Cytoplasm,osteoclast;myeloid leukocyte;myeloid cell;rod bipolar cell;OFF-bipolar cell;glycinergic neuron,,8.833,8.515,8.833,101165,99499,-0.053
ALOX5,,,no,True,ENSG00000012779,Polyunsaturated fatty acid 5-lipoxygenase,Cytoplasm,brush cell;intestinal tuft cell;tuft cell of colon;macrophage;tissue-resident macrophage;alveolar macrophage;lung macrophage;basophil;eosinophil;Langerhans cell;B-1b B cell;mast cell,,4.407,4.796,4.796,50476,56036,0.122
ALYREF,,,no,True,ENSG00000183684,THO complex subunit 4 (Tho4) (Ally of AML-1 and LEF-1) (Aly/REF export factor) (Transcriptional coactivator Aly/REF) (bZIP-enhancing factor BEF),Nucleus,DN4 thymocyte;erythroid progenitor cell;proerythroblast;common dendritic progenitor;hematopoietic precursor cell;myeloid lineage restricted progenitor cell,,7.56,8.181,8.181,86586,95597,0.114
AMFR,,,no,True,ENSG00000159461,E3 ubiquitin-protein ligase AMFR,Endoplasmic reticulum membrane,"kidney collecting duct intercalated cell;phagocyte;classical monocyte;CD14-positive, CD16-negative classical monocyte;monocyte;CD14-positive monocyte;CD14-positive, CD16-positive monocyte;CD8-positive, alpha-beta T cell;mature gamma-delta T cell;megakaryocyte",,9.498,8.472,9.498,108777,98996,-0.165
ANKRD44,,,no,True,ENSG00000065413,Serine/threonine-protein phosphatase 6 regulatory ankyrin repeat subunit B (PP6-ARS-B) (Serine/threonine-protein phosphatase 6 regulatory subunit ARS-B) (Ankyrin repeat domain-containing protein 44),,tissue-resident macrophage;Kupffer cell;central nervous system macrophage;mature microglial cell;melanocyte of skin,,1.379,1.947,1.947,15799,22749,0.497
ANP32E,,,no,True,ENSG00000143401,Acidic leucine-rich nuclear phosphoprotein 32 family member E (LANP-like protein) (LANP-L),Cytoplasm,"double-positive, alpha-beta thymocyte;T-helper 17 cell;DN4 thymocyte;CD34-positive, CD56-positive, CD117-positive common innate lymphoid precursor, human;fraction A pre-pro B cell;myeloid lineage restricted progenitor cell",,4.221,3.748,4.221,48345,43789,-0.172
ANXA5,,,no,True,ENSG00000164111,Annexin A5 (Anchorin CII) (Annexin V) (Annexin-5) (Calphobindin I) (CPB-I) (Endonexin II) (Lipocortin V) (Placental anticoagulant protein 4) (PP4) (Placental anticoagulant protein I) (PAP-I) (Thromboplastin inhibitor) (Vascular anticoagulant-alpha) (VAC-alpha),,skeletal muscle satellite stem cell;pancreatic PP cell;PP cell;ovarian surface epithelial cell;elicited macrophage;alternatively activated macrophage;myeloid leukocyte;myeloid cell;fibroblast of mammary gland;fibroblast of connective tissue of glandular part of prostate;fibroblast of breast,,36.744,27.541,36.744,420822,321811,-0.416
AOAH,,,no,True,ENSG00000136250,Acyloxyacyl hydrolase,Secreted,"macrophage;tissue-resident macrophage;Kupffer cell;central nervous system macrophage;microglial cell;mature microglial cell;hematopoietic cell;leukocyte;myeloid leukocyte;activated CD8-positive, alpha-beta T cell;innate lymphoid cell;CD16-positive, CD56-dim natural killer cell, human;immature innate lymphoid cell;myeloid cell",,0.894,2.817,2.817,10237,32916,1.656
APEX1,,,no,True,ENSG00000100823,DNA-(apurinic or apyrimidinic site) endonuclease,Nucleus,glioblast;Schwann cell precursor;bone marrow cell;granulocyte monocyte progenitor cell;professional antigen presenting cell;dendritic cell;common dendritic progenitor;macrophage dendritic cell progenitor;basophil mast progenitor cell;hematopoietic multipotent progenitor cell;early lymphoid progenitor;early T lineage precursor,,16.68,16.64,16.68,191030,194432,-0.003
ARF6,,,no,True,ENSG00000165527,ADP-ribosylation factor 6,Cytoplasm,"epithelial cell of urethra;CD141-positive myeloid dendritic cell;myeloid dendritic cell, human;alpha-beta T cell;mature alpha-beta T cell;mucosal invariant T cell;mature T cell;decidual natural killer cell, human",,11.185,8.344,11.185,128105,97494,-0.423
ARRB2,,,no,True,ENSG00000141480,Beta-arrestin-2 (Arrestin beta-2) (Non-visual arrestin-3),Cytoplasm;Nucleus;Cell membrane;Membrane,"phagocyte;classical monocyte;CD14-positive, CD16-negative classical monocyte;granulocyte;neutrophil;dendritic cell;conventional dendritic cell;myeloid dendritic cell;CD1c-positive myeloid dendritic cell;myeloid leukocyte;monocyte;non-classical monocyte;CD14-low, CD16-positive monocyte;CD14-positive monocyte;CD14-positive, CD16-positive monocyte;myeloid cell",,9.204,10.614,10.614,105415,124023,0.206
ATIC,,,no,True,ENSG00000138363,Bifunctional purine biosynthesis protein ATIC (AICAR transformylase/inosine monophosphate cyclohydrolase) (ATIC),Cytoplasm,macrophage dendritic cell progenitor,,10.254,10.1,10.254,117438,118013,-0.022
ATM,,,no,True,ENSG00000149311,Serine-protein kinase ATM,Nucleus,"central nervous system macrophage;mononuclear cell;lymphocyte;T cell;alpha-beta T cell;mature alpha-beta T cell;CD8-positive, alpha-beta cytokine secreting effector T cell;mucosal invariant T cell;mature T cell",,9.108,10.276,10.276,104310,120077,0.174
AXL,,,no,True,ENSG00000167601,Tyrosine-protein kinase receptor UFO,Cell membrane,"endosteal cell;CD14-positive, CD16-negative classical monocyte;myeloid dendritic cell, human;dendritic cell, human;reticular cell;tendon cell;inflammatory cell",GAS;PROS;TULP,3.909,3.951,3.951,44774,46171,0.015
BANK1,,,no,True,ENSG00000153064,B-cell scaffold protein with ankyrin repeats,,professional antigen presenting cell;mature B cell;memory B cell;unswitched memory B cell;class switched memory B cell;IgG memory B cell;IgG-negative class switched memory B cell;naive B cell;B-1b B cell;follicular B cell;germinal center B cell;mononuclear cell;lymphocyte;B cell;immature B cell;transitional stage B cell;plasma cell,,0.233,0.132,0.233,2664,1543,-0.817
BATF3,,,no,True,ENSG00000123685,Basic leucine zipper transcriptional factor ATF-like 3 (B-ATF-3) (21 kDa small nuclear factor isolated from T-cells) (Jun dimerization protein p21SNFT),Nucleus,"hematopoietic cell;blood cell;granulocyte;CD141-positive myeloid dendritic cell;activated CD4-positive, alpha-beta T cell;activated CD8-positive, alpha-beta T cell;pre-conventional dendritic cell",,0.311,0.386,0.386,3567,4512,0.31
BCL11A,,,no,True,ENSG00000119866,B-cell lymphoma/leukemia 11A (BCL-11A) (B-cell CLL/lymphoma 11A) (COUP-TF-interacting protein 1) (Ecotropic viral integration site 9 protein homolog) (EVI-9) (Zinc finger protein 856),Cytoplasm,"plasmacytoid dendritic cell;plasmacytoid dendritic cell, human;dendritic cell, human;common dendritic progenitor;hematopoietic multipotent progenitor cell;early lymphoid progenitor;common lymphoid progenitor;Purkinje cell",,2.776,2.232,2.776,31797,26079,-0.315
BCL2A1,,,no,True,ENSG00000140379,Bcl-2-related protein A1 (Bcl-2-like protein 5) (Bcl2-L-5) (Hemopoietic-specific early response protein) (Protein BFL-1) (Protein GRS),Cytoplasm,"phagocyte;macrophage;elicited macrophage;inflammatory macrophage;alternatively activated macrophage;colon macrophage;lung macrophage;classical monocyte;CD14-positive, CD16-negative classical monocyte;follicular dendritic cell;hematopoietic cell;blood cell;granulocyte;neutrophil;leukocyte;professional antigen presenting cell;myeloid dendritic cell, human;myeloid leukocyte;monocyte;non-classical monocyte;CD14-low, CD16-positive monocyte;CD14-positive monocyte;CD14-positive, CD16-positive monocyte;myeloid cell;myelocyte",,0.333,0.358,0.358,3817,4187,0.105
BID,,,no,True,ENSG00000015475,BH3-interacting domain death agonist (p22 BID) (BID),Cytoplasm,"CD141-positive myeloid dendritic cell;myeloid dendritic cell, human;non-classical monocyte;pre-conventional dendritic cell",,1.289,0.952,1.289,14758,11120,-0.437
BLK,,,no,True,ENSG00000136573,Tyrosine-protein kinase Blk,Cell membrane,professional antigen presenting cell;mature B cell;memory B cell;unswitched memory B cell;class switched memory B cell;IgG memory B cell;IgG-negative class switched memory B cell;naive B cell;B-1a B cell;B-1b B cell;follicular B cell;germinal center B cell;B cell;immature B cell;transitional stage B cell,,0.026,0.046,0.046,295,540,0.843
BLNK,,,no,True,ENSG00000095585,B-cell linker protein (B-cell adapter containing a SH2 domain protein) (B-cell adapter containing a Src homology 2 domain protein) (Cytoplasmic adapter protein) (Src homology 2 domain-containing leukocyte protein of 65 kDa) (SLP-65),Cytoplasm,central nervous system macrophage;B-1a B cell;late pro-B cell;early lymphoid progenitor;pro-B cell;fraction A pre-pro B cell,,1.718,1.959,1.959,19674,22888,0.189
BLVRA,,,no,True,ENSG00000106605,Biliverdin reductase A (BVR A),Cytoplasm,alveolar macrophage;lung macrophage;Hofbauer cell,,4.683,5.118,5.118,53632,59801,0.128
BMP2K,,,no,True,ENSG00000138756,BMP-2-inducible protein kinase (BIKe),Nucleus,lens epithelial cell;anterior lens cell;macrophage;tissue-resident macrophage;Kupffer cell;central nervous system macrophage;enucleate erythrocyte;mast cell;immature innate lymphoid cell,,4.076,4.833,4.833,46679,56475,0.246
BRCA2,,,no,True,ENSG00000139618,Breast cancer type 2 susceptibility protein (Fanconi anemia group D1 protein),Nucleus,common dendritic progenitor,,0.506,0.309,0.506,5797,3612,-0.711
C1QBP,,,no,True,ENSG00000108561,"Complement component 1 Q subcomponent-binding protein, mitochondrial (ASF/SF2-associated protein p32) (Glycoprotein gC1qBP) (C1qBP) (Hyaluronan-binding protein 1) (Mitochondrial matrix protein p32) (gC1q-R protein) (p33) (SF2AP32)",Mitochondrion matrix,erythroid progenitor cell;proerythroblast;macrophage dendritic cell progenitor;pre-conventional dendritic cell,,21.567,16.001,21.567,247001,186964,-0.431
C3AR1,,,no,True,ENSG00000171860,C3a anaphylatoxin chemotactic receptor (C3AR) (C3a-R),Cell membrane,phagocyte;macrophage;elicited macrophage;alternatively activated macrophage;tissue-resident macrophage;alveolar macrophage;microglial cell;colon macrophage;lung macrophage;hematopoietic cell;blood cell;granulocyte;leukocyte;professional antigen presenting cell;myeloid leukocyte;myeloid cell;myelocyte;granulocytopoietic cell,COMPLEMENT,1.863,1.889,1.889,21333,22070,0.02
C5AR1,,,no,True,ENSG00000197405,C5a anaphylatoxin chemotactic receptor 1 (C5a anaphylatoxin chemotactic receptor) (C5a-R) (C5aR) (CD antigen CD88),Cell membrane,"phagocyte;macrophage;elicited macrophage;inflammatory macrophage;alternatively activated macrophage;alveolar macrophage;lung macrophage;classical monocyte;hematopoietic cell;granulocyte;neutrophil;leukocyte;professional antigen presenting cell;myeloid leukocyte;monocyte;non-classical monocyte;CD14-low, CD16-positive monocyte;CD14-positive monocyte;CD14-positive, CD16-positive monocyte;intermediate monocyte;myeloid cell",COMPLEMENT,2.776,3.289,3.289,31795,38435,0.245
CALM3,,,no,True,ENSG00000160014,Calmodulin-3,Cytoplasm,pancreatic A cell;Hofbauer cell;platelet;T-helper 17 cell;large pre-B-II cell;myeloid cell;megakaryocyte-erythroid progenitor cell;megakaryocyte,,16.504,14.013,16.504,189023,163741,-0.236
CAMP,,,no,True,ENSG00000164047,Cathelicidin antimicrobial peptide (18 kDa cationic antimicrobial protein) (CAP-18) (hCAP-18),Secreted,acinar cell;acinar cell of salivary gland;brush cell;hematopoietic cell;blood cell;granulocyte;neutrophil;immature neutrophil;leukocyte;myeloid leukocyte;myeloid cell;promyelocyte;myelocyte;myeloid lineage restricted progenitor cell;granulocytopoietic cell,,0.04,,0.04,459,0,
CASP1,,,no,True,ENSG00000137752,Caspase-1 (CASP-1),Cytoplasm,"classical monocyte;CD14-positive, CD16-negative classical monocyte;hematopoietic cell;leukocyte;professional antigen presenting cell;dendritic cell;conventional dendritic cell;myeloid dendritic cell;CD1c-positive myeloid dendritic cell;dendritic cell, human;myeloid leukocyte;monocyte;non-classical monocyte;CD14-low, CD16-positive monocyte;CD14-positive monocyte;CD14-positive, CD16-positive monocyte;peripheral blood mononuclear cell;myeloid cell;transit amplifying cell of small intestine",,1.174,2.209,2.209,13447,25806,0.912
CAT,,,no,True,ENSG00000121691,Catalase,Peroxisome,"hematopoietic stem cell;epithelial cell of alveolus of lung;pneumocyte;type II pneumocyte;erythrocyte;enucleate erythrocyte;erythroid lineage cell;erythroid progenitor cell, mammalian;reticulocyte;enucleated reticulocyte;primitive red blood cell;common myeloid progenitor;lung secretory cell",,11.301,8.698,11.301,129427,101630,-0.378
CAVIN3,,,no,True,ENSG00000170955,Caveolae-associated protein 3 (Cavin-3) (Protein kinase C delta-binding protein) (Serum deprivation response factor-related gene product that binds to C-kinase) (hSRBC),Cytoplasm,vasa recta descending limb cell;cerebral cortex endothelial cell;endosteal cell;follicular dendritic cell;smooth muscle cell;vascular associated smooth muscle cell;smooth muscle fiber of ileum;myometrial cell;bronchial smooth muscle cell;reticular cell;pancreatic stellate cell,,2.744,2.901,2.901,31423,33900,0.081
CCDC50,,,no,True,ENSG00000152492,Coiled-coil domain-containing protein 50 (Protein Ymer),Cytoplasm,"professional antigen presenting cell;dendritic cell;plasmacytoid dendritic cell;plasmacytoid dendritic cell, human;dendritic cell, human;B-1a B cell;common dendritic progenitor",,13.095,14.881,14.881,149974,173877,0.184
CCL17,,,no,True,ENSG00000102970,C-C motif chemokine 17 (CC chemokine TARC) (Small-inducible cytokine A17) (Thymus and activation-regulated chemokine),Secreted,"mononuclear phagocyte;myeloid dendritic cell, human",CCL,0.019,0.015,0.019,213,173,-0.329
CCL18,,,no,True,ENSG00000275385,C-C motif chemokine 18 (Alternative macrophage activation-associated CC chemokine 1) (AMAC-1) (CC chemokine PARC) (Dendritic cell chemokine 1) (DC-CK1) (Macrophage inflammatory protein 4) (MIP-4) (Pulmonary and activation-regulated chemokine) (Small-inducible cytokine A18),Secreted,macrophage;alternatively activated macrophage;tissue-resident macrophage;alveolar macrophage;lung macrophage;basophil;professional antigen presenting cell,CCL,0.053,0.023,0.053,604,266,-1.212
CCL19,,,no,True,ENSG00000172724,C-C motif chemokine 19 (Beta-chemokine exodus-3) (CK beta-11) (Epstein-Barr virus-induced molecule 1 ligand chemokine) (EBI1 ligand chemokine) (ELC) (Macrophage inflammatory protein 3 beta) (MIP-3-beta) (Small-inducible cytokine A19),Secreted,epithelial cell of thymus;cortical thymic epithelial cell;medullary thymic epithelial cell;follicular dendritic cell;smooth muscle cell of prostate;connective tissue cell;fibroblast;fibroblast of lung;pericyte;mural cell;inflammatory cell,CCL,0.2,1.36,1.36,2292,15887,2.764
CCL20,,,no,True,ENSG00000115009,C-C motif chemokine 20 (Beta-chemokine exodus-1) (CC chemokine LARC) (Liver and activation-regulated chemokine) (Macrophage inflammatory protein 3 alpha) (MIP-3-alpha) (Small-inducible cytokine A20),Secreted,epithelial cell of alveolus of lung;pneumocyte;type II pneumocyte;paneth cell;M cell of gut;club cell;epithelial cell of urethra;inflammatory macrophage;T-helper 1 cell;lung secretory cell,CCL,0.279,0.211,0.279,3197,2468,-0.402
CCL22,,,no,True,ENSG00000102962,C-C motif chemokine 22 (CC chemokine STCP-1) (MDC(1-69)) (Macrophage-derived chemokine) (Small-inducible cytokine A22) (Stimulated T-cell chemotactic protein 1),Secreted,"Langerhans cell;myeloid dendritic cell, human;mature conventional dendritic cell;type I NK T cell",CCL,0.037,0.014,0.037,420,163,-1.394
CCR1,,,no,True,ENSG00000163823,C-C chemokine receptor type 1 (C-C CKR-1) (CC-CKR-1) (CCR-1) (CCR1) (HM145) (LD78 receptor) (Macrophage inflammatory protein 1-alpha receptor) (MIP-1alpha-R) (RANTES-R) (CD antigen CD191),Cell membrane,phagocyte;elicited macrophage;alternatively activated macrophage;intermediate monocyte,CCL,1.713,1.335,1.713,19624,15598,-0.36
CCR2,,,no,True,ENSG00000121807,C-C chemokine receptor type 2 (C-C CKR-2) (CC-CKR-2) (CCR-2) (CCR2) (Monocyte chemoattractant protein 1 receptor) (MCP-1-R) (CD antigen CD192),Cell membrane,classical monocyte;IgG plasmablast;IgA plasmablast;monocyte,CCL,0.497,1.363,1.363,5697,15929,1.454
CCR6,,,no,True,ENSG00000112486,C-C chemokine receptor type 6 (C-C CKR-6) (CC-CKR-6) (CCR-6) (Chemokine receptor-like 3) (CKR-L3) (DRY6) (G-protein coupled receptor 29) (GPR-CY4) (GPRCY4) (LARC receptor) (CD antigen CD196),Cell membrane,"Langerhans cell;T cell;CD4-positive helper T cell;T-helper 1 cell;T-helper 17 cell;activated CD4-positive, alpha-beta T cell, human;CD4-positive, alpha-beta memory T cell;effector memory CD4-positive, alpha-beta T cell;mucosal invariant T cell;memory T cell;regulatory T cell;group 3 innate lymphoid cell",CCL,0.059,0.094,0.094,672,1101,0.683
CCR7,,,no,True,ENSG00000126353,C-C chemokine receptor type 7 (C-C CKR-7) (CC-CKR-7) (CCR-7) (BLR2) (CDw197) (Epstein-Barr virus-induced G-protein coupled receptor 1) (EBI1) (EBV-induced G-protein coupled receptor 1) (MIP-3 beta receptor) (CD antigen CD197),Cell membrane,"leukocyte;myeloid dendritic cell, human;mature conventional dendritic cell;IgG-negative class switched memory B cell;B-1a B cell;mononuclear cell;lymphocyte;T cell;alpha-beta T cell;mature alpha-beta T cell;CD4-positive, alpha-beta T cell;CD4-positive, CD25-positive, alpha-beta regulatory T cell;naive regulatory T cell;naive thymus-derived CD4-positive, alpha-beta T cell;activated CD4-positive, alpha-beta T cell;activated CD4-positive, alpha-beta T cell, human;CD4-positive, alpha-beta memory T cell;effector CD4-positive, alpha-beta T cell;naive thymus-derived CD8-positive, alpha-beta T cell;mature T cell;regulatory T cell;naive T cell;DN3 thymocyte",CCL,0.018,0.011,0.018,210,127,-0.754
CCT8,,,no,True,ENSG00000156261,T-complex protein 1 subunit theta (TCP-1-theta) (CCT-theta) (Chaperonin containing T-complex polypeptide 1 subunit 8) (Renal carcinoma antigen NY-REN-15),Cytoplasm,professional antigen presenting cell;dendritic cell;basophil mast progenitor cell;early lymphoid progenitor,,30.394,27.923,30.394,348097,326267,-0.122
CD14,,,no,True,ENSG00000170458,Monocyte differentiation antigen CD14 (Myeloid cell-specific leucine-rich glycoprotein) (CD antigen CD14),Cell membrane,"acinar cell of salivary gland;phagocyte;macrophage;elicited macrophage;inflammatory macrophage;alternatively activated macrophage;microglial cell;kidney resident macrophage;colon macrophage;Hofbauer cell;classical monocyte;CD14-positive, CD16-negative classical monocyte;blood cell;granulocyte;dendritic cell, human;myeloid leukocyte;monocyte;CD14-positive monocyte;CD14-positive, CD16-positive monocyte;intermediate monocyte;myeloid cell;salivary gland cell",,6.434,7.258,7.258,73687,84803,0.174
CD163,,,no,True,ENSG00000177575,Scavenger receptor cysteine-rich type 1 protein M130 (Hemoglobin scavenger receptor) (CD antigen CD163),Secreted,"phagocyte;macrophage;elicited macrophage;inflammatory macrophage;alternatively activated macrophage;tissue-resident macrophage;Kupffer cell;alveolar macrophage;colon macrophage;lung macrophage;Hofbauer cell;mononuclear phagocyte;classical monocyte;hematopoietic cell;leukocyte;professional antigen presenting cell;dendritic cell, human;myeloid leukocyte;monocyte;CD14-positive, CD16-positive monocyte;intermediate monocyte;immature innate lymphoid cell;myeloid cell",,4.466,4.626,4.626,51145,54049,0.051
CD19,,,no,True,ENSG00000177455,B-lymphocyte antigen CD19 (B-lymphocyte surface antigen B4) (Differentiation antigen CD19) (T-cell surface antigen Leu-12) (CD antigen CD19),Cell membrane,professional antigen presenting cell;mature B cell;memory B cell;unswitched memory B cell;class switched memory B cell;IgG memory B cell;naive B cell;B-1a B cell;B-1b B cell;follicular B cell;germinal center B cell;mononuclear cell;lymphocyte;regulatory T cell;B cell;immature B cell;precursor B cell;small pre-B-II cell;large pre-B-II cell;pre-B-I cell;late pro-B cell;transitional stage B cell;early T lineage precursor,,0.078,0.132,0.132,897,1538,0.749
CD1A,,,no,True,ENSG00000158477,T-cell surface glycoprotein CD1a (T-cell surface antigen T6/Leu-6) (hTa1 thymocyte antigen) (CD antigen CD1a),Cell membrane,"Langerhans cell;alpha-beta T cell;immature alpha-beta T cell;double-positive, alpha-beta thymocyte;CD8-alpha-alpha-positive, alpha-beta intraepithelial T cell;intraepithelial lymphocyte;immature T cell;thymocyte;double negative thymocyte",,0.034,0.01,0.034,389,113,-1.812
