FCGR2A,,,no,True,ENSG00000143226,Low affinity immunoglobulin gamma Fc region receptor II-a (IgG Fc receptor II-a) (CDw32) (Fc-gamma RII-a) (Fc-gamma-RIIa) (FcRII-a) (CD antigen CD32),Cell membrane,"phagocyte;macrophage;elicited macrophage;inflammatory macrophage;alternatively activated macrophage;alveolar macrophage;microglial cell;colon macrophage;lung macrophage;CD14-positive, CD16-negative classical monocyte;hematopoietic cell;blood cell;granulocyte;neutrophil;leukocyte;professional antigen presenting cell;myeloid leukocyte;monocyte;CD14-positive, CD16-positive monocyte;myeloid cell",,3.357,3.777,3.777,38445,44137,0.17
FCGR2B,,,no,True,ENSG00000072694,Low affinity immunoglobulin gamma Fc region receptor II-b (IgG Fc receptor II-b) (CDw32) (Fc-gamma RII-b) (Fc-gamma-RIIb) (FcRII-b) (CD antigen CD32),Cell membrane,"alternatively activated macrophage;colon macrophage;basophil;professional antigen presenting cell;dendritic cell;conventional dendritic cell;Langerhans cell;CD1c-positive myeloid dendritic cell;dendritic cell, human;unswitched memory B cell",,0.251,0.606,0.606,2873,7078,1.272
FCGR3B,,,no,True,ENSG00000162747,Low affinity immunoglobulin gamma Fc region receptor III-B (Fc-gamma RIII-beta) (CD16-I) (Fc-gamma RIII) (Fc-gamma RIIIb) (FcRIII) (FcRIIIb) (FcR-10) (IgG Fc receptor III-1) (CD antigen CD16b),Cell membrane,blood cell;granulocyte;neutrophil;myelocyte;granulocytopoietic cell,,1.18,0.869,1.18,13519,10152,-0.442
FCN1,,,no,True,ENSG00000085265,Ficolin-1 (Collagen/fibrinogen domain-containing protein 1) (Ficolin-A) (Ficolin-alpha) (M-ficolin),Secreted,"phagocyte;colon macrophage;classical monocyte;CD14-positive, CD16-negative classical monocyte;hematopoietic cell;blood cell;granulocyte;neutrophil;immature neutrophil;leukocyte;dendritic cell;conventional dendritic cell;myeloid dendritic cell;CD1c-positive myeloid dendritic cell;dendritic cell, human;myeloid leukocyte;monocyte;non-classical monocyte;CD14-low, CD16-positive monocyte;CD14-positive monocyte;CD14-positive, CD16-positive monocyte;intermediate monocyte;mononuclear cell;mature NK T cell;peripheral blood mononuclear cell;myeloid cell;promonocyte;promyelocyte;myelocyte;hematopoietic precursor cell;myeloid lineage restricted progenitor cell;granulocytopoietic cell",,0.158,0.296,0.296,1808,3459,0.907
FGR,,,no,True,ENSG00000000938,Tyrosine-protein kinase Fgr,Cell membrane,"phagocyte;classical monocyte;CD14-positive, CD16-negative classical monocyte;hematopoietic cell;granulocyte;neutrophil;leukocyte;dendritic cell;conventional dendritic cell;myeloid dendritic cell;CD1c-positive myeloid dendritic cell;myeloid leukocyte;monocyte;non-classical monocyte;CD14-low, CD16-positive monocyte;CD14-positive monocyte;CD14-positive, CD16-positive monocyte;intermediate monocyte;mononuclear cell;decidual natural killer cell, human;CD34-positive, CD56-positive, CD117-positive common innate lymphoid precursor, human;peripheral blood mononuclear cell;myeloid cell;promonocyte",,0.67,0.773,0.773,7671,9035,0.207
FLOT2,,,no,True,ENSG00000132589,Flotillin-2 (Epidermal surface antigen) (ESA) (Membrane component chromosome 17 surface marker 1),Cell membrane,granulocyte;neutrophil,,14.003,14.234,14.234,160372,166318,0.024
FPR1,,,no,True,ENSG00000171051,fMet-Leu-Phe receptor (fMLP receptor) (N-formyl peptide receptor) (FPR) (N-formylpeptide chemoattractant receptor),Cell membrane,"phagocyte;macrophage;alveolar macrophage;microglial cell;lung macrophage;classical monocyte;CD14-positive, CD16-negative classical monocyte;blood cell;granulocyte;neutrophil;immature neutrophil;leukocyte;professional antigen presenting cell;myeloid leukocyte;monocyte;CD14-positive monocyte;CD14-positive, CD16-positive monocyte;intermediate monocyte;myeloid cell",ANNEXIN;TAFA;CTSG,0.751,0.982,0.982,8596,11474,0.388
FPR2,,,no,True,ENSG00000171049,N-formyl peptide receptor 2 (FMLP-related receptor I) (FMLP-R-I) (Formyl peptide receptor-like 1) (HM63) (Lipoxin A4 receptor) (LXA4 receptor) (RFP),Cell membrane,blood cell;granulocyte;neutrophil;myelocyte,ANNEXIN;SAA;LXA4,0.223,0.127,0.223,2558,1486,-0.812
FUT4,,,no,True,ENSG00000196371,"Alpha-(1,3)-fucosyltransferase 4 (4-galactosyl-N-acetylglucosaminide 3-alpha-L-fucosyltransferase)",Golgi apparatus,promyelocyte;granulocytopoietic cell,,3.995,3.115,3.995,45759,36396,-0.359
GATA1,,,no,True,ENSG00000102145,Erythroid transcription factor (Eryf1) (GATA-binding factor 1) (GATA-1) (GF-1) (NF-E1 DNA-binding protein),Nucleus,"hematopoietic stem cell;blood cell;eosinophil;erythrocyte;megakaryocyte-erythroid progenitor cell;megakaryocyte;erythroid lineage cell;erythroid progenitor cell;erythroid progenitor cell, mammalian;proerythroblast;reticulocyte;enucleated reticulocyte;primitive red blood cell;basophil mast progenitor cell;hematopoietic precursor cell;hematopoietic multipotent progenitor cell;myeloid lineage restricted progenitor cell;granulocytopoietic cell;common myeloid progenitor",,0.019,0.012,0.019,217,142,-0.641
GATA2,,,no,True,ENSG00000179348,Endothelial transcription factor GATA-2 (GATA-binding protein 2),Nucleus,"hematopoietic stem cell;extravillous trophoblast;granulocyte;basophil;eosinophil;mast cell;mucosal type mast cell;megakaryocyte-erythroid progenitor cell;megakaryocyte;erythroid progenitor cell;erythroid progenitor cell, mammalian;basophil mast progenitor cell;hematopoietic multipotent progenitor cell",,2.307,4.203,4.203,26419,49109,0.866
GRN,,,no,True,ENSG00000030582,Progranulin (PGRN) (Acrogranin) (Epithelin precursor) (Glycoprotein of 88 Kda) (GP88) (Glycoprotein 88) (Granulin precursor) (PC cell-derived growth factor) (PCDGF) (Proepithelin) (PEPI),Secreted,"pancreatic A cell;alveolar macrophage;colon macrophage;lung macrophage;Hofbauer cell;classical monocyte;CD14-positive, CD16-negative classical monocyte;osteoclast;granulocyte;dendritic cell;conventional dendritic cell;myeloid dendritic cell;myeloid dendritic cell, human;CD1c-positive myeloid dendritic cell;dendritic cell, human;myeloid cell",GRN,12.503,14.058,14.058,143198,164261,0.169
HBG1,,,no,True,ENSG00000213934,Hemoglobin subunit gamma-1 (Gamma-1-globin) (Hb F Agamma) (Hemoglobin gamma-1 chain) (Hemoglobin gamma-A chain),,hepatoblast;endocardial cell;blood cell;eosinophil;erythrocyte;enucleate erythrocyte;erythroid lineage cell;proerythroblast;reticulocyte;erythroblast;primitive red blood cell;promyelocyte;myeloid lineage restricted progenitor cell,,0.032,,0.032,362,0,
HCAR3,,,no,True,ENSG00000255398,Hydroxycarboxylic acid receptor 3 (G-protein coupled receptor 109B) (G-protein coupled receptor HM74) (G-protein coupled receptor HM74B) (Niacin receptor 2) (Nicotinic acid receptor 2),Cell membrane,stem cell of epidermis;epithelial cell of prostate;basal cell of prostate epithelium;medullary thymic epithelial cell;basophil,,0.031,0.021,0.031,360,242,-0.602
HCK,,,no,True,ENSG00000101336,Tyrosine-protein kinase HCK,Cell membrane,"brush cell;intestinal tuft cell;tuft cell of colon;phagocyte;classical monocyte;CD14-positive, CD16-negative classical monocyte;hematopoietic cell;granulocyte;leukocyte;myeloid leukocyte;monocyte;non-classical monocyte;CD14-low, CD16-positive monocyte;CD14-positive monocyte;CD14-positive, CD16-positive monocyte;peripheral blood mononuclear cell;myeloid cell",,1.351,1.907,1.907,15473,22278,0.497
HDAC2,,,no,True,ENSG00000196591,Histone deacetylase 2 (HD2),Nucleus,glioblast;Schwann cell precursor;neural crest cell;basophil mast progenitor cell;enteric neuron,,14.86,13.099,14.86,170186,153060,-0.182
HDC,,,no,True,ENSG00000140287,Histidine decarboxylase (HDC),,"granulocyte;basophil;eosinophil;mast cell;erythroid progenitor cell, mammalian;basophil mast progenitor cell;granulocytopoietic cell;neuron",,0.064,0.092,0.092,729,1080,0.538
HLX,,,no,True,ENSG00000136630,H2.0-like homeobox protein (Homeobox protein HB24) (Homeobox protein HLX1),Nucleus,mesodermal cell;immature neutrophil,,1.969,1.932,1.969,22549,22572,-0.027
HMGA1,,,no,True,ENSG00000137309,High mobility group protein HMG-I/HMG-Y (HMG-I(Y)) (High mobility group AT-hook protein 1) (High mobility group protein A1) (High mobility group protein R),Nucleus;Chromosome,endothelial cell of umbilical vein;epithelial cell of urethra;eosinophil;professional antigen presenting cell;dendritic cell;large pre-B-II cell;erythroid progenitor cell;proerythroblast;primitive red blood cell;basophil mast progenitor cell;early lymphoid progenitor;fraction A pre-pro B cell,,5.065,4.995,5.065,58009,58364,-0.02
HMGB2,,,no,True,ENSG00000164104,High mobility group protein B2 (High mobility group protein 2) (HMG-2),Nucleus,"bone marrow cell;granulocyte monocyte progenitor cell;immature alpha-beta T cell;double-positive, alpha-beta thymocyte;large pre-B-II cell;promonocyte;erythroid lineage cell;primitive red blood cell;myelocyte;hematopoietic precursor cell;pro-B cell;fraction A pre-pro B cell;myeloid lineage restricted progenitor cell",,0.558,0.318,0.558,6396,3717,-0.812
HPGD,,,no,True,ENSG00000164120,15-hydroxyprostaglandin dehydrogenase [NAD(+)] (15-PGDH),Cytoplasm,epithelial cell;enterocyte of epithelium of small intestine;lung endothelial cell;type B pancreatic cell;taste receptor cell;paneth cell of epithelium of small intestine;urothelial cell;bladder urothelial cell;epithelial cell of small intestine;endothelial cell;endothelial cell of vascular tree;melanocyte;basophil;eosinophil;mast cell;neuron;bladder cell,,0.212,0.153,0.212,2432,1789,-0.472
HPGDS,,,no,True,ENSG00000163106,Hematopoietic prostaglandin D synthase (H-PGDS),Cytoplasm,"pancreatic ductal cell;brush cell;intestinal tuft cell;tuft cell of colon;Hofbauer cell;granulocyte;basophil;eosinophil;mast cell;group 2 innate lymphoid cell;megakaryocyte-erythroid progenitor cell;erythroid progenitor cell, mammalian;basophil mast progenitor cell;hematopoietic multipotent progenitor cell",,0.362,0.298,0.362,4150,3479,-0.283
HRH2,,,no,True,ENSG00000113749,Histamine H2 receptor (H2R) (HH2R) (Gastric receptor I),Cell membrane,granulocyte;immature neutrophil;connective tissue cell;fibroblast;fibroblast of lung,Histamine,0.389,0.322,0.389,4460,3766,-0.273
HSPD1,,,no,True,ENSG00000144381,"60 kDa heat shock protein, mitochondrial",Mitochondrion matrix,professional antigen presenting cell;dendritic cell;mast cell;mucosal type mast cell;proerythroblast;fibroblast of connective tissue of nonglandular part of prostate;fibroblast of connective tissue of glandular part of prostate,,36.856,35.731,36.856,422107,417503,-0.045
IDO1,,,no,True,ENSG00000131203,"Indoleamine 2,3-dioxygenase 1 (IDO-1)",Cytoplasm,"lens epithelial cell;anterior lens cell;mononuclear phagocyte;hematopoietic cell;blood cell;granulocyte;leukocyte;CD141-positive myeloid dendritic cell;Langerhans cell;myeloid dendritic cell, human;myeloid leukocyte;myeloid cell",,0.041,0.039,0.041,469,458,-0.063
IKZF1,,,no,True,ENSG00000185811,DNA-binding protein Ikaros (Ikaros family zinc finger protein 1) (Lymphoid transcription factor LyF-1),Nucleus,"hematopoietic cell;immature neutrophil;naive regulatory T cell;activated CD4-positive, alpha-beta T cell, human;effector CD4-positive, alpha-beta T cell;CD8-positive, alpha-beta cytokine secreting effector T cell;type I NK T cell;DN3 thymocyte;DN4 thymocyte;immature natural killer cell;common dendritic progenitor;DN1 thymic pro-T cell;common lymphoid progenitor",,1.121,1.479,1.479,12839,17286,0.4
IL13,,,no,True,ENSG00000169194,Interleukin-13 (IL-13),Secreted,"mast cell;activated CD8-positive, alpha-beta T cell;CD8-positive, alpha-beta memory T cell, CD45RO-positive;effector memory CD8-positive, alpha-beta T cell;group 2 innate lymphoid cell",IL4,0.222,0.067,0.222,2538,780,-1.731
IL17RA,,,no,True,ENSG00000177663,Interleukin-17 receptor A (IL-17 receptor A) (IL-17RA) (CDw217) (CD antigen CD217),Secreted,"classical monocyte;CD14-positive, CD16-negative classical monocyte;granulocyte;neutrophil;monocyte;CD14-positive monocyte;promonocyte;myeloid lineage restricted progenitor cell",IL17,3.551,4.276,4.276,40675,49965,0.268
IL18R1,,,no,True,ENSG00000115604,Interleukin-18 receptor 1 (IL-18R-1) (IL-18R1),Membrane,granulocyte;neutrophil;mast cell;group 3 innate lymphoid cell,IL1,0.512,0.345,0.512,5860,4034,-0.568
IL1RL1,,,no,True,ENSG00000115602,Interleukin-1 receptor-like 1,Secreted,vasa recta ascending limb cell;glomerular capillary endothelial cell;capillary endothelial cell;fenestrated cell;glomerular endothelial cell;basophil;eosinophil;mast cell;mucosal type mast cell;group 2 innate lymphoid cell;fibroblast of breast,IL1,1.634,0.204,1.634,18718,2389,-2.999
IL1RN,,,no,True,ENSG00000136689,Interleukin-1 receptor antagonist protein (IL-1RN) (IL-1ra) (IRAP) (ICIL-1RA) (IL1 inhibitor) (Anakinra),Cytoplasm,epithelial cell of stratum germinativum of esophagus;keratinocyte;stratified epithelial cell;epidermal cell;epithelial cell of urethra;conjunctival epithelial cell;hematopoietic cell;blood cell;granulocyte;leukocyte;myeloid leukocyte;myeloid cell,,0.128,0.116,0.128,1466,1354,-0.144
IL3RA,,,no,True,ENSG00000185291,Interleukin-3 receptor subunit alpha (IL-3 receptor subunit alpha) (IL-3R subunit alpha) (IL-3R-alpha) (IL-3RA) (CD antigen CD123),Membrane,"prostate gland microvascular endothelial cell;gut endothelial cell;granulocyte;dendritic cell;plasmacytoid dendritic cell;plasmacytoid dendritic cell, human;dendritic cell, human;common dendritic progenitor",IL4,0.876,1.149,1.149,10030,13420,0.391
IL4,,,no,True,ENSG00000113520,Interleukin-4 (IL-4) (B-cell stimulatory factor 1) (BSF-1) (Binetrakin) (Lymphocyte stimulatory factor 1) (Pitrakinra),Secreted,basophil,IL2;IL4,0.034,0.012,0.034,389,137,-1.534
IL5RA,,,no,True,ENSG00000091181,Interleukin-5 receptor subunit alpha (IL-5 receptor subunit alpha) (IL-5R subunit alpha) (IL-5R-alpha) (IL-5RA) (CDw125) (CD antigen CD125),Membrane,granulocyte;basophil;eosinophil;mast cell;promyelocyte;basophil mast progenitor cell;granulocytopoietic cell,IL4,0.136,0.042,0.136,1552,491,-1.689
IMPDH2,,,no,True,ENSG00000178035,Inosine-5'-monophosphate dehydrogenase 2 (IMP dehydrogenase 2) (IMPD 2) (IMPDH 2),Cytoplasm,"erythroid progenitor cell, mammalian;macrophage dendritic cell progenitor;basophil mast progenitor cell",,41.181,34.871,41.181,471649,407462,-0.24
IQGAP1,,,no,True,ENSG00000140575,Ras GTPase-activating-like protein IQGAP1 (p195),Cell membrane,alternatively activated macrophage;neutrophil;mature conventional dendritic cell;myeloid leukocyte;myeloid cell,,14.685,16.393,16.393,168189,191552,0.159
IRF7,,,no,True,ENSG00000185507,Interferon regulatory factor 7 (IRF-7),Nucleus;Cytoplasm,"bone marrow cell;granulocyte monocyte progenitor cell;professional antigen presenting cell;dendritic cell;plasmacytoid dendritic cell;plasmacytoid dendritic cell, human;dendritic cell, human;activated CD4-positive, alpha-beta T cell, human;activated CD8-positive, alpha-beta T cell, human;IgG plasma cell;common dendritic progenitor",,0.991,0.876,0.991,11346,10237,-0.177
IRF8,,,no,True,ENSG00000140968,Interferon regulatory factor 8 (IRF-8) (Interferon consensus sequence-binding protein) (H-ICSBP) (ICSBP),Nucleus,"bone marrow cell;granulocyte monocyte progenitor cell;leukocyte;professional antigen presenting cell;dendritic cell;plasmacytoid dendritic cell;plasmacytoid dendritic cell, human;CD141-positive myeloid dendritic cell;myeloid dendritic cell, human;dendritic cell, human;mature B cell;memory B cell;B-1b B cell;follicular B cell;germinal center B cell;monocyte;B cell;common dendritic progenitor;macrophage dendritic cell progenitor;pre-conventional dendritic cell;early T lineage precursor",,0.3,0.713,0.713,3433,8331,1.25
ITGA2B,,,no,True,ENSG00000005961,Integrin alpha-IIb (GPalpha IIb) (GPIIb) (Platelet membrane glycoprotein IIb) (CD antigen CD41),Membrane,"hematopoietic stem cell;blood cell;basophil;platelet;megakaryocyte-erythroid progenitor cell;megakaryocyte;erythroid progenitor cell, mammalian;common myeloid progenitor",CD40;FN1;VTN;TENASCIN;VWF,0.037,0.052,0.052,429,603,0.462
ITGA4,,,no,True,ENSG00000115232,Integrin alpha-4 (CD49 antigen-like family member D) (Integrin alpha-IV) (VLA-4 subunit alpha) (CD antigen CD49d),Membrane,"hematopoietic cell;eosinophil;immature natural killer cell;megakaryocyte-erythroid progenitor cell;erythroid progenitor cell;erythroid progenitor cell, mammalian;basophil mast progenitor cell;hematopoietic precursor cell;hematopoietic multipotent progenitor cell;early lymphoid progenitor;common lymphoid progenitor",SPP1;MK;FN1;L1CAM;MADCAM;VCAM,1.285,2.169,2.169,14719,25349,0.755
ITGAM,,,no,True,ENSG00000169896,Integrin alpha-M (CD11 antigen-like family member B) (CR-3 alpha chain) (Cell surface glycoprotein MAC-1 subunit alpha) (Leukocyte adhesion receptor MO1) (Neutrophil adherence receptor) (CD antigen CD11b),Cell membrane,"phagocyte;classical monocyte;CD14-positive, CD16-negative classical monocyte;hematopoietic cell;granulocyte;neutrophil;immature neutrophil;leukocyte;myeloid leukocyte;myelocyte;granulocytopoietic cell",CD40;COMPLEMENT;CD23;GP1BA;ICAM;JAM;THY1,1.411,1.928,1.928,16156,22529,0.451
ITM2A,,,no,True,ENSG00000078596,Integral membrane protein 2A (Protein E25),Membrane,"epithelial cell;endothelial tip cell;retinal blood vessel endothelial cell;capillary endothelial cell;lung microvascular endothelial cell;lung endothelial cell;endothelial cell;endothelial cell of vascular tree;cerebral cortex endothelial cell;endosteal cell;CD8-alpha-alpha-positive, alpha-beta intraepithelial T cell;immature T cell;thymocyte;basophil mast progenitor cell;pro-T cell",,3.408,2.008,3.408,39026,23462,-0.763
IVNS1ABP,,,no,True,ENSG00000116679,Influenza virus NS1A-binding protein (NS1-BP) (NS1-binding protein) (Aryl hydrocarbon receptor-associated protein 3) (Kelch-like protein 39),Cytoplasm,lens epithelial cell;anterior lens cell;kidney distal convoluted tubule epithelial cell;neutrophil;myelocyte,,8.252,8.406,8.406,94508,98216,0.027
KIT,,,no,True,ENSG00000157404,Mast/stem cell growth factor receptor Kit (SCFR),Cytoplasm,"kidney collecting duct intercalated cell;interstitial cell of Cajal;renal intercalated cell;renal alpha-intercalated cell;pulmonary ionocyte;brush cell;brush cell of trachebronchial tree;brush cell of trachea;brush cell of bronchus;intestinal tuft cell;tuft cell of colon;ionocyte;melanocyte of skin;granulocyte;basophil;mast cell;mucosal type mast cell;group 3 innate lymphoid cell;CD34-positive, CD56-positive, CD117-positive common innate lymphoid precursor, human",KIT,0.308,0.525,0.525,3522,6135,0.772
KXD1,,,no,True,ENSG00000105700,KxDL motif-containing protein 1,Lysosome membrane,pancreatic PP cell;PP cell;mast cell;mucosal type mast cell;T cell,,10.059,10.212,10.212,115210,119323,0.022
LIF,,,no,True,ENSG00000128342,Leukemia inhibitory factor (LIF) (Differentiation-stimulating factor) (D factor) (Melanoma-derived LPL inhibitor) (MLPLI) (Emfilermin),Secreted,smooth muscle cell of prostate;mast cell;mucosal type mast cell;group 2 innate lymphoid cell;fibroblast of mammary gland;fibroblast of connective tissue of nonglandular part of prostate;fibroblast of connective tissue of glandular part of prostate;fibroblast of breast,LIFR,1.685,1.118,1.685,19294,13062,-0.592
LILRA2,,,no,True,ENSG00000239998,Leukocyte immunoglobulin-like receptor subfamily A member 2 (CD85 antigen-like family member H) (Immunoglobulin-like transcript 1) (ILT-1) (Leukocyte immunoglobulin-like receptor 7) (LIR-7) (CD antigen CD85h),Cell membrane,"classical monocyte;hematopoietic cell;granulocyte;leukocyte;myeloid leukocyte;monocyte;non-classical monocyte;CD14-positive monocyte;CD14-positive, CD16-positive monocyte;mature NK T cell;myeloid cell;promonocyte;myelocyte",,0.242,0.256,0.256,2767,2996,0.086
LILRA5,,,no,True,ENSG00000187116,Leukocyte immunoglobulin-like receptor subfamily A member 5 (CD85 antigen-like family member F) (Immunoglobulin-like transcript 11) (ILT-11) (Leukocyte immunoglobulin-like receptor 9) (LIR-9) (CD antigen CD85f),Cell membrane,"phagocyte;classical monocyte;CD14-positive, CD16-negative classical monocyte;blood cell;granulocyte;neutrophil;immature neutrophil;leukocyte;Langerhans cell;myeloid leukocyte;monocyte;non-classical monocyte;CD14-low, CD16-positive monocyte;CD14-positive monocyte;CD14-positive, CD16-positive monocyte;intermediate monocyte;mononuclear cell;mature NK T cell;myeloid cell",,0.328,0.279,0.328,3759,3256,-0.236
LILRB3,,,no,True,ENSG00000204577,Leukocyte immunoglobulin-like receptor subfamily B member 3 (LIR-3) (Leukocyte immunoglobulin-like receptor 3) (CD85 antigen-like family member A) (Immunoglobulin-like transcript 5) (ILT-5) (Monocyte inhibitory receptor HL9) (CD antigen CD85a),Cell membrane,"phagocyte;classical monocyte;CD14-positive, CD16-negative classical monocyte;blood cell;granulocyte;neutrophil;immature neutrophil;myeloid leukocyte;monocyte;CD14-positive monocyte;intermediate monocyte;myeloid cell",,0.233,0.607,0.607,2666,7089,1.382
LRRK2,,,no,True,ENSG00000188906,Leucine-rich repeat serine/threonine-protein kinase 2,Cytoplasmic vesicle,epithelial cell of lung;epithelial cell of alveolus of lung;pneumocyte;type II pneumocyte;kidney loop of Henle thin ascending limb epithelial cell;kidney loop of Henle thin descending limb epithelial cell;granulocyte;neutrophil;lung secretory cell,,2.362,2.415,2.415,27057,28221,0.032
LTA4H,,,no,True,ENSG00000111144,Leukotriene A-4 hydrolase (LTA-4 hydrolase),Cytoplasm,"epithelial cell of lung;epithelial cell of alveolus of lung;pneumocyte;type II pneumocyte;phagocyte;alveolar macrophage;lung macrophage;classical monocyte;immature neutrophil;monocyte;CD34-positive, CD56-positive, CD117-positive common innate lymphoid precursor, human;myeloid cell;myelocyte;granulocytopoietic cell;lung secretory cell",,11.736,13.158,13.158,134417,153752,0.165
LYN,,,no,True,ENSG00000254087,Tyrosine-protein kinase Lyn,Cell membrane;Nucleus;Cytoplasm;Cytoplasm,"hematopoietic cell;granulocyte;neutrophil;leukocyte;myeloid leukocyte;non-classical monocyte;CD14-low, CD16-positive monocyte;peripheral blood mononuclear cell;myeloid cell",,5.296,4.418,5.296,60650,51619,-0.262
MAOB,,,no,True,ENSG00000069535,Amine oxidase [flavin-containing] B,Mitochondrion outer membrane,lung neuroendocrine cell;pancreatic A cell;decidual cell;basophil;mast cell,,3.29,4.212,4.212,37685,49218,0.356
MARCO,,,no,True,ENSG00000019169,Macrophage receptor MARCO (Macrophage receptor with collagenous structure) (Scavenger receptor class A member 2),Cell membrane,blood vessel endothelial cell;endothelial cell of lymphatic vessel;phagocyte;macrophage;alternatively activated macrophage;tissue-resident macrophage;alveolar macrophage;lung macrophage;hematopoietic cell;basophil;leukocyte;professional antigen presenting cell;myeloid cell,UGRP1,0.733,0.485,0.733,8392,5662,-0.597
MAX,,,no,True,ENSG00000125952,Protein max (Class D basic helix-loop-helix protein 4) (bHLHd4) (Myc-associated factor X),Nucleus;Cell projection,eosinophil;platelet;megakaryocyte-erythroid progenitor cell;megakaryocyte,,5.721,5.229,5.721,65528,61102,-0.13
MGAM,,,no,True,ENSG00000257335,"Maltase-glucoamylase (Alpha-1,4-glucosidase)",Apical cell membrane,ciliated epithelial cell;enterocyte;enterocyte of epithelium of large intestine;enterocyte of colon;enterocyte of epithelium of small intestine;enterocyte of epithelium proper of ileum;columnar/cuboidal epithelial cell;type L enteroendocrine cell;intestinal epithelial cell;epithelial cell of small intestine;granulocyte;neutrophil,,0.106,0.08,0.106,1212,937,-0.4
MMP8,,,no,True,ENSG00000118113,Neutrophil collagenase,Cytoplasmic granule;Secreted,blood cell;granulocyte;immature neutrophil;myelocyte;granulocytopoietic cell,,0.049,0.015,0.049,556,178,-1.672
MMP9,,,no,True,ENSG00000100985,Matrix metalloproteinase-9 (MMP-9),Secreted,osteoclast;hematopoietic cell;blood cell;granulocyte;neutrophil;immature neutrophil;Langerhans cell;intermediate monocyte;myelocyte;granulocytopoietic cell,,0.037,0.076,0.076,419,884,1.048
MPO,,,no,True,ENSG00000005381,Myeloperoxidase (MPO),Lysosome,bone marrow cell;granulocyte monocyte progenitor cell;granulocyte;neutrophil;immature neutrophil;promonocyte;promyelocyte;common dendritic progenitor;macrophage dendritic cell progenitor;basophil mast progenitor cell;myelocyte;hematopoietic precursor cell;hematopoietic multipotent progenitor cell;early lymphoid progenitor;lymphoid lineage restricted progenitor cell;pro-T cell;early T lineage precursor;myeloid lineage restricted progenitor cell;granulocytopoietic cell;common myeloid progenitor;common lymphoid progenitor,,0.063,0.073,0.073,717,852,0.22
MS4A2,,,no,True,ENSG00000149534,High affinity immunoglobulin epsilon receptor subunit beta (FcERI) (Fc epsilon receptor I beta-chain) (IgE Fc receptor subunit beta) (Membrane-spanning 4-domains subfamily A member 2),Membrane,"basophil;eosinophil;mast cell;mucosal type mast cell;erythroid progenitor cell, mammalian",,0.093,0.111,0.111,1063,1299,0.26
MXD1,,,no,True,ENSG00000059728,Max dimerization protein 1 (Max dimerizer 1) (Protein MAD),Nucleus,paneth cell of colon;paneth cell of epithelium of small intestine;inflammatory macrophage;blood cell;granulocyte;neutrophil;liver dendritic cell,,1.533,1.641,1.641,17554,19170,0.098
MYB,,,no,True,ENSG00000118513,Transcriptional activator Myb (Proto-oncogene c-Myb),Nucleus,brush cell of trachebronchial tree;brush cell of bronchus;bone marrow cell;granulocyte monocyte progenitor cell;precursor B cell;late pro-B cell;megakaryocyte-erythroid progenitor cell;erythroid progenitor cell;promyelocyte;basophil mast progenitor cell;hematopoietic precursor cell;hematopoietic multipotent progenitor cell;early lymphoid progenitor;lymphoid lineage restricted progenitor cell;pro-B cell;fraction A pre-pro B cell;myeloid lineage restricted progenitor cell;granulocytopoietic cell;common myeloid progenitor;common lymphoid progenitor,,0.145,0.105,0.145,1662,1230,-0.463
