TNFRSF9,,,no,True,ENSG00000049249,Tumor necrosis factor receptor superfamily member 9 (4-1BB ligand receptor) (CDw137) (T-cell antigen 4-1BB homolog) (T-cell antigen ILA) (CD antigen CD137),Cell membrane,"mast cell;activated CD4-positive, alpha-beta T cell;activated CD8-positive, alpha-beta T cell;CD8-alpha-alpha-positive, alpha-beta intraepithelial T cell;type I NK T cell;CD8-alpha alpha positive, gamma-delta intraepithelial T cell;regulatory T cell;intraepithelial lymphocyte",CD137,0.281,0.148,0.281,3223,1729,-0.927
TNFSF10,,,no,True,ENSG00000121858,Tumor necrosis factor ligand superfamily member 10 (Apo-2 ligand) (Apo-2L) (TNF-related apoptosis-inducing ligand) (Protein TRAIL) (CD antigen CD253),Cell membrane,epithelial cell;glomerular capillary endothelial cell;lung endothelial cell;goblet cell;respiratory goblet cell;bronchial goblet cell;tracheal goblet cell;club cell;endothelial cell;endothelial cell of vascular tree;mast cell,TRAIL,3.339,5.115,5.115,38244,59772,0.615
TNFSF12,,,no,True,ENSG00000239697,Tumor necrosis factor ligand superfamily member 12 (APO3 ligand) (TNF-related weak inducer of apoptosis) (TWEAK),Cell membrane,hematopoietic cell;basophil,TWEAK,4.857,4.96,4.96,55632,57961,0.03
TREM1,,,no,True,ENSG00000124731,Triggering receptor expressed on myeloid cells 1 (TREM-1) (Triggering receptor expressed on monocytes 1) (CD antigen CD354),Secreted,phagocyte;macrophage;tissue-resident macrophage;alveolar macrophage;lung macrophage;classical monocyte;hematopoietic cell;blood cell;granulocyte;basophil;neutrophil;immature neutrophil;leukocyte;professional antigen presenting cell;myeloid leukocyte;myeloid cell,,0.261,0.31,0.31,2990,3626,0.249
TREM2,,,no,True,ENSG00000095970,Triggering receptor expressed on myeloid cells 2 (TREM-2) (Triggering receptor expressed on monocytes 2),Secreted,phagocyte;macrophage;tissue-resident macrophage;alveolar macrophage;microglial cell;lung macrophage;Hofbauer cell;basophil;professional antigen presenting cell;intermediate monocyte,APP;SEMA6;ApoA;ApoB;ApoE,1.437,1.8,1.8,16462,21034,0.325
TRH,,,no,True,ENSG00000170893,Pro-thyrotropin-releasing hormone (Pro-TRH) (Prothyroliberin),Secreted,bone marrow cell;granulocyte monocyte progenitor cell;promyelocyte;macrophage dendritic cell progenitor;hematopoietic precursor cell;early T lineage precursor;granulocytopoietic cell;common myeloid progenitor;common lymphoid progenitor;radial glial cell;Mueller cell;Cajal-Retzius cell,TRH,0.036,,0.036,410,0,
TRIB2,,,no,True,ENSG00000071575,Tribbles homolog 2 (TRB-2),Cytoplasm,mast cell;mucosal type mast cell,,4.487,3.855,4.487,51394,45049,-0.219
TSPO,,,no,True,ENSG00000100300,Translocator protein (Mitochondrial benzodiazepine receptor) (PKBS) (Peripheral-type benzodiazepine receptor) (PBR),Mitochondrion membrane,"stratified epithelial cell;classical monocyte;CD14-positive, CD16-negative classical monocyte;hematopoietic cell;blood cell;granulocyte;immature neutrophil;leukocyte;myeloid leukocyte;monocyte;CD14-positive monocyte;myeloid cell;promonocyte;myelocyte;granulocytopoietic cell",,0.322,0.195,0.322,3687,2277,-0.724
TUBB,,,no,True,ENSG00000196230,Tubulin beta chain (Tubulin beta-5 chain),Cytoplasm,"glioblast;Schwann cell precursor;neural crest cell;ovarian surface epithelial cell;mesodermal cell;mast cell;mucosal type mast cell;double-positive, alpha-beta thymocyte;large pre-B-II cell;primitive red blood cell;fraction A pre-pro B cell;immature Schwann cell;enteric neuron;peripheral nervous system neuron",,44.86,44.064,44.86,513780,514881,-0.026
UTS2,,,no,True,ENSG00000049247,Urotensin-2 (Urotensin II) (U-II) (UII),Secreted,mast cell,UTS2,0.025,,0.025,281,0,
VASP,,,no,True,ENSG00000125753,Vasodilator-stimulated phosphoprotein (VASP),Cytoplasm;Cytoplasm,"lung macrophage;extravillous trophoblast;granulocyte;neutrophil;myeloid dendritic cell, human;non-classical monocyte;CD14-low, CD16-positive monocyte;myeloid cell",,8.625,9.217,9.217,98786,107695,0.096
VDAC2,,,no,True,ENSG00000165637,Voltage-dependent anion-selective channel protein 2 (VDAC-2) (hVDAC2) (Outer mitochondrial membrane protein porin 2),Mitochondrion outer membrane,mast cell;mucosal type mast cell,,17.796,18.516,18.516,203812,216360,0.057
VSIG4,,,no,True,ENSG00000155659,V-set and immunoglobulin domain-containing protein 4 (Protein Z39Ig),Membrane,phagocyte;macrophage;elicited macrophage;alternatively activated macrophage;tissue-resident macrophage;alveolar macrophage;microglial cell;mature microglial cell;colon macrophage;lung macrophage;Hofbauer cell;mononuclear phagocyte;basophil;professional antigen presenting cell;myeloid leukocyte;intermediate monocyte;myeloid cell,,3.048,3.34,3.34,34912,39028,0.132
VSIR,,,no,True,ENSG00000107738,V-type immunoglobulin domain-containing suppressor of T-cell activation (Platelet receptor Gi24) (Stress-induced secreted protein-1) (Sisp-1) (V-set domain-containing immunoregulatory receptor) (V-set immunoregulatory receptor),Cell membrane,"phagocyte;classical monocyte;CD14-positive, CD16-negative classical monocyte;granulocyte;neutrophil;dendritic cell;conventional dendritic cell;myeloid dendritic cell;CD1c-positive myeloid dendritic cell;myeloid leukocyte;monocyte;non-classical monocyte;CD14-low, CD16-positive monocyte;CD14-positive monocyte;CD14-positive, CD16-positive monocyte;peripheral blood mononuclear cell;myeloid cell;promonocyte;myelocyte",VISTA,0.51,0.94,0.94,5836,10981,0.883
VSTM1,,,no,True,ENSG00000189068,V-set and transmembrane domain-containing protein 1 (Signal inhibitory receptor on leukocytes-1) (SIRL-1),Secreted,basophil;immature neutrophil;promyelocyte;myelocyte;granulocytopoietic cell,,0.012,,0.012,134,0,
XPO6,,,no,True,ENSG00000169180,Exportin-6 (Exp6) (Ran-binding protein 20),Nucleus,granulocyte;neutrophil,,5.443,5.942,5.942,62342,69429,0.126
YIF1B,,,no,True,ENSG00000167645,Protein YIF1B (YIP1-interacting factor homolog B),Endoplasmic reticulum membrane,eosinophil,,2.41,2.431,2.431,27600,28411,0.013
