gene,category,rationale,exclude_recommended,in_5K_reference,gene_id,full_name,location,cell_type,cellchat_pathway,detection_pct_0041323,detection_pct_0041326,det_max,n_cells_0041323,n_cells_0041326,log2_detection_ratio
ABTB1,,,no,True,ENSG00000114626,Ankyrin repeat and BTB/POZ domain-containing protein 1 (Elongation factor 1A-binding protein),Cytoplasm,blood cell;granulocyte;neutrophil,,0.542,1,1,6207,11679,0.883
ACP5,,,no,True,ENSG00000102575,Tartrate-resistant acid phosphatase type 5 (TR-AP),Lysosome,macrophage;tissue-resident macrophage;alveolar macrophage;colon macrophage;lung macrophage;mononuclear phagocyte;osteoclast;basophil;professional antigen presenting cell;Langerhans cell;intermediate monocyte;mononuclear cell;lymphocyte;B cell,,0.357,0.405,0.405,4090,4731,0.181
ACSL4,,,no,True,ENSG00000068366,Long-chain-fatty-acid--CoA ligase 4,Mitochondrion outer membrane,hepatoblast;epithelial cell of lung;epithelial cell of alveolus of lung;pneumocyte;type II pneumocyte;intestinal tuft cell;tuft cell of colon;kidney distal convoluted tubule epithelial cell;mast cell;lung secretory cell,,6.804,6.355,6.804,77926,74262,-0.098
ADA,,,no,True,ENSG00000196839,Adenosine deaminase,Cell membrane,"bone marrow cell;granulocyte monocyte progenitor cell;immature alpha-beta T cell;double-positive, alpha-beta thymocyte;immature T cell;thymocyte;double negative thymocyte;late pro-B cell;common dendritic progenitor;macrophage dendritic cell progenitor;hematopoietic precursor cell;hematopoietic multipotent progenitor cell;early lymphoid progenitor;lymphoid lineage restricted progenitor cell;pro-B cell;fraction A pre-pro B cell;pro-T cell;early T lineage precursor;common lymphoid progenitor",,1.192,1.529,1.529,13652,17862,0.359
ADAM8,,,no,True,ENSG00000151651,Disintegrin and metalloproteinase domain-containing protein 8 (ADAM 8),Membrane,"blood cell;granulocyte;basophil;eosinophil;conventional dendritic cell;Langerhans cell;myeloid dendritic cell, human;ILC1, human",,1.243,2.199,2.199,14233,25691,0.823
ADCYAP1,,,no,True,ENSG00000141433,Pituitary adenylate cyclase-activating polypeptide (PACAP),Secreted,type B pancreatic cell;enteroendocrine cell;endocrine cell;basophil;mast cell,PACAP,0.594,0.05,0.594,6807,581,-3.579
ADGRE2,,,no,True,ENSG00000127507,Adhesion G protein-coupled receptor E2 (EGF-like module receptor 2) (EGF-like module-containing mucin-like hormone receptor-like 2) (CD antigen CD312),Cell membrane,granulocyte;Langerhans cell,ADGRE,0.872,1.211,1.211,9984,14149,0.474
ADRB2,,,no,True,ENSG00000169252,Beta-2 adrenergic receptor (Beta-2 adrenoreceptor) (Beta-2 adrenoceptor),Cell membrane,stem cell of epidermis;keratinocyte;epidermal cell;mast cell,Adrenaline;Noradrenaline,0.311,0.488,0.488,3558,5697,0.65
AHR,,,no,True,ENSG00000106546,Aryl hydrocarbon receptor (Ah receptor) (AhR) (Class E basic helix-loop-helix protein 76) (bHLHe76),Cytoplasm,"lung goblet cell;mast cell;group 2 innate lymphoid cell;group 3 innate lymphoid cell;CD34-positive, CD56-positive, CD117-positive common innate lymphoid precursor, human",,5.117,6.008,6.008,58600,70198,0.232
ALOX5,,,no,True,ENSG00000012779,Polyunsaturated fatty acid 5-lipoxygenase,Cytoplasm,brush cell;intestinal tuft cell;tuft cell of colon;macrophage;tissue-resident macrophage;alveolar macrophage;lung macrophage;basophil;eosinophil;Langerhans cell;B-1b B cell;mast cell,,4.407,4.796,4.796,50476,56036,0.122
ALPL,,,no,True,ENSG00000162551,"Alkaline phosphatase, tissue-nonspecific isozyme (AP-TNAP) (TNS-ALP) (TNSALP)",Cell membrane,epithelial cell of lung;epithelial cell of alveolus of lung;pneumocyte;type II pneumocyte;goblet cell;respiratory goblet cell;tracheal goblet cell;preosteoblast;blood cell;granulocyte;neutrophil;osteoblast;lung secretory cell,,0.694,0.519,0.694,7944,6061,-0.419
ANXA3,,,no,True,ENSG00000138772,"Annexin A3 (35-alpha calcimedin) (Annexin III) (Annexin-3) (Inositol 1,2-cyclic phosphate 2-phosphohydrolase) (Lipocortin III) (Placental anticoagulant protein III) (PAP-III)",,pancreatic ductal cell;epithelial cell of lung;epithelial cell of alveolus of lung;pneumocyte;type I pneumocyte;epithelial cell of uterus;immature neutrophil;myelocyte;tracheobronchial serous cell,,11.643,10.303,11.643,133343,120384,-0.176
APEX1,,,no,True,ENSG00000100823,DNA-(apurinic or apyrimidinic site) endonuclease,Nucleus,glioblast;Schwann cell precursor;bone marrow cell;granulocyte monocyte progenitor cell;professional antigen presenting cell;dendritic cell;common dendritic progenitor;macrophage dendritic cell progenitor;basophil mast progenitor cell;hematopoietic multipotent progenitor cell;early lymphoid progenitor;early T lineage precursor,,16.68,16.64,16.68,191030,194432,-0.003
AQP9,,,no,True,ENSG00000103569,Aquaporin-9 (AQP-9) (Aquaglyceroporin-9) (Small solute channel 1),Cell membrane,blood cell;granulocyte;neutrophil,,0.293,0.248,0.293,3352,2892,-0.242
ARRB2,,,no,True,ENSG00000141480,Beta-arrestin-2 (Arrestin beta-2) (Non-visual arrestin-3),Cytoplasm;Nucleus;Cell membrane;Membrane,"phagocyte;classical monocyte;CD14-positive, CD16-negative classical monocyte;granulocyte;neutrophil;dendritic cell;conventional dendritic cell;myeloid dendritic cell;CD1c-positive myeloid dendritic cell;myeloid leukocyte;monocyte;non-classical monocyte;CD14-low, CD16-positive monocyte;CD14-positive monocyte;CD14-positive, CD16-positive monocyte;myeloid cell",,9.204,10.614,10.614,105415,124023,0.206
ATP5F1C,,,no,True,ENSG00000165629,"ATP synthase subunit gamma, mitochondrial (ATP synthase F1 subunit gamma) (F-ATPase gamma subunit)",Mitochondrion inner membrane,mast cell;mucosal type mast cell,,23.016,20.941,23.016,263606,244694,-0.136
BATF,,,no,True,ENSG00000156127,Basic leucine zipper transcriptional factor ATF-like (B-cell-activating transcription factor) (B-ATF) (SF-HT-activated gene 2 protein) (SFA-2),Nucleus,"duct epithelial cell;luminal epithelial cell of mammary gland;mammary gland epithelial cell;mast cell;CD4-positive helper T cell;T-helper 17 cell;T follicular helper cell;CD4-positive, CD25-positive, alpha-beta regulatory T cell;naive regulatory T cell;activated CD4-positive, alpha-beta T cell;activated CD8-positive, alpha-beta T cell;type I NK T cell;regulatory T cell;exhausted T cell;group 2 innate lymphoid cell",,0.664,0.516,0.664,7602,6029,-0.363
BATF3,,,no,True,ENSG00000123685,Basic leucine zipper transcriptional factor ATF-like 3 (B-ATF-3) (21 kDa small nuclear factor isolated from T-cells) (Jun dimerization protein p21SNFT),Nucleus,"hematopoietic cell;blood cell;granulocyte;CD141-positive myeloid dendritic cell;activated CD4-positive, alpha-beta T cell;activated CD8-positive, alpha-beta T cell;pre-conventional dendritic cell",,0.311,0.386,0.386,3567,4512,0.31
BCL2A1,,,no,True,ENSG00000140379,Bcl-2-related protein A1 (Bcl-2-like protein 5) (Bcl2-L-5) (Hemopoietic-specific early response protein) (Protein BFL-1) (Protein GRS),Cytoplasm,"phagocyte;macrophage;elicited macrophage;inflammatory macrophage;alternatively activated macrophage;colon macrophage;lung macrophage;classical monocyte;CD14-positive, CD16-negative classical monocyte;follicular dendritic cell;hematopoietic cell;blood cell;granulocyte;neutrophil;leukocyte;professional antigen presenting cell;myeloid dendritic cell, human;myeloid leukocyte;monocyte;non-classical monocyte;CD14-low, CD16-positive monocyte;CD14-positive monocyte;CD14-positive, CD16-positive monocyte;myeloid cell;myelocyte",,0.333,0.358,0.358,3817,4187,0.105
BMP2K,,,no,True,ENSG00000138756,BMP-2-inducible protein kinase (BIKe),Nucleus,lens epithelial cell;anterior lens cell;macrophage;tissue-resident macrophage;Kupffer cell;central nervous system macrophage;enucleate erythrocyte;mast cell;immature innate lymphoid cell,,4.076,4.833,4.833,46679,56475,0.246
BST1,,,no,True,ENSG00000109743,ADP-ribosyl cyclase/cyclic ADP-ribose hydrolase 2,Cell membrane,immature neutrophil;myelocyte;granulocytopoietic cell,,0.404,0.53,0.53,4625,6191,0.392
BTK,,,no,True,ENSG00000010671,Tyrosine-protein kinase BTK,Cytoplasm,basophil;eosinophil;B-1a B cell;B-1b B cell;small pre-B-II cell;pre-B-I cell,,0.95,1.736,1.736,10879,20284,0.87
C3AR1,,,no,True,ENSG00000171860,C3a anaphylatoxin chemotactic receptor (C3AR) (C3a-R),Cell membrane,phagocyte;macrophage;elicited macrophage;alternatively activated macrophage;tissue-resident macrophage;alveolar macrophage;microglial cell;colon macrophage;lung macrophage;hematopoietic cell;blood cell;granulocyte;leukocyte;professional antigen presenting cell;myeloid leukocyte;myeloid cell;myelocyte;granulocytopoietic cell,COMPLEMENT,1.863,1.889,1.889,21333,22070,0.02
C5AR1,,,no,True,ENSG00000197405,C5a anaphylatoxin chemotactic receptor 1 (C5a anaphylatoxin chemotactic receptor) (C5a-R) (C5aR) (CD antigen CD88),Cell membrane,"phagocyte;macrophage;elicited macrophage;inflammatory macrophage;alternatively activated macrophage;alveolar macrophage;lung macrophage;classical monocyte;hematopoietic cell;granulocyte;neutrophil;leukocyte;professional antigen presenting cell;myeloid leukocyte;monocyte;non-classical monocyte;CD14-low, CD16-positive monocyte;CD14-positive monocyte;CD14-positive, CD16-positive monocyte;intermediate monocyte;myeloid cell",COMPLEMENT,2.776,3.289,3.289,31795,38435,0.245
CACYBP,,,no,True,ENSG00000116161,Calcyclin-binding protein (CacyBP) (hCacyBP) (S100A6-binding protein) (Siah-interacting protein),Nucleus,pancreatic D cell;mast cell;mucosal type mast cell;double negative thymocyte;proerythroblast;early T lineage precursor,,5.882,4.101,5.882,67370,47923,-0.52
CALB2,,,no,True,ENSG00000172137,Calretinin (CR) (29 kDa calbindin),,mesothelial cell of pleura;ovarian surface epithelial cell;Leydig cell;mast cell;cortical interneuron;cerebral cortex GABAergic interneuron;Cajal-Retzius cell;glycinergic neuron,,0.047,0.068,0.068,535,793,0.539
CAMP,,,no,True,ENSG00000164047,Cathelicidin antimicrobial peptide (18 kDa cationic antimicrobial protein) (CAP-18) (hCAP-18),Secreted,acinar cell;acinar cell of salivary gland;brush cell;hematopoietic cell;blood cell;granulocyte;neutrophil;immature neutrophil;leukocyte;myeloid leukocyte;myeloid cell;promyelocyte;myelocyte;myeloid lineage restricted progenitor cell;granulocytopoietic cell,,0.04,,0.04,459,0,
CCL18,,,no,True,ENSG00000275385,C-C motif chemokine 18 (Alternative macrophage activation-associated CC chemokine 1) (AMAC-1) (CC chemokine PARC) (Dendritic cell chemokine 1) (DC-CK1) (Macrophage inflammatory protein 4) (MIP-4) (Pulmonary and activation-regulated chemokine) (Small-inducible cytokine A18),Secreted,macrophage;alternatively activated macrophage;tissue-resident macrophage;alveolar macrophage;lung macrophage;basophil;professional antigen presenting cell,CCL,0.053,0.023,0.053,604,266,-1.212
CCR3,,,no,True,ENSG00000183625,C-C chemokine receptor type 3 (C C CKR3) (C-C CKR-3) (CC-CKR-3) (CCR-3) (CCR3) (CKR 3) (CKR3) (Eosinophil eotaxin receptor) (CD antigen CD193),Cell membrane,"CD8-positive, alpha-beta memory T cell, CD45RO-positive;effector memory CD8-positive, alpha-beta T cell",CCL,0.021,,0.021,245,0,
CCT3,,,no,True,ENSG00000163468,T-complex protein 1 subunit gamma (TCP-1-gamma) (CCT-gamma) (hTRiC5),Cytoplasm,fallopian tube secretory epithelial cell;mast cell;mucosal type mast cell,,35.443,29.774,35.443,405923,347903,-0.251
CCT5,,,no,True,ENSG00000150753,T-complex protein 1 subunit epsilon (TCP-1-epsilon) (CCT-epsilon),Cytoplasm,mast cell;mucosal type mast cell;erythroid progenitor cell,,22.543,18.954,22.543,258179,221475,-0.25
CCT8,,,no,True,ENSG00000156261,T-complex protein 1 subunit theta (TCP-1-theta) (CCT-theta) (Chaperonin containing T-complex polypeptide 1 subunit 8) (Renal carcinoma antigen NY-REN-15),Cytoplasm,professional antigen presenting cell;dendritic cell;basophil mast progenitor cell;early lymphoid progenitor,,30.394,27.923,30.394,348097,326267,-0.122
CD14,,,no,True,ENSG00000170458,Monocyte differentiation antigen CD14 (Myeloid cell-specific leucine-rich glycoprotein) (CD antigen CD14),Cell membrane,"acinar cell of salivary gland;phagocyte;macrophage;elicited macrophage;inflammatory macrophage;alternatively activated macrophage;microglial cell;kidney resident macrophage;colon macrophage;Hofbauer cell;classical monocyte;CD14-positive, CD16-negative classical monocyte;blood cell;granulocyte;dendritic cell, human;myeloid leukocyte;monocyte;CD14-positive monocyte;CD14-positive, CD16-positive monocyte;intermediate monocyte;myeloid cell;salivary gland cell",,6.434,7.258,7.258,73687,84803,0.174
CD177,,,no,True,ENSG00000204936,CD177 antigen (Human neutrophil alloantigen 2a) (HNA-2a) (NB1 glycoprotein) (NB1 GP) (Polycythemia rubra vera protein 1) (PRV-1) (CD antigen CD177),Cell membrane,blood cell;granulocyte;neutrophil;immature neutrophil;myelocyte;granulocytopoietic cell,PECAM1,0.316,0.236,0.316,3615,2762,-0.417
CD33,,,no,True,ENSG00000105383,Myeloid cell surface antigen CD33 (Sialic acid-binding Ig-like lectin 3) (Siglec-3) (gp67) (CD antigen CD33),Peroxisome,eosinophil;dendritic cell;conventional dendritic cell;macrophage dendritic cell progenitor;common myeloid progenitor,,0.267,0.52,0.52,3056,6072,0.962
CD44,,,no,True,ENSG00000026508,CD44 antigen (CDw44) (Epican) (Extracellular matrix receptor III) (ECMR-III) (GP90 lymphocyte homing/adhesion receptor) (HUTCH-I) (Heparan sulfate proteoglycan) (Hermes antigen) (Hyaluronate receptor) (Phagocytic glycoprotein 1) (PGP-1) (Phagocytic glycoprotein I) (PGP-I) (CD antigen CD44),Cell membrane,intestinal crypt stem cell of large intestine;pancreatic ductal cell;pancreatic acinar cell;elicited macrophage;alternatively activated macrophage;hematopoietic cell;granulocyte;leukocyte;myeloid leukocyte;mast cell;B cell;myeloid cell;early T lineage precursor;fibroblast of breast,MIF;SPP1;GALECTIN;COLLAGEN;FN1;LAMININ;SELE,47.499,46.665,47.499,544000,545266,-0.026
CD55,,,no,True,ENSG00000196352,Complement decay-accelerating factor (CD antigen CD55),Cell membrane,epithelial cell of lacrimal sac;type I pneumocyte;respiratory goblet cell;tracheal goblet cell;paneth cell of epithelium of small intestine;urothelial cell;bladder urothelial cell;conjunctival epithelial cell;neutrophil;serous cell of epithelium of trachea;bladder cell,ADGRE,3.817,3.838,3.838,43717,44851,0.008
CD82,,,no,True,ENSG00000085117,CD82 antigen (C33 antigen) (IA4) (Inducible membrane protein R2) (Metastasis suppressor Kangai-1) (Suppressor of tumorigenicity 6 protein) (Tetraspanin-27) (Tspan-27) (CD antigen CD82),Cell membrane,"hematopoietic stem cell;CD34-positive, CD38-negative hematopoietic stem cell;follicular dendritic cell;eosinophil;erythroid progenitor cell, mammalian;basophil mast progenitor cell;pro-T cell;early T lineage precursor",,5.534,6.383,6.383,63382,74579,0.206
CD84,,,no,True,ENSG00000066294,SLAM family member 5 (Cell surface antigen MAX.3) (Hly9-beta) (Leukocyte differentiation antigen CD84) (Signaling lymphocytic activation molecule 5) (CD antigen CD84),Cell membrane,osteoclast;basophil;eosinophil;common myeloid progenitor,,1.099,1.503,1.503,12589,17563,0.451
CDA,,,no,True,ENSG00000158825,Cytidine deaminase,,renal beta-intercalated cell;granulocyte;neutrophil;immature neutrophil;promonocyte;myelocyte;myeloid lineage restricted progenitor cell;granulocytopoietic cell,,0.255,0.219,0.255,2917,2556,-0.22
CDC42,,,no,True,ENSG00000070831,Cell division control protein 42 homolog,Cell membrane,mast cell;mucosal type mast cell;peripheral blood mononuclear cell,,17.037,15.31,17.037,195127,178895,-0.154
CEACAM3,,,no,True,ENSG00000170956,Carcinoembryonic antigen-related cell adhesion molecule 3 (Carcinoembryonic antigen CGM1) (CD antigen CD66d),Membrane,myelocyte,,0.018,0.011,0.018,202,127,-0.698
CEACAM8,,,no,True,ENSG00000124469,Carcinoembryonic antigen-related cell adhesion molecule 8 (CD67 antigen) (Carcinoembryonic antigen CGM6) (Non-specific cross-reacting antigen NCA-95) (CD antigen CD66b),Cell membrane,neutrophil;immature neutrophil;promyelocyte;myelocyte;granulocytopoietic cell,CEACAM,0.058,0.015,0.058,663,180,-1.91
CFP,,,no,True,ENSG00000126759,Properdin (Complement factor P),Secreted,"phagocyte;colon macrophage;classical monocyte;CD14-positive, CD16-negative classical monocyte;hematopoietic cell;granulocyte;leukocyte;professional antigen presenting cell;dendritic cell;conventional dendritic cell;Langerhans cell;myeloid dendritic cell;CD1c-positive myeloid dendritic cell;dendritic cell, human;myeloid leukocyte;monocyte;non-classical monocyte;CD14-low, CD16-positive monocyte;CD14-positive monocyte;CD14-positive, CD16-positive monocyte;mononuclear cell;peripheral blood mononuclear cell;myeloid cell;promonocyte;myelocyte;myeloid lineage restricted progenitor cell;granulocytopoietic cell",,0.317,0.316,0.317,3626,3697,-0.001
CHIT1,,,no,True,ENSG00000133063,Chitotriosidase-1,Secreted;Lysosome,basophil;immature neutrophil;myelocyte;granulocytopoietic cell,,0.022,,0.022,257,0,
CKAP4,,,no,True,ENSG00000136026,Cytoskeleton-associated protein 4 (63-kDa cytoskeleton-linking membrane protein) (Climp-63) (p63),Endoplasmic reticulum membrane,immature neutrophil;myelocyte;osteoblast,,15.566,15.24,15.566,178280,178073,-0.031
CLEC12A,,,no,True,ENSG00000172322,C-type lectin domain family 12 member A (C-type lectin-like molecule 1) (CLL-1) (Dendritic cell-associated lectin 2) (DCAL-2) (Myeloid inhibitory C-type lectin-like receptor) (MICL) (CD antigen CD371),Cell membrane,"phagocyte;classical monocyte;CD14-positive, CD16-negative classical monocyte;granulocyte;immature neutrophil;myeloid leukocyte;monocyte;non-classical monocyte;CD14-low, CD16-positive monocyte;CD14-positive monocyte;CD14-positive, CD16-positive monocyte;myeloid cell;myelocyte",,0.161,0.643,0.643,1844,7508,1.997
CLEC7A,,,no,True,ENSG00000172243,C-type lectin domain family 7 member A (Beta-glucan receptor) (C-type lectin superfamily member 12) (Dendritic cell-associated C-type lectin 1) (DC-associated C-type lectin 1) (Dectin-1) (CD antigen CD369),Cell membrane,"phagocyte;macrophage;alveolar macrophage;colon macrophage;mononuclear phagocyte;classical monocyte;CD14-positive, CD16-negative classical monocyte;basophil;neutrophil;leukocyte;professional antigen presenting cell;dendritic cell;plasmacytoid dendritic cell;CD141-positive myeloid dendritic cell;conventional dendritic cell;CD1c-positive myeloid dendritic cell;myeloid leukocyte;monocyte;non-classical monocyte;CD14-low, CD16-positive monocyte;CD14-positive monocyte;CD14-positive, CD16-positive monocyte;intermediate monocyte;peripheral blood mononuclear cell;myeloid cell",,0.686,0.97,0.97,7851,11339,0.501
CMA1,,,no,True,ENSG00000092009,Chymase,Secreted;Cytoplasmic granule,basophil;mast cell;mucosal type mast cell,,0.041,0.027,0.041,472,316,-0.608
CNRIP1,,,no,True,ENSG00000119865,CB1 cannabinoid receptor-interacting protein 1 (CRIP-1),,"eosinophil;megakaryocyte-erythroid progenitor cell;erythroid lineage cell;erythroid progenitor cell;erythroid progenitor cell, mammalian;proerythroblast;basophil mast progenitor cell;myeloid lineage restricted progenitor cell",,2.311,1.955,2.311,26463,22838,-0.241
CR1,,,no,True,ENSG00000203710,Complement receptor type 1 (C3b/C4b receptor) (CD antigen CD35),Membrane,kidney glomerular epithelial cell;podocyte;follicular dendritic cell;blood cell;granulocyte;neutrophil;follicular B cell;immature innate lymphoid cell,,0.296,0.395,0.395,3395,4610,0.412
CSF1,,,no,True,ENSG00000184371,Macrophage colony-stimulating factor 1 (CSF-1) (M-CSF) (MCSF) (Lanimostim) (Proteoglycan macrophage colony-stimulating factor) (PG-M-CSF),Cell membrane,blood cell;granulocyte;mast cell,CSF,4.256,5.1,5.1,48740,59597,0.261
CSF2RB,,,no,True,ENSG00000100368,Cytokine receptor common subunit beta (CDw131) (GM-CSF/IL-3/IL-5 receptor common beta subunit) (CD antigen CD131),Membrane,follicular dendritic cell;granulocyte;basophil;eosinophil;plasmacytoid dendritic cell;basophil mast progenitor cell,IL4,0.365,0.478,0.478,4176,5586,0.391
CSF3R,,,no,True,ENSG00000119535,Granulocyte colony-stimulating factor receptor (G-CSF receptor) (G-CSF-R) (CD antigen CD114),Secreted,"classical monocyte;CD14-positive, CD16-negative classical monocyte;bone marrow cell;granulocyte monocyte progenitor cell;placental villous trophoblast;syncytiotrophoblast cell;blood cell;granulocyte;neutrophil;myeloid leukocyte;monocyte;CD14-positive monocyte;myeloid cell;promyelocyte",CSF3,0.727,1.573,1.573,8327,18385,1.114
CTSG,,,no,True,ENSG00000100448,Cathepsin G (CG),Cell membrane,bone marrow cell;granulocyte monocyte progenitor cell;basophil;eosinophil;neutrophil;immature neutrophil;mast cell;double negative thymocyte;promonocyte;promyelocyte;myelocyte;hematopoietic precursor cell;myeloid lineage restricted progenitor cell;granulocytopoietic cell;common myeloid progenitor,PARs;CTSG,0.074,0.101,0.101,849,1179,0.445
CTSL,,,no,True,ENSG00000135047,Procathepsin L,Lysosome,elicited macrophage;inflammatory macrophage;alternatively activated macrophage;lung macrophage;Hofbauer cell;extravillous trophoblast;placental villous trophoblast;syncytiotrophoblast cell;leukocyte;myeloid leukocyte;mast cell;mucosal type mast cell;myeloid cell;fibroblast;pancreatic stellate cell;fibroblast of mammary gland;fibroblast of breast,,14.526,15.423,15.423,166367,180209,0.086
CXCR1,,,no,True,ENSG00000163464,C-X-C chemokine receptor type 1 (CXC-R1) (CXCR-1) (CDw128a) (High affinity interleukin-8 receptor A) (IL-8R A) (IL-8 receptor type 1) (CD antigen CD181),Cell membrane,,CXCL,0.066,0.032,0.066,757,377,-1.035
CXCR2,,,no,True,ENSG00000180871,C-X-C chemokine receptor type 2 (CXC-R2) (CXCR-2) (CDw128b) (GRO/MGSA receptor) (High affinity interleukin-8 receptor B) (IL-8R B) (IL-8 receptor type 2) (CD antigen CD182),Cell membrane,blood cell;granulocyte;neutrophil,CXCL;MIF,0.037,0.025,0.037,427,288,-0.597
CYBB,,,no,True,ENSG00000165168,Cytochrome b-245 heavy chain,Cell membrane,"phagocyte;macrophage;alveolar macrophage;lung macrophage;classical monocyte;CD14-positive, CD16-negative classical monocyte;hematopoietic cell;granulocyte;immature neutrophil;leukocyte;professional antigen presenting cell;plasmacytoid dendritic cell, human;myeloid leukocyte;monocyte;non-classical monocyte;CD14-low, CD16-positive monocyte;CD14-positive monocyte;CD14-positive, CD16-positive monocyte;intermediate monocyte;myeloid cell;promonocyte;myelocyte;granulocytopoietic cell",,3.063,4.606,4.606,35082,53819,0.588
CYSLTR1,,,no,True,ENSG00000173198,Cysteinyl leukotriene receptor 1 (CysLTR1) (Cysteinyl leukotriene D4 receptor) (LTD4 receptor) (G-protein coupled receptor HG55) (HMTMF81),Cell membrane,mast cell;mucosal type mast cell;common dendritic progenitor,CysLTs,0.158,0.142,0.158,1814,1665,-0.153
DEFA1,,,no,True,ENSG00000206047,,,"CD4-positive, alpha-beta thymocyte;CD8-positive, alpha-beta thymocyte;promyelocyte",,0.069,0.024,0.069,795,280,-1.534
DEFA6,,,no,True,ENSG00000164822,"Defensin-6 (Defensin, alpha 6)",Secreted,intestinal crypt stem cell;intestinal crypt stem cell of small intestine;small intestine goblet cell;type L enteroendocrine cell;paneth cell;double negative thymocyte,,0.03,,0.03,348,0,
DNAJC9,,,no,True,ENSG00000213551,DnaJ homolog subfamily C member 9 (HDJC9) (DnaJ protein SB73),Nucleus,erythroid lineage cell;erythroid progenitor cell;proerythroblast;primitive red blood cell;basophil mast progenitor cell,,5.217,4.781,5.217,59747,55862,-0.126
ELANE,,,no,True,ENSG00000197561,Neutrophil elastase,Cytoplasmic vesicle,bone marrow cell;granulocyte;neutrophil;immature neutrophil;promyelocyte;hematopoietic precursor cell;granulocytopoietic cell;common myeloid progenitor;reticular cell,,0.072,0.02,0.072,828,229,-1.883
ENPP3,,,no,True,ENSG00000154269,Ectonucleotide pyrophosphatase/phosphodiesterase family member 3 (E-NPP 3) (NPP3) (Phosphodiesterase I beta) (PD-Ibeta) (Phosphodiesterase I/nucleotide pyrophosphatase 3) (CD antigen CD203c),Cell membrane,cortical cell of adrenal gland;epithelial cell of prostate;basal cell of prostate epithelium;mast cell,,0.11,0.078,0.11,1262,910,-0.501
EVI2B,,,no,True,ENSG00000185862,Protein EVI2B (Ecotropic viral integration site 2B protein homolog) (EVI-2B) (CD antigen CD361),Membrane,"alveolar macrophage;lung macrophage;hematopoietic cell;granulocyte;neutrophil;CD141-positive myeloid dendritic cell;IgG memory B cell;myeloid leukocyte;monocyte;non-classical monocyte;CD14-low, CD16-positive monocyte;CD14-positive monocyte;B cell;peripheral blood mononuclear cell;myeloid cell;myelocyte",,1.248,1.857,1.857,14289,21697,0.574
FBL,,,no,True,ENSG00000105202,rRNA 2'-O-methyltransferase fibrillarin,Nucleus,bone marrow cell;granulocyte monocyte progenitor cell;T cell;erythroid progenitor cell;proerythroblast;basophil mast progenitor cell,,37.523,34.367,37.523,429747,401568,-0.127
FCAR,,,no,True,ENSG00000186431,Immunoglobulin alpha Fc receptor (IgA Fc receptor) (CD antigen CD89),Secreted,blood cell;granulocyte;myelocyte,,0.114,0.194,0.194,1305,2261,0.764
FCER1A,,,no,True,ENSG00000179639,High affinity immunoglobulin epsilon receptor subunit alpha (Fc-epsilon RI-alpha) (FcERI) (IgE Fc receptor subunit alpha),Cell membrane,"hematopoietic stem cell;CD34-positive, CD38-negative hematopoietic stem cell;colon macrophage;mononuclear phagocyte;basophil;professional antigen presenting cell;dendritic cell;plasmacytoid dendritic cell;plasmacytoid dendritic cell, human;conventional dendritic cell;Langerhans cell;myeloid dendritic cell;myeloid dendritic cell, human;CD1c-positive myeloid dendritic cell;dendritic cell, human;mast cell;mucosal type mast cell;megakaryocyte-erythroid progenitor cell;megakaryocyte;erythroid progenitor cell, mammalian",,0.029,0.063,0.063,328,736,1.137
FCGR1A,,,no,True,ENSG00000150337,High affinity immunoglobulin gamma Fc receptor I (IgG Fc receptor I) (Fc-gamma RI) (FcRI) (Fc-gamma RIA) (FcgammaRIa) (CD antigen CD64),Cell membrane,phagocyte;macrophage;microglial cell;Hofbauer cell;classical monocyte;immature neutrophil;professional antigen presenting cell;myeloid leukocyte;mast cell;mucosal type mast cell;myeloid cell,,0.216,0.41,0.41,2479,4796,0.923
