gene,category,rationale,exclude_recommended,gene_id,full_name,location,cell_type,cellchat_pathway,detection_pct_0041323,detection_pct_0041326,det_max,n_cells_0041323,n_cells_0041326,log2_detection_ratio,pathway_source,pathway_term,was_uncategorized
ACTN1,,,no,ENSG00000072110,Alpha-actinin-1 (Alpha-actinin cytoskeletal isoform) (F-actin cross-linking protein) (Non-muscle alpha-actinin-1),Cytoplasm,myoepithelial cell;myoepithelial cell of mammary gland;retinal blood vessel endothelial cell;smooth muscle cell;smooth muscle cell of sphincter of pupil;enteric smooth muscle cell;myometrial cell;tracheobronchial smooth muscle cell;bronchial smooth muscle cell,,10.874,11.16,11.16,124541,130398,0.037,curated,cell_adhesion_junctions_ECM_extended,False
ACTN4,,,no,ENSG00000130402,Alpha-actinin-4 (Non-muscle alpha-actinin 4),Nucleus,myoepithelial cell;myoepithelial cell of mammary gland;podocyte,,33.487,34.258,34.258,383523,400293,0.033,curated,cell_adhesion_junctions_ECM_extended,True
ADAM10,,,no,ENSG00000137845,Disintegrin and metalloproteinase domain-containing protein 10 (ADAM 10),Cell membrane,papillary tips cell,,10.308,9.545,10.308,118053,111533,-0.111,curated,cell_adhesion_junctions_ECM_extended,False
ADAM9,,,no,ENSG00000168615,Disintegrin and metalloproteinase domain-containing protein 9 (ADAM 9),Secreted,salivary gland cell,,13.215,10.442,13.215,151346,122009,-0.34,curated,cell_adhesion_junctions_ECM_extended,True
ADAMTS2,,,no,ENSG00000087116,A disintegrin and metalloproteinase with thrombospondin motifs 2 (ADAM-TS 2) (ADAM-TS2) (ADAMTS-2),Secreted,hepatic stellate cell;alveolar type 2 fibroblast cell;preadipocyte;subcutaneous fat cell,,3.351,2.83,3.351,38380,33064,-0.244,curated,cell_adhesion_junctions_ECM_extended,False
ADAMTS5,,,no,ENSG00000154736,A disintegrin and metalloproteinase with thrombospondin motifs 5 (ADAM-TS 5) (ADAM-TS5) (ADAMTS-5),Secreted,mesenchymal stem cell,,0.381,0.279,0.381,4362,3257,-0.45,curated,cell_adhesion_junctions_ECM_extended,False
ADCY2,,,no,ENSG00000078295,Adenylate cyclase type 2,Membrane,smooth muscle cell of prostate;astrocyte;Bergmann glial cell;mature astrocyte;retina horizontal cell,,0.284,0.174,0.284,3247,2028,-0.708,curated,cell_adhesion_junctions_ECM_extended,False
ADIPOR2,,,no,ENSG00000006831,Adiponectin receptor protein 2 (Progestin and adipoQ receptor family member 2) (Progestin and adipoQ receptor family member II),Cell membrane,melanocyte;brown fat cell;epicardial adipocyte;adipocyte of epicardial fat of left ventricle,ADIPONECTIN,2.964,2.061,2.964,33952,24088,-0.524,curated,cell_adhesion_junctions_ECM_extended,False
ADRA1B,,,no,ENSG00000170214,Alpha-1B adrenergic receptor (Alpha-1B adrenoreceptor) (Alpha-1B adrenoceptor),Nucleus membrane,,Adrenaline;Noradrenaline,0.176,0.094,0.176,2014,1096,-0.907,curated,cell_adhesion_junctions_ECM_extended,True
ADRB1,,,no,ENSG00000043591,Beta-1 adrenergic receptor (Beta-1 adrenoreceptor) (Beta-1 adrenoceptor),Cell membrane,,Adrenaline;Noradrenaline,0.657,0.24,0.657,7522,2802,-1.454,curated,cell_adhesion_junctions_ECM_extended,True
AFAP1L2,,,no,ENSG00000169129,Actin filament-associated protein 1-like 2 (AFAP1-like protein 2),Cytoplasm,"brush cell;intestinal tuft cell;tuft cell of colon;decidual natural killer cell, human",,7.496,5.21,7.496,85851,60872,-0.525,curated,cell_adhesion_junctions_ECM_extended,False
AKT1,,,no,ENSG00000142208,RAC-alpha serine/threonine-protein kinase,Cytoplasm,,,21.471,16.765,21.471,245908,195890,-0.357,curated,cell_adhesion_junctions_ECM_extended,True
AKT2,,,no,ENSG00000105221,RAC-beta serine/threonine-protein kinase,Cytoplasm;Nucleus;Cell membrane,,,14.34,16.101,16.101,164236,188133,0.167,curated,cell_adhesion_junctions_ECM_extended,True
AKT3,,,no,ENSG00000117020,RAC-gamma serine/threonine-protein kinase,Nucleus,,,6.099,7.575,7.575,69847,88506,0.313,curated,cell_adhesion_junctions_ECM_extended,True
ALCAM,,,no,ENSG00000170017,CD166 antigen (Activated leukocyte cell adhesion molecule) (CD antigen CD166),Cell membrane,corneal endothelial cell;neuroendocrine cell;chromaffin cell;type I pneumocyte;lung goblet cell;pancreatic A cell;visceromotor neuron;sebaceous gland cell,CD6,11.611,7.895,11.611,132980,92252,-0.556,curated,cell_adhesion_junctions_ECM_extended,False
AMH,,,no,ENSG00000104899,Muellerian-inhibiting factor (Anti-Muellerian hormone) (AMH) (Muellerian-inhibiting substance) (MIS),Secreted,duct epithelial cell;Sertoli cell;squamous epithelial cell;mesothelial cell;mesenchymal cell,AMH,0.069,0.019,0.069,792,225,-1.844,curated,cell_adhesion_junctions_ECM_extended,False
AMIGO1,,,no,ENSG00000181754,Amphoterin-induced protein 1 (AMIGO-1) (Alivin-2),Cell membrane,,,1.295,1.354,1.354,14832,15826,0.065,curated,cell_adhesion_junctions_ECM_extended,True
AMOT,,,no,ENSG00000126016,Angiomotin,Cell junction,,,1.824,1.789,1.824,20892,20908,-0.028,curated,cell_adhesion_junctions_ECM_extended,True
APP,,,no,ENSG00000142192,Amyloid-beta precursor protein (APP) (ABPP) (APPI) (Alzheimer disease amyloid A4 protein homolog) (Alzheimer disease amyloid protein) (Amyloid precursor protein) (Amyloid-beta (A4) precursor protein) (Amyloid-beta A4 protein) (Cerebral vascular amyloid peptide) (CVAP) (PreA4) (Protease nexin-II) (PN-II),Cell membrane,epithelial cell;lens epithelial cell;anterior lens cell;endothelial tip cell;kidney capillary endothelial cell;glomerular capillary endothelial cell;lung endothelial cell;type B pancreatic cell;fenestrated cell;glomerular endothelial cell;endothelial cell;endothelial cell of vascular tree;kidney loop of Henle thin ascending limb epithelial cell;surface ectodermal cell,APP,50.114,50.835,50.835,573949,593997,0.021,curated,cell_adhesion_junctions_ECM_extended,False
ARHGAP35,,,no,ENSG00000160007,Rho GTPase-activating protein 35 (Glucocorticoid receptor DNA-binding factor 1) (Glucocorticoid receptor repression factor 1) (GRF-1) (Rho GAP p190A) (p190-A),Cytoplasm,,,10.331,10.862,10.862,118320,126919,0.072,curated,cell_adhesion_junctions_ECM_extended,True
ARHGEF2,,,no,ENSG00000116584,Rho guanine nucleotide exchange factor 2 (Guanine nucleotide exchange factor H1) (GEF-H1) (Microtubule-regulated Rho-GEF) (Proliferating cell nucleolar antigen p40),Cytoplasm,,,4.689,7.396,7.396,53702,86415,0.657,curated,cell_adhesion_junctions_ECM_extended,True
ASPN,,,no,ENSG00000106819,Asporin (Periodontal ligament-associated protein 1) (PLAP-1),Secreted,interstitial cell of Cajal;endocardial cell;mesodermal cell;muscle cell;smooth muscle cell;skin fibroblast;myofibroblast cell;tendon cell;chondrocyte;mesenchymal cell,,0.982,0.979,0.982,11244,11440,-0.004,curated,cell_adhesion_junctions_ECM_extended,False
BAD,,,no,ENSG00000002330,Bcl2-associated agonist of cell death (BAD) (Bcl-2-binding component 6) (Bcl-2-like protein 8) (Bcl2-L-8) (Bcl-xL/Bcl-2-associated death promoter) (Bcl2 antagonist of cell death),Mitochondrion outer membrane;Cytoplasm,,,0.348,0.301,0.348,3987,3518,-0.209,curated,cell_adhesion_junctions_ECM_extended,False
BAIAP2,,,no,ENSG00000175866,Brain-specific angiogenesis inhibitor 1-associated protein 2 (BAI-associated protein 2) (BAI1-associated protein 2) (Protein BAP2) (Fas ligand-associated factor 3) (FLAF3) (Insulin receptor substrate p53/p58) (IRS-58) (IRSp53/58) (Insulin receptor substrate protein of 53 kDa) (IRSp53) (Insulin receptor substrate p53),Cytoplasm;Membrane,epithelial cell of lung;epithelial cell of alveolus of lung;pneumocyte;type I pneumocyte;type II pneumocyte,,0.783,1.127,1.127,8963,13167,0.526,curated,cell_adhesion_junctions_ECM_extended,False
BCAN,,,no,ENSG00000132692,Brevican core protein (Brain-enriched hyaluronan-binding protein) (BEHAB) (Chondroitin sulfate proteoglycan 7),Secreted,radial glial cell;forebrain radial glial cell;neural progenitor cell,,0.043,0.011,0.043,492,126,-1.994,curated,cell_adhesion_junctions_ECM_extended,False
BCAR1,,,no,ENSG00000050820,Breast cancer anti-estrogen resistance protein 1 (CRK-associated substrate) (Cas scaffolding protein family member 1) (p130cas),Cell junction,,,1.48,1.141,1.48,16949,13338,-0.375,curated,cell_adhesion_junctions_ECM_extended,True
BCL2,,,no,ENSG00000171791,Apoptosis regulator Bcl-2,Mitochondrion outer membrane,parietal epithelial cell;kidney loop of Henle thin descending limb epithelial cell;melanocyte;Schwann cell;fat cell;subcutaneous fat cell;adipocyte of breast;epicardial adipocyte;adipocyte of epicardial fat of left ventricle,,1.295,1.556,1.556,14831,18181,0.265,curated,cell_adhesion_junctions_ECM_extended,False
BIRC2,,,no,ENSG00000110330,Baculoviral IAP repeat-containing protein 2,Cytoplasm;Nucleus,,,15.907,16.978,16.978,182178,198387,0.094,curated,cell_adhesion_junctions_ECM_extended,False
BRAF,,,no,ENSG00000157764,Serine/threonine-protein kinase B-raf,Nucleus,,,9.828,9.385,9.828,112563,109665,-0.067,curated,cell_adhesion_junctions_ECM_extended,True
BRCA1,,,no,ENSG00000012048,Breast cancer type 1 susceptibility protein,Nucleus,,,0.771,0.492,0.771,8835,5745,-0.65,curated,cell_adhesion_junctions_ECM_extended,True
BVES,,,no,ENSG00000112276,Blood vessel epicardial substance (hBVES) (Popeye domain-containing protein 1) (Popeye protein 1),Lateral cell membrane,,,0.369,0.356,0.369,4227,4154,-0.054,curated,cell_adhesion_junctions_ECM_extended,True
CACNA1D,,,no,ENSG00000157388,"Voltage-dependent L-type calcium channel subunit alpha-1D (Calcium channel, L type, alpha-1 polypeptide, isoform 2) (Voltage-gated calcium channel subunit alpha Cav1.3)",Membrane,non-pigmented ciliary epithelial cell;corneal epithelial cell;kidney distal convoluted tubule epithelial cell;retinal pigment epithelial cell;amacrine cell;alveolar type 2 fibroblast cell,,1.15,0.96,1.15,13170,11215,-0.261,curated,cell_adhesion_junctions_ECM_extended,False
CADM3,,,no,ENSG00000162706,Cell adhesion molecule 3 (Brain immunoglobulin receptor) (Immunoglobulin superfamily member 4B) (IgSF4B) (Nectin-like protein 1) (NECL-1) (Synaptic cell adhesion molecule 3) (SynCAM3) (TSLC1-like protein 1) (TSLL1),Cell membrane,OFF-bipolar cell;Cajal-Retzius cell;visceromotor neuron,CADM;NECTIN,0.282,0.446,0.446,3225,5210,0.663,curated,cell_adhesion_junctions_ECM_extended,False
CALB2,,,no,ENSG00000172137,Calretinin (CR) (29 kDa calbindin),,mesothelial cell of pleura;ovarian surface epithelial cell;Leydig cell;mast cell;cortical interneuron;cerebral cortex GABAergic interneuron;Cajal-Retzius cell;glycinergic neuron,,0.047,0.068,0.068,535,793,0.539,curated,cell_adhesion_junctions_ECM_extended,False
CASK,,,no,ENSG00000147044,Peripheral plasma membrane protein CASK (hCASK),Nucleus,,,5.086,4.438,5.086,58249,51853,-0.197,curated,cell_adhesion_junctions_ECM_extended,True
CAV2,,,no,ENSG00000105971,Caveolin-2,Nucleus;Cytoplasm;Golgi apparatus membrane,pancreatic ductal cell;myoepithelial cell;myoepithelial cell of mammary gland;endothelial cell of artery;capillary endothelial cell;mesothelial cell of pleura;type I pneumocyte;bronchial smooth muscle cell;brown fat cell;adipocyte of breast,,5.932,5.385,5.932,67943,62928,-0.14,curated,cell_adhesion_junctions_ECM_extended,False
CCND1,,,no,ENSG00000110092,G1/S-specific cyclin-D1 (B-cell lymphoma 1 protein) (BCL-1) (BCL-1 oncogene) (PRAD1 oncogene),Nucleus,glioblast;Schwann cell precursor;epithelial cell;type I pneumocyte;epithelial cell of uterus;epithelial cell of thymus;cortical thymic epithelial cell,,9.831,5.998,9.831,112592,70080,-0.713,curated,cell_adhesion_junctions_ECM_extended,False
CCND2,,,no,ENSG00000118971,G1/S-specific cyclin-D2,Nucleus,"intestinal crypt stem cell of small intestine;IgG plasmablast;IgA plasmablast;activated CD4-positive, alpha-beta T cell;CD34-positive, CD56-positive, CD117-positive common innate lymphoid precursor, human;neural progenitor cell",,17.11,16.337,17.11,195956,190890,-0.067,curated,cell_adhesion_junctions_ECM_extended,False
CCND3,,,no,ENSG00000112576,G1/S-specific cyclin-D3,Nucleus,"platelet;double-positive, alpha-beta thymocyte;precursor B cell;large pre-B-II cell;late pro-B cell;immature natural killer cell;CD16-positive, CD56-dim natural killer cell, human;megakaryocyte;lymphoid lineage restricted progenitor cell;pro-B cell;fraction A pre-pro B cell",,2.449,1.864,2.449,28049,21786,-0.393,curated,cell_adhesion_junctions_ECM_extended,False
CD151,,,no,ENSG00000177697,CD151 antigen (GP27) (Membrane glycoprotein SFA-1) (Platelet-endothelial tetraspan antigen 3) (PETA-3) (Tetraspanin-24) (Tspan-24) (CD antigen CD151),Membrane,pancreatic ductal cell;myometrial cell;bronchial smooth muscle cell,,17.06,15.549,17.06,195386,181686,-0.134,curated,cell_adhesion_junctions_ECM_extended,False
CD160,,,no,ENSG00000117281,CD160 antigen (Natural killer cell receptor BY55) (CD antigen CD160),Secreted,"CD8-positive, alpha-beta T cell;activated CD8-positive, alpha-beta T cell;CD8-positive, alpha-beta memory T cell;CD8-positive, alpha-beta memory T cell, CD45RO-positive;effector memory CD8-positive, alpha-beta T cell;CD8-alpha-beta-positive, alpha-beta intraepithelial T cell;mature NK T cell;type I NK T cell;mucosal invariant T cell;gamma-delta T cell;mature gamma-delta T cell;CD8-alpha alpha positive, gamma-delta intraepithelial T cell;intraepithelial lymphocyte;innate lymphoid cell;natural killer cell;CD16-negative, CD56-bright natural killer cell, human;CD16-positive, CD56-dim natural killer cell, human;ILC1, human",CD160,0.056,0.047,0.056,647,548,-0.268,curated,cell_adhesion_junctions_ECM_extended,False
CD1A,,,no,ENSG00000158477,T-cell surface glycoprotein CD1a (T-cell surface antigen T6/Leu-6) (hTa1 thymocyte antigen) (CD antigen CD1a),Cell membrane,"Langerhans cell;alpha-beta T cell;immature alpha-beta T cell;double-positive, alpha-beta thymocyte;CD8-alpha-alpha-positive, alpha-beta intraepithelial T cell;intraepithelial lymphocyte;immature T cell;thymocyte;double negative thymocyte",,0.034,0.01,0.034,389,113,-1.812,curated,cell_adhesion_junctions_ECM_extended,False
CD1B,,,no,ENSG00000158485,T-cell surface glycoprotein CD1b (CD antigen CD1b),Cell membrane,"lymphocyte;T cell;alpha-beta T cell;immature alpha-beta T cell;double-positive, alpha-beta thymocyte;CD8-alpha-alpha-positive, alpha-beta intraepithelial T cell;gamma-delta T cell;intraepithelial lymphocyte;immature T cell;thymocyte;double negative thymocyte",,0.017,,0.017,189,0,,curated,cell_adhesion_junctions_ECM_extended,False
CD1C,,,no,ENSG00000158481,T-cell surface glycoprotein CD1c (CD antigen CD1c),Cell membrane,"mononuclear phagocyte;professional antigen presenting cell;dendritic cell;conventional dendritic cell;Langerhans cell;myeloid dendritic cell;myeloid dendritic cell, human;CD1c-positive myeloid dendritic cell;dendritic cell, human;unswitched memory B cell;B-1a B cell;B-1b B cell;follicular B cell;immature alpha-beta T cell;double-positive, alpha-beta thymocyte;immature T cell;thymocyte;transitional stage B cell",,0.049,0.07,0.07,564,815,0.502,curated,cell_adhesion_junctions_ECM_extended,False
CD1D,,,no,ENSG00000158473,Antigen-presenting glycoprotein CD1d (R3G1) (CD antigen CD1d),Cell membrane,mononuclear phagocyte;dendritic cell;conventional dendritic cell;Langerhans cell,CEACAM,0.54,0.965,0.965,6181,11275,0.838,curated,cell_adhesion_junctions_ECM_extended,False
CD1E,,,no,ENSG00000158488,"T-cell surface glycoprotein CD1e, membrane-associated (hCD1e) (R2G1) (CD antigen CD1e)",Lysosome lumen,"mononuclear phagocyte;Langerhans cell;dendritic cell, human;lymphocyte;T cell;alpha-beta T cell;immature alpha-beta T cell;double-positive, alpha-beta thymocyte;CD8-alpha-alpha-positive, alpha-beta intraepithelial T cell;gamma-delta T cell;intraepithelial lymphocyte;immature T cell;thymocyte;double negative thymocyte",,0.053,0.023,0.053,602,268,-1.196,curated,cell_adhesion_junctions_ECM_extended,False
CD2,,,no,ENSG00000116824,T-cell surface antigen CD2 (Erythrocyte receptor) (LFA-2) (LFA-3 receptor) (Rosette receptor) (T-cell surface antigen T11/Leu-5) (CD antigen CD2),Cell membrane,"hematopoietic cell;leukocyte;mononuclear cell;lymphocyte;T cell;alpha-beta T cell;mature alpha-beta T cell;CD4-positive helper T cell;T-helper 1 cell;T-helper 17 cell;T follicular helper cell;CD4-positive, CD25-positive, alpha-beta regulatory T cell;memory regulatory T cell;activated CD4-positive, alpha-beta T cell;activated CD4-positive, alpha-beta T cell, human;effector memory CD4-positive, alpha-beta T cell;CD4-positive, alpha-beta cytotoxic T cell;effector CD4-positive, alpha-beta T cell;activated CD8-positive, alpha-beta T cell;activated CD8-positive, alpha-beta T cell, human;CD8-positive, alpha-beta memory T cell;effector memory CD8-positive, alpha-beta T cell, terminally differentiated;CD8-alpha-beta-positive, alpha-beta intraepithelial T cell;CD8-alpha-alpha-positive, alpha-beta intraepithelial T cell;mature NK T cell;type I NK T cell;CD8-alpha alpha positive, gamma-delta intraepithelial T cell;mature T cell;regulatory T cell;cytotoxic T cell;exhausted T cell;intraepithelial lymphocyte;DN3 thymocyte;DN1 thymic pro-T cell",,0.235,0.318,0.318,2697,3711,0.432,curated,cell_adhesion_junctions_ECM_extended,False
CD209,,,no,ENSG00000090659,CD209 antigen (C-type lectin domain family 4 member L) (Dendritic cell-specific ICAM-3-grabbing non-integrin 1) (DC-SIGN) (DC-SIGN1) (CD antigen CD209),Secreted,blood vessel endothelial cell;endothelial cell of lymphatic vessel;mononuclear phagocyte,CEACAM;ICAM,0.654,0.521,0.654,7485,6084,-0.328,curated,cell_adhesion_junctions_ECM_extended,False
CD22,,,no,ENSG00000012124,B-cell receptor CD22 (B-lymphocyte cell adhesion molecule) (BL-CAM) (Sialic acid-binding Ig-like lectin 2) (Siglec-2) (T-cell surface antigen Leu-14) (CD antigen CD22),Cell membrane,"professional antigen presenting cell;dendritic cell, human;mature B cell;memory B cell;unswitched memory B cell;class switched memory B cell;IgG memory B cell;IgG-negative class switched memory B cell;naive B cell;B-1b B cell;follicular B cell;germinal center B cell;B cell;immature B cell;transitional stage B cell",CD45,0.214,0.261,0.261,2447,3046,0.287,curated,cell_adhesion_junctions_ECM_extended,False
CD226,,,no,ENSG00000150637,CD226 antigen (DNAX accessory molecule 1) (DNAM-1) (CD antigen CD226),Cell membrane,platelet;megakaryocyte,NECTIN;PVR,0.112,0.086,0.112,1287,1001,-0.391,curated,cell_adhesion_junctions_ECM_extended,True
CD274,,,no,ENSG00000120217,Programmed cell death 1 ligand 1 (PD-L1) (PDCD1 ligand 1) (Programmed death ligand 1) (hPD-L1) (B7 homolog 1) (B7-H1) (CD antigen CD274),Cell membrane,,CD80;PD-L1,0.55,0.719,0.719,6297,8396,0.386,curated,cell_adhesion_junctions_ECM_extended,True
CD276,,,no,ENSG00000103855,CD276 antigen (4Ig-B7-H3) (B7 homolog 3) (B7-H3) (Costimulatory molecule) (CD antigen CD276),Membrane,extravillous trophoblast;pancreatic stellate cell,CD276,5.652,4.526,5.652,64737,52881,-0.321,curated,cell_adhesion_junctions_ECM_extended,False
CD28,,,no,ENSG00000178562,T-cell-specific surface glycoprotein CD28 (TP44) (CD antigen CD28),Membrane,"T cell;alpha-beta T cell;mature alpha-beta T cell;CD4-positive, alpha-beta T cell;CD4-positive helper T cell;T-helper 1 cell;T follicular helper cell;CD4-positive, CD25-positive, alpha-beta regulatory T cell;naive regulatory T cell;CD4-positive, alpha-beta memory T cell;CD4-positive, alpha-beta memory T cell, CD45RO-positive;effector memory CD4-positive, alpha-beta T cell;effector CD4-positive, alpha-beta T cell;CD8-alpha-alpha-positive, alpha-beta intraepithelial T cell;mature T cell;regulatory T cell;cytotoxic T cell;intraepithelial lymphocyte;DN4 thymocyte;double negative T regulatory cell",CD80;CD86;ICOS,0.281,0.188,0.281,3220,2198,-0.58,curated,cell_adhesion_junctions_ECM_extended,False
CD34,,,no,ENSG00000174059,Hematopoietic progenitor cell antigen CD34 (CD antigen CD34),Membrane,"hematopoietic stem cell;CD34-positive, CD38-negative hematopoietic stem cell;interstitial cell of Cajal;blood vessel endothelial cell;endothelial tip cell;vein endothelial cell;vasa recta descending limb cell;retinal blood vessel endothelial cell;endothelial cell of artery;capillary endothelial cell;gut endothelial cell;endothelial cell of uterus;hematopoietic multipotent progenitor cell;early T lineage precursor;common lymphoid progenitor;keratocyte;adventitial cell",CD34;SELL,3.511,4.827,4.827,40207,56397,0.459,curated,cell_adhesion_junctions_ECM_extended,False
CD36,,,no,ENSG00000135218,Platelet glycoprotein 4 (Fatty acid translocase) (FAT) (Glycoprotein IIIb) (GPIIIB) (Leukocyte differentiation antigen CD36) (PAS IV) (PAS-4) (Platelet collagen receptor) (Platelet glycoprotein IV) (GPIV) (Thrombospondin receptor) (CD antigen CD36),Cell membrane,"vein endothelial cell;capillary endothelial cell;dermis microvascular lymphatic vessel endothelial cell;Hofbauer cell;cardiac muscle cell;regular atrial cardiac myocyte;regular ventricular cardiac myocyte;muscle precursor cell;cardiac muscle myoblast;dendritic cell, human;erythroid lineage cell;erythroblast;fat cell;white fat cell;adipocyte of breast",THBS,2.321,2.918,2.918,26582,34098,0.33,curated,cell_adhesion_junctions_ECM_extended,False
CD4,,,no,ENSG00000010610,T-cell surface glycoprotein CD4 (T-cell surface antigen T4/Leu-3) (CD antigen CD4),Cell membrane,"macrophage;colon macrophage;dendritic cell;plasmacytoid dendritic cell;plasmacytoid dendritic cell, human;dendritic cell, human;lymphocyte;T cell;T-helper 1 cell;T follicular helper cell;effector memory CD4-positive, alpha-beta T cell;regulatory T cell;cytotoxic T cell",IL16;MHC-II,2.249,3.322,3.322,25757,38821,0.563,curated,cell_adhesion_junctions_ECM_extended,False
CD40,,,no,ENSG00000101017,Tumor necrosis factor receptor superfamily member 5 (B-cell surface antigen CD40) (Bp50) (CD40L receptor) (CDw40) (CD antigen CD40),Secreted,"medullary thymic epithelial cell;dendritic cell;myeloid dendritic cell, human;memory B cell;class switched memory B cell;IgG memory B cell;IgG-negative class switched memory B cell;B-1a B cell;germinal center B cell",CD40,2.268,3.815,3.815,25980,44572,0.75,curated,cell_adhesion_junctions_ECM_extended,False
CD40LG,,,no,ENSG00000102245,CD40 ligand (CD40-L) (T-cell antigen Gp39) (TNF-related activation protein) (TRAP) (Tumor necrosis factor ligand superfamily member 5) (CD antigen CD154),Cell membrane,"T cell;alpha-beta T cell;mature alpha-beta T cell;CD4-positive, alpha-beta T cell;CD4-positive helper T cell;T-helper 1 cell;T-helper 17 cell;T follicular helper cell;activated CD4-positive, alpha-beta T cell;activated CD4-positive, alpha-beta T cell, human;CD4-positive, alpha-beta memory T cell;CD4-positive, alpha-beta memory T cell, CD45RO-positive;central memory CD4-positive, alpha-beta T cell;effector memory CD4-positive, alpha-beta T cell;effector CD4-positive, alpha-beta T cell;CD8-alpha-alpha-positive, alpha-beta intraepithelial T cell;type I NK T cell;mucosal invariant T cell;mature T cell;memory T cell;group 3 innate lymphoid cell",CD40,0.05,0.043,0.05,567,506,-0.193,curated,cell_adhesion_junctions_ECM_extended,False
CD44,,,no,ENSG00000026508,CD44 antigen (CDw44) (Epican) (Extracellular matrix receptor III) (ECMR-III) (GP90 lymphocyte homing/adhesion receptor) (HUTCH-I) (Heparan sulfate proteoglycan) (Hermes antigen) (Hyaluronate receptor) (Phagocytic glycoprotein 1) (PGP-1) (Phagocytic glycoprotein I) (PGP-I) (CD antigen CD44),Cell membrane,intestinal crypt stem cell of large intestine;pancreatic ductal cell;pancreatic acinar cell;elicited macrophage;alternatively activated macrophage;hematopoietic cell;granulocyte;leukocyte;myeloid leukocyte;mast cell;B cell;myeloid cell;early T lineage precursor;fibroblast of breast,MIF;SPP1;GALECTIN;COLLAGEN;FN1;LAMININ;SELE,47.499,46.665,47.499,544000,545266,-0.026,curated,cell_adhesion_junctions_ECM_extended,False
CD47,,,no,ENSG00000196776,Leukocyte surface antigen CD47 (Antigenic surface determinant protein OA3) (Integrin-associated protein) (IAP) (Protein MER6) (CD antigen CD47),Cell membrane,fallopian tube secretory epithelial cell;pro-T cell,THBS;SIRP,15.743,13.588,15.743,180309,158769,-0.212,curated,cell_adhesion_junctions_ECM_extended,False
CD58,,,no,ENSG00000116815,Lymphocyte function-associated antigen 3 (Ag3) (Surface glycoprotein LFA-3) (CD antigen CD58),Cell membrane,"myeloid dendritic cell, human",,3.112,3.298,3.298,35644,38542,0.084,curated,cell_adhesion_junctions_ECM_extended,False
CD6,,,no,ENSG00000013725,T-cell differentiation antigen CD6 (T12) (TP120) (CD antigen CD6),Cell membrane,"leukocyte;mononuclear cell;lymphocyte;T cell;alpha-beta T cell;mature alpha-beta T cell;CD4-positive, alpha-beta T cell;CD4-positive helper T cell;T-helper 1 cell;T-helper 22 cell;T follicular helper cell;naive thymus-derived CD4-positive, alpha-beta T cell;activated CD4-positive, alpha-beta T cell;activated CD4-positive, alpha-beta T cell, human;CD4-positive, alpha-beta memory T cell;CD4-positive, alpha-beta memory T cell, CD45RO-positive;central memory CD4-positive, alpha-beta T cell;effector memory CD4-positive, alpha-beta T cell;CD4-positive, alpha-beta cytotoxic T cell;effector CD4-positive, alpha-beta T cell;CD8-positive, alpha-beta T cell;CD8-positive, alpha-beta cytotoxic T cell;naive thymus-derived CD8-positive, alpha-beta T cell;mucosal invariant T cell;mature T cell;memory T cell;naive T cell;DN4 thymocyte",CD6,0.225,0.232,0.232,2576,2714,0.046,curated,cell_adhesion_junctions_ECM_extended,False
CD80,,,no,ENSG00000121594,T-lymphocyte activation antigen CD80 (Activation B7-1 antigen) (BB1) (CTLA-4 counter-receptor B7.1) (B7) (CD antigen CD80),Membrane,,CD80,0.065,0.083,0.083,745,970,0.352,curated,cell_adhesion_junctions_ECM_extended,True
