FGFR1,,,no,ENSG00000077782,Fibroblast growth factor receptor 1 (FGFR-1),Cell membrane,mesenchymal stem cell;pigmented epithelial cell;non-pigmented ciliary epithelial cell;pancreatic PP cell;fibroblast;keratocyte;fibroblast of connective tissue of nonglandular part of prostate;fibroblast of breast;tendon cell;adventitial cell,FGF;NCAM,20.063,19.893,20.063,229786,232446,-0.012,curated,cell_adhesion_junctions_ECM_extended,False
FLNB,,,no,ENSG00000136068,Filamin-B (FLN-B) (ABP-278) (ABP-280 homolog) (Actin-binding-like protein) (Beta-filamin) (Filamin homolog 1) (Fh1) (Filamin-3) (Thyroid autoantigen) (Truncated actin-binding protein) (Truncated ABP),Cytoplasm,ciliary muscle cell;papillary tips cell,,17.103,19.596,19.596,195885,228975,0.196,curated,cell_adhesion_junctions_ECM_extended,True
FLNC,,,no,ENSG00000128591,Filamin-C (FLN-C) (FLNc) (ABP-280-like protein) (ABP-L) (Actin-binding-like protein) (Filamin-2) (Gamma-filamin),Cytoplasm,slow muscle cell;smooth muscle cell of prostate,,0.106,0.133,0.133,1217,1551,0.321,curated,cell_adhesion_junctions_ECM_extended,False
FLOT2,,,no,ENSG00000132589,Flotillin-2 (Epidermal surface antigen) (ESA) (Membrane component chromosome 17 surface marker 1),Cell membrane,granulocyte;neutrophil,,14.003,14.234,14.234,160372,166318,0.024,curated,cell_adhesion_junctions_ECM_extended,False
FLT4,,,no,ENSG00000037280,Vascular endothelial growth factor receptor 3 (VEGFR-3),Cell membrane,endothelial cell of lymphatic vessel;surface ectodermal cell,,0.634,1.107,1.107,7260,12930,0.804,curated,cell_adhesion_junctions_ECM_extended,False
FMOD,,,no,ENSG00000122176,Fibromodulin (FM) (Collagen-binding 59 kDa protein) (Keratan sulfate proteoglycan fibromodulin) (KSPG fibromodulin),Secreted,duodenum glandular cell;endocardial cell;tendon cell;chondrocyte,,5.36,4.986,5.36,61384,58260,-0.104,curated,cell_adhesion_junctions_ECM_extended,True
FRAS1,,,no,ENSG00000138759,Extracellular matrix organizing protein FRAS1 (Fraser syndrome 1 protein),Cell membrane,epithelial cell of lung;type I pneumocyte;kidney connecting tubule epithelial cell;mesothelial fibroblast;kidney cell,,5.61,5.523,5.61,64250,64533,-0.023,curated,cell_adhesion_junctions_ECM_extended,False
FREM1,,,no,ENSG00000164946,FRAS1-related extracellular matrix protein 1 (Protein QBRICK),Secreted,kidney collecting duct epithelial cell;kidney collecting duct intercalated cell;renal intercalated cell;renal beta-intercalated cell;renal alpha-intercalated cell;taste receptor cell;kidney distal convoluted tubule epithelial cell;kidney connecting tubule epithelial cell;mesangial cell;kidney collecting duct cell,,1.632,1.386,1.632,18693,16191,-0.236,curated,cell_adhesion_junctions_ECM_extended,False
FREM2,,,no,ENSG00000150893,FRAS1-related extracellular matrix protein 2 (ECM3 homolog),Cell membrane,taste receptor cell;cortical cell of adrenal gland;neuron,,2.864,1.196,2.864,32806,13971,-1.26,curated,cell_adhesion_junctions_ECM_extended,False
FSCN1,,,no,ENSG00000075618,Fascin (55 kDa actin-bundling protein) (Singed-like protein) (p55),Cytoplasm,glioblast;Schwann cell precursor;neural crest cell;Sertoli cell;endothelial tip cell;mesothelial cell;lung endothelial cell;granulosa cell;gut endothelial cell;ovarian surface epithelial cell;Hofbauer cell;immature Schwann cell;enteric neuron;peripheral nervous system neuron,,2.087,2.471,2.471,23905,28869,0.243,curated,cell_adhesion_junctions_ECM_extended,False
FYN,,,no,ENSG00000010810,Tyrosine-protein kinase Fyn,Cytoplasm,alpha-beta T cell;mature alpha-beta T cell;mucosal invariant T cell;mature T cell;immature natural killer cell;DN1 thymic pro-T cell;brown preadipocyte;fibro/adipogenic progenitor cell,,2.617,3.046,3.046,29968,35596,0.219,curated,cell_adhesion_junctions_ECM_extended,False
FZR1,,,no,ENSG00000105325,Fizzy-related protein homolog (Fzr) (CDC20-like protein 1) (Cdh1/Hct1 homolog) (hCDH1),Cytoplasm,,,2.81,3.256,3.256,32178,38047,0.213,curated,cell_adhesion_junctions_ECM_extended,True
GATA3,,,no,ENSG00000107485,Trans-acting T-cell-specific transcription factor GATA-3 (GATA-binding factor 3),Nucleus,basal cell of epidermis;kidney collecting duct epithelial cell;kidney collecting duct principal cell;renal principal cell;taste receptor cell;kidney connecting tubule epithelial cell;extravillous trophoblast;placental villous trophoblast;syncytiotrophoblast cell;T-helper 2 cell;group 2 innate lymphoid cell;group 3 innate lymphoid cell;early T lineage precursor;neuron;papillary tips cell;kidney collecting duct cell,,0.061,0.054,0.061,703,631,-0.185,curated,cell_adhesion_junctions_ECM_extended,False
GATA4,,,no,ENSG00000136574,Transcription factor GATA-4 (GATA-binding factor 4),Nucleus,Sertoli cell;mesothelial cell;granulosa cell;endothelial cell of sinusoid;endothelial cell of hepatic sinusoid;endothelial cell of pericentral hepatic sinusoid;ovarian surface epithelial cell;Leydig cell;regular atrial cardiac myocyte,,8.05,8.864,8.864,92197,103568,0.139,curated,cell_adhesion_junctions_ECM_extended,False
GJA1,,,no,ENSG00000152661,Gap junction alpha-1 protein (Connexin-43) (Cx43) (Gap junction 43 kDa heart protein),Cell membrane,squamous epithelial cell;blood vessel endothelial cell;vein endothelial cell;vasa recta ascending limb cell;retinal blood vessel endothelial cell;prostate gland microvascular endothelial cell;keratinocyte;epidermal cell;endothelial cell of vascular tree;preosteoblast;osteoblast,GAP,3.263,2.296,3.263,37370,26826,-0.507,curated,cell_adhesion_junctions_ECM_extended,False
GNA11,,,no,ENSG00000088256,Guanine nucleotide-binding protein subunit alpha-11 (G alpha-11) (G-protein subunit alpha-11) (Guanine nucleotide-binding protein G(y) subunit alpha),Cell membrane,enterocyte;M cell of gut,,4.774,4.719,4.774,54674,55138,-0.017,curated,cell_adhesion_junctions_ECM_extended,True
GNAI1,,,no,ENSG00000127955,Guanine nucleotide-binding protein G(i) subunit alpha-1 (Adenylate cyclase-inhibiting G alpha protein),Nucleus,,,2.02,1.894,2.02,23135,22136,-0.093,curated,cell_adhesion_junctions_ECM_extended,True
GNAI2,,,no,ENSG00000114353,Guanine nucleotide-binding protein G(i) subunit alpha-2 (Adenylate cyclase-inhibiting G alpha protein),Cytoplasm,"gut endothelial cell;surface ectodermal cell;CD141-positive myeloid dendritic cell;myeloid dendritic cell;CD1c-positive myeloid dendritic cell;mature conventional dendritic cell;CD14-low, CD16-positive monocyte;promonocyte",,12.549,12.454,12.549,143725,145521,-0.011,curated,cell_adhesion_junctions_ECM_extended,False
GNAQ,,,no,ENSG00000156052,Guanine nucleotide-binding protein G(q) subunit alpha (Guanine nucleotide-binding protein alpha-q),Cell membrane,Purkinje cell,,5.861,5.107,5.861,67128,59669,-0.199,curated,cell_adhesion_junctions_ECM_extended,True
GP1BA,,,no,ENSG00000185245,Platelet glycoprotein Ib alpha chain (GP-Ib alpha) (GPIb-alpha) (GPIbA) (Glycoprotein Ibalpha) (Antigen CD42b-alpha) (CD antigen CD42b),Membrane,platelet;megakaryocyte-erythroid progenitor cell;megakaryocyte,GP1BA,0.053,0.024,0.053,602,285,-1.108,curated,cell_adhesion_junctions_ECM_extended,True
GP5,,,no,ENSG00000178732,Platelet glycoprotein V (GPV) (Glycoprotein 5) (CD antigen CD42d),Membrane,,,0.032,,0.032,370,0,,curated,cell_adhesion_junctions_ECM_extended,True
GP6,,,no,ENSG00000088053,Platelet glycoprotein VI (GPVI) (Glycoprotein 6),Cell membrane,,COLLAGEN,0.04,0.031,0.04,457,366,-0.349,curated,cell_adhesion_junctions_ECM_extended,False
GRB2,,,no,ENSG00000177885,Growth factor receptor-bound protein 2 (Adapter protein GRB2) (Protein Ash) (SH2/SH3 adapter GRB2),Nucleus,inflammatory macrophage;hematopoietic cell;leukocyte;conventional dendritic cell;intermediate monocyte,,10.544,10.031,10.544,120762,117211,-0.072,curated,cell_adhesion_junctions_ECM_extended,False
GRM1,,,no,ENSG00000152822,Metabotropic glutamate receptor 1 (mGluR1),Cell membrane,cerebellar granule cell;neuronal brush cell,Glutamate,0.025,0.009,0.025,286,107,-1.447,curated,cell_adhesion_junctions_ECM_extended,True
GRM5,,,no,ENSG00000168959,Metabotropic glutamate receptor 5 (mGluR5),Cell membrane,neural cell;neuron associated cell (sensu Vertebrata);oligodendrocyte precursor cell;Bergmann glial cell;neuron;interneuron;bipolar neuron;retinal bipolar neuron;ganglion interneuron;inhibitory interneuron;GABAergic neuron;glutamatergic neuron,Glutamate,0.107,0.024,0.107,1227,280,-2.161,curated,cell_adhesion_junctions_ECM_extended,False
GSK3B,,,no,ENSG00000082701,Glycogen synthase kinase-3 beta (GSK-3 beta),Cytoplasm,brown fat cell,,4.448,4.135,4.448,50945,48316,-0.105,curated,cell_adhesion_junctions_ECM_extended,False
GSTM3,,,no,ENSG00000134202,Glutathione S-transferase Mu 3,Cytoplasm,epithelial cell of lung;epithelial cell of alveolus of lung;pneumocyte;type II pneumocyte;pancreatic D cell;sperm;lung secretory cell,,9.652,9.66,9.66,110545,112878,0.001,curated,cell_adhesion_junctions_ECM_extended,False
GUCY1A2,,,no,ENSG00000152402,Guanylate cyclase soluble subunit alpha-2 (GCS-alpha-2),Cytoplasm,smooth muscle myoblast;kidney interstitial fibroblast;pericyte;renal interstitial pericyte;mural cell;kidney interstitial cell,,3.023,4.217,4.217,34621,49280,0.48,curated,cell_adhesion_junctions_ECM_extended,False
HGF,,,no,ENSG00000019991,Hepatocyte growth factor (Hepatopoietin-A) (Scatter factor) (SF),,promyelocyte;connective tissue cell;fibroblast;hepatic stellate cell;fibroblast of mammary gland;fibroblast of breast;mural cell,HGF,1.036,1.258,1.258,11870,14699,0.279,curated,cell_adhesion_junctions_ECM_extended,False
HMMR,,,no,ENSG00000072571,Hyaluronan mediated motility receptor (Intracellular hyaluronic acid-binding protein) (Receptor for hyaluronan-mediated motility) (CD antigen CD168),Cell surface,,,0.321,0.185,0.321,3681,2163,-0.796,curated,cell_adhesion_junctions_ECM_extended,True
HRAS,,,no,ENSG00000174775,GTPase HRas,Cell membrane,,,3.894,4.039,4.039,44603,47189,0.052,curated,cell_adhesion_junctions_ECM_extended,True
HSPA4,,,no,ENSG00000170606,Heat shock 70 kDa protein 4 (HSP70RY) (Heat shock 70-related protein APG-2),Cytoplasm,,,10.279,8.987,10.279,117722,105008,-0.194,curated,cell_adhesion_junctions_ECM_extended,True
HSPG2,,,no,ENSG00000142798,Basement membrane-specific heparan sulfate proteoglycan core protein (HSPG) (Perlecan) (PLC),Secreted,endothelial tip cell;endothelial cell of umbilical vein;retinal blood vessel endothelial cell;lung microvascular endothelial cell;lung endothelial cell;gut endothelial cell;endocardial cell;preadipocyte;white fat cell,HSPG,12.999,15.664,15.664,148881,183033,0.269,curated,cell_adhesion_junctions_ECM_extended,False
HTR2A,,,no,ENSG00000102468,5-hydroxytryptamine receptor 2A (5-HT-2) (5-HT-2A) (Serotonin receptor 2A),Cell membrane,,5-HT;SerotoninDopamin,0.069,0.014,0.069,790,169,-2.254,curated,cell_adhesion_junctions_ECM_extended,True
HTR2B,,,no,ENSG00000135914,5-hydroxytryptamine receptor 2B (5-HT-2B) (5-HT2B) (Serotonin receptor 2B),Cell membrane,uterine smooth muscle cell,5-HT;SerotoninDopamin,0.12,0.095,0.12,1372,1105,-0.341,curated,cell_adhesion_junctions_ECM_extended,False
HTR2C,,,no,ENSG00000147246,5-hydroxytryptamine receptor 2C (5-HT-2C) (5-HT2C) (5-HTR2C) (5-hydroxytryptamine receptor 1C) (5-HT-1C) (5-HT1C) (Serotonin receptor 2C),Cell membrane,ependymal cell;choroid plexus epithelial cell;columnar/cuboidal epithelial cell;pigmented ciliary epithelial cell;neuron,5-HT;SerotoninDopamin,0.021,,0.021,240,0,,curated,cell_adhesion_junctions_ECM_extended,False
ICAM1,,,no,ENSG00000090339,Intercellular adhesion molecule 1 (ICAM-1) (Major group rhinovirus receptor) (CD antigen CD54),Membrane,squamous epithelial cell;blood vessel endothelial cell;vein endothelial cell;endothelial cell of umbilical vein;vasa recta ascending limb cell;prostate gland microvascular endothelial cell;type I pneumocyte;medullary thymic epithelial cell;endothelial cell;gut endothelial cell;endothelial cell of vascular tree,ICAM,3.492,3.187,3.492,39994,37245,-0.132,curated,cell_adhesion_junctions_ECM_extended,False
ICAM2,,,no,ENSG00000108622,Intercellular adhesion molecule 2 (ICAM-2) (CD antigen CD102),Membrane,blood vessel endothelial cell;endothelial tip cell;endothelial cell of umbilical vein;vasa recta descending limb cell;endothelial cell of artery;glomerular capillary endothelial cell;capillary endothelial cell;fenestrated cell;glomerular endothelial cell;endothelial cell;gut endothelial cell;cerebral cortex endothelial cell;follicular dendritic cell;megakaryocyte,ICAM,1.278,1.69,1.69,14642,19752,0.403,curated,cell_adhesion_junctions_ECM_extended,False
ICAM3,,,no,ENSG00000076662,Intercellular adhesion molecule 3 (ICAM-3) (CDw50) (ICAM-R) (CD antigen CD50),Membrane,"hematopoietic stem cell;CD34-positive, CD38-negative hematopoietic stem cell;hematopoietic cell;CD141-positive myeloid dendritic cell;B-1a B cell;T-helper 2 cell;group 2 innate lymphoid cell;CD34-positive, CD56-positive, CD117-positive common innate lymphoid precursor, human;hematopoietic precursor cell;hematopoietic multipotent progenitor cell;pro-T cell;early T lineage precursor",,0.934,1.13,1.13,10698,13209,0.275,curated,cell_adhesion_junctions_ECM_extended,False
ICAM4,,,no,ENSG00000105371,Intercellular adhesion molecule 4 (ICAM-4) (Landsteiner-Wiener blood group glycoprotein) (LW blood group protein) (CD antigen CD242),Secreted,vasa recta ascending limb cell;megakaryocyte-erythroid progenitor cell;erythroid lineage cell;erythroblast;primitive red blood cell;myeloid lineage restricted progenitor cell,,0.144,0.068,0.144,1646,799,-1.072,curated,cell_adhesion_junctions_ECM_extended,False
ICAM5,,,no,ENSG00000105376,Intercellular adhesion molecule 5 (ICAM-5) (Telencephalin),Membrane,neural progenitor cell,ICAM,0.032,0.032,0.032,365,375,0.01,curated,cell_adhesion_junctions_ECM_extended,True
ICOS,,,no,ENSG00000163600,Inducible T-cell costimulator (Activation-inducible lymphocyte immunomediatory molecule) (CD antigen CD278),Secreted,"mononuclear cell;lymphocyte;T cell;alpha-beta T cell;mature alpha-beta T cell;CD4-positive, alpha-beta T cell;CD4-positive helper T cell;T-helper 1 cell;T follicular helper cell;CD4-positive, CD25-positive, alpha-beta regulatory T cell;naive regulatory T cell;activated CD4-positive, alpha-beta T cell;CD4-positive, alpha-beta memory T cell;CD4-positive, alpha-beta memory T cell, CD45RO-positive;effector memory CD4-positive, alpha-beta T cell;effector CD4-positive, alpha-beta T cell;activated CD8-positive, alpha-beta T cell;CD8-alpha-alpha-positive, alpha-beta intraepithelial T cell;mature NK T cell;type I NK T cell;mature T cell;memory T cell;regulatory T cell;intraepithelial lymphocyte;double negative thymocyte;DN3 thymocyte;group 3 innate lymphoid cell",ICOS,0.041,0.036,0.041,464,426,-0.152,curated,cell_adhesion_junctions_ECM_extended,False
ICOSLG,,,no,ENSG00000160223,ICOS ligand (B7 homolog 2) (B7-H2) (B7-like protein Gl50) (B7-related protein 1) (B7RP-1) (CD antigen CD275),Cell membrane,IgG-negative class switched memory B cell,,1.006,1.235,1.235,11518,14426,0.296,curated,cell_adhesion_junctions_ECM_extended,False
IGF1,,,no,ENSG00000017427,Insulin-like growth factor I (IGF-I) (Mechano growth factor) (MGF) (Somatomedin-C),Secreted,mesenchymal stem cell;pulmonary ionocyte;ionocyte;tracheobronchial smooth muscle cell;decidual cell;neuron;connective tissue cell;fibroblast;fibroblast of connective tissue of nonglandular part of prostate;fibroblast of connective tissue of glandular part of prostate;subcutaneous fat cell;adipocyte of breast;epicardial adipocyte;adipocyte of epicardial fat of left ventricle;myofibroblast cell;stromal cell;stromal cell of ovary;adventitial cell,IGF,2.35,0.766,2.35,26912,8945,-1.618,curated,cell_adhesion_junctions_ECM_extended,False
IGF1R,,,no,ENSG00000140443,Insulin-like growth factor 1 receptor,Cell membrane,corneal endothelial cell;pigmented epithelial cell;smooth muscle cell of sphincter of pupil,IGF,10.202,10.651,10.651,116843,124455,0.062,curated,cell_adhesion_junctions_ECM_extended,False
IKBKG,,,no,ENSG00000269335,NF-kappa-B essential modulator (NEMO) (FIP-3) (IkB kinase-associated protein 1) (IKKAP1) (Inhibitor of nuclear factor kappa-B kinase subunit gamma) (I-kappa-B kinase subunit gamma) (IKK-gamma) (IKKG) (IkB kinase subunit gamma) (NF-kappa-B essential modifier),Cytoplasm,,,3.475,3.987,3.987,39802,46583,0.198,curated,cell_adhesion_junctions_ECM_extended,True
IL2RB,,,no,ENSG00000100385,Interleukin-2 receptor subunit beta (IL-2 receptor subunit beta) (IL-2R subunit beta) (IL-2RB) (High affinity IL-2 receptor subunit beta) (Interleukin-15 receptor subunit beta) (p70-75) (p75) (CD antigen CD122),Cell membrane,"leukocyte;mononuclear cell;lymphocyte;T cell;alpha-beta T cell;mature alpha-beta T cell;CD8-positive, alpha-beta cytokine secreting effector T cell;CD8-alpha-beta-positive, alpha-beta intraepithelial T cell;mature NK T cell;type I NK T cell;mucosal invariant T cell;gamma-delta T cell;CD8-alpha alpha positive, gamma-delta intraepithelial T cell;mature T cell;regulatory T cell;intraepithelial lymphocyte;innate lymphoid cell;natural killer cell;CD16-negative, CD56-bright natural killer cell, human;CD16-positive, CD56-dim natural killer cell, human;decidual natural killer cell, human;ILC1, human;group 3 innate lymphoid cell",IL2,0.076,0.19,0.19,868,2215,1.323,curated,cell_adhesion_junctions_ECM_extended,False
IL2RG,,,no,ENSG00000147168,Cytokine receptor common subunit gamma (Interleukin-2 receptor subunit gamma) (IL-2 receptor subunit gamma) (IL-2R subunit gamma) (IL-2RG) (gammaC) (p64) (CD antigen CD132),Cell membrane,"hematopoietic cell;leukocyte;mononuclear cell;lymphocyte;T-helper 17 cell;effector memory CD4-positive, alpha-beta T cell;CD4-positive, alpha-beta cytotoxic T cell;CD8-positive, alpha-beta cytotoxic T cell;effector memory CD8-positive, alpha-beta T cell, terminally differentiated;effector CD8-positive, alpha-beta T cell;CD8-alpha-alpha-positive, alpha-beta intraepithelial T cell;mucosal invariant T cell;exhausted T cell;intraepithelial lymphocyte;double negative thymocyte;innate lymphoid cell;natural killer cell;immature natural killer cell;CD16-negative, CD56-bright natural killer cell, human;CD16-positive, CD56-dim natural killer cell, human;decidual natural killer cell, human;group 2 innate lymphoid cell, human;group 3 innate lymphoid cell;hematopoietic multipotent progenitor cell;early T lineage precursor",IL2,0.277,0.597,0.597,3171,6978,1.109,curated,cell_adhesion_junctions_ECM_extended,False
ILK,,,no,ENSG00000166333,Integrin-linked protein kinase,Cell junction,enteric smooth muscle cell;tracheobronchial smooth muscle cell;bronchial smooth muscle cell;platelet;megakaryocyte-erythroid progenitor cell;megakaryocyte,,12.062,13.357,13.357,138144,156071,0.147,curated,cell_adhesion_junctions_ECM_extended,False
INPPL1,,,no,ENSG00000165458,"Phosphatidylinositol 3,4,5-trisphosphate 5-phosphatase 2",Cytoplasm,pulmonary ionocyte;ionocyte,,14.524,18.626,18.626,166343,217635,0.359,curated,cell_adhesion_junctions_ECM_extended,True
INSR,,,no,ENSG00000171105,Insulin receptor (IR),Cell membrane,secondary lens fiber,,27.543,34.363,34.363,315452,401520,0.319,curated,cell_adhesion_junctions_ECM_extended,True
IQGAP1,,,no,ENSG00000140575,Ras GTPase-activating-like protein IQGAP1 (p195),Cell membrane,alternatively activated macrophage;neutrophil;mature conventional dendritic cell;myeloid leukocyte;myeloid cell,,14.685,16.393,16.393,168189,191552,0.159,curated,cell_adhesion_junctions_ECM_extended,False
IRS1,,,no,ENSG00000169047,Insulin receptor substrate 1 (IRS-1),,tracheobronchial smooth muscle cell,,5.307,6.072,6.072,60779,70949,0.194,curated,cell_adhesion_junctions_ECM_extended,False
ITGA1,,,no,ENSG00000213949,Integrin alpha-1 (CD49 antigen-like family member A) (Laminin and collagen receptor) (VLA-1) (CD antigen CD49a),Membrane,"capillary endothelial cell;cardiac endothelial cell;muscle cell;smooth muscle cell;enteric smooth muscle cell;smooth muscle cell of prostate;T cell;CD4-positive, alpha-beta memory T cell;CD8-positive, alpha-beta memory T cell;hepatic stellate cell;kidney interstitial fibroblast;renal interstitial pericyte;kidney interstitial cell",ANGPTL;COLLAGEN;LAMININ;CDH;CDH1;SEMA7,1.051,1.251,1.251,12037,14615,0.251,curated,cell_adhesion_junctions_ECM_extended,False
ITGA2,,,no,ENSG00000164171,Integrin alpha-2 (CD49 antigen-like family member B) (Collagen receptor) (Platelet membrane glycoprotein Ia) (GPIa) (VLA-2 subunit alpha) (CD antigen CD49b),Membrane,basal cell;luminal epithelial cell of mammary gland;basal epithelial cell of prostatic duct;myoepithelial cell;myoepithelial cell of mammary gland;epithelial cell of prostate;basal cell of prostate epithelium;mammary gland epithelial cell;epithelial cell of urethra;conjunctival epithelial cell,COLLAGEN;LAMININ;CHAD;CSPG4,2.525,2.233,2.525,28924,26096,-0.177,curated,cell_adhesion_junctions_ECM_extended,False
ITGA2B,,,no,ENSG00000005961,Integrin alpha-IIb (GPalpha IIb) (GPIIb) (Platelet membrane glycoprotein IIb) (CD antigen CD41),Membrane,"hematopoietic stem cell;blood cell;basophil;platelet;megakaryocyte-erythroid progenitor cell;megakaryocyte;erythroid progenitor cell, mammalian;common myeloid progenitor",CD40;FN1;VTN;TENASCIN;VWF,0.037,0.052,0.052,429,603,0.462,curated,cell_adhesion_junctions_ECM_extended,False
ITGA3,,,no,ENSG00000005884,Integrin alpha-3 (CD49 antigen-like family member C) (FRP-2) (Galactoprotein B3) (GAPB3) (VLA-3 subunit alpha) (CD antigen CD49c),Cell membrane,myoepithelial cell;myoepithelial cell of mammary gland;kidney glomerular epithelial cell;podocyte;parietal epithelial cell,COLLAGEN;FN1;LAMININ;RELN;THBS;JAM,8.336,9.495,9.495,95475,110949,0.188,curated,cell_adhesion_junctions_ECM_extended,False
ITGA4,,,no,ENSG00000115232,Integrin alpha-4 (CD49 antigen-like family member D) (Integrin alpha-IV) (VLA-4 subunit alpha) (CD antigen CD49d),Membrane,"hematopoietic cell;eosinophil;immature natural killer cell;megakaryocyte-erythroid progenitor cell;erythroid progenitor cell;erythroid progenitor cell, mammalian;basophil mast progenitor cell;hematopoietic precursor cell;hematopoietic multipotent progenitor cell;early lymphoid progenitor;common lymphoid progenitor",SPP1;MK;FN1;L1CAM;MADCAM;VCAM,1.285,2.169,2.169,14719,25349,0.755,curated,cell_adhesion_junctions_ECM_extended,False
ITGA5,,,no,ENSG00000161638,Integrin alpha-5 (CD49 antigen-like family member E) (Fibronectin receptor subunit alpha) (Integrin alpha-F) (VLA-5) (CD antigen CD49e),Cell membrane,squamous epithelial cell;blood vessel endothelial cell;endothelial tip cell;retinal blood vessel endothelial cell;endothelial cell;endothelial cell of vascular tree;surface ectodermal cell;smooth muscle cell of prostate;extravillous trophoblast;fibroblast of breast,CD40;SPP1;VISFATIN;ANGPTL;ANGPT;FN1,3.693,3.113,3.693,42298,36375,-0.247,curated,cell_adhesion_junctions_ECM_extended,False
ITGA6,,,no,ENSG00000091409,Integrin alpha-6 (CD49 antigen-like family member F) (VLA-6) (CD antigen CD49f),Cell membrane,intestinal crypt stem cell of small intestine;intestinal crypt stem cell of colon;epithelial cell;kidney collecting duct intercalated cell;renal intercalated cell;renal beta-intercalated cell;renal alpha-intercalated cell;retinal blood vessel endothelial cell;lung endothelial cell;endothelial cell;endothelial cell of vascular tree,NRG;IGF;MK;LAMININ,17.45,14.755,17.45,199856,172409,-0.242,curated,cell_adhesion_junctions_ECM_extended,False
ITGAD,,,no,ENSG00000156886,Integrin alpha-D (ADB2) (CD11 antigen-like family member D) (Leukointegrin alpha D) (CD antigen CD11d),Membrane,"type I NK T cell;decidual natural killer cell, human",VCAM,0.052,0.04,0.052,601,462,-0.408,curated,cell_adhesion_junctions_ECM_extended,False
ITGAE,,,no,ENSG00000083457,Integrin alpha-E (HML-1 antigen) (Integrin alpha-IEL) (Mucosal lymphocyte 1 antigen) (CD antigen CD103),Membrane,,CDH1,0.06,0.111,0.111,682,1294,0.895,curated,cell_adhesion_junctions_ECM_extended,True
ITGAL,,,no,ENSG00000005844,Integrin alpha-L (CD11 antigen-like family member A) (Leukocyte adhesion glycoprotein LFA-1 alpha chain) (LFA-1A) (Leukocyte function-associated molecule 1 alpha chain) (CD antigen CD11a),Cell membrane,"non-classical monocyte;alpha-beta T cell;mature alpha-beta T cell;CD4-positive, alpha-beta cytotoxic T cell;CD8-positive, alpha-beta cytotoxic T cell;activated CD8-positive, alpha-beta T cell, human;CD8-positive, alpha-beta cytokine secreting effector T cell;effector memory CD8-positive, alpha-beta T cell, terminally differentiated;mucosal invariant T cell;mature gamma-delta T cell;mature T cell;innate lymphoid cell;natural killer cell;CD16-positive, CD56-dim natural killer cell, human",ICAM;JAM,0.621,2.107,2.107,7113,24625,1.763,curated,cell_adhesion_junctions_ECM_extended,False
ITGAM,,,no,ENSG00000169896,Integrin alpha-M (CD11 antigen-like family member B) (CR-3 alpha chain) (Cell surface glycoprotein MAC-1 subunit alpha) (Leukocyte adhesion receptor MO1) (Neutrophil adherence receptor) (CD antigen CD11b),Cell membrane,"phagocyte;classical monocyte;CD14-positive, CD16-negative classical monocyte;hematopoietic cell;granulocyte;neutrophil;immature neutrophil;leukocyte;myeloid leukocyte;myelocyte;granulocytopoietic cell",CD40;COMPLEMENT;CD23;GP1BA;ICAM;JAM;THY1,1.411,1.928,1.928,16156,22529,0.451,curated,cell_adhesion_junctions_ECM_extended,False
ITGAV,,,no,ENSG00000138448,Integrin alpha-V (Vitronectin receptor) (Vitronectin receptor subunit alpha) (CD antigen CD51),Cell membrane,pigmented ciliary epithelial cell;type B pancreatic cell;kidney glomerular epithelial cell;podocyte;retinal pigment epithelial cell,NRG;IGF;SPP1;ANGPTL;PTN;PERIOSTIN;COLLAGEN;FN1;LAMININ;THBS;VTN;TENASCIN;DSPP;VWF;BSP;DMP1;CD23;JAM;L1CAM;THY1;ADGRA;ADGRB;ADGRE;MMP,7.177,5.973,7.177,82199,69797,-0.265,curated,cell_adhesion_junctions_ECM_extended,False
