P4HB,,,no,ENSG00000185624,Protein disulfide-isomerase (PDI),Endoplasmic reticulum,epithelial cell of alveolus of lung;pneumocyte;type II pneumocyte;pancreatic acinar cell;acinar cell;microfold cell of epithelium of small intestine;tracheobronchial serous cell;serous cell of epithelium of bronchus;lung secretory cell,GALECTIN,79.5,71.201,79.5,910512,831959,-0.159,curated,cell_adhesion_junctions_ECM_extended,False
PAK1,,,no,ENSG00000149269,Serine/threonine-protein kinase PAK 1,Cytoplasm,Langerhans cell;promonocyte,,7.519,7.94,7.94,86117,92771,0.078,curated,cell_adhesion_junctions_ECM_extended,False
PAK2,,,no,ENSG00000180370,Serine/threonine-protein kinase PAK 2,Nucleus,"CD34-positive, CD56-positive, CD117-positive common innate lymphoid precursor, human;common dendritic progenitor",,13.34,12.568,13.34,152781,146855,-0.086,curated,cell_adhesion_junctions_ECM_extended,False
PAK4,,,no,ENSG00000130669,Serine/threonine-protein kinase PAK 4,Cytoplasm,ovarian surface epithelial cell,,9.104,11.073,11.073,104270,129383,0.282,curated,cell_adhesion_junctions_ECM_extended,False
PARD3,,,no,ENSG00000148498,Partitioning defective 3 homolog (PAR-3) (PARD-3) (Atypical PKC isotype-specific-interacting protein) (ASIP) (CTCL tumor antigen se2-5) (PAR3-alpha),Cytoplasm,papillary tips cell,PARs,7.205,8.225,8.225,82520,96105,0.191,curated,cell_adhesion_junctions_ECM_extended,True
PCNA,,,no,ENSG00000132646,Proliferating cell nuclear antigen (PCNA) (Cyclin),Nucleus,alpha-beta T cell;mature alpha-beta T cell;mucosal invariant T cell;mature T cell;primitive red blood cell;pre-conventional dendritic cell,,8.72,8.294,8.72,99873,96918,-0.072,curated,cell_adhesion_junctions_ECM_extended,False
PCSK9,,,no,ENSG00000169174,Proprotein convertase subtilisin/kexin type 9,Cytoplasm;Secreted;Endosome;Lysosome;Cell surface;Endoplasmic reticulum;Golgi apparatus,,,0.875,0.205,0.875,10026,2395,-2.095,curated,cell_adhesion_junctions_ECM_extended,True
PDCD1,,,no,ENSG00000188389,Programmed cell death protein 1 (Protein PD-1) (hPD-1) (CD antigen CD279),Cell membrane,"CD4-positive helper T cell;T follicular helper cell;CD4-positive, CD25-positive, alpha-beta regulatory T cell;activated CD8-positive, alpha-beta T cell;CD8-alpha-alpha-positive, alpha-beta intraepithelial T cell;regulatory T cell;intraepithelial lymphocyte",PD-L1;PDL2,0.033,0.051,0.051,379,596,0.624,curated,cell_adhesion_junctions_ECM_extended,False
PDCD1LG2,,,no,ENSG00000197646,Programmed cell death 1 ligand 2 (PD-1 ligand 2) (PD-L2) (PDCD1 ligand 2) (Programmed death ligand 2) (Butyrophilin B7-DC) (B7-DC) (CD antigen CD273),Cell membrane,,PDL2,0.131,0.128,0.131,1497,1498,-0.028,curated,cell_adhesion_junctions_ECM_extended,True
PDGFA,,,no,ENSG00000197461,Platelet-derived growth factor subunit A (PDGF subunit A) (PDGF-1) (Platelet-derived growth factor A chain) (Platelet-derived growth factor alpha polypeptide),Secreted,"paneth cell of epithelium of small intestine;CD14-positive, CD16-negative classical monocyte;myometrial cell;CD14-positive, CD16-positive monocyte",PDGF,21.946,19.66,21.946,251350,229716,-0.159,curated,cell_adhesion_junctions_ECM_extended,False
PDGFB,,,no,ENSG00000100311,Platelet-derived growth factor subunit B (PDGF subunit B) (PDGF-2) (Platelet-derived growth factor B chain) (Platelet-derived growth factor beta polypeptide) (Proto-oncogene c-Sis) (Becaplermin),Secreted,squamous epithelial cell;blood vessel endothelial cell;endothelial cell;endothelial cell of vascular tree,PDGF,1.864,2.224,2.224,21348,25988,0.255,curated,cell_adhesion_junctions_ECM_extended,False
PDGFC,,,no,ENSG00000145431,Platelet-derived growth factor C (PDGF-C) (Fallotein) (Spinal cord-derived growth factor) (SCDGF) (VEGF-E),Cytoplasm,cholangiocyte;Kupffer cell;immature innate lymphoid cell,PDGF,9.043,8.547,9.043,103571,99875,-0.081,curated,cell_adhesion_junctions_ECM_extended,False
PDGFD,,,no,ENSG00000170962,Platelet-derived growth factor D (PDGF-D) (Iris-expressed growth factor) (Spinal cord-derived growth factor B) (SCDGF-B),Secreted,cholangiocyte;kidney capillary endothelial cell;melanocyte;neuron;fibroblast of cardiac tissue,PDGF,4.856,5.099,5.099,55617,59582,0.07,curated,cell_adhesion_junctions_ECM_extended,False
PDGFRA,,,no,ENSG00000134853,Platelet-derived growth factor receptor alpha (PDGF-R-alpha) (PDGFR-alpha),Cell membrane,mesenchymal stem cell;interstitial cell of Cajal;mesodermal cell;muscle cell;smooth muscle cell;connective tissue cell;fibroblast;keratocyte;alveolar type 2 fibroblast cell;fibroblast of cardiac tissue;fibroblast of breast;mesothelial fibroblast;myofibroblast cell;stromal cell;stromal cell of ovary;interstitial cell of ovary;mesangial cell;mesenchymal cell;fibro/adipogenic progenitor cell,PDGF,7.675,7.553,7.675,87901,88254,-0.023,curated,cell_adhesion_junctions_ECM_extended,False
PDGFRB,,,no,ENSG00000113721,Platelet-derived growth factor receptor beta (PDGF-R-beta) (PDGFR-beta),Cell membrane,cerebral cortex endothelial cell;muscle cell;smooth muscle cell;vascular associated smooth muscle cell;bronchial smooth muscle cell;smooth muscle myoblast;connective tissue cell;fibroblast;keratocyte;hepatic stellate cell;preadipocyte;brown preadipocyte;pancreatic stellate cell;pericyte;renal interstitial pericyte;mural cell,PDGF,6.511,5.072,6.511,74566,59261,-0.36,curated,cell_adhesion_junctions_ECM_extended,False
PDPK1,,,no,ENSG00000140992,3-phosphoinositide-dependent protein kinase 1 (hPDK1),Cytoplasm;Nucleus;Cell membrane,,,6.841,7.32,7.32,78351,85530,0.098,curated,cell_adhesion_junctions_ECM_extended,True
PECAM1,,,no,ENSG00000261371,Platelet endothelial cell adhesion molecule (PECAM-1) (EndoCAM) (GPIIA') (PECA1) (CD antigen CD31),Cell membrane,"epithelial cell;squamous epithelial cell;blood vessel endothelial cell;endothelial tip cell;vein endothelial cell;vasa recta ascending limb cell;vasa recta descending limb cell;retinal blood vessel endothelial cell;endothelial cell of artery;kidney capillary endothelial cell;glomerular capillary endothelial cell;capillary endothelial cell;lung microvascular endothelial cell;prostate gland microvascular endothelial cell;lung endothelial cell;fenestrated cell;glomerular endothelial cell;endothelial cell;gut endothelial cell;endothelial cell of vascular tree;endothelial cell of lymphatic vessel;endothelial cell of uterus;cardiac endothelial cell;endocardial cell;surface ectodermal cell;non-classical monocyte;CD14-low, CD16-positive monocyte",PECAM1;PECAM2,4.026,6.915,6.915,46106,80801,0.781,curated,cell_adhesion_junctions_ECM_extended,False
PGF,,,no,ENSG00000119630,Placenta growth factor (PlGF),Secreted,squamous epithelial cell;blood vessel endothelial cell;vein endothelial cell;endothelial cell of umbilical vein;endothelial cell;endothelial cell of vascular tree;cerebral cortex endothelial cell;trophoblast giant cell;extravillous trophoblast;syncytiotrophoblast cell;myofibroblast cell,VEGF,0.676,0.641,0.676,7737,7490,-0.076,curated,cell_adhesion_junctions_ECM_extended,False
PIK3CA,,,no,ENSG00000121879,"Phosphatidylinositol 4,5-bisphosphate 3-kinase catalytic subunit alpha isoform (PI3-kinase subunit alpha) (PI3K-alpha) (PI3Kalpha) (PtdIns-3-kinase subunit alpha)",,,,6.97,6.121,6.97,79827,71518,-0.187,curated,cell_adhesion_junctions_ECM_extended,True
PIK3CB,,,no,ENSG00000051382,"Phosphatidylinositol 4,5-bisphosphate 3-kinase catalytic subunit beta isoform (PI3-kinase subunit beta) (PI3K-beta) (PI3Kbeta) (PtdIns-3-kinase subunit beta)",Cytoplasm,,,10.714,9.571,10.714,122705,111829,-0.163,curated,cell_adhesion_junctions_ECM_extended,True
PIK3CD,,,no,ENSG00000171608,"Phosphatidylinositol 4,5-bisphosphate 3-kinase catalytic subunit delta isoform (PI3-kinase subunit delta) (PI3K-delta) (PI3Kdelta) (PtdIns-3-kinase subunit delta)",Cytoplasm,,,1.39,2.73,2.73,15919,31898,0.974,curated,cell_adhesion_junctions_ECM_extended,True
PIK3R1,,,no,ENSG00000145675,Phosphatidylinositol 3-kinase regulatory subunit alpha (PI3-kinase regulatory subunit alpha) (PI3K regulatory subunit alpha) (PtdIns-3-kinase regulatory subunit alpha) (Phosphatidylinositol 3-kinase 85 kDa regulatory subunit alpha) (PI3-kinase subunit p85-alpha) (PtdIns-3-kinase regulatory subunit p85-alpha),,epithelial cell of thymus;cortical thymic epithelial cell;alpha-beta T cell;mature alpha-beta T cell;mucosal invariant T cell;mature T cell;keratocyte,,4.493,4.853,4.853,51457,56704,0.111,curated,cell_adhesion_junctions_ECM_extended,False
PIK3R2,,,no,ENSG00000105647,Phosphatidylinositol 3-kinase regulatory subunit beta (PI3-kinase regulatory subunit beta) (PI3K regulatory subunit beta) (PtdIns-3-kinase regulatory subunit beta) (Phosphatidylinositol 3-kinase 85 kDa regulatory subunit beta) (PI3-kinase subunit p85-beta) (PtdIns-3-kinase regulatory subunit p85-beta),,,,8.295,7.973,8.295,94998,93166,-0.057,curated,cell_adhesion_junctions_ECM_extended,True
PKD1,,,no,ENSG00000008710,Polycystin-1 (PC1) (Autosomal dominant polycystic kidney disease 1 protein),Cell membrane,,,3.819,4.49,4.49,43736,52461,0.234,curated,cell_adhesion_junctions_ECM_extended,True
PKHD1,,,no,ENSG00000170927,Fibrocystin (Polycystic kidney and hepatic disease 1 protein) (Polyductin) (Tigmin),Cell membrane,epithelial cell of proximal tubule;cholangiocyte;kidney collecting duct epithelial cell;kidney collecting duct principal cell;renal principal cell;kidney distal convoluted tubule epithelial cell;kidney loop of Henle ascending limb epithelial cell;kidney loop of Henle thick ascending limb epithelial cell;kidney loop of Henle thin ascending limb epithelial cell;kidney epithelial cell;parietal epithelial cell;kidney cortex tubule cell;kidney connecting tubule epithelial cell;epithelial cell of nephron;kidney loop of Henle epithelial cell;kidney loop of Henle thin descending limb epithelial cell;kidney cell;kidney collecting duct cell,,11.011,14.289,14.289,126103,166961,0.376,curated,cell_adhesion_junctions_ECM_extended,False
PLAUR,,,no,ENSG00000011422,Urokinase plasminogen activator surface receptor (U-PAR) (uPAR) (Monocyte activation antigen Mo3) (CD antigen CD87),Cell membrane,epithelial cell of lacrimal sac;epithelial cell of uterus;epithelial cell of urethra;elicited macrophage;inflammatory macrophage;alternatively activated macrophage;hematopoietic cell;blood cell;granulocyte;leukocyte;liver dendritic cell;myeloid leukocyte;myeloid cell,VTN;PLAU,3.688,4.487,4.487,42234,52425,0.283,curated,cell_adhesion_junctions_ECM_extended,False
PLCB1,,,no,ENSG00000182621,"1-phosphatidylinositol 4,5-bisphosphate phosphodiesterase beta-1",Nucleus membrane,endothelial cell of sinusoid;endothelial cell of hepatic sinusoid;endothelial cell of pericentral hepatic sinusoid;cardiac endothelial cell;kidney loop of Henle ascending limb epithelial cell;kidney loop of Henle thick ascending limb epithelial cell;kidney loop of Henle epithelial cell;Schwann cell;mesangial cell,,4.51,3.9,4.51,51649,45569,-0.21,curated,cell_adhesion_junctions_ECM_extended,False
PLCG1,,,no,ENSG00000124181,"1-phosphatidylinositol 4,5-bisphosphate phosphodiesterase gamma-1",Cell projection,,,5.209,7.695,7.695,59656,89916,0.563,curated,cell_adhesion_junctions_ECM_extended,True
PLEC,,,no,ENSG00000178209,Plectin (PCN) (PLTN) (Hemidesmosomal protein 1) (HD1) (Plectin-1),Cytoplasm,,,25.446,30.531,30.531,291429,356744,0.263,curated,cell_adhesion_junctions_ECM_extended,True
PPP1CA,,,no,ENSG00000172531,Serine/threonine-protein phosphatase PP1-alpha catalytic subunit (PP-1A),Cytoplasm,large pre-B-II cell;pre-conventional dendritic cell,,16.15,16.684,16.684,184968,194948,0.047,curated,cell_adhesion_junctions_ECM_extended,False
PPP2CA,,,no,ENSG00000113575,Serine/threonine-protein phosphatase 2A catalytic subunit alpha isoform (PP2A-alpha),Cytoplasm,,,15.594,14.558,15.594,178595,170102,-0.099,curated,cell_adhesion_junctions_ECM_extended,True
PPP2R1A,,,no,ENSG00000105568,Serine/threonine-protein phosphatase 2A 65 kDa regulatory subunit A alpha isoform (Medium tumor antigen-associated 61 kDa protein) (PP2A subunit A isoform PR65-alpha) (PP2A subunit A isoform R1-alpha),Cytoplasm,glioblast;Schwann cell precursor;ovarian surface epithelial cell,,12.025,13.083,13.083,137719,152877,0.122,curated,cell_adhesion_junctions_ECM_extended,False
PRKAA1,,,no,ENSG00000132356,5'-AMP-activated protein kinase catalytic subunit alpha-1 (AMPK subunit alpha-1),Cytoplasm,,,8.061,7.554,8.061,92325,88264,-0.094,curated,cell_adhesion_junctions_ECM_extended,True
PRKAA2,,,no,ENSG00000162409,5'-AMP-activated protein kinase catalytic subunit alpha-2 (AMPK subunit alpha-2),Cytoplasm,renal beta-intercalated cell,,2.068,1.699,2.068,23685,19858,-0.283,curated,cell_adhesion_junctions_ECM_extended,True
PRKAB1,,,no,ENSG00000111725,5'-AMP-activated protein kinase subunit beta-1 (AMPK subunit beta-1) (AMPKb),,enteroendocrine cell of colon;lung secretory cell,,3.934,4.127,4.127,45057,48224,0.069,curated,cell_adhesion_junctions_ECM_extended,True
PRKACA,,,no,ENSG00000072062,cAMP-dependent protein kinase catalytic subunit alpha (PKA C-alpha),Cytoplasm,,,13.316,14.222,14.222,152507,166178,0.095,curated,cell_adhesion_junctions_ECM_extended,True
PRKACB,,,no,ENSG00000142875,cAMP-dependent protein kinase catalytic subunit beta (PKA C-beta),Cytoplasm,,,5.254,5.917,5.917,60170,69137,0.172,curated,cell_adhesion_junctions_ECM_extended,True
PRKAG1,,,no,ENSG00000181929,5'-AMP-activated protein kinase subunit gamma-1 (AMPK gamma1) (AMPK subunit gamma-1) (AMPKg),,,,7.179,6.306,7.179,82220,73684,-0.187,curated,cell_adhesion_junctions_ECM_extended,True
PRKAG2,,,no,ENSG00000106617,5'-AMP-activated protein kinase subunit gamma-2 (AMPK gamma2) (AMPK subunit gamma-2) (H91620p),,regular atrial cardiac myocyte,,2.524,2.493,2.524,28910,29126,-0.018,curated,cell_adhesion_junctions_ECM_extended,True
PRKCA,,,no,ENSG00000154229,Protein kinase C alpha type (PKC-A) (PKC-alpha),Cytoplasm,endothelial cell of hepatic sinusoid;endothelial cell of pericentral hepatic sinusoid;Bergmann glial cell;Schwann cell;neuron;kidney interstitial fibroblast,,2.789,3.645,3.645,31945,42590,0.386,curated,cell_adhesion_junctions_ECM_extended,False
PRKCB,,,no,ENSG00000166501,Protein kinase C beta type (PKC-B) (PKC-beta),Cytoplasm,IgG memory B cell;IgG-negative class switched memory B cell;amacrine cell;stellate neuron,,0.4,0.534,0.534,4584,6243,0.417,curated,cell_adhesion_junctions_ECM_extended,False
PRKCE,,,no,ENSG00000171132,Protein kinase C epsilon type,Cytoplasm,renal beta-intercalated cell,,1.225,1.263,1.263,14032,14757,0.044,curated,cell_adhesion_junctions_ECM_extended,True
PRKCG,,,no,ENSG00000126583,Protein kinase C gamma type (PKC-gamma),Cytoplasm,,,0.083,0.065,0.083,952,759,-0.356,curated,cell_adhesion_junctions_ECM_extended,True
PRKCI,,,no,ENSG00000163558,Protein kinase C iota type,Cytoplasm,fallopian tube secretory epithelial cell,,5.332,5.185,5.332,61066,60585,-0.04,curated,cell_adhesion_junctions_ECM_extended,False
PRKCZ,,,no,ENSG00000067606,Protein kinase C zeta type,Cytoplasm,type I pneumocyte;syncytiotrophoblast cell,,3.072,4.046,4.046,35180,47272,0.397,curated,cell_adhesion_junctions_ECM_extended,False
PTEN,,,no,ENSG00000171862,"Phosphatidylinositol 3,4,5-trisphosphate 3-phosphatase and dual-specificity protein phosphatase PTEN",Cytoplasm,melanocyte;melanocyte of skin;kidney interstitial fibroblast;subcutaneous fat cell;epicardial adipocyte,,21.121,18.505,21.121,241901,216228,-0.191,curated,cell_adhesion_junctions_ECM_extended,False
PTK2,,,no,ENSG00000169398,Focal adhesion kinase 1 (FADK 1),Cell junction,papillary tips cell;neural progenitor cell,,10.001,10.179,10.179,114546,118942,0.025,curated,cell_adhesion_junctions_ECM_extended,True
PTPN1,,,no,ENSG00000196396,Tyrosine-protein phosphatase non-receptor type 1,Endoplasmic reticulum membrane,type I pneumocyte;elicited macrophage;inflammatory macrophage,,6.782,6.906,6.906,77670,80696,0.026,curated,cell_adhesion_junctions_ECM_extended,False
PTPN6,,,no,ENSG00000111679,Tyrosine-protein phosphatase non-receptor type 6,Cytoplasm;Nucleus,"eosinophil;leukocyte;conventional dendritic cell;myeloid dendritic cell;CD1c-positive myeloid dendritic cell;B-1a B cell;B-1b B cell;non-classical monocyte;CD14-low, CD16-positive monocyte;CD14-positive, CD16-positive monocyte;B cell",,3.889,5.335,5.335,44537,62337,0.456,curated,cell_adhesion_junctions_ECM_extended,False
PTPRF,,,no,ENSG00000142949,Receptor-type tyrosine-protein phosphatase F,Membrane,epithelial cell of alveolus of lung;pneumocyte;type I pneumocyte;fallopian tube secretory epithelial cell,NGL;PTPR,15.905,17.873,17.873,182158,208836,0.168,curated,cell_adhesion_junctions_ECM_extended,False
PTPRJ,,,no,ENSG00000149177,Receptor-type tyrosine-protein phosphatase eta (Protein-tyrosine phosphatase eta) (R-PTP-eta),Cell membrane,kidney collecting duct intercalated cell;melanocyte;Schwann cell,,4.658,4.73,4.73,53343,55263,0.022,curated,cell_adhesion_junctions_ECM_extended,False
PTPRM,,,no,ENSG00000173482,Receptor-type tyrosine-protein phosphatase mu (Protein-tyrosine phosphatase mu) (R-PTP-mu),Cell membrane,corneal endothelial cell;lung endothelial cell;endothelial cell;endothelial cell of vascular tree;cardiac endothelial cell;melanocyte;melanocyte of skin;papillary tips cell,PTPRM,5.576,6.887,6.887,63863,80471,0.305,curated,cell_adhesion_junctions_ECM_extended,False
PVR,,,no,ENSG00000073008,Poliovirus receptor (Nectin-like protein 5) (NECL-5) (CD antigen CD155),Secreted,,CD96;NECTIN;PVR,10.374,8.013,10.374,118814,93630,-0.373,curated,cell_adhesion_junctions_ECM_extended,True
PXN,,,no,ENSG00000089159,Paxillin,Cytoplasm,,,5.194,5.522,5.522,59484,64524,0.088,curated,cell_adhesion_junctions_ECM_extended,True
RAB8A,,,no,ENSG00000167461,Ras-related protein Rab-8A,Cell membrane,,,8.84,7.828,8.84,101239,91465,-0.175,curated,cell_adhesion_junctions_ECM_extended,True
RAC1,,,no,ENSG00000136238,Ras-related C3 botulinum toxin substrate 1,Cell membrane,endothelial cell of umbilical vein;epithelial cell of urethra,,48.985,45.143,48.985,561018,527479,-0.118,curated,cell_adhesion_junctions_ECM_extended,False
RAF1,,,no,ENSG00000132155,RAF proto-oncogene serine/threonine-protein kinase,Cytoplasm;Cell membrane;Mitochondrion;Nucleus,,,15.389,15.043,15.389,176249,175777,-0.033,curated,cell_adhesion_junctions_ECM_extended,True
RAP1A,,,no,ENSG00000116473,Ras-related protein Rap-1A,Cell membrane,mast cell;mucosal type mast cell,,21.61,18.49,21.61,247496,216050,-0.225,curated,cell_adhesion_junctions_ECM_extended,False
RAPGEF3,,,no,ENSG00000079337,Rap guanine nucleotide exchange factor 3 (Exchange factor directly activated by cAMP 1) (Exchange protein directly activated by cAMP 1) (EPAC 1) (Rap1 guanine-nucleotide-exchange factor directly activated by cAMP) (cAMP-regulated guanine nucleotide exchange factor I) (cAMP-GEFI),Endomembrane system,kidney glomerular epithelial cell;parietal epithelial cell,,0.738,1.89,1.89,8448,22084,1.357,curated,cell_adhesion_junctions_ECM_extended,False
RAPGEF6,,,no,ENSG00000158987,Rap guanine nucleotide exchange factor 6 (PDZ domain-containing guanine nucleotide exchange factor 2) (PDZ-GEF2) (RA-GEF-2),Cytoplasm,neuroendocrine cell;chromaffin cell,,2.509,2.346,2.509,28735,27407,-0.097,curated,cell_adhesion_junctions_ECM_extended,True
RASA1,,,no,ENSG00000145715,Ras GTPase-activating protein 1 (GAP) (GTPase-activating protein) (RasGAP) (Ras p21 protein activator) (p120GAP),Cytoplasm,trophoblast giant cell;syncytiotrophoblast cell,,4.865,4.961,4.961,55715,57973,0.028,curated,cell_adhesion_junctions_ECM_extended,False
RASGRP1,,,no,ENSG00000172575,RAS guanyl-releasing protein 1 (Calcium and DAG-regulated guanine nucleotide exchange factor II) (CalDAG-GEFII) (Ras guanyl-releasing protein),Cytoplasm,memory regulatory T cell;DN4 thymocyte,,1.337,1.253,1.337,15318,14639,-0.094,curated,cell_adhesion_junctions_ECM_extended,False
RELN,,,no,ENSG00000189056,Reelin,Secreted,pigmented epithelial cell;pigmented ciliary epithelial cell;dermis microvascular lymphatic vessel endothelial cell;endothelial cell of sinusoid;endothelial cell of hepatic sinusoid;endothelial cell of pericentral hepatic sinusoid;erythroblast;neuron;stellate neuron;granule cell;cerebellar granule cell;neuronal brush cell;Cajal-Retzius cell;hepatic stellate cell,RELN,0.181,0.233,0.233,2077,2722,0.361,curated,cell_adhesion_junctions_ECM_extended,False
RHOA,,,no,ENSG00000067560,Transforming protein RhoA,Cell membrane,"pancreatic PP cell;PP cell;mature conventional dendritic cell;myeloid leukocyte;mast cell;mucosal type mast cell;CD34-positive, CD56-positive, CD117-positive common innate lymphoid precursor, human;myeloid cell",,29.58,26.558,29.58,338774,310325,-0.155,curated,cell_adhesion_junctions_ECM_extended,False
ROCK1,,,no,ENSG00000067900,Rho-associated protein kinase 1,Cytoplasm,,,8.709,8.698,8.709,99743,101636,-0.002,curated,cell_adhesion_junctions_ECM_extended,True
ROCK2,,,no,ENSG00000134318,Rho-associated protein kinase 2,Cytoplasm;Cell membrane,subcutaneous fat cell;adipocyte of breast;adipocyte of epicardial fat of left ventricle,,3.66,3.015,3.66,41919,35229,-0.28,curated,cell_adhesion_junctions_ECM_extended,False
RRAS,,,no,ENSG00000126458,Ras-related protein R-Ras,Cell membrane,cerebral cortex endothelial cell;endosteal cell;myometrial cell,,1.824,1.985,1.985,20887,23189,0.122,curated,cell_adhesion_junctions_ECM_extended,False
RUNX1,,,no,ENSG00000159216,Runt-related transcription factor 1 (Acute myeloid leukemia 1 protein) (Core-binding factor subunit alpha-2) (CBF-alpha-2) (Oncogene AML-1) (Polyomavirus enhancer-binding protein 2 alpha B subunit) (PEA2-alpha B) (PEBP2-alpha B) (SL3-3 enhancer factor 1 alpha B subunit) (SL3/AKV core-binding factor alpha B subunit),Nucleus,duct epithelial cell;luminal epithelial cell of mammary gland;cholangiocyte;lung goblet cell;mammary gland epithelial cell;tissue-resident macrophage;Kupffer cell;mature microglial cell;immature innate lymphoid cell;preadipocyte;brown preadipocyte;mesothelial fibroblast;brown fat cell,,2.308,2.506,2.506,26429,29284,0.119,curated,cell_adhesion_junctions_ECM_extended,False
SCRIB,,,no,ENSG00000180900,Protein scribble homolog (Scribble) (hScrib) (Protein LAP4),Cell membrane,,,3.836,4.669,4.669,43931,54560,0.284,curated,cell_adhesion_junctions_ECM_extended,True
SDC2,,,no,ENSG00000169439,Syndecan-2 (SYND2) (Fibroglycan) (Heparan sulfate proteoglycan core protein) (HSPG) (CD antigen CD362),Membrane,renal beta-intercalated cell;pancreatic PP cell;PP cell;endosteal cell;muscle cell;smooth muscle cell;bronchial smooth muscle cell;pancreatic stellate cell;osteoblast;theca cell,ANGPTL;MK;PTN;ADGRA,17.839,16.667,17.839,204308,194750,-0.098,curated,cell_adhesion_junctions_ECM_extended,False
SDC3,,,no,ENSG00000162512,Syndecan-3 (SYND3),Cell membrane,,ANGPTL;PTN,1.64,0.798,1.64,18779,9330,-1.038,curated,cell_adhesion_junctions_ECM_extended,True
SDC4,,,no,ENSG00000124145,Syndecan-4 (SYND4) (Amphiglycan) (Ryudocan core protein),Secreted,duct epithelial cell;pancreatic ductal cell;luminal epithelial cell of mammary gland;myoepithelial cell;myoepithelial cell of mammary gland;mammary gland epithelial cell;serous cell of epithelium of trachea,ANGPTL;MK;PTN;COLLAGEN;FN1;THBS;TENASCIN,16.859,13.533,16.859,193090,158133,-0.317,curated,cell_adhesion_junctions_ECM_extended,False
SELE,,,no,ENSG00000007908,E-selectin (CD62 antigen-like family member E) (Endothelial leukocyte adhesion molecule 1) (ELAM-1) (Leukocyte-endothelial cell adhesion molecule 2) (LECAM2) (CD antigen CD62E),Cell membrane,epithelial cell;squamous epithelial cell;blood vessel endothelial cell;vein endothelial cell;vasa recta ascending limb cell;retinal blood vessel endothelial cell;kidney capillary endothelial cell;prostate gland microvascular endothelial cell;endothelial cell;gut endothelial cell;endothelial cell of vascular tree;endothelial cell of uterus,CEACAM;SELE;SELPLG,0.198,0.046,0.198,2268,535,-2.113,curated,cell_adhesion_junctions_ECM_extended,False
SELL,,,no,ENSG00000188404,L-selectin (CD62 antigen-like family member L) (Leukocyte adhesion molecule 1) (LAM-1) (Leukocyte surface antigen Leu-8) (Leukocyte-endothelial cell adhesion molecule 1) (LECAM1) (Lymph node homing receptor) (TQ1) (gp90-MEL) (CD antigen CD62L),Cell membrane,"hematopoietic stem cell;CD34-positive, CD38-negative hematopoietic stem cell;hematopoietic cell;blood cell;granulocyte;neutrophil;plasmacytoid dendritic cell;plasmacytoid dendritic cell, human;dendritic cell, human;naive B cell;T-helper 2 cell;naive regulatory T cell;naive thymus-derived CD4-positive, alpha-beta T cell;activated CD4-positive, alpha-beta T cell, human;naive thymus-derived CD8-positive, alpha-beta T cell;gamma-delta T cell;double negative thymocyte;CD16-negative, CD56-bright natural killer cell, human;ILC1, human;group 2 innate lymphoid cell;group 2 innate lymphoid cell, human;pro-T cell",SELL;SELPLG,0.14,0.098,0.14,1602,1142,-0.517,curated,cell_adhesion_junctions_ECM_extended,False
SELP,,,no,ENSG00000174175,P-selectin (CD62 antigen-like family member P) (Granule membrane protein 140) (GMP-140) (Leukocyte-endothelial cell adhesion molecule 3) (LECAM3) (Platelet activation dependent granule-external membrane protein) (PADGEM) (CD antigen CD62P),Cell membrane,squamous epithelial cell;vein endothelial cell;retinal blood vessel endothelial cell;endothelial cell of artery;prostate gland microvascular endothelial cell;endothelial cell;endothelial cell of vascular tree;endocardial cell;platelet;megakaryocyte,CD34;SELPLG,0.151,0.312,0.312,1728,3650,1.05,curated,cell_adhesion_junctions_ECM_extended,False
SELPLG,,,no,ENSG00000110876,P-selectin glycoprotein ligand 1 (PSGL-1) (Selectin P ligand) (CD antigen CD162),Membrane,"hematopoietic cell;plasmacytoid dendritic cell;CD141-positive myeloid dendritic cell;non-classical monocyte;exhausted T cell;natural killer cell;CD16-positive, CD56-dim natural killer cell, human",SELPLG,0.678,0.869,0.869,7767,10151,0.357,curated,cell_adhesion_junctions_ECM_extended,False
