CD86,,,no,ENSG00000114013,T-lymphocyte activation antigen CD86 (Activation B7-2 antigen) (B70) (BU63) (CTLA-4 counter-receptor B7.2) (FUN-1) (CD antigen CD86),Cell membrane,"phagocyte;macrophage;inflammatory macrophage;tissue-resident macrophage;colon macrophage;mononuclear phagocyte;professional antigen presenting cell;dendritic cell;conventional dendritic cell;Langerhans cell;myeloid dendritic cell;myeloid dendritic cell, human;CD1c-positive myeloid dendritic cell;myeloid leukocyte;myeloid cell",CD86,0.418,0.591,0.591,4791,6904,0.498,curated,cell_adhesion_junctions_ECM_extended,False
CD8A,,,no,ENSG00000153563,T-cell surface glycoprotein CD8 alpha chain (T-lymphocyte differentiation antigen T8/Leu-2) (CD antigen CD8a),Secreted,"hematopoietic cell;leukocyte;mononuclear cell;lymphocyte;T cell;alpha-beta T cell;immature alpha-beta T cell;double-positive, alpha-beta thymocyte;CD8-positive, alpha-beta thymocyte;immature NK T cell;mature alpha-beta T cell;CD8-positive, alpha-beta T cell;CD8-positive, alpha-beta cytotoxic T cell;naive thymus-derived CD8-positive, alpha-beta T cell;activated CD8-positive, alpha-beta T cell;activated CD8-positive, alpha-beta T cell, human;CD8-positive, alpha-beta memory T cell;effector memory CD8-positive, alpha-beta T cell, terminally differentiated;CD8-positive, alpha-beta memory T cell, CD45RO-positive;central memory CD8-positive, alpha-beta T cell;effector memory CD8-positive, alpha-beta T cell;effector CD8-positive, alpha-beta T cell;CD8-alpha-beta-positive, alpha-beta intraepithelial T cell;CD8-alpha-alpha-positive, alpha-beta intraepithelial T cell;mature NK T cell;mucosal invariant T cell;CD8-alpha alpha positive, gamma-delta intraepithelial T cell;mature T cell;memory T cell;naive T cell;cytotoxic T cell;exhausted T cell;intraepithelial lymphocyte;immature T cell;thymocyte;DN1 thymic pro-T cell",CEACAM;LCK;MHC-I,0.553,0.847,0.847,6338,9902,0.615,curated,cell_adhesion_junctions_ECM_extended,False
CD8B,,,no,ENSG00000172116,T-cell surface glycoprotein CD8 beta chain (CD antigen CD8b),Secreted,"hematopoietic cell;leukocyte;mononuclear cell;lymphocyte;T cell;alpha-beta T cell;immature alpha-beta T cell;double-positive, alpha-beta thymocyte;CD8-positive, alpha-beta thymocyte;mature alpha-beta T cell;activated CD4-positive, alpha-beta T cell, human;CD8-positive, alpha-beta T cell;CD8-positive, alpha-beta cytotoxic T cell;naive thymus-derived CD8-positive, alpha-beta T cell;activated CD8-positive, alpha-beta T cell;activated CD8-positive, alpha-beta T cell, human;CD8-positive, alpha-beta memory T cell;effector memory CD8-positive, alpha-beta T cell, terminally differentiated;CD8-positive, alpha-beta memory T cell, CD45RO-positive;central memory CD8-positive, alpha-beta T cell;effector memory CD8-positive, alpha-beta T cell;effector CD8-positive, alpha-beta T cell;CD8-alpha-beta-positive, alpha-beta intraepithelial T cell;CD8-alpha-alpha-positive, alpha-beta intraepithelial T cell;mature NK T cell;mucosal invariant T cell;CD8-alpha alpha positive, gamma-delta intraepithelial T cell;mature T cell;memory T cell;naive T cell;cytotoxic T cell;exhausted T cell;intraepithelial lymphocyte;immature T cell;thymocyte;double negative thymocyte;double negative T regulatory cell",MHC-I,0.164,0.14,0.164,1879,1641,-0.224,curated,cell_adhesion_junctions_ECM_extended,False
CD99,,,no,ENSG00000002586,CD99 antigen (12E7) (E2 antigen) (Protein MIC2) (T-cell surface glycoprotein E2) (CD antigen CD99),Membrane,"Sertoli cell;pancreatic endocrine cell;type B pancreatic cell;pancreatic A cell;enteroendocrine cell;endosteal cell;preosteoblast;immature alpha-beta T cell;double-positive, alpha-beta thymocyte;immature T cell;thymocyte;double negative thymocyte;late pro-B cell;early lymphoid progenitor;lymphoid lineage restricted progenitor cell;pro-T cell;common lymphoid progenitor",CD99,27.52,28.886,28.886,315188,337521,0.07,curated,cell_adhesion_junctions_ECM_extended,False
CDC42,,,no,ENSG00000070831,Cell division control protein 42 homolog,Cell membrane,mast cell;mucosal type mast cell;peripheral blood mononuclear cell,,17.037,15.31,17.037,195127,178895,-0.154,curated,cell_adhesion_junctions_ECM_extended,False
CDH1,,,no,ENSG00000039068,Cadherin-1 (CAM 120/80) (Epithelial cadherin) (E-cadherin) (Uvomorulin) (CD antigen CD324),Cell junction,ciliated cell of the bronchus;kidney collecting duct epithelial cell;lung neuroendocrine cell;type I pneumocyte;type II pneumocyte;pulmonary ionocyte;brush cell of bronchus;club cell;basal epithelial cell of tracheobronchial tree;kidney distal convoluted tubule epithelial cell;macula densa epithelial cell;kidney loop of Henle thick ascending limb epithelial cell;kidney loop of Henle medullary thick ascending limb epithelial cell;kidney loop of Henle cortical thick ascending limb epithelial cell;kidney loop of Henle thin ascending limb epithelial cell;kidney connecting tubule epithelial cell;kidney loop of Henle thin descending limb epithelial cell;lung ciliated cell,CDH;CDH1,29.181,27.874,29.181,334214,325701,-0.066,curated,cell_adhesion_junctions_ECM_extended,False
CDH11,,,no,ENSG00000140937,Cadherin-11 (OSF-4) (Osteoblast cadherin) (OB-cadherin),Cell membrane,endocardial cell;preosteoblast;connective tissue cell;fibroblast;pulmonary interstitial fibroblast;alveolar type 2 fibroblast cell;fibroblast of lung;bronchus fibroblast of lung;kidney interstitial fibroblast;mesangial cell;kidney interstitial cell,ANGPTL,1.414,1.718,1.718,16193,20071,0.281,curated,cell_adhesion_junctions_ECM_extended,False
CDH2,,,no,ENSG00000170558,Cadherin-2 (CDw325) (Neural cadherin) (N-cadherin) (CD antigen CD325),Cell membrane,lens epithelial cell;cardiac muscle cell;regular ventricular cardiac myocyte;muscle precursor cell;cardiac muscle myoblast,CDH,0.194,0.109,0.194,2224,1272,-0.835,curated,cell_adhesion_junctions_ECM_extended,False
CDH3,,,no,ENSG00000062038,Cadherin-3 (Placental cadherin) (P-cadherin),Cell membrane,basal cell;basal epithelial cell of prostatic duct;myoepithelial cell;myoepithelial cell of mammary gland;epithelial cell of thymus;medullary thymic epithelial cell,CDH,0.282,0.224,0.282,3233,2620,-0.332,curated,cell_adhesion_junctions_ECM_extended,False
CDH5,,,no,ENSG00000179776,Cadherin-5 (7B4 antigen) (Vascular endothelial cadherin) (VE-cadherin) (CD antigen CD144),Cell junction,epithelial cell;squamous epithelial cell;blood vessel endothelial cell;endothelial tip cell;vein endothelial cell;endothelial cell of umbilical vein;vasa recta descending limb cell;endothelial cell of artery;kidney capillary endothelial cell;capillary endothelial cell;lung endothelial cell;glomerular endothelial cell;endothelial cell;gut endothelial cell;endothelial cell of vascular tree;endothelial cell of lymphatic vessel;endothelial cell of uterus;cardiac endothelial cell;endocardial cell;cerebral cortex endothelial cell;surface ectodermal cell;extravillous trophoblast,ANGPTL;CDH5,0.912,1.521,1.521,10450,17772,0.737,curated,cell_adhesion_junctions_ECM_extended,False
CDH6,,,no,ENSG00000113361,Cadherin-6 (Kidney cadherin) (K-cadherin),Cell membrane,glioblast;Schwann cell precursor;neural crest cell;epithelial cell of proximal tubule;parietal epithelial cell;ciliary muscle cell,,0.876,0.578,0.876,10033,6751,-0.6,curated,cell_adhesion_junctions_ECM_extended,False
CDK1,,,no,ENSG00000170312,Cyclin-dependent kinase 1 (CDK1),Nucleus,"double-positive, alpha-beta thymocyte;precursor B cell;large pre-B-II cell;erythroid lineage cell;pro-B cell;fraction A pre-pro B cell",,0.48,0.229,0.48,5502,2671,-1.071,curated,cell_adhesion_junctions_ECM_extended,False
CDK4,,,no,ENSG00000135446,Cyclin-dependent kinase 4,Cytoplasm,glioblast;Schwann cell precursor;macrophage dendritic cell progenitor,,7.883,8.209,8.209,90289,95916,0.058,curated,cell_adhesion_junctions_ECM_extended,False
CDK8,,,no,ENSG00000132964,Cyclin-dependent kinase 8,Nucleus,cortical cell of adrenal gland,,6.118,5.67,6.118,70070,66248,-0.11,curated,cell_adhesion_junctions_ECM_extended,True
CDSN,,,no,ENSG00000204539,Corneodesmosin (S protein),Secreted,,,0.025,,0.025,290,0,,curated,cell_adhesion_junctions_ECM_extended,True
CFTR,,,no,ENSG00000001626,Cystic fibrosis transmembrane conductance regulator (CFTR) (ATP-binding cassette sub-family C member 7) (Channel conductance-controlling ATPase),Apical cell membrane,intestinal crypt stem cell of colon;pancreatic ductal cell;cholangiocyte;columnar/cuboidal epithelial cell;pulmonary ionocyte;lung goblet cell;bronchial goblet cell;paneth cell of epithelium of small intestine;duodenum glandular cell;periportal region hepatocyte;M cell of gut;ionocyte,,29.856,32.182,32.182,341934,376037,0.108,curated,cell_adhesion_junctions_ECM_extended,False
CGNL1,,,no,ENSG00000128849,Cingulin-like protein 1 (Junction-associated coiled-coil protein) (Paracingulin),Cell junction,lens epithelial cell;anterior lens cell;renal beta-intercalated cell;epithelial cell of lung;type I pneumocyte;endocardial cell;kidney loop of Henle ascending limb epithelial cell;kidney loop of Henle thick ascending limb epithelial cell;kidney epithelial cell;epithelial cell of nephron;kidney loop of Henle epithelial cell;kidney cell,,8.808,8.615,8.808,100879,100666,-0.032,curated,cell_adhesion_junctions_ECM_extended,False
CHAD,,,no,ENSG00000136457,Chondroadherin (Cartilage leucine-rich protein),Secreted,osteoblast;chondrocyte,CHAD,0.408,0.83,0.83,4676,9701,1.024,curated,cell_adhesion_junctions_ECM_extended,True
CLDN1,,,no,ENSG00000163347,Claudin-1 (Senescence-associated epithelial membrane protein),Cell junction,basal cell of epidermis;stem cell of epidermis;pancreatic ductal cell;intrahepatic cholangiocyte;epithelial cell of lacrimal sac;mesothelial cell of pleura;corneal epithelial cell;epithelial cell of urethra;conjunctival epithelial cell,CLDN,21.44,14.895,21.44,245550,174040,-0.526,curated,cell_adhesion_junctions_ECM_extended,False
CLDN18,,,no,ENSG00000066405,Claudin-18,Cell junction,epithelial cell of lung;epithelial cell of alveolus of lung;pneumocyte;type I pneumocyte;type II pneumocyte;paneth cell;paneth cell of epithelium of small intestine;lung secretory cell,,0.051,0.031,0.051,579,366,-0.691,curated,cell_adhesion_junctions_ECM_extended,False
CLDN5,,,no,ENSG00000184113,Claudin-5 (Transmembrane protein deleted in VCFS) (TMDVCF),Cell junction,epithelial cell;squamous epithelial cell;blood vessel endothelial cell;endothelial tip cell;vein endothelial cell;vasa recta descending limb cell;retinal blood vessel endothelial cell;endothelial cell of artery;kidney capillary endothelial cell;glomerular capillary endothelial cell;capillary endothelial cell;lung microvascular endothelial cell;prostate gland microvascular endothelial cell;lung endothelial cell;endothelial cell;gut endothelial cell;endothelial cell of vascular tree;endothelial cell of lymphatic vessel;endothelial cell of uterus;cerebral cortex endothelial cell;surface ectodermal cell,,0.915,2.032,2.032,10484,23747,1.151,curated,cell_adhesion_junctions_ECM_extended,False
CLDN7,,,no,ENSG00000181885,Claudin-7 (CLDN-7),Cell membrane,epithelial cell of alveolus of lung;pneumocyte;type II pneumocyte;transit amplifying cell of colon,,8.823,6.96,8.823,101055,81321,-0.342,curated,cell_adhesion_junctions_ECM_extended,False
CNTN2,,,no,ENSG00000184144,Contactin-2 (Axonal glycoprotein TAG-1) (Axonin-1) (Transient axonal glycoprotein 1) (TAX-1),Cell membrane,,CNTN,0.071,0.053,0.071,817,622,-0.422,curated,cell_adhesion_junctions_ECM_extended,True
CNTNAP1,,,no,ENSG00000108797,Contactin-associated protein 1 (Caspr) (Caspr1) (Neurexin IV) (Neurexin-4) (p190),Membrane,,CNTN,2.67,2.617,2.67,30576,30574,-0.029,curated,cell_adhesion_junctions_ECM_extended,True
COL17A1,,,no,ENSG00000065618,Collagen alpha-1(XVII) chain (180 kDa bullous pemphigoid antigen 2) (Bullous pemphigoid antigen 2),Cell junction,stem cell;basal cell;basal cell of epidermis;respiratory basal cell;basal cell of epithelium of bronchus;stem cell of epidermis;myoepithelial cell;myoepithelial cell of mammary gland;keratinocyte;epithelial cell of thymus;cortical thymic epithelial cell;basal epithelial cell of tracheobronchial tree;epidermal cell,,0.038,0.01,0.038,432,115,-1.938,curated,cell_adhesion_junctions_ECM_extended,False
COL18A1,,,no,ENSG00000182871,Collagen alpha-1(XVIII) chain,Secreted,pancreatic ductal cell;kidney loop of Henle thin ascending limb epithelial cell,,13.111,15.849,15.849,150159,185186,0.274,curated,cell_adhesion_junctions_ECM_extended,False
COL23A1,,,no,ENSG00000050767,Collagen alpha-1(XXIII) chain,Cell membrane,endocardial cell,,0.039,0.024,0.039,450,278,-0.724,curated,cell_adhesion_junctions_ECM_extended,True
COL25A1,,,no,ENSG00000188517,Collagen alpha-1(XXV) chain (Alzheimer disease amyloid-associated protein) (AMY) (CLAC-P),Membrane,smooth muscle cell of sphincter of pupil;stellate neuron;neuronal receptor cell;photoreceptor cell;eye photoreceptor cell;retinal rod cell;kidney interstitial fibroblast;pericyte;mesangial cell;renal interstitial pericyte;kidney interstitial cell,,0.094,0.053,0.094,1079,615,-0.84,curated,cell_adhesion_junctions_ECM_extended,False
COL4A1,,,no,ENSG00000187498,Collagen alpha-1(IV) chain,Secreted,mesenchymal stem cell;endothelial tip cell;retinal blood vessel endothelial cell;endothelial cell;gut endothelial cell;endothelial cell of vascular tree;skeletal muscle fibroblast;extravillous trophoblast;pancreatic stellate cell;fat cell;brown fat cell;subcutaneous fat cell;adipocyte of breast;epicardial adipocyte;adipocyte of epicardial fat of left ventricle;mural cell,COLLAGEN;ADGRG,16.921,10.786,16.921,193799,126026,-0.65,curated,cell_adhesion_junctions_ECM_extended,False
COL4A2,,,no,ENSG00000134871,Collagen alpha-2(IV) chain,Secreted,mesenchymal stem cell;lens epithelial cell;anterior lens cell;endothelial tip cell;smooth muscle myoblast;brown preadipocyte;pancreatic stellate cell;fat cell;brown fat cell;subcutaneous fat cell;adipocyte of breast;epicardial adipocyte;adipocyte of epicardial fat of left ventricle,COLLAGEN;ADGRG,10.108,7.19,10.108,115761,84017,-0.491,curated,cell_adhesion_junctions_ECM_extended,False
COL4A3,,,no,ENSG00000169031,Collagen alpha-3(IV) chain (Goodpasture antigen),Secreted,corneal endothelial cell;lens epithelial cell;anterior lens cell;epithelial cell of lung;type I pneumocyte;kidney loop of Henle thin ascending limb epithelial cell;lens fiber cell;secondary lens fiber;kidney glomerular epithelial cell;podocyte;retinal pigment epithelial cell,COLLAGEN;ADGRG,0.736,0.679,0.736,8424,7939,-0.114,curated,cell_adhesion_junctions_ECM_extended,False
COL4A4,,,no,ENSG00000081052,Collagen alpha-4(IV) chain,Secreted,corneal endothelial cell;lens epithelial cell;anterior lens cell;epithelial cell of lung;lens fiber cell;secondary lens fiber;kidney glomerular epithelial cell;podocyte;fibroblast of cardiac tissue;kidney interstitial fibroblast;kidney interstitial cell,COLLAGEN;ADGRG,2.031,1.592,2.031,23266,18600,-0.352,curated,cell_adhesion_junctions_ECM_extended,False
COL4A5,,,no,ENSG00000188153,Collagen alpha-5(IV) chain,Secreted,basal epithelial cell of prostatic duct;corneal endothelial cell;lens epithelial cell;anterior lens cell;lens fiber cell;secondary lens fiber;ciliary muscle cell,COLLAGEN;ADGRG,0.223,0.229,0.229,2549,2675,0.041,curated,cell_adhesion_junctions_ECM_extended,False
COL5A1,,,no,ENSG00000130635,Collagen alpha-1(V) chain,Secreted,endosteal cell;preosteoblast;connective tissue cell;fibroblast;pulmonary interstitial fibroblast;alveolar type 2 fibroblast cell;brown preadipocyte;pancreatic stellate cell;fibroblast of cardiac tissue;fibroblast of lung;bronchus fibroblast of lung;mesothelial fibroblast;osteoblast;stromal cell;stromal cell of ovary;interstitial cell of ovary;mesenchymal cell,,6.941,4.792,6.941,79494,55991,-0.535,curated,cell_adhesion_junctions_ECM_extended,False
COL5A2,,,no,ENSG00000204262,Collagen alpha-2(V) chain,Secreted,corneal endothelial cell;endosteal cell;preosteoblast;muscle cell;smooth muscle cell;connective tissue cell;fibroblast;alveolar type 2 fibroblast cell;preadipocyte;brown preadipocyte;fibroblast of cardiac tissue;fibroblast of lung;mesothelial fibroblast;osteoblast;mesenchymal cell;fibro/adipogenic progenitor cell,,3.242,2.494,3.242,37135,29143,-0.379,curated,cell_adhesion_junctions_ECM_extended,False
COL7A1,,,no,ENSG00000114270,Collagen alpha-1(VII) chain (Long-chain collagen) (LC collagen),Secreted,basal cell of epidermis;stem cell of epidermis;basal epithelial cell of tracheobronchial tree,,0.107,0.1,0.107,1223,1172,-0.09,curated,cell_adhesion_junctions_ECM_extended,False
CREBBP,,,no,ENSG00000005339,CREB-binding protein (Histone lysine acetyltransferase CREBBP),Cytoplasm,,,14.832,17.279,17.279,169874,201905,0.22,curated,cell_adhesion_junctions_ECM_extended,True
CRK,,,no,ENSG00000167193,Adapter molecule crk (Proto-oncogene c-Crk) (p38),Cytoplasm,,,11.256,7.992,11.256,128920,93383,-0.494,curated,cell_adhesion_junctions_ECM_extended,True
CRKL,,,no,ENSG00000099942,Crk-like protein,,,,5.202,5.491,5.491,59579,64165,0.078,curated,cell_adhesion_junctions_ECM_extended,True
CRYBG1,,,no,ENSG00000112297,Beta/gamma crystallin domain-containing protein 1 (Absent in melanoma 1 protein),,kidney collecting duct principal cell;renal principal cell;corneal epithelial cell;DN1 thymic pro-T cell;papillary tips cell;sebaceous gland cell,,2.173,3.34,3.34,24885,39029,0.62,curated,cell_adhesion_junctions_ECM_extended,False
CSK,,,no,ENSG00000103653,Tyrosine-protein kinase CSK,Cytoplasm,"CD141-positive myeloid dendritic cell;myeloid dendritic cell;CD1c-positive myeloid dendritic cell;B-1a B cell;B-1b B cell;germinal center B cell;non-classical monocyte;CD14-low, CD16-positive monocyte;DN4 thymocyte;B cell;group 2 innate lymphoid cell",,5.215,6.292,6.292,59731,73517,0.271,curated,cell_adhesion_junctions_ECM_extended,False
CSNK2A1,,,no,ENSG00000101266,Casein kinase II subunit alpha (CK II alpha),Nucleus,,,13.459,13.368,13.459,154148,156204,-0.01,curated,cell_adhesion_junctions_ECM_extended,True
CSNK2A2,,,no,ENSG00000070770,Casein kinase II subunit alpha' (CK II alpha'),Nucleus,,,13.538,15.372,15.372,155050,179613,0.183,curated,cell_adhesion_junctions_ECM_extended,True
CSNK2B,,,no,ENSG00000204435,Casein kinase II subunit beta (CK II beta) (Phosvitin) (Protein G5a),Nucleus,"erythroid progenitor cell, mammalian",,23.744,24.972,24.972,271940,291789,0.073,curated,cell_adhesion_junctions_ECM_extended,True
CTLA4,,,no,ENSG00000163599,Cytotoxic T-lymphocyte protein 4 (Cytotoxic T-lymphocyte-associated antigen 4) (CTLA-4) (CD antigen CD152),Cell membrane,"CD4-positive, alpha-beta T cell;CD4-positive helper T cell;T-helper 1 cell;T follicular helper cell;CD4-positive, CD25-positive, alpha-beta regulatory T cell;naive regulatory T cell;memory regulatory T cell;CD4-positive, alpha-beta memory T cell;effector CD4-positive, alpha-beta T cell;mature NK T cell;type I NK T cell;regulatory T cell;DN3 thymocyte;DN4 thymocyte;double negative T regulatory cell",CD80;CD86;ICOS,0.115,0.066,0.115,1318,771,-0.802,curated,cell_adhesion_junctions_ECM_extended,False
CTNNA1,,,no,ENSG00000044115,Catenin alpha-1 (Alpha E-catenin) (Cadherin-associated protein) (Renal carcinoma antigen NY-REN-13),Cell membrane,epithelial cell,,23.457,22.639,23.457,268653,264536,-0.051,curated,cell_adhesion_junctions_ECM_extended,False
CTNNB1,,,no,ENSG00000168036,Catenin beta-1 (Beta-catenin),Cytoplasm,melanocyte;serous cell of epithelium of trachea,,25.402,27.226,27.226,290932,318130,0.1,curated,cell_adhesion_junctions_ECM_extended,True
CTNND1,,,no,ENSG00000198561,Catenin delta-1 (Cadherin-associated Src substrate) (CAS) (p120 catenin) (p120(ctn)) (p120(cas)),Cell junction,basal cell of epithelium of bronchus;epithelial cell;lung endothelial cell;brush cell of trachebronchial tree;basal epithelial cell of tracheobronchial tree;endothelial cell;endothelial cell of vascular tree,,33.035,36.527,36.527,378343,426812,0.145,curated,cell_adhesion_junctions_ECM_extended,False
CTSL,,,no,ENSG00000135047,Procathepsin L,Lysosome,elicited macrophage;inflammatory macrophage;alternatively activated macrophage;lung macrophage;Hofbauer cell;extravillous trophoblast;placental villous trophoblast;syncytiotrophoblast cell;leukocyte;myeloid leukocyte;mast cell;mucosal type mast cell;myeloid cell;fibroblast;pancreatic stellate cell;fibroblast of mammary gland;fibroblast of breast,,14.526,15.423,15.423,166367,180209,0.086,curated,cell_adhesion_junctions_ECM_extended,False
CTTN,,,no,ENSG00000085733,Src substrate cortactin (Amplaxin) (Oncogene EMS1),Cytoplasm,,,22.917,24.226,24.226,262471,283076,0.08,curated,cell_adhesion_junctions_ECM_extended,True
CX3CL1,,,no,ENSG00000006210,Fractalkine (C-X3-C motif chemokine 1) (CX3C membrane-anchored chemokine) (Neurotactin) (Small-inducible cytokine D1),Cell membrane,duct epithelial cell;luminal epithelial cell of mammary gland;squamous epithelial cell;blood vessel endothelial cell;vasa recta ascending limb cell;vasa recta descending limb cell;endothelial cell of artery;endothelial cell;endothelial cell of vascular tree;mammary gland epithelial cell,CX3C,2.797,1.965,2.797,32034,22955,-0.51,curated,cell_adhesion_junctions_ECM_extended,False
DAG1,,,no,ENSG00000173402,Dystroglycan 1 (Dystroglycan) (Dystrophin-associated glycoprotein 1),Cell membrane,skeletal muscle satellite cell,LAMININ;AGRN;HSPG;NRXN,13.446,16.113,16.113,153995,188275,0.261,curated,cell_adhesion_junctions_ECM_extended,False
DDR1,,,no,ENSG00000204580,Epithelial discoidin domain-containing receptor 1 (Epithelial discoidin domain receptor 1),Cell membrane,pancreatic PP cell,,17.583,19.45,19.45,201380,227267,0.146,curated,cell_adhesion_junctions_ECM_extended,False
DDR2,,,no,ENSG00000162733,Discoidin domain-containing receptor 2 (Discoidin domain receptor 2),Cell membrane,pigmented epithelial cell;pigmented ciliary epithelial cell;fibroblast;keratocyte;brown preadipocyte;mesothelial fibroblast;fibro/adipogenic progenitor cell,,1.103,1.472,1.472,12627,17197,0.417,curated,cell_adhesion_junctions_ECM_extended,False
DLG1,,,no,ENSG00000075711,Disks large homolog 1 (Synapse-associated protein 97) (SAP-97) (SAP97) (hDlg),Membrane,corneal endothelial cell;oligodendrocyte,,5.434,5.558,5.558,62239,64949,0.033,curated,cell_adhesion_junctions_ECM_extended,False
DRD1,,,no,ENSG00000184845,D(1A) dopamine receptor (Dopamine D1 receptor),Cell membrane,medium spiny neuron,Dopamine;SerotoninDopamin,0.056,0.047,0.056,637,549,-0.243,curated,cell_adhesion_junctions_ECM_extended,False
DRD2,,,no,ENSG00000149295,D(2) dopamine receptor (Dopamine D2 receptor),Cell membrane,medium spiny neuron,Dopamine;SerotoninDopamin,0.043,0.028,0.043,491,332,-0.593,curated,cell_adhesion_junctions_ECM_extended,False
DST,,,no,ENSG00000151914,Dystonin (230 kDa bullous pemphigoid antigen) (230/240 kDa bullous pemphigoid antigen) (Bullous pemphigoid antigen 1) (BPA) (Bullous pemphigoid antigen) (Dystonia musculorum protein) (Hemidesmosomal plaque protein),Cytoplasm,basal cell;basal cell of epidermis;stem cell of epidermis;myoepithelial cell;myoepithelial cell of mammary gland;alveolar type 2 fibroblast cell,,18.669,14.026,18.669,213813,163891,-0.413,curated,cell_adhesion_junctions_ECM_extended,False
EGF,,,no,ENSG00000138798,Pro-epidermal growth factor (EGF),Membrane,kidney distal convoluted tubule epithelial cell;kidney loop of Henle ascending limb epithelial cell;kidney loop of Henle thick ascending limb epithelial cell;kidney epithelial cell;kidney cortex tubule cell;epithelial cell of nephron;kidney loop of Henle epithelial cell;kidney cell,EGF,9.107,11.806,11.806,104305,137953,0.374,curated,cell_adhesion_junctions_ECM_extended,False
EGFR,,,no,ENSG00000146648,Epidermal growth factor receptor,Cell membrane,basal epithelial cell of prostatic duct;trophoblast giant cell;syncytiotrophoblast cell,EGF;EPGN,6.755,6.097,6.755,77364,71247,-0.148,curated,cell_adhesion_junctions_ECM_extended,False
ELK1,,,no,ENSG00000126767,ETS domain-containing protein Elk-1,Nucleus,granulosa cell;stromal cell;stromal cell of ovary;interstitial cell of ovary;mesenchymal cell,,3.702,2.742,3.702,42400,32039,-0.433,curated,cell_adhesion_junctions_ECM_extended,False
EP300,,,no,ENSG00000100393,Histone acetyltransferase p300 (p300 HAT),Cytoplasm,enucleate erythrocyte,,13.387,15.102,15.102,153325,176464,0.174,curated,cell_adhesion_junctions_ECM_extended,True
EPHB4,,,no,ENSG00000196411,Ephrin type-B receptor 4,Cell membrane,,EPHB,2.827,2.725,2.827,32372,31845,-0.053,curated,cell_adhesion_junctions_ECM_extended,False
ERBB2,,,no,ENSG00000141736,Receptor tyrosine-protein kinase erbB-2,Cell membrane,,EGF;NRG,5.451,6.4,6.4,62435,74778,0.231,curated,cell_adhesion_junctions_ECM_extended,True
F11R,,,no,ENSG00000158769,Junctional adhesion molecule A (JAM-A) (Junctional adhesion molecule 1) (JAM-1) (Platelet F11 receptor) (Platelet adhesion molecule 1) (PAM-1) (CD antigen CD321),Cell junction,urothelial cell;bladder urothelial cell;epithelial cell of urethra;bladder cell,JAM,18.96,16.298,18.96,217146,190438,-0.218,curated,cell_adhesion_junctions_ECM_extended,False
FER,,,no,ENSG00000151422,Tyrosine-protein kinase Fer,Cytoplasm;Cytoplasm,lens epithelial cell;anterior lens cell;melanocyte,,2.272,1.995,2.272,26022,23308,-0.188,curated,cell_adhesion_junctions_ECM_extended,False
FGF13,,,no,ENSG00000129682,Fibroblast growth factor 13 (FGF-13) (Fibroblast growth factor homologous factor 2) (FHF-2),Cytoplasm,chromaffin cell;epithelial cell of sweat gland;kidney distal convoluted tubule epithelial cell;ciliary muscle cell;neuronal brush cell;visceromotor neuron,,0.273,0.203,0.273,3124,2368,-0.429,curated,cell_adhesion_junctions_ECM_extended,False
