OPRD1,,,no,ENSG00000116329,Delta-type opioid receptor (D-OR-1) (DOR-1),Cell membrane,,OPIOID,0.148,0.065,0.148,1700,758,-1.194,curated,calcium_cAMP_signaling,True
ORAI2,,,no,ENSG00000160991,Protein orai-2 (CAP-binding protein complex-interacting protein 2) (Transmembrane protein 142B),Membrane,IgG memory B cell;IgG-negative class switched memory B cell,,2.264,2.21,2.264,25928,25827,-0.035,curated,calcium_cAMP_signaling,False
ORAI3,,,no,ENSG00000175938,Protein orai-3 (Transmembrane protein 142C),Cell membrane,eosinophil;basophil mast progenitor cell,,3.963,4.824,4.824,45393,56363,0.283,curated,calcium_cAMP_signaling,False
OXTR,,,no,ENSG00000180914,Oxytocin receptor (OT-R),Cell membrane,stem cell;basal cell;myoepithelial cell;myoepithelial cell of mammary gland,OXT,0.077,0.049,0.077,882,577,-0.641,curated,calcium_cAMP_signaling,True
P2RX1,,,no,ENSG00000108405,P2X purinoceptor 1 (P2X1) (ATP receptor) (Purinergic receptor),Membrane,"eosinophil;mast cell;megakaryocyte-erythroid progenitor cell;erythroid progenitor cell, mammalian",,2.897,5.181,5.181,33179,60542,0.839,curated,calcium_cAMP_signaling,False
P2RX3,,,no,ENSG00000109991,P2X purinoceptor 3 (P2X3) (ATP receptor) (Purinergic receptor),Cell membrane,,,0.05,0.043,0.05,574,500,-0.228,curated,calcium_cAMP_signaling,True
P2RX4,,,no,ENSG00000135124,P2X purinoceptor 4 (P2X4) (ATP receptor) (Purinergic receptor),Cell membrane,,,8.757,9.165,9.165,100290,107085,0.066,curated,calcium_cAMP_signaling,True
P2RX7,,,no,ENSG00000089041,P2X purinoceptor 7 (P2X7) (ATP receptor) (P2Z receptor) (Purinergic receptor),Cell membrane,,,0.955,1.865,1.865,10940,21797,0.966,curated,calcium_cAMP_signaling,True
PAK1,,,no,ENSG00000149269,Serine/threonine-protein kinase PAK 1,Cytoplasm,Langerhans cell;promonocyte,,7.519,7.94,7.94,86117,92771,0.078,curated,calcium_cAMP_signaling,False
PDE10A,,,no,ENSG00000112541,"cAMP and cAMP-inhibited cGMP 3',5'-cyclic phosphodiesterase 10A",Cytoplasm,pigmented ciliary epithelial cell;cortical cell of adrenal gland;cerebellar granule cell,,0.513,0.552,0.552,5881,6451,0.105,curated,calcium_cAMP_signaling,False
PDE2A,,,no,ENSG00000186642,"cGMP-dependent 3',5'-cyclic phosphodiesterase",Mitochondrion,,,0.933,1.712,1.712,10688,20004,0.875,curated,calcium_cAMP_signaling,True
PDE3A,,,no,ENSG00000172572,"cGMP-inhibited 3',5'-cyclic phosphodiesterase 3A",Membrane,cardiac endothelial cell;endocardial cell;muscle cell;cardiac muscle cell;regular atrial cardiac myocyte;regular ventricular cardiac myocyte;smooth muscle cell;ciliary muscle cell;muscle precursor cell;smooth muscle myoblast;cardiac muscle myoblast;immature innate lymphoid cell;neuron;amacrine cell;hepatic stellate cell;fibroblast of cardiac tissue;kidney interstitial fibroblast;pericyte;mesangial cell;renal interstitial pericyte;kidney interstitial cell,,1.008,0.672,1.008,11547,7847,-0.586,curated,calcium_cAMP_signaling,False
PDE4A,,,no,ENSG00000065989,"cAMP-specific 3',5'-cyclic phosphodiesterase 4A",Cytoplasm,Langerhans cell,,1.916,1.711,1.916,21939,19990,-0.163,curated,calcium_cAMP_signaling,False
PDE4B,,,no,ENSG00000184588,"cAMP-specific 3',5'-cyclic phosphodiesterase 4B",Cytoplasm,lung endothelial cell;endothelial cell;endothelial cell of vascular tree;retinal pigment epithelial cell;inflammatory macrophage;neuron associated cell;neuron associated cell (sensu Vertebrata);oligodendrocyte precursor cell;glial cell;macroglial cell;astrocyte;Bergmann glial cell;oligodendrocyte;retina horizontal cell,,0.647,0.731,0.731,7409,8546,0.177,curated,calcium_cAMP_signaling,False
PDE5A,,,no,ENSG00000138735,"cGMP-specific 3',5'-cyclic phosphodiesterase",,muscle cell;smooth muscle cell;smooth muscle cell of sphincter of pupil;ciliary muscle cell,,7.736,8.941,8.941,88598,104470,0.209,curated,calcium_cAMP_signaling,False
PDGFA,,,no,ENSG00000197461,Platelet-derived growth factor subunit A (PDGF subunit A) (PDGF-1) (Platelet-derived growth factor A chain) (Platelet-derived growth factor alpha polypeptide),Secreted,"paneth cell of epithelium of small intestine;CD14-positive, CD16-negative classical monocyte;myometrial cell;CD14-positive, CD16-positive monocyte",PDGF,21.946,19.66,21.946,251350,229716,-0.159,curated,calcium_cAMP_signaling,False
PDGFB,,,no,ENSG00000100311,Platelet-derived growth factor subunit B (PDGF subunit B) (PDGF-2) (Platelet-derived growth factor B chain) (Platelet-derived growth factor beta polypeptide) (Proto-oncogene c-Sis) (Becaplermin),Secreted,squamous epithelial cell;blood vessel endothelial cell;endothelial cell;endothelial cell of vascular tree,PDGF,1.864,2.224,2.224,21348,25988,0.255,curated,calcium_cAMP_signaling,False
PDGFC,,,no,ENSG00000145431,Platelet-derived growth factor C (PDGF-C) (Fallotein) (Spinal cord-derived growth factor) (SCDGF) (VEGF-E),Cytoplasm,cholangiocyte;Kupffer cell;immature innate lymphoid cell,PDGF,9.043,8.547,9.043,103571,99875,-0.081,curated,calcium_cAMP_signaling,False
PDGFD,,,no,ENSG00000170962,Platelet-derived growth factor D (PDGF-D) (Iris-expressed growth factor) (Spinal cord-derived growth factor B) (SCDGF-B),Secreted,cholangiocyte;kidney capillary endothelial cell;melanocyte;neuron;fibroblast of cardiac tissue,PDGF,4.856,5.099,5.099,55617,59582,0.07,curated,calcium_cAMP_signaling,False
PDGFRA,,,no,ENSG00000134853,Platelet-derived growth factor receptor alpha (PDGF-R-alpha) (PDGFR-alpha),Cell membrane,mesenchymal stem cell;interstitial cell of Cajal;mesodermal cell;muscle cell;smooth muscle cell;connective tissue cell;fibroblast;keratocyte;alveolar type 2 fibroblast cell;fibroblast of cardiac tissue;fibroblast of breast;mesothelial fibroblast;myofibroblast cell;stromal cell;stromal cell of ovary;interstitial cell of ovary;mesangial cell;mesenchymal cell;fibro/adipogenic progenitor cell,PDGF,7.675,7.553,7.675,87901,88254,-0.023,curated,calcium_cAMP_signaling,False
PDGFRB,,,no,ENSG00000113721,Platelet-derived growth factor receptor beta (PDGF-R-beta) (PDGFR-beta),Cell membrane,cerebral cortex endothelial cell;muscle cell;smooth muscle cell;vascular associated smooth muscle cell;bronchial smooth muscle cell;smooth muscle myoblast;connective tissue cell;fibroblast;keratocyte;hepatic stellate cell;preadipocyte;brown preadipocyte;pancreatic stellate cell;pericyte;renal interstitial pericyte;mural cell,PDGF,6.511,5.072,6.511,74566,59261,-0.36,curated,calcium_cAMP_signaling,False
PHB2,,,no,ENSG00000215021,Prohibitin-2 (B-cell receptor-associated protein BAP37) (D-prohibitin) (Repressor of estrogen receptor activity),Mitochondrion inner membrane,glioblast;Schwann cell precursor,,30.311,29.52,30.311,347146,344936,-0.038,curated,calcium_cAMP_signaling,False
PIK3CA,,,no,ENSG00000121879,"Phosphatidylinositol 4,5-bisphosphate 3-kinase catalytic subunit alpha isoform (PI3-kinase subunit alpha) (PI3K-alpha) (PI3Kalpha) (PtdIns-3-kinase subunit alpha)",,,,6.97,6.121,6.97,79827,71518,-0.187,curated,calcium_cAMP_signaling,True
PIK3CB,,,no,ENSG00000051382,"Phosphatidylinositol 4,5-bisphosphate 3-kinase catalytic subunit beta isoform (PI3-kinase subunit beta) (PI3K-beta) (PI3Kbeta) (PtdIns-3-kinase subunit beta)",Cytoplasm,,,10.714,9.571,10.714,122705,111829,-0.163,curated,calcium_cAMP_signaling,True
PIK3CD,,,no,ENSG00000171608,"Phosphatidylinositol 4,5-bisphosphate 3-kinase catalytic subunit delta isoform (PI3-kinase subunit delta) (PI3K-delta) (PI3Kdelta) (PtdIns-3-kinase subunit delta)",Cytoplasm,,,1.39,2.73,2.73,15919,31898,0.974,curated,calcium_cAMP_signaling,True
PIK3CG,,,no,ENSG00000105851,"Phosphatidylinositol 4,5-bisphosphate 3-kinase catalytic subunit gamma isoform (PI3-kinase subunit gamma) (PI3K-gamma) (PI3Kgamma) (PtdIns-3-kinase subunit gamma)",Cytoplasm,brush cell;intestinal tuft cell;tuft cell of colon,,0.895,1.298,1.298,10252,15166,0.536,curated,calcium_cAMP_signaling,False
PIK3R1,,,no,ENSG00000145675,Phosphatidylinositol 3-kinase regulatory subunit alpha (PI3-kinase regulatory subunit alpha) (PI3K regulatory subunit alpha) (PtdIns-3-kinase regulatory subunit alpha) (Phosphatidylinositol 3-kinase 85 kDa regulatory subunit alpha) (PI3-kinase subunit p85-alpha) (PtdIns-3-kinase regulatory subunit p85-alpha),,epithelial cell of thymus;cortical thymic epithelial cell;alpha-beta T cell;mature alpha-beta T cell;mucosal invariant T cell;mature T cell;keratocyte,,4.493,4.853,4.853,51457,56704,0.111,curated,calcium_cAMP_signaling,False
PIK3R2,,,no,ENSG00000105647,Phosphatidylinositol 3-kinase regulatory subunit beta (PI3-kinase regulatory subunit beta) (PI3K regulatory subunit beta) (PtdIns-3-kinase regulatory subunit beta) (Phosphatidylinositol 3-kinase 85 kDa regulatory subunit beta) (PI3-kinase subunit p85-beta) (PtdIns-3-kinase regulatory subunit p85-beta),,,,8.295,7.973,8.295,94998,93166,-0.057,curated,calcium_cAMP_signaling,True
PLCB1,,,no,ENSG00000182621,"1-phosphatidylinositol 4,5-bisphosphate phosphodiesterase beta-1",Nucleus membrane,endothelial cell of sinusoid;endothelial cell of hepatic sinusoid;endothelial cell of pericentral hepatic sinusoid;cardiac endothelial cell;kidney loop of Henle ascending limb epithelial cell;kidney loop of Henle thick ascending limb epithelial cell;kidney loop of Henle epithelial cell;Schwann cell;mesangial cell,,4.51,3.9,4.51,51649,45569,-0.21,curated,calcium_cAMP_signaling,False
PLCE1,,,no,ENSG00000138193,"1-phosphatidylinositol 4,5-bisphosphate phosphodiesterase epsilon-1",Cytoplasm,corneal endothelial cell;pigmented ciliary epithelial cell;kidney glomerular epithelial cell;podocyte;parietal epithelial cell;retinal pigment epithelial cell;smooth muscle myoblast;Schwann cell,,0.657,0.643,0.657,7519,7517,-0.029,curated,calcium_cAMP_signaling,False
PLCG1,,,no,ENSG00000124181,"1-phosphatidylinositol 4,5-bisphosphate phosphodiesterase gamma-1",Cell projection,,,5.209,7.695,7.695,59656,89916,0.563,curated,calcium_cAMP_signaling,True
PLCG2,,,no,ENSG00000197943,"1-phosphatidylinositol 4,5-bisphosphate phosphodiesterase gamma-2",Membrane raft,kidney collecting duct intercalated cell;renal intercalated cell;renal beta-intercalated cell;renal alpha-intercalated cell;pulmonary ionocyte;brush cell;intestinal tuft cell;tuft cell of colon;endothelial cell of lymphatic vessel;ionocyte;melanocyte of skin,,1.576,2.24,2.24,18051,26172,0.507,curated,calcium_cAMP_signaling,False
PLD1,,,no,ENSG00000075651,Phospholipase D1 (PLD 1) (hPLD1),Cytoplasm,pigmented epithelial cell;non-pigmented ciliary epithelial cell,,5.994,6.647,6.647,68647,77667,0.149,curated,calcium_cAMP_signaling,False
PLD2,,,no,ENSG00000129219,Phospholipase D2 (PLD 2) (hPLD2),Cell membrane,,,3.27,4.304,4.304,37450,50293,0.396,curated,calcium_cAMP_signaling,True
POMC,,,no,ENSG00000115138,Pro-opiomelanocortin (POMC) (Corticotropin-lipotropin),Secreted,Sertoli cell,MELANOCORTIN;OPIOID,2.136,1.327,2.136,24465,15500,-0.687,curated,calcium_cAMP_signaling,True
PPARA,,,no,ENSG00000186951,Peroxisome proliferator-activated receptor alpha (PPAR-alpha) (Nuclear receptor subfamily 1 group C member 1),Nucleus,centrilobular region hepatocyte;sebaceous gland cell,DHEA;DHEAS,4.03,4.47,4.47,46150,52227,0.15,curated,calcium_cAMP_signaling,True
PPIF,,,no,ENSG00000108179,"Peptidyl-prolyl cis-trans isomerase F, mitochondrial (PPIase F)",Mitochondrion matrix,,,10.234,9.01,10.234,117212,105285,-0.184,curated,calcium_cAMP_signaling,True
PPP1CA,,,no,ENSG00000172531,Serine/threonine-protein phosphatase PP1-alpha catalytic subunit (PP-1A),Cytoplasm,large pre-B-II cell;pre-conventional dendritic cell,,16.15,16.684,16.684,184968,194948,0.047,curated,calcium_cAMP_signaling,False
PPP1R1B,,,no,ENSG00000131771,Protein phosphatase 1 regulatory subunit 1B (DARPP-32) (Dopamine- and cAMP-regulated neuronal phosphoprotein),Cytoplasm,intestinal crypt stem cell;intestinal crypt stem cell of small intestine;intestinal crypt stem cell of colon;large intestine goblet cell;colon goblet cell;enteroendocrine cell of colon;intestinal tuft cell;tuft cell of colon;transit amplifying cell of colon;transit amplifying cell of small intestine;tracheobronchial serous cell,,7.182,7.356,7.356,82257,85955,0.035,curated,calcium_cAMP_signaling,False
PPP3CA,,,no,ENSG00000138814,Protein phosphatase 3 catalytic subunit alpha,Cytoplasm,renal beta-intercalated cell;luminal cell of prostate epithelium;stellate neuron;granule cell;cerebellar granule cell,,3.993,4.225,4.225,45734,49368,0.081,curated,calcium_cAMP_signaling,False
PRKACA,,,no,ENSG00000072062,cAMP-dependent protein kinase catalytic subunit alpha (PKA C-alpha),Cytoplasm,,,13.316,14.222,14.222,152507,166178,0.095,curated,calcium_cAMP_signaling,True
PRKACB,,,no,ENSG00000142875,cAMP-dependent protein kinase catalytic subunit beta (PKA C-beta),Cytoplasm,,,5.254,5.917,5.917,60170,69137,0.172,curated,calcium_cAMP_signaling,True
PRKCA,,,no,ENSG00000154229,Protein kinase C alpha type (PKC-A) (PKC-alpha),Cytoplasm,endothelial cell of hepatic sinusoid;endothelial cell of pericentral hepatic sinusoid;Bergmann glial cell;Schwann cell;neuron;kidney interstitial fibroblast,,2.789,3.645,3.645,31945,42590,0.386,curated,calcium_cAMP_signaling,False
PRKCB,,,no,ENSG00000166501,Protein kinase C beta type (PKC-B) (PKC-beta),Cytoplasm,IgG memory B cell;IgG-negative class switched memory B cell;amacrine cell;stellate neuron,,0.4,0.534,0.534,4584,6243,0.417,curated,calcium_cAMP_signaling,False
PRKCE,,,no,ENSG00000171132,Protein kinase C epsilon type,Cytoplasm,renal beta-intercalated cell,,1.225,1.263,1.263,14032,14757,0.044,curated,calcium_cAMP_signaling,True
PRKCG,,,no,ENSG00000126583,Protein kinase C gamma type (PKC-gamma),Cytoplasm,,,0.083,0.065,0.083,952,759,-0.356,curated,calcium_cAMP_signaling,True
PTAFR,,,no,ENSG00000169403,Platelet-activating factor receptor (PAF-R) (PAFr),Cell membrane,phagocyte;immature neutrophil,,1.264,1.649,1.649,14478,19272,0.384,curated,calcium_cAMP_signaling,False
PTCH1,,,no,ENSG00000185920,Protein patched homolog 1 (PTC) (PTC1),Cell membrane,mesodermal cell;enteric smooth muscle cell,HH,3.186,3.03,3.186,36494,35403,-0.073,curated,calcium_cAMP_signaling,False
PTGER2,,,no,ENSG00000125384,Prostaglandin E2 receptor EP2 subtype (PGE receptor EP2 subtype) (PGE2 receptor EP2 subtype) (Prostanoid EP2 receptor),Cell membrane,"T-helper 1 cell;T-helper 22 cell;activated CD4-positive, alpha-beta T cell, human;effector memory CD4-positive, alpha-beta T cell;central memory CD8-positive, alpha-beta T cell;CD8-alpha-beta-positive, alpha-beta intraepithelial T cell;group 2 innate lymphoid cell;DN1 thymic pro-T cell",Prostaglandin,0.367,0.42,0.42,4199,4910,0.197,curated,calcium_cAMP_signaling,False
PTGER3,,,no,ENSG00000050628,Prostaglandin E2 receptor EP3 subtype (PGE receptor EP3 subtype) (PGE2 receptor EP3 subtype) (PGE2-R) (Prostanoid EP3 receptor),Cell membrane,kidney collecting duct epithelial cell;kidney collecting duct intercalated cell;renal intercalated cell;renal beta-intercalated cell;renal alpha-intercalated cell;kidney distal convoluted tubule epithelial cell;kidney loop of Henle ascending limb epithelial cell;kidney loop of Henle thick ascending limb epithelial cell;kidney epithelial cell;kidney cortex tubule cell;kidney connecting tubule epithelial cell;epithelial cell of nephron;kidney loop of Henle epithelial cell;fat cell;adipocyte of epicardial fat of left ventricle;kidney cell;kidney collecting duct cell,Prostaglandin,1.507,0.88,1.507,17254,10284,-0.775,curated,calcium_cAMP_signaling,False
PTGFR,,,no,ENSG00000122420,Prostaglandin F2-alpha receptor (PGF receptor) (PGF2-alpha receptor) (Prostanoid FP receptor),Cell membrane,,Prostaglandin,0.498,0.42,0.498,5701,4910,-0.244,curated,calcium_cAMP_signaling,True
PTK2B,,,no,ENSG00000120899,Protein-tyrosine kinase 2-beta,Cytoplasm;Cytoplasm,,,5.761,7.432,7.432,65980,86840,0.367,curated,calcium_cAMP_signaling,True
RAC1,,,no,ENSG00000136238,Ras-related C3 botulinum toxin substrate 1,Cell membrane,endothelial cell of umbilical vein;epithelial cell of urethra,,48.985,45.143,48.985,561018,527479,-0.118,curated,calcium_cAMP_signaling,False
RAF1,,,no,ENSG00000132155,RAF proto-oncogene serine/threonine-protein kinase,Cytoplasm;Cell membrane;Mitochondrion;Nucleus,,,15.389,15.043,15.389,176249,175777,-0.033,curated,calcium_cAMP_signaling,True
RAP1A,,,no,ENSG00000116473,Ras-related protein Rap-1A,Cell membrane,mast cell;mucosal type mast cell,,21.61,18.49,21.61,247496,216050,-0.225,curated,calcium_cAMP_signaling,False
RAPGEF3,,,no,ENSG00000079337,Rap guanine nucleotide exchange factor 3 (Exchange factor directly activated by cAMP 1) (Exchange protein directly activated by cAMP 1) (EPAC 1) (Rap1 guanine-nucleotide-exchange factor directly activated by cAMP) (cAMP-regulated guanine nucleotide exchange factor I) (cAMP-GEFI),Endomembrane system,kidney glomerular epithelial cell;parietal epithelial cell,,0.738,1.89,1.89,8448,22084,1.357,curated,calcium_cAMP_signaling,False
RELA,,,no,ENSG00000173039,Transcription factor p65 (Nuclear factor NF-kappa-B p65 subunit) (Nuclear factor of kappa light polypeptide gene enhancer in B-cells 3),Nucleus,,,10.299,10.655,10.655,117951,124503,0.049,curated,calcium_cAMP_signaling,True
RET,,,no,ENSG00000165731,Proto-oncogene tyrosine-protein kinase receptor Ret,Cell membrane,lung neuroendocrine cell,,0.302,0.339,0.339,3462,3966,0.167,curated,calcium_cAMP_signaling,False
RHOA,,,no,ENSG00000067560,Transforming protein RhoA,Cell membrane,"pancreatic PP cell;PP cell;mature conventional dendritic cell;myeloid leukocyte;mast cell;mucosal type mast cell;CD34-positive, CD56-positive, CD117-positive common innate lymphoid precursor, human;myeloid cell",,29.58,26.558,29.58,338774,310325,-0.155,curated,calcium_cAMP_signaling,False
ROCK1,,,no,ENSG00000067900,Rho-associated protein kinase 1,Cytoplasm,,,8.709,8.698,8.709,99743,101636,-0.002,curated,calcium_cAMP_signaling,True
ROCK2,,,no,ENSG00000134318,Rho-associated protein kinase 2,Cytoplasm;Cell membrane,subcutaneous fat cell;adipocyte of breast;adipocyte of epicardial fat of left ventricle,,3.66,3.015,3.66,41919,35229,-0.28,curated,calcium_cAMP_signaling,False
RRAS,,,no,ENSG00000126458,Ras-related protein R-Ras,Cell membrane,cerebral cortex endothelial cell;endosteal cell;myometrial cell,,1.824,1.985,1.985,20887,23189,0.122,curated,calcium_cAMP_signaling,False
SLC25A31,,,no,ENSG00000151475,"ADP/ATP translocase 4 (ADP,ATP carrier protein 4) (Adenine nucleotide translocator 4) (ANT 4) (Solute carrier family 25 member 31) (Sperm flagellar energy carrier protein)",Mitochondrion inner membrane,,,0.112,0.019,0.112,1286,222,-2.563,curated,calcium_cAMP_signaling,True
SLC25A4,,,no,ENSG00000151729,"ADP/ATP translocase 1 (ADP,ATP carrier protein 1) (ADP,ATP carrier protein, heart/skeletal muscle isoform T1) (Adenine nucleotide translocator 1) (ANT 1) (Solute carrier family 25 member 4)",Mitochondrion inner membrane,cardiac muscle cell;slow muscle cell;fast muscle cell,,7.178,4.688,7.178,82209,54781,-0.615,curated,calcium_cAMP_signaling,True
SLC9A1,,,no,ENSG00000090020,"Sodium/hydrogen exchanger 1 (APNH) (Na(+)/H(+) antiporter, amiloride-sensitive) (Na(+)/H(+) exchanger 1) (NHE-1) (Solute carrier family 9 member 1)",Cell membrane,,,3.261,3.19,3.261,37343,37274,-0.032,curated,calcium_cAMP_signaling,True
SOX9,,,no,ENSG00000125398,Transcription factor SOX-9,Nucleus,intestinal crypt stem cell of large intestine;intrahepatic cholangiocyte;Sertoli cell;duodenum glandular cell;brush cell;intestinal tuft cell;tuft cell of colon;forebrain radial glial cell;chondrocyte;serous cell of epithelium of trachea,,15.268,17.427,17.427,174867,203625,0.191,curated,calcium_cAMP_signaling,False
SPHK1,,,no,ENSG00000176170,Sphingosine kinase 1 (SK 1) (SPK 1),Cytoplasm,pancreatic ductal cell;vein endothelial cell;endothelial cell of umbilical vein;endothelial cell of lymphatic vessel;pancreatic stellate cell;fibroblast of mammary gland;fibroblast of breast,,4.308,5.795,5.795,49341,67714,0.428,curated,calcium_cAMP_signaling,False
SRF,,,no,ENSG00000112658,Serum response factor (SRF),Nucleus,neural progenitor cell,,5.323,4.321,5.323,60965,50494,-0.301,curated,calcium_cAMP_signaling,True
SSTR1,,,no,ENSG00000139874,Somatostatin receptor type 1 (SS-1-R) (SS1-R) (SS1R) (SST1) (SRIF-2),Cell membrane,intestinal enteroendocrine cell,SOMATOSTATIN,0.38,0.279,0.38,4356,3260,-0.447,curated,calcium_cAMP_signaling,True
SSTR2,,,no,ENSG00000180616,Somatostatin receptor type 2 (SS-2-R) (SS2-R) (SS2R) (SST2) (SRIF-1),Cell membrane,pancreatic epsilon cell;intestinal enteroendocrine cell;enteroendocrine cell of small intestine;vascular associated smooth muscle cell;smooth muscle cell of prostate;fibroblast of connective tissue of nonglandular part of prostate;mural cell,SOMATOSTATIN,0.626,0.443,0.626,7173,5175,-0.5,curated,calcium_cAMP_signaling,False
SSTR5,,,no,ENSG00000162009,Somatostatin receptor type 5 (SS-5-R) (SS5-R) (SS5R) (SST5),Cell membrane,,SOMATOSTATIN;UROTENSIN,0.05,0.02,0.05,573,235,-1.315,curated,calcium_cAMP_signaling,True
STIM1,,,no,ENSG00000167323,Stromal interaction molecule 1,Cell membrane,,,6.779,7.168,7.168,77643,83757,0.08,curated,calcium_cAMP_signaling,True
STIM2,,,no,ENSG00000109689,Stromal interaction molecule 2,Endoplasmic reticulum membrane,choroid plexus epithelial cell;smooth muscle cell of sphincter of pupil;ciliary muscle cell,,4.7,5.466,5.466,53830,63869,0.218,curated,calcium_cAMP_signaling,False
TACR1,,,no,ENSG00000115353,Substance-P receptor (SPR) (NK-1 receptor) (NK-1R) (Tachykinin receptor 1),Cell membrane,medium spiny neuron,TAC,0.028,0.046,0.046,324,536,0.697,curated,calcium_cAMP_signaling,False
TACR2,,,no,ENSG00000075073,Substance-K receptor (SKR) (NK-2 receptor) (NK-2R) (Neurokinin A receptor) (Tachykinin receptor 2),Cell membrane,,TAC,0.062,0.047,0.062,707,548,-0.396,curated,calcium_cAMP_signaling,True
TACR3,,,no,ENSG00000169836,Neuromedin-K receptor (NKR) (NK-3 receptor) (NK-3R) (Neurokinin B receptor) (Tachykinin receptor 3),Cell membrane,neuron,TAC,0.018,,0.018,202,0,,curated,calcium_cAMP_signaling,False
TBXA2R,,,no,ENSG00000006638,Thromboxane A2 receptor (TXA2-R) (Prostanoid TP receptor),Cell membrane,,Prostaglandin,0.272,0.221,0.272,3116,2586,-0.298,curated,calcium_cAMP_signaling,True
TIAM1,,,no,ENSG00000156299,Rho guanine nucleotide exchange factor TIAM1 (T-lymphoma invasion and metastasis-inducing protein 1) (TIAM-1),Cell junction;Cell membrane,corneal epithelial cell;retina horizontal cell;cerebellar granule cell,,0.741,0.564,0.741,8481,6590,-0.393,curated,calcium_cAMP_signaling,False
TPCN1,,,no,ENSG00000186815,Two pore channel protein 1 (Two pore calcium channel protein 1) (Voltage-dependent calcium channel protein TPC1),Lysosome membrane,papillary tips cell,,7.817,9.016,9.016,89527,105349,0.206,curated,calcium_cAMP_signaling,True
TRHR,,,no,ENSG00000174417,Thyrotropin-releasing hormone receptor (TRH-R) (Thyroliberin receptor),Cell membrane,,TRH,0.037,,0.037,422,0,,curated,calcium_cAMP_signaling,True
TRPC6,,,no,ENSG00000137672,Short transient receptor potential channel 6 (TrpC6) (Transient receptor protein 6) (TRP-6),Cell membrane,alveolar type 2 fibroblast cell,,0.289,0.364,0.364,3313,4249,0.33,curated,calcium_cAMP_signaling,False
TSHR,,,no,ENSG00000165409,Thyrotropin receptor (Thyroid-stimulating hormone receptor) (TSH-R),Cell membrane,double negative thymocyte,TSH,0.082,0.027,0.082,935,320,-1.576,curated,calcium_cAMP_signaling,False
VASP,,,no,ENSG00000125753,Vasodilator-stimulated phosphoprotein (VASP),Cytoplasm;Cytoplasm,"lung macrophage;extravillous trophoblast;granulocyte;neutrophil;myeloid dendritic cell, human;non-classical monocyte;CD14-low, CD16-positive monocyte;myeloid cell",,8.625,9.217,9.217,98786,107695,0.096,curated,calcium_cAMP_signaling,False
VAV1,,,no,ENSG00000141968,Proto-oncogene vav,,,,0.915,1.87,1.87,10482,21856,1.031,curated,calcium_cAMP_signaling,True
VAV3,,,no,ENSG00000134215,Guanine nucleotide exchange factor VAV3 (VAV-3),,kidney distal convoluted tubule epithelial cell,,3.116,2.401,3.116,35690,28054,-0.376,curated,calcium_cAMP_signaling,False
VDAC1,,,no,ENSG00000213585,Voltage-dependent anion-selective channel protein 1 (VDAC-1) (hVDAC1) (Outer mitochondrial membrane protein porin 1) (Plasmalemmal porin) (Porin 31HL) (Porin 31HM),Mitochondrion outer membrane,microfold cell of epithelium of small intestine;osteoclast;ON-bipolar cell;rod bipolar cell;OFF-bipolar cell,,16.544,19.468,19.468,189477,227475,0.235,curated,calcium_cAMP_signaling,True
VDAC2,,,no,ENSG00000165637,Voltage-dependent anion-selective channel protein 2 (VDAC-2) (hVDAC2) (Outer mitochondrial membrane protein porin 2),Mitochondrion outer membrane,mast cell;mucosal type mast cell,,17.796,18.516,18.516,203812,216360,0.057,curated,calcium_cAMP_signaling,False
VEGFA,,,no,ENSG00000112715,"Vascular endothelial growth factor A, long form (L-VEGF) (Vascular permeability factor) (VPF)",Secreted,intestinal crypt stem cell of large intestine;type I pneumocyte;type B pancreatic cell;club cell;kidney glomerular epithelial cell;podocyte;elicited macrophage;inflammatory macrophage;liver dendritic cell;subcutaneous fat cell,VEGF,9.162,8.643,9.162,104935,100994,-0.084,curated,calcium_cAMP_signaling,False
VEGFB,,,no,ENSG00000173511,Vascular endothelial growth factor B (VEGF-B) (VEGF-related factor) (VRF),Secreted,,VEGF,17.446,23.079,23.079,199805,269673,0.404,curated,calcium_cAMP_signaling,True
VEGFC,,,no,ENSG00000150630,Vascular endothelial growth factor C (VEGF-C) (Flt4 ligand) (Flt4-L) (Vascular endothelial growth factor-related protein) (VRP),Secreted,endothelial cell of artery;cardiac endothelial cell,VEGF,0.562,0.883,0.883,6438,10317,0.651,curated,calcium_cAMP_signaling,False
VEGFD,,,no,ENSG00000165197,Vascular endothelial growth factor D (VEGF-D) (c-Fos-induced growth factor) (FIGF),Secreted,connective tissue cell;fibroblast;pulmonary interstitial fibroblast;fibroblast of lung,VEGF,0.231,0.159,0.231,2651,1859,-0.541,curated,calcium_cAMP_signaling,False
VIP,,,no,ENSG00000146469,VIP peptides,Secreted,enteric neuron;cortical interneuron;cerebral cortex GABAergic interneuron;peripheral nervous system neuron,VIP,0.117,0.136,0.136,1340,1588,0.216,curated,calcium_cAMP_signaling,False
