gene,category,rationale,exclude_recommended,gene_id,full_name,location,cell_type,cellchat_pathway,detection_pct_0041323,detection_pct_0041326,det_max,n_cells_0041323,n_cells_0041326,log2_detection_ratio,pathway_source,pathway_term,was_uncategorized
ABCC4,,,no,ENSG00000125257,ATP-binding cassette sub-family C member 4,Basolateral cell membrane,kidney collecting duct intercalated cell;renal intercalated cell;renal alpha-intercalated cell;luminal cell of prostate epithelium;tissue-resident macrophage;central nervous system macrophage;enucleate erythrocyte;epidermal Langerhans cell,,1.253,1.428,1.428,14351,16690,0.189,curated,calcium_cAMP_signaling,False
ADCY2,,,no,ENSG00000078295,Adenylate cyclase type 2,Membrane,smooth muscle cell of prostate;astrocyte;Bergmann glial cell;mature astrocyte;retina horizontal cell,,0.284,0.174,0.284,3247,2028,-0.708,curated,calcium_cAMP_signaling,False
ADCYAP1,,,no,ENSG00000141433,Pituitary adenylate cyclase-activating polypeptide (PACAP),Secreted,type B pancreatic cell;enteroendocrine cell;endocrine cell;basophil;mast cell,PACAP,0.594,0.05,0.594,6807,581,-3.579,curated,calcium_cAMP_signaling,False
ADCYAP1R1,,,no,ENSG00000078549,Pituitary adenylate cyclase-activating polypeptide type I receptor (PACAP type I receptor) (PACAP-R-1) (PACAP-R1),Cell membrane,,PACAP,0.213,0.204,0.213,2441,2382,-0.064,curated,calcium_cAMP_signaling,True
ADORA1,,,no,ENSG00000163485,Adenosine receptor A1,Cell membrane,,CD39;Adenosine,4.512,4.74,4.74,51675,55388,0.071,curated,calcium_cAMP_signaling,True
ADORA2A,,,no,ENSG00000128271,Adenosine receptor A2a,Cell membrane,,CD39;Adenosine,0.263,0.281,0.281,3014,3288,0.097,curated,calcium_cAMP_signaling,True
ADORA2B,,,no,ENSG00000170425,Adenosine receptor A2b,Cell membrane,,CD39;Adenosine,0.172,0.132,0.172,1970,1548,-0.377,curated,calcium_cAMP_signaling,True
ADORA3,,,no,ENSG00000282608,Adenosine receptor A3,Cell membrane,microglial cell,CD39;Adenosine,0.785,0.683,0.785,8986,7982,-0.2,curated,calcium_cAMP_signaling,False
ADRA1A,,,no,ENSG00000120907,Alpha-1A adrenergic receptor (Alpha-1A adrenoreceptor) (Alpha-1A adrenoceptor) (Alpha-1C adrenergic receptor) (Alpha-adrenergic receptor 1c),Nucleus membrane,hepatocyte;periportal region hepatocyte;midzonal region hepatocyte;centrilobular region hepatocyte;hepatic stellate cell;epicardial adipocyte;adipocyte of epicardial fat of left ventricle,Adrenaline;Noradrenaline,0.123,0.086,0.123,1405,1008,-0.508,curated,calcium_cAMP_signaling,True
ADRA1B,,,no,ENSG00000170214,Alpha-1B adrenergic receptor (Alpha-1B adrenoreceptor) (Alpha-1B adrenoceptor),Nucleus membrane,,Adrenaline;Noradrenaline,0.176,0.094,0.176,2014,1096,-0.907,curated,calcium_cAMP_signaling,True
ADRA1D,,,no,ENSG00000171873,Alpha-1D adrenergic receptor (Alpha-1A adrenergic receptor) (Alpha-1D adrenoreceptor) (Alpha-1D adrenoceptor) (Alpha-adrenergic receptor 1a),Cell membrane,,Adrenaline;Noradrenaline,0.061,,0.061,694,0,,curated,calcium_cAMP_signaling,True
ADRA2A,,,no,ENSG00000150594,Alpha-2A adrenergic receptor (Alpha-2 adrenergic receptor subtype C10) (Alpha-2A adrenoreceptor) (Alpha-2A adrenoceptor) (Alpha-2AAR),Cell membrane,vascular associated smooth muscle cell;mural cell,Adrenaline;Noradrenaline,5.189,7.022,7.022,59428,82047,0.436,curated,calcium_cAMP_signaling,False
ADRA2B,,,no,ENSG00000274286,Alpha-2B adrenergic receptor (Alpha-2 adrenergic receptor subtype C2) (Alpha-2B adrenoreceptor) (Alpha-2B adrenoceptor) (Alpha-2BAR),Cell membrane,,Adrenaline;Noradrenaline,0.254,0.214,0.254,2912,2505,-0.246,curated,calcium_cAMP_signaling,True
ADRA2C,,,no,ENSG00000184160,Alpha-2C adrenergic receptor (Alpha-2 adrenergic receptor subtype C4) (Alpha-2C adrenoreceptor) (Alpha-2C adrenoceptor) (Alpha-2CAR),Cell membrane,uterine smooth muscle cell;myometrial cell;smooth muscle cell of prostate;myofibroblast cell;stromal cell;stromal cell of ovary;pericyte;mural cell,Adrenaline;Noradrenaline,0.883,0.39,0.883,10109,4555,-1.179,curated,calcium_cAMP_signaling,False
ADRB1,,,no,ENSG00000043591,Beta-1 adrenergic receptor (Beta-1 adrenoreceptor) (Beta-1 adrenoceptor),Cell membrane,,Adrenaline;Noradrenaline,0.657,0.24,0.657,7522,2802,-1.454,curated,calcium_cAMP_signaling,True
ADRB2,,,no,ENSG00000169252,Beta-2 adrenergic receptor (Beta-2 adrenoreceptor) (Beta-2 adrenoceptor),Cell membrane,stem cell of epidermis;keratinocyte;epidermal cell;mast cell,Adrenaline;Noradrenaline,0.311,0.488,0.488,3558,5697,0.65,curated,calcium_cAMP_signaling,False
ADRB3,,,no,ENSG00000188778,Beta-3 adrenergic receptor (Beta-3 adrenoreceptor) (Beta-3 adrenoceptor),Cell membrane,,Adrenaline;Noradrenaline,0.023,,0.023,266,0,,curated,calcium_cAMP_signaling,True
AGTR1,,,no,ENSG00000144891,Type-1 angiotensin II receptor (AT1AR) (AT1BR) (Angiotensin II type-1 receptor) (AT1 receptor),Cell membrane,,,0.529,0.703,0.703,6055,8213,0.411,curated,calcium_cAMP_signaling,True
AKT1,,,no,ENSG00000142208,RAC-alpha serine/threonine-protein kinase,Cytoplasm,,,21.471,16.765,21.471,245908,195890,-0.357,curated,calcium_cAMP_signaling,True
AKT2,,,no,ENSG00000105221,RAC-beta serine/threonine-protein kinase,Cytoplasm;Nucleus;Cell membrane,,,14.34,16.101,16.101,164236,188133,0.167,curated,calcium_cAMP_signaling,True
AKT3,,,no,ENSG00000117020,RAC-gamma serine/threonine-protein kinase,Nucleus,,,6.099,7.575,7.575,69847,88506,0.313,curated,calcium_cAMP_signaling,True
AMH,,,no,ENSG00000104899,Muellerian-inhibiting factor (Anti-Muellerian hormone) (AMH) (Muellerian-inhibiting substance) (MIS),Secreted,duct epithelial cell;Sertoli cell;squamous epithelial cell;mesothelial cell;mesenchymal cell,AMH,0.069,0.019,0.069,792,225,-1.844,curated,calcium_cAMP_signaling,False
ATF2,,,no,ENSG00000115966,Cyclic AMP-dependent transcription factor ATF-2 (cAMP-dependent transcription factor ATF-2) (Activating transcription factor 2) (Cyclic AMP-responsive element-binding protein 2) (CREB-2) (cAMP-responsive element-binding protein 2) (HB16) (cAMP response element-binding protein CRE-BP1),Nucleus;Cytoplasm;Mitochondrion outer membrane,,,7.302,6.753,7.302,83635,78904,-0.113,curated,calcium_cAMP_signaling,True
ATF4,,,no,ENSG00000128272,Cyclic AMP-dependent transcription factor ATF-4 (cAMP-dependent transcription factor ATF-4) (Activating transcription factor 4) (Cyclic AMP-responsive element-binding protein 2) (CREB-2) (cAMP-responsive element-binding protein 2) (Tax-responsive enhancer element-binding protein 67) (TaxREB67),Nucleus,pancreatic PP cell;pancreatic acinar cell;PP cell,,51.875,47.634,51.875,594118,556593,-0.123,curated,calcium_cAMP_signaling,False
ATP1A1,,,no,ENSG00000163399,Sodium/potassium-transporting ATPase subunit alpha-1 (Na(+)/K(+) ATPase alpha-1 subunit),Basolateral cell membrane,intestinal crypt stem cell of small intestine;enterocyte of epithelium of small intestine;pancreatic ductal cell;intrahepatic cholangiocyte;epithelial cell of alveolus of lung;pneumocyte;type II pneumocyte;pulmonary ionocyte;microfold cell of epithelium of small intestine;epithelial cell of small intestine;kidney distal convoluted tubule epithelial cell;macula densa epithelial cell;kidney loop of Henle ascending limb epithelial cell;kidney loop of Henle thick ascending limb epithelial cell;kidney loop of Henle medullary thick ascending limb epithelial cell;kidney loop of Henle cortical thick ascending limb epithelial cell;kidney loop of Henle thin ascending limb epithelial cell;kidney loop of Henle epithelial cell;ionocyte;transit amplifying cell of small intestine;serous cell of epithelium of trachea;lung secretory cell,,56.009,55.094,56.009,641463,643760,-0.024,curated,calcium_cAMP_signaling,False
ATP2A2,,,no,ENSG00000174437,Sarcoplasmic/endoplasmic reticulum calcium ATPase 2 (SERCA2) (SR Ca(2+)-ATPase 2),Endoplasmic reticulum membrane,muscle cell;cardiac muscle cell;regular atrial cardiac myocyte;regular ventricular cardiac myocyte;slow muscle cell;smooth muscle cell of sphincter of pupil;ciliary muscle cell;muscle precursor cell;cardiac muscle myoblast,,14.018,12.195,14.018,160553,142491,-0.201,curated,calcium_cAMP_signaling,False
ATP2B1,,,no,ENSG00000070961,Plasma membrane calcium-transporting ATPase 1,Cell membrane,,,4.903,4.146,4.903,56153,48450,-0.242,curated,calcium_cAMP_signaling,True
AVPR1A,,,no,ENSG00000166148,Vasopressin V1a receptor (V1aR) (AVPR V1a) (Antidiuretic hormone receptor 1a) (Vascular/hepatic-type arginine vasopressin receptor),Cell membrane,smooth muscle cell;vascular associated smooth muscle cell;uterine smooth muscle cell;smooth muscle cell of prostate;pericyte;mural cell,AVP,0.435,0.432,0.435,4979,5048,-0.009,curated,calcium_cAMP_signaling,False
AVPR1B,,,no,ENSG00000198049,Vasopressin V1b receptor (V1bR) (AVPR V1b) (AVPR V3) (Antidiuretic hormone receptor 1b) (Vasopressin V3 receptor),Cell membrane,,AVP,0.165,0.169,0.169,1893,1978,0.034,curated,calcium_cAMP_signaling,True
BAD,,,no,ENSG00000002330,Bcl2-associated agonist of cell death (BAD) (Bcl-2-binding component 6) (Bcl-2-like protein 8) (Bcl2-L-8) (Bcl-xL/Bcl-2-associated death promoter) (Bcl2 antagonist of cell death),Mitochondrion outer membrane;Cytoplasm,,,0.348,0.301,0.348,3987,3518,-0.209,curated,calcium_cAMP_signaling,False
BDKRB1,,,no,ENSG00000100739,B1 bradykinin receptor (B1R) (BK-1 receptor),Cell membrane,fibroblast;fibroblast of mammary gland,BRADYKININ,0.165,0.122,0.165,1891,1425,-0.437,curated,calcium_cAMP_signaling,False
BDKRB2,,,no,ENSG00000168398,B2 bradykinin receptor (B2R) (BK-2 receptor),Cell membrane,,BRADYKININ,1.682,1.144,1.682,19269,13373,-0.556,curated,calcium_cAMP_signaling,True
BDNF,,,no,ENSG00000176697,Brain-derived neurotrophic factor (BDNF) (Abrineurin),Secreted,,NT,0.067,0.034,0.067,765,403,-0.954,curated,calcium_cAMP_signaling,True
BRAF,,,no,ENSG00000157764,Serine/threonine-protein kinase B-raf,Nucleus,,,9.828,9.385,9.828,112563,109665,-0.067,curated,calcium_cAMP_signaling,True
CACNA1B,,,no,ENSG00000148408,"Voltage-dependent N-type calcium channel subunit alpha-1B (Brain calcium channel III) (BIII) (Calcium channel, L type, alpha-1 polypeptide isoform 5) (Voltage-gated calcium channel subunit alpha Cav2.2)",Membrane,neural cell;neuron;interneuron;ganglion interneuron;inhibitory interneuron;amacrine cell;GABAergic neuron;glutamatergic neuron,,0.152,0.123,0.152,1741,1440,-0.303,curated,calcium_cAMP_signaling,False
CACNA1C,,,no,ENSG00000151067,"Voltage-dependent L-type calcium channel subunit alpha-1C (Calcium channel, L type, alpha-1 polypeptide, isoform 1, cardiac muscle) (Voltage-gated calcium channel subunit alpha Cav1.2)",Cell membrane,pigmented epithelial cell;pigmented ciliary epithelial cell;muscle cell;cardiac muscle cell;regular atrial cardiac myocyte;regular ventricular cardiac myocyte;smooth muscle cell of sphincter of pupil;muscle precursor cell;smooth muscle myoblast;cardiac muscle myoblast;retina horizontal cell;alveolar type 2 fibroblast cell;fibroblast of cardiac tissue;kidney interstitial fibroblast;renal interstitial pericyte;kidney interstitial cell,,1.333,1.217,1.333,15270,14215,-0.132,curated,calcium_cAMP_signaling,False
CACNA1D,,,no,ENSG00000157388,"Voltage-dependent L-type calcium channel subunit alpha-1D (Calcium channel, L type, alpha-1 polypeptide, isoform 2) (Voltage-gated calcium channel subunit alpha Cav1.3)",Membrane,non-pigmented ciliary epithelial cell;corneal epithelial cell;kidney distal convoluted tubule epithelial cell;retinal pigment epithelial cell;amacrine cell;alveolar type 2 fibroblast cell,,1.15,0.96,1.15,13170,11215,-0.261,curated,calcium_cAMP_signaling,False
CACNA1G,,,no,ENSG00000006283,Voltage-dependent T-type calcium channel subunit alpha-1G (Cav3.1c) (NBR13) (Voltage-gated calcium channel subunit alpha Cav3.1),Cell membrane,,,0.061,0.032,0.061,695,379,-0.904,curated,calcium_cAMP_signaling,True
CACNA1H,,,no,ENSG00000196557,Voltage-dependent T-type calcium channel subunit alpha-1H (Low-voltage-activated calcium channel alpha1 3.2 subunit) (Voltage-gated calcium channel subunit alpha Cav3.2),Cell membrane,,,1.018,1.321,1.321,11657,15440,0.377,curated,calcium_cAMP_signaling,True
CALM3,,,no,ENSG00000160014,Calmodulin-3,Cytoplasm,pancreatic A cell;Hofbauer cell;platelet;T-helper 17 cell;large pre-B-II cell;myeloid cell;megakaryocyte-erythroid progenitor cell;megakaryocyte,,16.504,14.013,16.504,189023,163741,-0.236,curated,calcium_cAMP_signaling,False
CALML3,,,no,ENSG00000178363,Calmodulin-like protein 3 (CaM-like protein) (CLP) (Calmodulin-related protein NB-1),,stem cell;basal cell;respiratory basal cell;basal cell of epithelium of trachea;epithelial cell of stratum germinativum of esophagus;epithelial cell;keratinocyte;stratified epithelial cell;pulmonary ionocyte;epithelial cell of thymus;cortical thymic epithelial cell;medullary thymic epithelial cell;epidermal cell;ionocyte;conjunctival epithelial cell,,0.033,,0.033,378,0,,curated,calcium_cAMP_signaling,False
CAMK1,,,no,ENSG00000134072,Calcium/calmodulin-dependent protein kinase type 1,Cytoplasm,,,2.662,2.799,2.799,30483,32702,0.072,curated,calcium_cAMP_signaling,True
CAMK2A,,,no,ENSG00000070808,Calcium/calmodulin-dependent protein kinase type II subunit alpha (CaM kinase II subunit alpha) (CaMK-II subunit alpha),Synapse,,,0.038,0.012,0.038,431,141,-1.641,curated,calcium_cAMP_signaling,True
CAMK2B,,,no,ENSG00000058404,Calcium/calmodulin-dependent protein kinase type II subunit beta (CaM kinase II subunit beta) (CaMK-II subunit beta),Cytoplasm,bipolar neuron;retinal bipolar neuron;ON-bipolar cell;rod bipolar cell;OFF-bipolar cell,,0.397,0.229,0.397,4543,2680,-0.79,curated,calcium_cAMP_signaling,False
CAMK2D,,,no,ENSG00000145349,Calcium/calmodulin-dependent protein kinase type II subunit delta (CaM kinase II subunit delta) (CaMK-II subunit delta),Cell membrane,cardiac muscle cell;regular ventricular cardiac myocyte;muscle precursor cell;cardiac muscle myoblast;preadipocyte;brown preadipocyte,,3.496,4.151,4.151,40034,48503,0.248,curated,calcium_cAMP_signaling,True
CAMK2G,,,no,ENSG00000148660,Calcium/calmodulin-dependent protein kinase type II subunit gamma (CaM kinase II subunit gamma) (CaMK-II subunit gamma),Sarcoplasmic reticulum membrane,astrocyte,,2.392,3.066,3.066,27398,35823,0.358,curated,calcium_cAMP_signaling,True
CCKAR,,,no,ENSG00000163394,Cholecystokinin receptor type A (CCK-A receptor) (CCK-AR) (Cholecystokinin-1 receptor) (CCK1-R),Cell membrane,,CCK,0.027,0.01,0.027,311,113,-1.489,curated,calcium_cAMP_signaling,True
CCKBR,,,no,ENSG00000110148,Gastrin/cholecystokinin type B receptor (CCK-B receptor) (CCK-BR) (Cholecystokinin-2 receptor) (CCK2-R),Cell membrane,,CCK,2.276,0.593,2.276,26066,6925,-1.941,curated,calcium_cAMP_signaling,True
CD38,,,no,ENSG00000004468,ADP-ribosyl cyclase/cyclic ADP-ribose hydrolase 1,Cell surface,"plasmablast;IgG plasmablast;IgA plasmablast;alpha-beta T cell;immature alpha-beta T cell;double-positive, alpha-beta thymocyte;mature alpha-beta T cell;CD8-alpha-alpha-positive, alpha-beta intraepithelial T cell;mucosal invariant T cell;mature T cell;immature T cell;thymocyte;precursor B cell;small pre-B-II cell;large pre-B-II cell;pre-B-I cell;late pro-B cell;plasma cell;IgG plasma cell;IgM plasma cell;IgA plasma cell;erythroid progenitor cell, mammalian;lymphoid lineage restricted progenitor cell;pro-B cell;fraction A pre-pro B cell",PECAM2,0.382,0.421,0.421,4378,4921,0.14,curated,calcium_cAMP_signaling,False
CFTR,,,no,ENSG00000001626,Cystic fibrosis transmembrane conductance regulator (CFTR) (ATP-binding cassette sub-family C member 7) (Channel conductance-controlling ATPase),Apical cell membrane,intestinal crypt stem cell of colon;pancreatic ductal cell;cholangiocyte;columnar/cuboidal epithelial cell;pulmonary ionocyte;lung goblet cell;bronchial goblet cell;paneth cell of epithelium of small intestine;duodenum glandular cell;periportal region hepatocyte;M cell of gut;ionocyte,,29.856,32.182,32.182,341934,376037,0.108,curated,calcium_cAMP_signaling,False
CHRM1,,,no,ENSG00000168539,Muscarinic acetylcholine receptor M1,Cell membrane,,Ach,0.057,0.018,0.057,648,216,-1.614,curated,calcium_cAMP_signaling,True
CHRM2,,,no,ENSG00000181072,Muscarinic acetylcholine receptor M2,Cell membrane,muscle cell;cardiac muscle cell;regular atrial cardiac myocyte;regular ventricular cardiac myocyte;muscle precursor cell;cardiac muscle myoblast;visceromotor neuron,Ach,0.027,0.017,0.027,309,200,-0.657,curated,calcium_cAMP_signaling,False
CHRM3,,,no,ENSG00000133019,Muscarinic acetylcholine receptor M3,Cell membrane,kidney capillary endothelial cell;epithelial cell of sweat gland;smooth muscle cell of sphincter of pupil;ciliary muscle cell;stellate neuron;visceromotor neuron,Ach,2.547,2.524,2.547,29172,29490,-0.013,curated,calcium_cAMP_signaling,False
CHRM5,,,no,ENSG00000184984,Muscarinic acetylcholine receptor M5,Cell membrane,ganglion interneuron;medium spiny neuron,Ach,0.028,0.009,0.028,323,102,-1.692,curated,calcium_cAMP_signaling,False
CHRNA7,,,no,ENSG00000175344,Neuronal acetylcholine receptor subunit alpha-7,Postsynaptic cell membrane,neuroendocrine cell;chromaffin cell;cortical cell of adrenal gland,SLURP;Ach,0.913,0.485,0.913,10454,5664,-0.913,curated,calcium_cAMP_signaling,True
CREB1,,,no,ENSG00000118260,Cyclic AMP-responsive element-binding protein 1 (CREB-1) (cAMP-responsive element-binding protein 1),Nucleus,,,7.977,8.081,8.081,91362,94424,0.019,curated,calcium_cAMP_signaling,True
CREB3,,,no,ENSG00000107175,Cyclic AMP-responsive element-binding protein 3 (CREB-3) (cAMP-responsive element-binding protein 3) (Leucine zipper protein) (Luman) (Transcription factor LZIP-alpha),Nucleus,,,9.603,10.001,10.001,109987,116861,0.059,curated,calcium_cAMP_signaling,True
CREB5,,,no,ENSG00000146592,Cyclic AMP-responsive element-binding protein 5 (CREB-5) (cAMP-responsive element-binding protein 5) (cAMP-response element-binding protein A) (CRE-BPa),Nucleus,endosteal cell;fibroblast of mammary gland,,0.927,0.876,0.927,10613,10231,-0.082,curated,calcium_cAMP_signaling,False
CREBBP,,,no,ENSG00000005339,CREB-binding protein (Histone lysine acetyltransferase CREBBP),Cytoplasm,,,14.832,17.279,17.279,169874,201905,0.22,curated,calcium_cAMP_signaling,True
CXCR4,,,no,ENSG00000121966,C-X-C chemokine receptor type 4 (CXC-R4) (CXCR-4) (FB22) (Fusin) (HM89) (LCR1) (Leukocyte-derived seven transmembrane domain receptor) (LESTR) (Lipopolysaccharide-associated protein 3) (LAP-3) (LPS-associated protein 3) (NPYRL) (Stromal cell-derived factor 1 receptor) (SDF-1 receptor) (CD antigen CD184),Cell membrane,"mononuclear phagocyte;hematopoietic cell;leukocyte;mature conventional dendritic cell;liver dendritic cell;mature B cell;memory B cell;class switched memory B cell;IgG memory B cell;IgG-negative class switched memory B cell;naive B cell;follicular B cell;mononuclear cell;lymphocyte;CD4-positive helper T cell;T-helper 1 cell;effector CD4-positive, alpha-beta T cell;CD8-positive, alpha-beta cytokine secreting effector T cell;effector memory CD8-positive, alpha-beta T cell, terminally differentiated;type I NK T cell;DN3 thymocyte;B cell;immature B cell;precursor B cell;immature natural killer cell;DN1 thymic pro-T cell",CXCL;MIF,0.9,4.239,4.239,10310,49526,2.235,curated,calcium_cAMP_signaling,False
CYSLTR1,,,no,ENSG00000173198,Cysteinyl leukotriene receptor 1 (CysLTR1) (Cysteinyl leukotriene D4 receptor) (LTD4 receptor) (G-protein coupled receptor HG55) (HMTMF81),Cell membrane,mast cell;mucosal type mast cell;common dendritic progenitor,CysLTs,0.158,0.142,0.158,1814,1665,-0.153,curated,calcium_cAMP_signaling,False
CYSLTR2,,,no,ENSG00000152207,Cysteinyl leukotriene receptor 2 (CysLTR2) (G-protein coupled receptor GPCR21) (hGPCR21) (G-protein coupled receptor HG57) (HPN321),Cell membrane,pericyte;mural cell,CysLTs,0.044,0.018,0.044,504,216,-1.251,curated,calcium_cAMP_signaling,False
DRD1,,,no,ENSG00000184845,D(1A) dopamine receptor (Dopamine D1 receptor),Cell membrane,medium spiny neuron,Dopamine;SerotoninDopamin,0.056,0.047,0.056,637,549,-0.243,curated,calcium_cAMP_signaling,False
DRD2,,,no,ENSG00000149295,D(2) dopamine receptor (Dopamine D2 receptor),Cell membrane,medium spiny neuron,Dopamine;SerotoninDopamin,0.043,0.028,0.043,491,332,-0.593,curated,calcium_cAMP_signaling,False
DRD5,,,no,ENSG00000169676,D(1B) dopamine receptor (D(5) dopamine receptor) (D1beta dopamine receptor) (Dopamine D5 receptor),Cell membrane,,Dopamine;SerotoninDopamin,0.105,0.019,0.105,1199,224,-2.449,curated,calcium_cAMP_signaling,True
EDN1,,,no,ENSG00000078401,Endothelin-1 (Preproendothelin-1) (PPET1),Secreted,epithelial cell;squamous epithelial cell;blood vessel endothelial cell;vein endothelial cell;endothelial cell of umbilical vein;vasa recta descending limb cell;endothelial cell of artery;epithelial cell of uterus;epithelial cell of prostate;basal cell of prostate epithelium;endothelial cell of vascular tree;endothelial cell of uterus;cerebral cortex endothelial cell,EDN,2.22,1.82,2.22,25420,21270,-0.286,curated,calcium_cAMP_signaling,False
EDNRA,,,no,ENSG00000151617,Endothelin-1 receptor (Endothelin receptor type A) (ET-A) (ETA-R) (hET-AR),Cell membrane,muscle cell;smooth muscle cell;vascular associated smooth muscle cell;smooth muscle myoblast;glutamatergic neuron;fibroblast of lung;bronchus fibroblast of lung;pericyte;mesangial cell;renal interstitial pericyte;mesenchymal cell;mural cell,EDN,0.486,0.374,0.486,5561,4375,-0.375,curated,calcium_cAMP_signaling,False
EDNRB,,,no,ENSG00000136160,Endothelin receptor type B (ET-B) (ET-BR) (Endothelin receptor non-selective type),Cell membrane,glioblast;Schwann cell precursor;neural crest cell;epithelial cell;lung endothelial cell;endothelial cell;endothelial cell of vascular tree;endocardial cell;surface ectodermal cell;melanocyte;vascular associated smooth muscle cell;tracheobronchial smooth muscle cell;astrocyte;pancreatic stellate cell;fibroblast of breast;pericyte;mural cell,EDN,3.71,1.511,3.71,42491,17651,-1.296,curated,calcium_cAMP_signaling,False
EGF,,,no,ENSG00000138798,Pro-epidermal growth factor (EGF),Membrane,kidney distal convoluted tubule epithelial cell;kidney loop of Henle ascending limb epithelial cell;kidney loop of Henle thick ascending limb epithelial cell;kidney epithelial cell;kidney cortex tubule cell;epithelial cell of nephron;kidney loop of Henle epithelial cell;kidney cell,EGF,9.107,11.806,11.806,104305,137953,0.374,curated,calcium_cAMP_signaling,False
EGFR,,,no,ENSG00000146648,Epidermal growth factor receptor,Cell membrane,basal epithelial cell of prostatic duct;trophoblast giant cell;syncytiotrophoblast cell,EGF;EPGN,6.755,6.097,6.755,77364,71247,-0.148,curated,calcium_cAMP_signaling,False
EP300,,,no,ENSG00000100393,Histone acetyltransferase p300 (p300 HAT),Cytoplasm,enucleate erythrocyte,,13.387,15.102,15.102,153325,176464,0.174,curated,calcium_cAMP_signaling,True
ERBB2,,,no,ENSG00000141736,Receptor tyrosine-protein kinase erbB-2,Cell membrane,,EGF;NRG,5.451,6.4,6.4,62435,74778,0.231,curated,calcium_cAMP_signaling,True
ERBB3,,,no,ENSG00000065361,Receptor tyrosine-protein kinase erbB-3,Secreted,intestinal crypt stem cell of small intestine,NRG,11.452,14.628,14.628,131158,170929,0.353,curated,calcium_cAMP_signaling,True
F2R,,,no,ENSG00000181104,Proteinase-activated receptor 1 (PAR-1) (Coagulation factor II receptor) (Thrombin receptor),Cell membrane,endothelial tip cell;endothelial cell of umbilical vein;endocardial cell;pancreatic stellate cell,PARs;KLK;PROCR,1.599,1.326,1.599,18309,15489,-0.27,curated,calcium_cAMP_signaling,False
FGF1,,,no,ENSG00000113578,Fibroblast growth factor 1 (FGF-1) (Acidic fibroblast growth factor) (aFGF) (Endothelial cell growth factor) (ECGF) (Heparin-binding growth factor 1) (HBGF-1),Secreted;Cytoplasm;Cytoplasm,kidney glomerular epithelial cell;podocyte,FGF,0.157,0.115,0.157,1802,1343,-0.453,curated,calcium_cAMP_signaling,False
FGF10,,,no,ENSG00000070193,Fibroblast growth factor 10 (FGF-10) (Keratinocyte growth factor 2),Secreted,corneal endothelial cell;endosteal cell;neuron,FGF,1.064,0.845,1.064,12191,9874,-0.333,curated,calcium_cAMP_signaling,False
FGF19,,,no,ENSG00000162344,Fibroblast growth factor 19 (FGF-19),Secreted,,,0.016,,0.016,183,0,,curated,calcium_cAMP_signaling,True
FGF2,,,no,ENSG00000138685,Fibroblast growth factor 2 (FGF-2) (Basic fibroblast growth factor) (bFGF) (Heparin-binding growth factor 2) (HBGF-2),Secreted,myoepithelial cell;myoepithelial cell of mammary gland;fibroblast of connective tissue of nonglandular part of prostate;fibroblast of connective tissue of glandular part of prostate,FGF,0.524,0.608,0.608,6005,7105,0.214,curated,calcium_cAMP_signaling,False
FGF21,,,no,ENSG00000105550,Fibroblast growth factor 21 (FGF-21),Secreted,,FGF,0.026,0.017,0.026,299,202,-0.595,curated,calcium_cAMP_signaling,False
FGF23,,,no,ENSG00000118972,Fibroblast growth factor 23 (FGF-23) (Phosphatonin) (Tumor-derived hypophosphatemia-inducing factor),Secreted,"phagocyte;classical monocyte;CD14-positive, CD16-negative classical monocyte;hematopoietic cell;leukocyte;myeloid leukocyte;monocyte;CD14-positive monocyte;CD14-positive, CD16-positive monocyte;mononuclear cell;lymphocyte;T cell;alpha-beta T cell;mature alpha-beta T cell;CD8-positive, alpha-beta T cell;mature NK T cell;gamma-delta T cell;mature gamma-delta T cell;mature T cell;B cell;innate lymphoid cell;natural killer cell;myeloid cell",FGF,0.02,,0.02,227,0,,curated,calcium_cAMP_signaling,False
FGF4,,,no,ENSG00000075388,Fibroblast growth factor 4 (FGF-4) (Heparin secretory-transforming protein 1) (HST) (HST-1) (HSTF-1) (Heparin-binding growth factor 4) (HBGF-4) (Transforming protein KS3),Secreted,,FGF,0.021,,0.021,246,0,,curated,calcium_cAMP_signaling,False
