FGF7,,,no,ENSG00000140285,Fibroblast growth factor 7 (FGF-7) (Heparin-binding growth factor 7) (HBGF-7) (Keratinocyte growth factor),Secreted,enteric smooth muscle cell;connective tissue cell;fibroblast;alveolar type 2 fibroblast cell;fibroblast of lung;bronchus fibroblast of lung;fibroblast of mammary gland;fibroblast of connective tissue of glandular part of prostate;fibroblast of breast;myofibroblast cell,FGF,2.953,1.762,2.953,33819,20591,-0.745,curated,calcium_cAMP_signaling,False
FGF9,,,no,ENSG00000102678,Fibroblast growth factor 9 (FGF-9) (Glia-activating factor) (GAF) (Heparin-binding growth factor 9) (HBGF-9),Secreted,radial glial cell;Mueller cell,FGF,0.214,0.149,0.214,2449,1738,-0.524,curated,calcium_cAMP_signaling,False
FGFR1,,,no,ENSG00000077782,Fibroblast growth factor receptor 1 (FGFR-1),Cell membrane,mesenchymal stem cell;pigmented epithelial cell;non-pigmented ciliary epithelial cell;pancreatic PP cell;fibroblast;keratocyte;fibroblast of connective tissue of nonglandular part of prostate;fibroblast of breast;tendon cell;adventitial cell,FGF;NCAM,20.063,19.893,20.063,229786,232446,-0.012,curated,calcium_cAMP_signaling,False
FGFR2,,,no,ENSG00000066468,Fibroblast growth factor receptor 2 (FGFR-2),Cell membrane,basal cell of epidermis;choroid plexus epithelial cell;cholangiocyte;intrahepatic cholangiocyte;pigmented epithelial cell;non-pigmented ciliary epithelial cell;lens epithelial cell;anterior lens cell;lens fiber cell;secondary lens fiber;smooth muscle cell of sphincter of pupil;ciliary muscle cell;Bergmann glial cell;lung secretory cell,FGF,6.628,8.716,8.716,75913,101840,0.395,curated,calcium_cAMP_signaling,False
FGFR3,,,no,ENSG00000068078,Fibroblast growth factor receptor 3 (FGFR-3),Cell membrane,basal cell of epidermis;basal cell of epithelium of trachea;stem cell of epidermis;ependymal cell;keratinocyte;epidermal cell;conjunctival epithelial cell;astrocyte;mature astrocyte,FGF,9.369,13.209,13.209,107302,154346,0.496,curated,calcium_cAMP_signaling,False
FGFR4,,,no,ENSG00000160867,Fibroblast growth factor receptor 4 (FGFR-4),Cell membrane,pulmonary interstitial fibroblast;fibroblast of lung,FGF,3.986,4.659,4.659,45653,54437,0.225,curated,calcium_cAMP_signaling,False
FLT4,,,no,ENSG00000037280,Vascular endothelial growth factor receptor 3 (VEGFR-3),Cell membrane,endothelial cell of lymphatic vessel;surface ectodermal cell,,0.634,1.107,1.107,7260,12930,0.804,curated,calcium_cAMP_signaling,False
FSHR,,,no,ENSG00000170820,Follicle-stimulating hormone receptor (FSH-R) (Follitropin receptor),Cell membrane,neuron,FSH,0.032,,0.032,361,0,,curated,calcium_cAMP_signaling,False
GABBR1,,,no,ENSG00000204681,Gamma-aminobutyric acid type B receptor subunit 1 (GABA-B receptor 1) (GABA-B-R1) (GABA-BR1) (GABABR1) (Gb1),Cell membrane,,GABA-B,2.63,4.209,4.209,30119,49186,0.679,curated,calcium_cAMP_signaling,True
GABBR2,,,no,ENSG00000136928,Gamma-aminobutyric acid type B receptor subunit 2 (GABA-B receptor 2) (GABA-B-R2) (GABA-BR2) (GABABR2) (Gb2) (G-protein coupled receptor 51) (HG20),Cell membrane,ganglion interneuron;inhibitory interneuron;Purkinje cell;GABAergic neuron;glutamatergic neuron,GABA-B,0.064,0.011,0.064,737,134,-2.488,curated,calcium_cAMP_signaling,False
GATA4,,,no,ENSG00000136574,Transcription factor GATA-4 (GATA-binding factor 4),Nucleus,Sertoli cell;mesothelial cell;granulosa cell;endothelial cell of sinusoid;endothelial cell of hepatic sinusoid;endothelial cell of pericentral hepatic sinusoid;ovarian surface epithelial cell;Leydig cell;regular atrial cardiac myocyte,,8.05,8.864,8.864,92197,103568,0.139,curated,calcium_cAMP_signaling,False
GDNF,,,no,ENSG00000168621,Glial cell line-derived neurotrophic factor (hGDNF) (Astrocyte-derived trophic factor) (ATF),Secreted,mesangial cell,GDNF,0.053,0.041,0.053,608,477,-0.379,curated,calcium_cAMP_signaling,True
GHSR,,,no,ENSG00000121853,Growth hormone secretagogue receptor type 1 (GHS-R) (GH-releasing peptide receptor) (GHRP) (Ghrelin receptor),Cell membrane,,GHRELIN;GHRH,0.132,0.073,0.132,1514,852,-0.858,curated,calcium_cAMP_signaling,True
GLI1,,,no,ENSG00000111087,Zinc finger protein GLI1 (Glioma-associated oncogene) (Oncogene GLI),Cytoplasm,,,0.09,0.069,0.09,1029,807,-0.38,curated,calcium_cAMP_signaling,True
GLI3,,,no,ENSG00000106571,Transcriptional activator GLI3 (GLI3 form of 190 kDa) (GLI3-190) (GLI3 full-length protein) (GLI3FL),Nucleus;Cytoplasm;Cell projection,corneal endothelial cell;forebrain radial glial cell;medium spiny neuron;fibro/adipogenic progenitor cell,,0.844,1.038,1.038,9672,12133,0.298,curated,calcium_cAMP_signaling,False
GLP1R,,,no,ENSG00000112164,Glucagon-like peptide 1 receptor (GLP-1 receptor) (GLP-1-R) (GLP-1R),Cell membrane,neuron,GCG,1.796,3.361,3.361,20570,39277,0.904,curated,calcium_cAMP_signaling,False
GNA11,,,no,ENSG00000088256,Guanine nucleotide-binding protein subunit alpha-11 (G alpha-11) (G-protein subunit alpha-11) (Guanine nucleotide-binding protein G(y) subunit alpha),Cell membrane,enterocyte;M cell of gut,,4.774,4.719,4.774,54674,55138,-0.017,curated,calcium_cAMP_signaling,True
GNAI1,,,no,ENSG00000127955,Guanine nucleotide-binding protein G(i) subunit alpha-1 (Adenylate cyclase-inhibiting G alpha protein),Nucleus,,,2.02,1.894,2.02,23135,22136,-0.093,curated,calcium_cAMP_signaling,True
GNAI2,,,no,ENSG00000114353,Guanine nucleotide-binding protein G(i) subunit alpha-2 (Adenylate cyclase-inhibiting G alpha protein),Cytoplasm,"gut endothelial cell;surface ectodermal cell;CD141-positive myeloid dendritic cell;myeloid dendritic cell;CD1c-positive myeloid dendritic cell;mature conventional dendritic cell;CD14-low, CD16-positive monocyte;promonocyte",,12.549,12.454,12.549,143725,145521,-0.011,curated,calcium_cAMP_signaling,False
GNAQ,,,no,ENSG00000156052,Guanine nucleotide-binding protein G(q) subunit alpha (Guanine nucleotide-binding protein alpha-q),Cell membrane,Purkinje cell,,5.861,5.107,5.861,67128,59669,-0.199,curated,calcium_cAMP_signaling,True
GRIA1,,,no,ENSG00000155511,"Glutamate receptor 1 (GluR-1) (AMPA-selective glutamate receptor 1) (GluR-A) (GluR-K1) (Glutamate receptor ionotropic, AMPA 1) (GluA1)",Cell membrane,neuroendocrine cell;chromaffin cell;neural cell;astrocyte;Bergmann glial cell;neuron;interneuron;bipolar neuron;inhibitory interneuron;Purkinje cell;visceromotor neuron;GABAergic neuron;glutamatergic neuron;alveolar type 2 fibroblast cell,Glutamate,0.023,0.018,0.023,262,214,-0.321,curated,calcium_cAMP_signaling,False
GRIA2,,,no,ENSG00000120251,"Glutamate receptor 2 (GluR-2) (AMPA-selective glutamate receptor 2) (GluR-B) (GluR-K2) (Glutamate receptor ionotropic, AMPA 2) (GluA2)",Cell membrane,neural cell;neuron associated cell (sensu Vertebrata);oligodendrocyte precursor cell;neuron;interneuron;bipolar neuron;retinal bipolar neuron;amacrine cell;granule cell;neuronal brush cell;retinal ganglion cell;GABAergic neuron;glutamatergic neuron,Glutamate,0.297,0.206,0.297,3396,2410,-0.524,curated,calcium_cAMP_signaling,False
GRIN1,,,no,ENSG00000176884,"Glutamate receptor ionotropic, NMDA 1 (GluN1) (Glutamate [NMDA] receptor subunit zeta-1) (N-methyl-D-aspartate receptor subunit NR1) (NMD-R1)",Cell membrane,inhibitory interneuron,Glutamate,0.057,0.071,0.071,657,831,0.31,curated,calcium_cAMP_signaling,True
GRIN2B,,,no,ENSG00000273079,"Glutamate receptor ionotropic, NMDA 2B (GluN2B) (Glutamate [NMDA] receptor subunit epsilon-2) (N-methyl D-aspartate receptor subtype 2B) (NMDAR2B) (NR2B) (N-methyl-D-aspartate receptor subunit 3) (NR3) (hNR3)",Cell membrane,corneal endothelial cell;neural cell;neuron;inhibitory interneuron;stellate neuron;granule cell;neuronal brush cell;GABAergic neuron;glutamatergic neuron,Glutamate,0.021,,0.021,238,0,,curated,calcium_cAMP_signaling,False
GRIN2C,,,no,ENSG00000161509,"Glutamate receptor ionotropic, NMDA 2C (GluN2C) (Glutamate [NMDA] receptor subunit epsilon-3) (N-methyl D-aspartate receptor subtype 2C) (NMDAR2C) (NR2C)",Cell membrane,,Glutamate,0.03,0.016,0.03,345,185,-0.928,curated,calcium_cAMP_signaling,True
GRIN2D,,,no,ENSG00000105464,"Glutamate receptor ionotropic, NMDA 2D (GluN2D) (EB11) (Glutamate [NMDA] receptor subunit epsilon-4) (N-methyl D-aspartate receptor subtype 2D) (NMDAR2D) (NR2D)",Cell membrane,,Glutamate,0.079,0.083,0.083,908,964,0.057,curated,calcium_cAMP_signaling,True
GRM1,,,no,ENSG00000152822,Metabotropic glutamate receptor 1 (mGluR1),Cell membrane,cerebellar granule cell;neuronal brush cell,Glutamate,0.025,0.009,0.025,286,107,-1.447,curated,calcium_cAMP_signaling,True
GRM5,,,no,ENSG00000168959,Metabotropic glutamate receptor 5 (mGluR5),Cell membrane,neural cell;neuron associated cell (sensu Vertebrata);oligodendrocyte precursor cell;Bergmann glial cell;neuron;interneuron;bipolar neuron;retinal bipolar neuron;ganglion interneuron;inhibitory interneuron;GABAergic neuron;glutamatergic neuron,Glutamate,0.107,0.024,0.107,1227,280,-2.161,curated,calcium_cAMP_signaling,False
GRPR,,,no,ENSG00000126010,Gastrin-releasing peptide receptor (GRP-R) (GRP-preferring bombesin receptor),Cell membrane,,GPR,9.731,12.186,12.186,111452,142389,0.325,curated,calcium_cAMP_signaling,True
GTF2I,,,no,ENSG00000263001,General transcription factor II-I (GTFII-I) (TFII-I) (Bruton tyrosine kinase-associated protein 135) (BAP-135) (BTK-associated protein 135) (SRF-Phox1-interacting protein) (SPIN) (Williams-Beuren syndrome chromosomal region 6 protein),Cytoplasm,epithelial cell;multi-ciliated epithelial cell;ciliated columnar cell of tracheobronchial tree;ciliated cell of the bronchus;enteroendocrine cell of small intestine;fallopian tube secretory epithelial cell;brush cell of trachebronchial tree;brush cell of bronchus;bronchial epithelial cell;brown fat cell,,29.116,29.909,29.909,333462,349473,0.039,curated,calcium_cAMP_signaling,False
GUCY1A2,,,no,ENSG00000152402,Guanylate cyclase soluble subunit alpha-2 (GCS-alpha-2),Cytoplasm,smooth muscle myoblast;kidney interstitial fibroblast;pericyte;renal interstitial pericyte;mural cell;kidney interstitial cell,,3.023,4.217,4.217,34621,49280,0.48,curated,calcium_cAMP_signaling,False
HCAR2,,,no,ENSG00000182782,Hydroxycarboxylic acid receptor 2 (G-protein coupled receptor 109A) (G-protein coupled receptor HM74A) (Niacin receptor 1) (Nicotinic acid receptor),Cell membrane,epithelial cell of prostate;basal cell of prostate epithelium;medullary thymic epithelial cell,,0.053,0.018,0.053,612,212,-1.558,curated,calcium_cAMP_signaling,False
HCAR3,,,no,ENSG00000255398,Hydroxycarboxylic acid receptor 3 (G-protein coupled receptor 109B) (G-protein coupled receptor HM74) (G-protein coupled receptor HM74B) (Niacin receptor 2) (Nicotinic acid receptor 2),Cell membrane,stem cell of epidermis;epithelial cell of prostate;basal cell of prostate epithelium;medullary thymic epithelial cell;basophil,,0.031,0.021,0.031,360,242,-0.602,curated,calcium_cAMP_signaling,False
HGF,,,no,ENSG00000019991,Hepatocyte growth factor (Hepatopoietin-A) (Scatter factor) (SF),,promyelocyte;connective tissue cell;fibroblast;hepatic stellate cell;fibroblast of mammary gland;fibroblast of breast;mural cell,HGF,1.036,1.258,1.258,11870,14699,0.279,curated,calcium_cAMP_signaling,False
HRH1,,,no,ENSG00000196639,Histamine H1 receptor (H1R) (HH1R),Cell membrane,parietal epithelial cell,Histamine,0.234,0.31,0.31,2675,3623,0.409,curated,calcium_cAMP_signaling,False
HRH2,,,no,ENSG00000113749,Histamine H2 receptor (H2R) (HH2R) (Gastric receptor I),Cell membrane,granulocyte;immature neutrophil;connective tissue cell;fibroblast;fibroblast of lung,Histamine,0.389,0.322,0.389,4460,3766,-0.273,curated,calcium_cAMP_signaling,False
HTR1A,,,no,ENSG00000178394,5-hydroxytryptamine receptor 1A (5-HT-1A) (5-HT1A) (G-21) (Serotonin receptor 1A),Cell membrane,,5-HT;SerotoninDopamin,0.013,,0.013,146,0,,curated,calcium_cAMP_signaling,True
HTR1B,,,no,ENSG00000135312,5-hydroxytryptamine receptor 1B (5-HT-1B) (5-HT1B) (S12) (Serotonin 1D beta receptor) (5-HT-1D-beta) (Serotonin receptor 1B),Cell membrane,,5-HT;SerotoninDopamin,0.033,0.018,0.033,379,205,-0.915,curated,calcium_cAMP_signaling,True
HTR1D,,,no,ENSG00000179546,5-hydroxytryptamine receptor 1D (5-HT-1D) (5-HT1D) (Serotonin 1D alpha receptor) (5-HT-1D-alpha) (Serotonin receptor 1D),Cell membrane,,5-HT;SerotoninDopamin,0.045,0.011,0.045,518,125,-2.08,curated,calcium_cAMP_signaling,True
HTR1E,,,no,ENSG00000168830,5-hydroxytryptamine receptor 1E (5-HT-1E) (5-HT1E) (S31) (Serotonin receptor 1E),Cell membrane,,SerotoninDopamin,0.025,,0.025,285,0,,curated,calcium_cAMP_signaling,True
HTR2A,,,no,ENSG00000102468,5-hydroxytryptamine receptor 2A (5-HT-2) (5-HT-2A) (Serotonin receptor 2A),Cell membrane,,5-HT;SerotoninDopamin,0.069,0.014,0.069,790,169,-2.254,curated,calcium_cAMP_signaling,True
HTR2B,,,no,ENSG00000135914,5-hydroxytryptamine receptor 2B (5-HT-2B) (5-HT2B) (Serotonin receptor 2B),Cell membrane,uterine smooth muscle cell,5-HT;SerotoninDopamin,0.12,0.095,0.12,1372,1105,-0.341,curated,calcium_cAMP_signaling,False
HTR2C,,,no,ENSG00000147246,5-hydroxytryptamine receptor 2C (5-HT-2C) (5-HT2C) (5-HTR2C) (5-hydroxytryptamine receptor 1C) (5-HT-1C) (5-HT1C) (Serotonin receptor 2C),Cell membrane,ependymal cell;choroid plexus epithelial cell;columnar/cuboidal epithelial cell;pigmented ciliary epithelial cell;neuron,5-HT;SerotoninDopamin,0.021,,0.021,240,0,,curated,calcium_cAMP_signaling,False
HTR4,,,no,ENSG00000164270,5-hydroxytryptamine receptor 4 (5-HT-4) (5-HT4) (Serotonin receptor 4),Cell membrane,,5-HT;SerotoninDopamin,0.132,0.046,0.132,1511,533,-1.532,curated,calcium_cAMP_signaling,True
HTR5A,,,no,ENSG00000157219,5-hydroxytryptamine receptor 5A (5-HT-5) (5-HT-5A) (5-HT5A) (Serotonin receptor 5A),Cell membrane,,5-HT;SerotoninDopamin,0.045,0.01,0.045,517,112,-2.236,curated,calcium_cAMP_signaling,True
HTR6,,,no,ENSG00000158748,5-hydroxytryptamine receptor 6 (5-HT-6) (5-HT6) (Serotonin receptor 6),Cell membrane,,5-HT;SerotoninDopamin,0.017,,0.017,193,0,,curated,calcium_cAMP_signaling,True
HTR7,,,no,ENSG00000148680,5-hydroxytryptamine receptor 7 (5-HT-7) (5-HT7) (5-HT-X) (Serotonin receptor 7),Cell membrane,,5-HT;SerotoninDopamin,0.22,0.397,0.397,2517,4638,0.853,curated,calcium_cAMP_signaling,True
INSR,,,no,ENSG00000171105,Insulin receptor (IR),Cell membrane,secondary lens fiber,,27.543,34.363,34.363,315452,401520,0.319,curated,calcium_cAMP_signaling,True
IRS1,,,no,ENSG00000169047,Insulin receptor substrate 1 (IRS-1),,tracheobronchial smooth muscle cell,,5.307,6.072,6.072,60779,70949,0.194,curated,calcium_cAMP_signaling,False
IRS2,,,no,ENSG00000185950,Insulin receptor substrate 2 (IRS-2),Cytoplasm,salivary gland cell,,3.409,5.046,5.046,39043,58963,0.566,curated,calcium_cAMP_signaling,True
IRS4,,,no,ENSG00000133124,Insulin receptor substrate 4 (IRS-4) (160 kDa phosphotyrosine protein) (py160) (Phosphoprotein of 160 kDa) (pp160),Cell membrane,,,0.035,0.032,0.035,400,378,-0.111,curated,calcium_cAMP_signaling,True
ITPKA,,,no,ENSG00000137825,Inositol-trisphosphate 3-kinase A,Cytoplasm,,,0.181,0.182,0.182,2071,2121,0.006,curated,calcium_cAMP_signaling,True
ITPR1,,,no,ENSG00000150995,"Inositol 1,4,5-trisphosphate receptor type 1 (IP3 receptor isoform 1) (IP3R 1) (InsP3R1) (Type 1 inositol 1,4,5-trisphosphate receptor) (Type 1 InsP3 receptor)",Endoplasmic reticulum membrane,choroid plexus epithelial cell;kidney distal convoluted tubule epithelial cell;smooth muscle cell of sphincter of pupil;ciliary muscle cell;Purkinje cell,,1.418,1.182,1.418,16241,13811,-0.263,curated,calcium_cAMP_signaling,False
ITPR3,,,no,ENSG00000096433,"Inositol 1,4,5-trisphosphate receptor type 3 (IP3 receptor isoform 3) (IP3R 3) (InsP3R3) (Type 3 inositol 1,4,5-trisphosphate receptor) (Type 3 InsP3 receptor)",Endoplasmic reticulum membrane,,,7.175,11.43,11.43,82178,133554,0.672,curated,calcium_cAMP_signaling,True
KCNJ8,,,no,ENSG00000121361,"ATP-sensitive inward rectifier potassium channel 8 (Inward rectifier K(+) channel Kir6.1) (Potassium channel, inwardly rectifying subfamily J member 8) (uKATP-1)",Membrane,interstitial cell of Cajal;capillary endothelial cell;pancreatic D cell;cerebral cortex endothelial cell;pericyte;mural cell,,12.276,9.242,12.276,140598,107987,-0.41,curated,calcium_cAMP_signaling,False
KCNMA1,,,no,ENSG00000156113,"Calcium-activated potassium channel subunit alpha-1 (BK channel) (BKCA alpha) (Calcium-activated potassium channel, subfamily M subunit alpha-1) (K(VCA)alpha) (KCa1.1) (Maxi K channel) (MaxiK) (Slo-alpha) (Slo1) (Slowpoke homolog) (Slo homolog) (hSlo)",Cell membrane,type B pancreatic cell;Kupffer cell;bipolar neuron;retinal bipolar neuron,,2.849,3.362,3.362,32628,39284,0.239,curated,calcium_cAMP_signaling,False
KCNMB1,,,no,ENSG00000145936,"Calcium-activated potassium channel subunit beta-1 (BK channel subunit beta-1) (BKbeta) (BKbeta1) (Hbeta1) (Calcium-activated potassium channel, subfamily M subunit beta-1) (Calcium-activated potassium channel subunit beta) (Charybdotoxin receptor subunit beta-1) (K(VCA)beta-1) (Maxi K channel subunit beta-1) (Slo-beta-1) (Slo-beta)",Membrane,microglial cell;mature microglial cell;smooth muscle cell;enteric smooth muscle cell;uterine smooth muscle cell;tracheobronchial smooth muscle cell;bronchial smooth muscle cell;Langerhans cell,,0.241,0.498,0.498,2765,5817,1.044,curated,calcium_cAMP_signaling,False
KCNU1,,,no,ENSG00000215262,"Potassium channel subfamily U member 1 (Calcium-activated potassium channel subunit alpha-3) (Calcium-activated potassium channel, subfamily M subunit alpha-3) (KCa5) (Slowpoke homolog 3)",Cell membrane,,,0.025,,0.025,285,0,,curated,calcium_cAMP_signaling,True
KDR,,,no,ENSG00000128052,Vascular endothelial growth factor receptor 2 (VEGFR-2),Cell junction,endothelial tip cell;vasa recta ascending limb cell;kidney capillary endothelial cell;glomerular capillary endothelial cell;capillary endothelial cell;prostate gland microvascular endothelial cell;fenestrated cell;glomerular endothelial cell;respiratory epithelial cell;epithelial cell of lower respiratory tract;club cell;endothelial cell;gut endothelial cell;endothelial cell of vascular tree;endothelial cell of sinusoid;endocardial cell;cerebral cortex endothelial cell;surface ectodermal cell,SEMA6,2.171,2.745,2.745,24863,32077,0.339,curated,calcium_cAMP_signaling,False
LHCGR,,,no,ENSG00000138039,Lutropin-choriogonadotropic hormone receptor (LH/CG-R) (Luteinizing hormone receptor) (LHR) (LSH-R),Cell membrane,,LHB,0.028,,0.028,316,0,,curated,calcium_cAMP_signaling,True
LIPE,,,no,ENSG00000079435,Hormone-sensitive lipase (HSL),Cell membrane,fat cell;white fat cell;brown fat cell;subcutaneous fat cell;adipocyte of breast;epicardial adipocyte;adipocyte of epicardial fat of left ventricle,,0.129,0.106,0.129,1477,1238,-0.284,curated,calcium_cAMP_signaling,False
LTB4R2,,,no,ENSG00000213906,Leukotriene B4 receptor 2 (LTB4-R 2) (LTB4-R2) (LTB4 receptor JULF2) (Leukotriene B4 receptor BLT2) (Seven transmembrane receptor BLTR2),Cell membrane,,CysLTs;12oxoLTB5,0.772,1.073,1.073,8838,12535,0.475,curated,calcium_cAMP_signaling,True
MAP2K1,,,no,ENSG00000169032,Dual specificity mitogen-activated protein kinase kinase 1 (MAP kinase kinase 1) (MAPKK 1) (MKK1),Cytoplasm,,,4.591,3.625,4.591,52585,42362,-0.341,curated,calcium_cAMP_signaling,True
MAPK1,,,no,ENSG00000100030,Mitogen-activated protein kinase 1 (MAP kinase 1) (MAPK 1),Cytoplasm,"CD8-positive, alpha-beta cytokine secreting effector T cell",,12.287,10.624,12.287,140728,124144,-0.21,curated,calcium_cAMP_signaling,False
MAPK10,,,no,ENSG00000109339,Mitogen-activated protein kinase 10 (MAP kinase 10) (MAPK 10),Cytoplasm,ependymal cell;choroid plexus epithelial cell;astrocyte;papillary tips cell,,1.99,1.682,1.99,22794,19649,-0.243,curated,calcium_cAMP_signaling,False
MAPK3,,,no,ENSG00000102882,Mitogen-activated protein kinase 3 (MAP kinase 3) (MAPK 3),Cytoplasm,,,8.17,12.041,12.041,93574,140692,0.559,curated,calcium_cAMP_signaling,True
MAPK8,,,no,ENSG00000107643,Mitogen-activated protein kinase 8 (MAP kinase 8) (MAPK 8),Cytoplasm,,,4.446,4.116,4.446,50917,48090,-0.111,curated,calcium_cAMP_signaling,True
MAPK9,,,no,ENSG00000050748,Mitogen-activated protein kinase 9 (MAP kinase 9) (MAPK 9),Cytoplasm,,,9.884,7.415,9.884,113205,86638,-0.415,curated,calcium_cAMP_signaling,True
MEF2A,,,no,ENSG00000068305,Myocyte-specific enhancer factor 2A (Serum response factor-like protein 1),Nucleus,epithelial cell;lung endothelial cell;endothelial cell;endothelial cell of vascular tree;tissue-resident macrophage;central nervous system macrophage;mature microglial cell,,7.276,7.004,7.276,83332,81845,-0.055,curated,calcium_cAMP_signaling,False
MEF2C,,,no,ENSG00000081189,Myocyte-specific enhancer factor 2C (Myocyte enhancer factor 2C),Nucleus,macrophage;tissue-resident macrophage;central nervous system macrophage;microglial cell;mature microglial cell;liver dendritic cell;B cell;early lymphoid progenitor;pro-B cell;glutamatergic neuron;osteoblast,,0.992,1.208,1.208,11359,14119,0.285,curated,calcium_cAMP_signaling,False
MET,,,no,ENSG00000105976,Hepatocyte growth factor receptor (HGF receptor),Membrane,melanocyte,HGF,5.275,3.472,5.275,60409,40564,-0.603,curated,calcium_cAMP_signaling,True
MST1,,,no,ENSG00000173531,Hepatocyte growth factor-like protein (Macrophage stimulatory protein) (Macrophage-stimulating protein) (MSP),Secreted,paneth cell,,7.609,6.74,7.609,87141,78757,-0.175,curated,calcium_cAMP_signaling,True
MST1R,,,no,ENSG00000164078,Macrophage-stimulating protein receptor (MSP receptor),Membrane,,,0.546,0.62,0.62,6252,7247,0.184,curated,calcium_cAMP_signaling,True
MYLK,,,no,ENSG00000065534,"Myosin light chain kinase, smooth muscle (MLCK) (smMLCK)",Cytoplasm,basal cell;muscle cell;smooth muscle cell;smooth muscle cell of sphincter of pupil;vascular associated smooth muscle cell;enteric smooth muscle cell;smooth muscle fiber of ileum;uterine smooth muscle cell;myometrial cell;tracheobronchial smooth muscle cell;bronchial smooth muscle cell;ciliary muscle cell;smooth muscle cell of prostate;pulmonary interstitial fibroblast;myofibroblast cell,,2.07,2.896,2.896,23708,33834,0.484,curated,calcium_cAMP_signaling,False
MYLK2,,,no,ENSG00000101306,"Myosin light chain kinase 2, skeletal/cardiac muscle (MLCK2)",Cytoplasm,cerebral cortex endothelial cell,,0.482,0.577,0.577,5520,6737,0.259,curated,calcium_cAMP_signaling,False
MYLK3,,,no,ENSG00000140795,Myosin light chain kinase 3,Cytoplasm,muscle cell;cardiac muscle cell;regular atrial cardiac myocyte;regular ventricular cardiac myocyte;muscle precursor cell;cardiac muscle myoblast,,0.098,0.076,0.098,1117,885,-0.365,curated,calcium_cAMP_signaling,True
NFATC1,,,no,ENSG00000131196,"Nuclear factor of activated T-cells, cytoplasmic 1 (NF-ATc1) (NFATc1) (NFAT transcription complex cytosolic component) (NF-ATc) (NFATc)",Cytoplasm,epithelial cell of thymus;endothelial cell of lymphatic vessel;osteoclast;neuron,,1.318,1.555,1.555,15093,18175,0.239,curated,calcium_cAMP_signaling,False
NFATC2,,,no,ENSG00000101096,"Nuclear factor of activated T-cells, cytoplasmic 2 (NF-ATc2) (NFATc2) (NFAT pre-existing subunit) (NF-ATp) (T-cell transcription factor NFAT1)",Cytoplasm;Nucleus,,,1.293,1.217,1.293,14807,14226,-0.087,curated,calcium_cAMP_signaling,True
NFATC3,,,no,ENSG00000072736,"Nuclear factor of activated T-cells, cytoplasmic 3 (NF-ATc3) (NFATc3) (NFATx) (T-cell transcription factor NFAT4) (NF-AT4) (NF-AT4c)",Cytoplasm,,,3.852,3.766,3.852,44120,44008,-0.033,curated,calcium_cAMP_signaling,True
NFATC4,,,no,ENSG00000100968,"Nuclear factor of activated T-cells, cytoplasmic 4 (NF-ATc4) (NFATc4) (T-cell transcription factor NFAT3) (NF-AT3)",Cytoplasm,neural progenitor cell,,1.719,1.732,1.732,19683,20243,0.012,curated,calcium_cAMP_signaling,True
NFKB1,,,no,ENSG00000109320,Nuclear factor NF-kappa-B p105 subunit (DNA-binding factor KBF1) (EBP-1) (Nuclear factor of kappa light polypeptide gene enhancer in B-cells 1),Nucleus,"cortical thymic epithelial cell;elicited macrophage;inflammatory macrophage;alternatively activated macrophage;mast cell;mucosal type mast cell;group 3 innate lymphoid cell;CD34-positive, CD56-positive, CD117-positive common innate lymphoid precursor, human;myeloid cell;fibroblast of connective tissue of nonglandular part of prostate",,4.659,4.48,4.659,53358,52342,-0.057,curated,calcium_cAMP_signaling,False
NGF,,,no,ENSG00000134259,Beta-nerve growth factor (Beta-NGF),Secreted,smooth muscle myoblast;pericyte;renal interstitial pericyte;mural cell,NGF;NT,0.049,0.036,0.049,565,424,-0.443,curated,calcium_cAMP_signaling,False
NOS1,,,no,ENSG00000089250,Nitric oxide synthase 1,Cell membrane,macula densa epithelial cell;neuron,,0.87,0.821,0.87,9965,9597,-0.083,curated,calcium_cAMP_signaling,False
NOS2,,,no,ENSG00000007171,"Nitric oxide synthase, inducible",Cytoplasm,basal cell of epithelium of trachea,,0.032,0.011,0.032,370,123,-1.618,curated,calcium_cAMP_signaling,True
NOS3,,,no,ENSG00000164867,Nitric oxide synthase 3,Cell membrane;Membrane,,,1.286,1.835,1.835,14734,21444,0.513,curated,calcium_cAMP_signaling,True
NPR1,,,no,ENSG00000169418,Atrial natriuretic peptide receptor 1,Membrane,parietal epithelial cell,NPR1,1.375,1.644,1.644,15752,19208,0.257,curated,calcium_cAMP_signaling,False
NPY1R,,,no,ENSG00000164128,Neuropeptide Y receptor type 1 (NPY1-R),Cell membrane,kidney interstitial fibroblast;kidney interstitial cell,NPY,2.792,1.753,2.792,31979,20479,-0.672,curated,calcium_cAMP_signaling,False
NTRK1,,,no,ENSG00000198400,High affinity nerve growth factor receptor,Cell membrane,renal beta-intercalated cell,NT,0.39,0.071,0.39,4465,832,-2.453,curated,calcium_cAMP_signaling,True
NTRK2,,,no,ENSG00000148053,BDNF/NT-3 growth factors receptor,Cell membrane,ependymal cell;lens epithelial cell;anterior lens cell;astrocyte;mature astrocyte;retina horizontal cell;keratocyte,NT;Netrin,3.893,5.039,5.039,44589,58874,0.372,curated,calcium_cAMP_signaling,False
NTSR1,,,no,ENSG00000101188,Neurotensin receptor type 1 (NT-R-1) (NTR1) (High-affinity levocabastine-insensitive neurotensin receptor) (NTRH),Cell membrane,,NTS,0.024,0.012,0.024,275,135,-1.055,curated,calcium_cAMP_signaling,True
